,artist_title,lyrics
0,Ninho - La vie qu'on mène,"69 ContributorsTranslationsEnglishLa vie qu’on mène Lyrics

Chady
Hey, hey

Bientôt, j'irai au ciel rejoindre Rimkus, le p'tit Lamine
Regarde la vie qu'on mène, on fait ça que pour la famille
On a toujours fait que du sale et nos parents ne font que prier
Pardonne-moi si j'suis pas là, c'est qu'je cours derrière les milliers
J'suis avec Savastano dans un quatre étoiles en Crête
Pas très loin de Malia, elle est chargée sous le maillot
Le nez dans mes affaires, bébé, m'attends pas pour le dîner
Et si c'est trop bizarre, bah, j'disparaîtrais comme Houdini
Vaillant comme Souleymane, vaillant comme Mekness et di-Meh
À deux doigts d'péter l'million, mais ce pédé s'fait désirer
Pour l'instant, j'suis dans le hall, sous doré, j'réfléchis
Qui aura l'sourire en coin d'bouche si je flanche ?
Ceux qui parlent fort sont que des baltringues déguisées
J'ai les chaussures qui piquent, j'arrive vers les Champs-Élysées
On peut t'enlever la vie pour sauver nos réputations
Évitons toutes les tentations, à l'heure qu'il est, j'suis dans l'avion
On tire, laisse-les planter, j'arrive en tête du plôton, j'suis là que pour la plata (J'suis là que pour la plata)
Le lundi et le mardi, le gérant se lève à cinq heures par peur qu'on vienne l'éclater (Par peur qu’on vienne l'éclater)
See Ninho LiveGet tickets as low as $53You might also like
Y a rien d'facile dans l'argent facile, Zé Pequeno me fascine
.357 Magnum, pas de grappling
Y a la volaille qui rapplique, on s'échappe
Minuit, pété sous champ', demain, j's'rai aux Seychelles
Et pour avoir cette vie-là, j'ai remonté les bretelles
Quand le rêve est trop long, le réveil est brutal
Black Panther, comme la daronne de 2Pac
Les barreaux ou les tropiques, on prendra l'argent d'tout-par
Et de toute façon, c'est nous les bests, en vrai
Dis-leur qu'ils restent tranquilles ou le machin va discuter
Tu veux donner des coups de mains ? Allez, baise ton père
J'ai mon papier, j’ai mon équipe, j'suis pas dans la mendicité

Élève dissipé d’après les dires du prof'
Cinq ans plus tard, son fils me demandera une to-ph'
Cinq-cents milles albums plus tard, ma tête a pas gonflé
Le prochain s’appellera ""Destin"", j'vais tout vous raconter (Et j'dirai que la vérité)

Bientôt, j'irai au ciel rejoindre Rimkus, le p'tit Lamine
Regarde la vie qu'on mène, on fait ça que pour la famille
On a toujours fait que du sale et nos parents ne font que prier
Pardonne-moi si j'suis pas là, c'est qu’je cours derrière les milliers
Oh oh oh, oh oh oh
Pardonne-moi si j'suis pas là, c'est qu'je cours derrière les milliers
Woh, oh, oh, woh, oh, oh
Pardonne-moi si j'suis pas là, c'est qu'je cours derrière les milliers13Embed"
1,Naps - La kiffance,"43 ContributorsLa kiffance Lyrics

Ok, prépare les valises, ma jolie
Zeg P on the track
Tout ça, c'est fini (ouh)

J'vais t'faire kiffer les week-ends, ma jolie (ok)
Elle m'parle plus du quartier, du shit, d'la police (ouh, ouh)
Toute la semaine, comme le J, en folie (han)
J'fais des cendriers-canettes dans l'Audi (vroum)
J'passe les vitesses aux palettes vers Conti
Vas-y, garde moi la barrette là, j'suis en condi' (ah, ah, ah)
Comme à l'ancienne, j'mets le polo crocodile (ouais)
Bronzage doré à l'huile de cocotier (ok)
Voyager jusqu'au Nirvana, hôtel cinq étoiles, prendre le p'tit déj' en pyjama (ouh)
Faire un p'tit pétou sur le Mont Fujiyama, faire le tour d'la Thaïlande en 500 Yamaha (ok)

Faut qu'j'quitte la France, elle a fait la petite frange (ouh)
C'est la kiffance, c'est la kiffance
Que je dépense, gros joint devant la Défense
C'est la kiffance, c'est la kiffance (ouh, ouh)

J'prends Uber Eats, j'suis calé au George V
À la Ribéry, j'mange des entrecôtes à mille cinq (ah, ah, ah)
J'vais faire un tour, j'suis sans casque en 125 (vroum, vroum)
J'suis dans la kiffance, j'me sens plus d'attendre le 5
J'fais plaisir à ma mère, dans l'ménage, elle a trop souffert
Ma mère, c'est ma reine, j'la laisse même pas mettre les couverts
Quand j'étais en galère, elle m'dépannait à découvert (ouh)
Dernier Range Rover, que je rode le toit ouvert
See Naps LiveGet tickets as low as $102You might also like
Faut qu'j'quitte la France, elle a fait la petite frange (ok)
C'est la kiffance (okay), c'est la kiffance (ok)
Que je dépense, gros joint devant la Défense (ouh)
C'est la kiffance (ouh), c'est la kiffance (ouh)

Voyager jusqu'au Nirvana, hôtel cinq étoiles, prendre le p'tit déj' en pyjama
Faire un p'tit pétou sur le Mont Fujiyama, faire le tour d'la Thaïlande en 500 Yamaha (ok)

Faut qu'j'quitte la France, elle a fait la petite frange (ok)
C'est la kiffance, c'est la kiffance (Manny)
Que je dépense, gros joint devant la Défense (ok)
C'est la kiffance (ouh), c'est la kiffance (ouh, ouh)
Faut qu'j'quitte la France, elle a fait la petite frange (ok)
C'est la kiffance, c'est la kiffance
Que je dépense, gros joint devant la Défense
C'est la kiffance, c'est la kiffance

Voyager jusqu'au Nirvana, hôtel cinq étoiles, prendre le p'tit déj' en pyjama
Faire un p'tit pétou sur le Mont Fujiyama, c'est la kiffance5Embed"
2,The Weeknd - Blinding Lights,"234 ContributorsTranslationsTürkçeSvenskaEspañolSlovenčinaРусскийPortuguêsPolskiNorsk (bokmål / riksmål)日本語ItalianoHebrewDeutschFrançaisفارسیNederlandsDanskShqipالعربيةBlinding Lights Lyrics
Yeah

I've been tryna call
I've been on my own for long enough
Maybe you can show me how to love, maybe
I'm goin' through withdrawals
You don't even have to do too much
You can turn me on with just a touch, baby

I look around and
Sin City's cold and empty (Oh)
No one's around to judge me (Oh)
I can't see clearly when you're gone

I said, ooh, I'm blinded by the lights
No, I can't sleep until I feel your touch
I said, ooh, I'm drowning in the night
Oh, when I'm like this, you're the one I trust
Hey, hey, hey

I'm running out of time
'Cause I can see the sun light up the sky
So I hit the road in overdrive, baby, oh
You might also like
The city's cold and empty (Oh)
No one's around to judge me (Oh)
I can't see clearly when you're gone

I said, ooh, I'm blinded by the lights
No, I can't sleep until I feel your touch
I said, ooh, I'm drowning in the night
Oh, when I'm like this, you're the one I trust

I'm just calling back to let you know (Back to let you know)
I could never say it on the phone (Say it on the phone)
Will never let you go this time (Ooh)

I said, ooh, I'm blinded by the lights
No, I can't sleep until I feel your touch
Hey, hey, hey

Hey, hey, hey

I said, ooh, I'm blinded by the lights
No, I can't sleep until I feel your touch276Embed"
3,13 Organisé - Bande organisée,"106 ContributorsTranslationsEnglishBande organisée Lyrics

Oui, ma gâtée, RS4 gris nardo, bien sûr qu'ils m'ont raté (gros, bien sûr)
Soleil dans la bulle, sur le Prado, Shifter pro' (Shifter pro')
Contre-sens (ah), ma chérie, tu es à contre-sens
Puta, où tu étais quand j'mettais des sept euros d'essence (hein) ?
Tu veux nous faire la guerre (hein) ? Par Dieu, c'est B (ah)
Ça prend ton Audi, ça prend ta gadji, ça prend ta CB (eh, eh)
Le téléphone bippe (brr), que tu prends la kew (ew)
C'est Marseille, bébé (ah), sa mère un CDD (ah)
Wesh alors, ma race, tranquille ou quoi ? (oh, mathafack)
Grimpe dans la tchop, j'fais zéro à cent en deux secondes trois
Guitarisé, oh, AC/DC, oh, on s'croise, c'est sûr, t'es tétanisé

J'ai passé la bague à Tchikita, deux mois après, j'l'ai déjà quittée (ah, ah)
T'es un p'tit bâtard, j'suis un Nabba, j'suis un Diakité (eh)
J'suis le capitaine (eh), j'vais les décapiter (eh)
C'est pas la capitale (nan), c'est Marseille, bébé (pah, pah, pah)
1.3, Audi Sport, j'passe la douane, les rapports
Nique ta mère sur la Canebière, nique tes morts sur le Vieux-Port (Santé & Bonheur)
Mi amor, c'est les quartiers Sud, c'est les quartiers Nord
Nique ta mère sur la Canebière, nique tes morts sur le Vieux-Port (ah)

J'suis à la zone, sans casque sur un scooter kité
Oublie-la, c'est une puta, elle t'a quitté
J'suis ailleurs, c'est d'la moula qu'j'ai effritée
D'puis t'à l'heure, que ça me nique mon briquet
Rafale, flow bazookaw, j'ai des potes qui s'déplacent au cas où
La moto, elle fait ""brm, brm, brm, brm"", toujours là, demande à
Tchico
J'suis dans l'game en claquettes, survêt'
J'fuck les folles qui parlent de moi sur l'net
J'suis sous potion là, j'tire deux-trois sur l'pét'
Au fait, on grimpe, envoie les zéros sur l'chèque
Ah, ah, poto, qué pasa ? Ah, ah, dans la cabeza
Ah, ah, grr, ratata, ah, ah, pour les mapesa
Ah, ah, poto, qué pasa ? Ah, ah, dans la cabeza
Ah, ah, grr, ratata, ah, ah, pour les mapesa
Plus besoin d'aller chez Lacoste depuis qu'j'suis fait d'or et d'platine
Et sur Twitter, j'vois leurs posts, nique leurs mères ceux qui parlent mal d'la team
You might also like
En bande organisée, personne peut nous canaliser
Dans la zone, ça fume la fusée, pistés par les banalisées
Hasta luego, fais-en un, hasta luego, fais-en deux
Hasta luego, ouh, ouh, hasta luego, bam, bam

C'est du 24 carats (nan), j'rappe depuis l'époque de K-Ra
La technique, le flow de malade, artistiquement, on se balade (ok)
T-Max, casque Araï, recherché à kech-Marra
J'lui envoie une frappe imparable, j'fais couler son mascara (ah, ah)
Le J, c'est le S (ok), hum, j'sors le RS (vroum, vroum)
Une liasse épaisse, Arlabelek, N.A.P.S (ah, ah)
Le, le J, c'est le S (ok), hum, j'sors le RS (vroum, vroum)
Une liasse épaisse, Arlabelek, N.A.P.S (ok)

Yo, cesse ton baratin (yeah), t'es qu'un fils de bar à tain-p' (ah)
J'commence le rap avec 7 et 3, à la rivière, j'ai touché la quinte
Yo, j'vise l'or, le platine (ah), à la base, c'était les assises
J'suis un peu d'Zampa, un peu d'Zizou (coup), j'offre un Ricard à Poutine
Jeune trafiquant dans le bâtiment, cavale comme Usain Bolt (ah, ah)
Je connais le maniement de mon département, le soir, pour te froisser ta gold (ah, ah, ah)
Et ça fait : zumba, caféw, caféw, carnaval
J'suis dans l'4x4 teinté, pisté par la banal'
Et ça fait : zumba, caféw, caféw, carnaval
J'suis dans l'4x4 teinté, pisté par la banal' (yah)
En bande organisée, personne peut nous canaliser
Dans la zone, ça fume la fusée, pistés par les banalisées
Hasta luego, fais-en un, hasta luego, fais-en deux
Hasta luego, ouh, ouh, hasta luego, bam, bam

Légal, illégal (eh), Alpha, Oméga (vroum)
On fait coup d'État, balle dans la te-tê, c'est la cuenta (vroum)
Poursuite, y a les bleus (bleus), serein, j'sors d'la bleue (bleue)
Ter-ter, guidon, logistique, par terre, du sang, balistique
A-tchu-tchu-tcha (tcha), c'est une salvatrucha ('cha)
Trafic haram (ah), Marseille, on trouve des cadavres (ouais)
Marseille hala, plus d'âme, les p'tits passent à l'acte (ouais)
Milli', j'veux l'milli' comme l'OVNI (hum), ces filha puta, j'les finis

Yah, on les rend amis : ennemis, yah, on les rend ennemis : amis, yah
J'ai les poches pleines, tu m'suis, j'ai fait le calcul de plus le calculer lui, yah (ouh)
Comportement dans la zone, yah, comporte avec les hommes, yah
Garde la pêche, moi, j'ai la forme, forme, temenik, on te déforme
Car c'est trop vrai, t'as l'regard et l'fond mauvais, quand j'galère, toi t'es refait (eh)
Au lit, t'es mauvais (eh), ta gadji, on la connaît (eh, eh)
Au parloir, elle a tourné (eh, eh), cognée par des prisonniers (ouh, ouh)
Tu dois des sous, sous, sous, tu fais la mala dans les ""boum, boum, boum""
Pour de la monnaie, on te click, click, boum, l'alcool, on l'a glou, glou, glou (glou, glou, glou)
Tu dois des sous, sous, sous, tu fais la mala dans les ""boum, boum, boum""
Pour de la monnaie, on te click, click, boum, l'alcool, on l'a glou, glou, glou (glou, glou, glou)
Wesh, tu veux pas la guerre mais pourquoi tu allumes la mèche (mèche, mèche) ?
J'suis dans la zone, j'évite les putas, wesh
Moi, j'écoute pas les gens et ma Clio, elle est sur les jantes
J'fais que fumer le jaune, des fois, avec un peu de Marie-Jeanne
Hier, j'étais bleu, j'voulais un Porsche GT bleu (bleu)
Y avait le pain, on était plein, y avait pas un, on était deux (deux)
J'suis dans le bloc, ma biche, dans la zone, c'est chacun sa kich' (sa kich')
Y a eu des traîtres, des traîtres, des traîtres, nique sa mère, c'est rien, ma3lich
Au quartier, y a d'la vente d'armes, nouvelle paire, j'paye en espèces
Fais belek, y a les gendarmes, ils sont loin, c'est bon, déstresse
C'est tous pour la plata, retour de flamme, fumar mata (brh)
Ça danse en équipe sur le chant des ""ratata""

En bande organisée, personne peut nous canaliser
Dans la zone, ça fume la fusée, pistés par les banalisées
Hasta luego, fais-en un, hasta luego, fais-en deux
Hasta luego, ouh, ouh, hasta luego, bam, bam
En bande organisée, personne peut nous canaliser
Dans la zone, ça fume la fusée, pistés par les banalisées
Hasta luego, fais-en un, hasta luego, fais-en deux
Hasta luego, ouh, ouh, hasta luego, bam, bam8Embed"
4,Damso - Θ. Macarena,"86 ContributorsΘ. Macarena Lyrics

Double X on the track, bitch!
Le monde est à nous, le monde est à toi et moi
Mais p't-être que sans moi, le monde s'ra à toi
Et p't-être qu'avec lui, le monde s'ra à vous et c'est p't-être mieux ainsi
Mes sentiments dansent la macarena
Donc, je me dis qu'si t'es avec lui, tu t'sentiras mieux
Mais si tu t'sens mieux, tu t'souviendras plus de moi
Oh la la, mon cœur danse la macarena
La, la, la, la, la, la, la, la, la, la
Oh la la, mon cœur danse la macarena
La, la, la, la, la, la, la, la, la, la

Sabrina, t'es d'jà trentenaire, on s'envoie en l'air mais j'ai qu'la vingtaine, donc j'ai qu'ça à faire, me parle pas de mariage
J'te fais perdre ton temps mais qu'est-c'que c'est bon
Quand j'p'lote tes implants, j'me sens comme avant, comme quand j'en avais rien à battre
Je suis jeune, j'm'en fous d'l'avenir, de c'que notre relation va devenir mais pour lui, c'n'est pas le cas, il a d'jà un taf
Il fait le mec mature mais tu sais qu'au lit, plus que lui, j'assure
Rappelle-toi quand t'avais des courbatures, j't'avais bien niqué ta race
Rappelle-toi bien de la suite, dans les hôtels et les suites
J't'invitais aux soirées VIP, à la télé', tu r'gardais mes clips
On l'a fait sans autotune, sur une prod de Twinsmatic
C'est ma manière romantique de dire que j'n'avais pas mis de préservatif
You might also like
Le monde est à nous, le monde est à toi et moi
Mais p't-être que sans moi, le monde s'ra à toi
Et p't-être qu'avec lui, le monde s'ra à vous et c'est peut-être mieux ainsi
Mes sentiments dansent la macarena
Donc, je me dis qu'si t'es avec lui, tu t'sentiras mieux
Mais si tu te sens mieux, tu t'souviendras plus de moi
Oh la la, mon cœur danse la macarena
La, la, la, la, la, la, la, la, la, la
Oh la la, mon cœur danse la macarena
La, la, la, la, la, la, la, la, la, la
J'ai fait semblant d'bien aller
Quand t'as démarré, qu't'es allée chez lui ben nan, j'ai rien dit
Pourtant, j'le savais qu'tu baisais pour t'évader, après tout, j''tais là qu'pour dépanner
J'vais pas trop m'étaler, saigner fallait, blessé j'l'étais, j't'ai remballé, tu m'as remplacé, tu m'as délaissé
Mais comme tout salaud, j't'ai téléphoné, j't'ai récupéré puis, j't'ai fait pleurer parce que j'en ai rien à foutre, c'est ça la life (Ouais)
Qu'est-c'qu'tu croyais ? Tu baises avec moi, tu baises avec d'autres même si j'fais pareil, c'est pas la même chose
Ben oui et non, moi, j'ai b'soin de ma dose, ma libido
Et casse pas les lles-c', fais pas celle qui réplique, t'façon, j'veux plus trop qu'on s'explique
P't-être qu'avec lui, le monde s'ra à vous et c'est p't-être mieux ainsi
Donc, je me dis qu'si t'es avec lui, tu t'sentiras mieux mais si tu te sens mieux, tu te souviendras plus de moi
Oh la, la (Oui)

Mon cœur danse la macarena la, la, la, la, la, la, la, la, la, la
Oh la la (Oui, oui)
Mon cœur danse la macarena la, la, la, la, la, la, la, la, la, la
Oui
Dems
Oui, oui, oui, oui30Embed"
5,Lomepal - Trop beau,"73 ContributorsTrop beau Lyrics

J'avais jamais vu de nuit aussi calme, hey
J'la r'garde enchaîner les cigarettes, hey
Ses larmes coulent en silence, on entend toujours les cigales
On se blesserait même avec zéro mot, pourtant aucun mur sur cette terre
Ne pourrait étouffer le cri de nos phéromones, on risque pas de tenir longtemps (longtemps, longtemps, longtemps, longtemps)
Tu m'as même comparé à Lucifer, maint'nant, tu bois et tu veux bien de moi
Nan, mais j'hallucine hein, (je sais déjà c'que la distance entraîne) je sais déjà c'que la distance entraîne
Soit c'est la guerre pendant dix ans sans trêve, soit je la quitte en lui disant

Garde le sourire, plus rien n'est grave
Tant qu'il nous reste une seconde de souv'nir dans le crâne
Nos deux corps pourraient mourir, j'ai déjà fait le deuil
Maint'nant pars loin de moi, une larme cachée dans l'œil

Notre histoire n'aurait jamais pu finir dans le calme et la tendresse
Je te déteste comme cette phrase qui dit : ""C'était trop beau pour être vrai""
Je n'avouerai jamais que certaines de mes propres émotions m’effraient
Je te déteste comme cette phrase qui dit : ""C'était trop beau pour être vrai""

Bébé, serre-moi fort que j'oublie qu'c'est le chaos, autour, c'est le chaos
Regarde-nous, le destin a pas honte, les dieux ont pas honte
J'ai tout foiré cette année, c'est toujours en chantier, est-c'qu'on peut rev'nir en janvier ?
Son regard me traverse le corps comme une longue aiguille, on dirait bien qu'on est cuits
Nous deux dans la même voiture, on fonce vers la mort, on s'déteste tellement qu'on refait l'amour
Parce que c'est comme de la drogue, on a d'quoi planer, sur son dos, mon torse fait de l'aquaplaning
Le problème, c'est qu'ça m'rappelle pourquoi je l'aime
Je revois le début, les premières semaines, on pourrait repartir à zéro
Et prendre le premier avion comme dans un f‌ilm de merde mais c'est du délire
You might also like
Garde le sourire, plus rien n'est grave
Tant qu'il nous reste une seconde de souv'nir dans le crâne
Nos deux corps pourraient mourir, j'ai déjà fait le deuil
Maintenant, pars loin de moi, une larme cachée dans l'œil

Notre histoire n'aurait jamais pu finir dans le calme et la tendresse
Je te déteste comme cette phrase qui dit : ""C'était trop beau pour être vrai""
Je n'avouerai jamais que certaines de mes propres émotions m’effraient
Je te déteste comme cette phrase qui dit : ""C'était trop beau pour être vrai""14Embed"
6,Ninho - Lettre à une femme,"25 ContributorsLettre à une femme Lyrics

Uh, uh, uh, uh, uh, uh
Uh, uh, uh, uh, uh, uh

J'pourrais t'aimer toute ma vie même si tu fais trop mal au crâne
C'est comme une maladie sans vraiment savoir où j'ai mal
Et tes copines veulent tout gâcher (gâcher), à chercher mes erreurs
Et si elles arrivent à trouver (ouais), y aura des cris, des pleurs (hey)
J'dois faire de toi ma femme, j'en ai vu défiler des centaines
Moi, j'suis un loup du binks, à mes côtés, il m'faut une panthère
Qui ressemble à ma mère (eh), à la vie, à la muerte (à la vie, à la muerte)
On s'oubliera peut-être par fierté

La reine du royaume, c'est toi (hey), ma fille, ça s'ra une princesse
J'voulais juste la paix, moi et ma bella dans le Classe S (eh)
Oh mi amor, c'est que nous deux, fuck le reste (fuck)
C'est toi la best (ouais), en classe affaire, ici, c'est trop la guerre

À toi mon bébé, à toi ma future femme, y aura des trucs à respecter si tu veux qu'on y aille
Jusqu'au bout, je sais qu't'as kiffé, j'le vois dans ton sourire (dans ton sourire), j'te f'rai plus jamais souffrir
Et tes copines disent que c'est mort un avenir avec NI (avec NI)
Mais c'est p't-être William qui veut construire une famille
Une putain d'vie d'artiste, une putain d'vie de OG (une putain d'vie de OG)
Je sais qu'elle m'aime à la folie (oui), hey, hey (hey)
See Ninho LiveGet tickets as low as $53You might also like
Je sais qu'elle est jalouse, j'dois m'barrer en showcase
Je dis : ""J'dois faire d'la maille"" (maille), elle m'dit : ""Fais attention (ouais) quand même car si tu tombes (tombes), je tombe aussi (oui)
Ne viens pas gâcher nos projets, j'ai pas qu'ça à faire de ma vie, compris ?"" (oui, oui)
Y a que nous deux dans l'bolide, on s'balade depuis tout à l'heure
J'ai les clés des Portes de Paris, yeah, baby mama, de quoi t'as peur (ouais) ?
J'ai son cœur dans la poche (poche) mais rien qu'elle brouille les pistes (pistes)
Elle veut qu'j'fasse des efforts ('fforts), elle prendra la tête toute ma vie (oui)

La reine du royaume, c'est toi, ma fille, ça s'ra une princesse
J'voulais juste la paix, moi et ma bella dans le Classe S (Classe S, Classe S, Classe S)
Han (hein, hein)

À toi mon bébé, à toi ma future femme, y aura des trucs à respecter si tu veux qu'on y aille
Jusqu'au bout, je sais qu't'as kiffé, j'le vois dans ton sourire (dans ton sourire, ton sourire), j'te f'rai plus jamais souffrir
Et tes copines disent que c'est mort un avenir avec NI (avec NI)
Mais c'est p't-être William qui veut construire une famille
Une putain d'vie d'artiste, une putain d'vie de OG (une putain d'vie de OG)
Je sais qu'elle m'aime à la folie, hey, hey (hey, hey)

Je sais qu'elle m'aime à la folie, hey, hey (hey, hey)
Je sais qu'elle m'aime à la folie, hey, hey (hey, hey)5Embed"
7,Gazo - DIE,"9 ContributorsTranslationsEnglishDIE Lyrics

La mala est gangx
Eh
Bang-bang
Eh
Grr-grr
Le bang-bang
Ton gars Sherko est l'ingé'
Eh-eh, toujours
BSB
Hey (Hey)

Tu crois que j't'évite alors que j'maille (Que j'maille)
Elle veut savoir j'suis dans quel bail (Quel bail)
Dis où tu veux qu'on s'voit (S'voit) et j'te donnerais c'que tu veux d'moi (Veux d'moi)
Jusqu'à c'que je die (Die), mission, il va falloir que j'y aille (Aille)
Jusqu'à c'que je die (Je die), elle veut savoir comment que j'maille (Quе j'maille)

Nouvelle cargaison, donc partout, j'la répands
On achètе, on revend, on arrête, on reprend
Nou-nouvelle cargaison, donc partout, j'la répands
On achète, on revend, on arrête, on reprend
You might also like
Avec un peu de bien et de mal, on est fait, j'ai fumé ton doré mais j'attends l'effet
J'suis plus un ange, je sais, en effet, on était lié mais on s'est défait
Devant les gens, ils m'diront : ""Mon frère"", première occasion : penseront à me faire
J'me roule un grr pour me calmer les nerfs et on s'dit à dans quelques millénaires
Veulent voler mon flow et veulent voler ma 'sique, eux, c'est mes babys, de tout p'tits nous
Pour eux, que des baffes et des coups de genoux, té-ma ta dégaine, t'as tout d'chez nous
Ces ients-cli la bi'-bi', mon bigo m'agite, ton caillou arrive, j'suis dans le carrosse
Couper la part et des tout petits bouts, genre ""bibbidi-bobbidi-bobbidi-boo""

Tu crois que j't'évite alors que j'maille (Que j'maille)
Elle veut savoir j'suis dans quel bail (Quel bail)
Dis où tu veux qu'on s'voit (S'voit) et j'te donnerais c'que tu veux d'moi (Veux d'moi)
Jusqu'à c'que je die (Die), mission, il va falloir que j'y aille (Aille)
Jusqu'à c'que je die (Je die), elle veut savoir comment que j'maille (Que j'maille)

Hey, tais-toi et profite du moment jusqu'à c'que j'taille (Que j'taille)
Hey, pourquoi j't'ai pas connu avant ? Là, j'dois marger, faire ma maille, bae (Bae)
Tais-toi et profite du moment jusqu'à c'que j'taille (Que j'taille)
Hey, pourquoi j't'ai pas connu avant ? Là, j'dois marger, faire ma maille, bae (Bae)

J'te connais maintenant, nan, si j'te prends, moi, c'pas pour une autre (Pas pour une autre)
Même si là, t'as tort, bah, j'suis de ton côté, j'connais pas l'neutre (J'connais pas l'neutre)
Mais que tu veux m'bloquer si j'ai pas d'plavon, c'est de ta faute (C'est de ta faute)
Car si j'ai pas d'talbins, tu diras sûrement qu'c'est de ma faute (Qu'c'est de ma faute) donc
Tu crois que j't'évite alors que j'maille (Que j'maille)
Elle veut savoir j'suis dans quel bail (Quel bail)
Dis où tu veux qu'on s'voit (S'voit) et j'te donnerais c'que tu veux d'moi (Veux d'moi)
Jusqu'à c'que je die (Die), mission, il va falloir que j'y aille (Aille)
Jusqu'à c'que je die (Je die), elle veut savoir comment que j'maille (Que j'maille)

Jusqu'à c'que je die (Que je die)
Mission, il va falloir que j'y aille2Embed"
