,artist_title,lyrics
51,"Emilia - Ела, Хабиби","1 ContributorЕла, Хабиби (Ela, Habibi) Lyrics

Предупредиха ме опасна си била
Разбивала си много мъжките сърца
Ако са верни всички слухове за теб
Ами да взема да ти стана продуцент

Жесток си пак, пак, пак
Бог си пак, пак, пак
Кажи ми честно с колко спа?
Сваляли са ми хиляди звезди
С какво си по-различен ти?

Ела, хабиби, хабиби, при мен ела
Нали си най-добрата казваш в любовта
В тебе влюбвали се много всеки ден
Ами добре тогава пробвай се с мен
Ела, хабиби, хабиби, при мен ела
Да си намериш майстора в любовта
Ще ти запазя стая още от сега
Там в хотела на разбитите сърца

Oще първия ден ще си луда по-мен
А беше свикнала съвсем
Мъжете след тебе да ходят
Да ти се молят, създаваш им проблем
Ама не става с мен
Щом заспиш отивам си, самичка ще осъмнеш
Няма номер да ти дам на които да звъннеш
Тръпка дай ми, консумирам безотговорно
Трябва да ме впечатлиш, да искам повторно
You might also like
Ако ти бях жена на тебе...
Щях да те направя теб на пух и прах
Че тежък бил характера ти чух
След мен ще е памук, памук!

Жесток си пак, пак, пак
Бог си пак, пак, пак
Кажи ми честно с колко спа
С 200 пак, пак, пак
С 300 пак, пак, пак
А как върви в любовта?

Ела, хабиби, хабиби, при мен ела
Нали си най-добрата казваш в любовта
В тебе влюбвали се много всеки ден
Ами добре тогава пробвай се с мен
Ела, хабиби, хабиби, при мен ела
Да си намериш майстора в любовта
Ще ти запазя стая още от сега
Там в хотела на разбитите сърцаEmbed"
52,Elley Duhé - MIDDLE OF THE NIGHT,"48 ContributorsTranslationsEspañolTürkçeMIDDLE OF THE NIGHT Lyrics
I summoned you, please come to me
Don't bury thoughts that you really want
I fill you up, drink from my cup
Within me lies what you really want

Come, lay me down
'Cause you know this
'Cause you know this sound

In the middle of the night
In the middle of the night
Just call my name
I'm yours to tame
In the middle of the night
In the middle of the night
I'm wide awake
I crave your taste all night long
'Til morning comes
I'm getting what is mine
You gon' get yours, oh no, ooh
In the middle of the night
In the middle of the night, oh
You might also like
These burning flames, these crashing waves
Wash over me like a hurricane
I captivate, you're hypnotized
Feel powerful, but it's me again

Come, lay me down
'Cause I know this
'Cause I know this sound

In the middle of the night
In the middle of the night
Just call my name
I'm yours to tame
In the middle of the night
In the middle of the night
I'm wide awake
I crave your taste all night long
'Til morning comes
I'm getting what is mine
You gon' get yours, oh no, ooh
In the middle of the night
In the middle of the night, oh
Just call on me, ah
Just call my name
Like you mean it, ah

In the middle of the night
In the middle of the night
Just call my name
I'm yours to tame
In the middle of the night
In the middle of the night
I'm wide awake
I crave your taste all night long
'Til morning comes
I'm getting what is mine
You gon' get yours, oh
In the middle of the night
In the middle of the night, oh13Embed"
53,The Weeknd - Heartless,"266 ContributorsTranslationsTürkçeРусскийPortuguêsPolskiItalianoDeutschFrançaisفارسیNederlandsThe Weeknd - Heartless (Përkthim në Shqip)EspañolEnglishSvenskaHeartless Lyrics
Young Metro, young Metro, young Metro (Sheesh)
Ayy (Ayy)
Young Metro, young Metro

Never need a bitch, I'm what a bitch need (Bitch need)
Tryna find the one that can fix me
I've been dodgin' death in the six-speed
Amphetamine got my stummy feelin' sickly
Yeah, I want it all now
I've been runnin' through the pussy, need a dog pound
Hundred models gettin' faded in the compound
Tryna love me, but they never get a pulse down

Why? 'Cause I'm heartless
And I'm back to my ways 'cause I'm heartless
All this money and this pain got me heartless
Low life for life 'cause I'm heartless
Said I'm heartless
Tryna be a better man, but I'm heartless
Never be a weddin' plan for the heartless
Low life for life 'cause I'm heartless

Said I'm heartless
So much pussy, it be fallin' out the pocket
Metro Boomin turn this ho into a moshpit
Tesla pill got me flyin' like a cockpit
Yeah, I got her watchin'
Call me up, turn that pussy to a faucet
Duffle bags full of drugs and a rocket
Stix drunk, but he never miss a target
Photoshoots, I'm a star now (Star)
I'm talkin' Time, Rolling Stone, and Bazaar now (Bazaar now)
Sellin' dreams to these girls with their guard down (What?)
Seven years, I've been swimmin' with the sharks now
You might also like
Why? 'Cause I'm heartless
And I'm back to my ways 'cause I'm heartless
All this money and this pain got me heartless
Low life for life 'cause I'm heartless
Said I'm heartless
Tryna be a better man, but I'm heartless
Never be a weddin' plan for the heartless
Low life for life 'cause I'm heartless

I lost my heart and my mind
I try to always do right
I thought I lost you this time
You just came back in my life
You never gave up on me (Why don't you?)
I'll never know what you see (Why won't you?)
I don't do well when alone (Oh yeah)
You hear it clear in my tone

'Cause I'm heartless (Ooh)
And I'm back to my ways 'cause I'm heartless
All this money and this pain got me heartless
Low life for life 'cause I'm heartless
Said I'm heartless
Tryna be a better man, but I'm heartless
Never be a weddin' plan for the heartless
Low life for life 'cause I'm heartless159Embed"
54,Masked Wolf - Astronaut In The Ocean,"211 ContributorsTranslationsTürkçeРусскийDeutschFrançaisAstronaut in the Ocean Lyrics
Astronaut

What you know about rollin' down in the deep?
When your brain goes numb, you can call that mental freeze
When these people talk too much, put that shit in slow motion, yeah
I feel like an astronaut in the ocean, ayy
What you know about rollin' down in the deep?
When your brain goes numb, you can call that mental freeze
When these people talk too much, put that shit in slow motion, yeah
I feel like an astronaut in the ocean

She say that I'm cool (Damn straight)
I'm like, ""Yeah, that's true"" (That's true)
I believe in G-O-D (Ayy)
Don't believe in T-H-O-T
She keep playing me dumb, uh (Play me)
I'ma play her for fun (Uh-huh)
Y'all don't really know my mental
Let me give you the picture like stencil
Fallin' out in a drought
No flow, rain wasn't pourin' down (Pourin' down)
See, that pain was all around
See, my mode was kinda lounged
Didn't know which, which way to turn
Flow was cool, but I still felt burnt
Energy up, you can feel my surge
I'ma kill everything like this purge (Ayy)
You might also like
Let's just get this straight for a second, I'ma work (Yuh)
Even if I don't get paid for progression, I'ma get it (Uh, get it)
Everything that I do is electric (Ayy)
I'ma keep it in a motion, keep it movin' like kinetic, ayy (Yeah, yeah, yeah, yeah, yeah)

Put this shit in a frame, better know I don't blame
Everything that I say, man, I seen you deflate
Let me elevate, this ain't a prank
Have you walkin' on a plank, li-li-li-li-like
Both hands together, God, let me pray (Now let me pray), uh
I've been goin' right, right around, call that relay (Masked Wolf)
Pass the baton, back and I'm on
Swimmin' in the pool, Kendrick Lamar, uh (Ayy)
Want a piece of this, a piece of mine, my peace a sign
Can you please read between the lines?
My rhyme's inclined to break your spine (Spine)
They say that I'm so fine (Fine)
You could never match my grind (True)
Please do not, not waste my time (Wolf)

What you know about rollin' down in the deep?
When your brain goes numb, you can call that mental freeze
When these people talk too much, put that shit in slow motion, yeah
I feel like an astronaut in the ocean, ayy
What you know about rollin' down in the deep?
When your brain goes numb, you can call that mental freeze
When these people talk too much, put that shit in slow motion, yeah
I feel like an astronaut in the ocean69Embed"
55,Tate McRae - greedy,"59 ContributorsTranslationsPortuguêsEspañolDeutschFrançaisItalianoNorsk (bokmål / riksmål)​greedy Lyrics
(Woo)

He said, ""Are you serious? I've tried, but I can't figure out
I've been next to you all night and still don't know what you're about
You keep ta- (Ta-ta-), talkin', but not much comin' out your mouth
Can't you tell that I want you?"", I say, yeah
I would want myself
Baby, please believe me
I'll put you through hell
Just to know me, yeah, yeah
So sure of yourself
Baby, don't get greedy
That shit won't end well
(No, it won't) End well

(Uh-uh, uh-uh-uh, uh-uh, woo)

I see you eyein' me down, but you'll never know much past my name
Or how I'm runnin' this room around and that I'm still half your age
Yeah, you're loo- (Loo-loo-), lookin' at me like I'm some sweet escape
Obvious that you want me, but I said
See Tate McRae LiveGet tickets as low as $26You might also like
I would want myself
Baby, please believe me
I'll put you through hell
Just to know me, yeah, yeah
So sure of yourself
Baby, don't get greedy
That shit won't end well
(No, it won't) End well

He said, ""I'm just curious, is this for real or just an act?
Can't tell if you love or hate me, never met someone like that
Drive me so (So, so) crazy, did you know you got that effect?""
I said, ""Lemme check, yeah""
I would want myself
Baby, please believe me
I'll put you through hell
Just to know me, yeah, yeah
So sure of yourself
Baby, don't get greedy
That shit won't end well
(No, it won't) End well
(I would want myself)
(I would want myself)
I would want myself
(I would want myself)
(I would want myself)
(Uh-uh, uh-uh-uh, uh)22Embed"
56,The Kid LAROI - Stay,"136 ContributorsTranslationsTürkçeEspañolPortuguêsItalianoDeutschFrançaisفارسیРусскийSTAY Lyrics
I do the same thing I told you that I never would
I told you I'd change, even when I knew I never could
I know that I can’t find nobody else as good as you
I need you to stay, need you to stay, hey (Oh)

I get drunk, wake up, I'm wasted still
I realize the time that I wasted here
I feel like you can't feel the way I feel
Oh, I’ll be fucked up if you can't be right here

Oh, ooh-woah (Oh, ooh-woah, ooh-woah)
Oh, ooh-woah (Oh, ooh-woah, ooh-woah)
Oh, ooh-woah (Oh, ooh-woah, ooh-woah)
Oh, I'll be fucked up if you can't be right here

I do the same thing I told you that I never would
I told you I'd change, even when I knew I never could
I know that I can't find nobody else as good as you
I need you to stay, need you to stay, hey
I do the same thing I told you that I never would
I told you I'd change, even when I knew I never could
I know that I can't find nobody else as good as you
I need you to stay, need you to stay, hey
You might also like
When I’m away from you, I miss your touch (Ooh)
You’re the reason I believe in love
It's been difficult for me to trust (Ooh)
And I’m afraid that I'ma fuck it up
Ain't no way that I can leave you stranded
'Cause you ain’t ever left me empty-handed
And you know that I know that I can't live without you
So, baby, stay

Oh, ooh-woah (Oh, ooh-woah, ooh-woah)
Oh, ooh-woah (Oh, ooh-woah, ooh-woah)
Oh, ooh-woah (Oh, ooh-woah, ooh-woah)
I'll be fucked up if you can't be right here

I do the same thing I told you that I never would
I told you I'd change, even when I knew I never could
I know that I can't find nobody else as good as you
I need you to stay, need you to stay, hey
I do the same thing I told you that I never would
I told you I'd change, even when I knew I never could
I know that I can't find nobody else as good as you
I need you to stay, need you to stay, hey
Woah-oh
I need you to stay, need you to stay, hey115Embed"
57,Preslava - Sladkoto zlo,"1 ContributorBlišč Lyrics
Uhh, pojači mau beat plis
Huh-uh
Vidm da rabte uh
Hey, uh, uh
Vidm da rabte ta Blišč, huh-huh-huh
Vidm da rabte ta Blišč in svet se vm v učeh, huh
Js gledam svoje brate in seke in vidm cel svet zlat
Tvoj dotik v mojmu spominu je zdj že pozablen komet (Ayy)

Vidm da rabte ta Blišč in svet se vm v učeh, huh
Js gledam svoje brate in seke in vidm cel svet zlat
Tvoj dotik v mojmu spominu je zdj že pozablen komet
Utrink besed in želj, izginja k najin prvi pogled

Moj dotik zate je fantasy
Včasih ti biu je ecstasy
Hvalеžn da bil je destiny
Delam kar vеdno je best for me
On zdj naprej sam kidam
Kiddo v men uživa
Demon v men ubija, uh
Narco v men si zvija (Ayy)
You might also like
Vidm da rabte ta Blišč in svet se vm v učeh, huh
Js gledam svoje brate in seke in vidm cel svet zlat
Tvoj dotik v mojmu spominu je zdj že pozablen komet
Utrink besed in želj, izginja k najin prvi pogled

Yeah baby, niso zvezde sam Mercedes
Voz pele po nebu, sam vn prit
Runway ni omejitve
In lately, fura me muska k Bentley
Rože podobne so pentli
Topijo v ustih k candy  (Yeah, yeah, yeah)

Vidm da rabte ta Blišč in svet se vm v učeh, huh
Js gledam svoje brate in seke in vidm cel svet zlat
Tvoj dotik v mojmu spominu je zdj že pozablen komet  (Yeah)
Utrink besed in želj, izginja k najin prvi pogled  (Yeah)

Poberm torbe, po čike bejbi v trafiko
Midva greva lahk skupi v Afriko
Greva po najnm highwayu v Saudijo
Greva daleč stran v Arabijo
Od kraja do kraja, vsakič nova postaja
Naju noben ne dohaja, ker noben ne probava
V vsako mesto k greva, isti tattoo si dava
Od kluba do kluba, sam ti si zabava
Kjer sva sama ostala in peščena obala
Valovi in skale, naju tok da ujame
Naju pele do jame, kjer bova prespala
Rečš mi goodnight, js pa sladko v sanje

Poberm torbe, po čike bejbi v trafiko
Midva greva lahk skupi v Afriko
Greva po najnm highwayu v Saudijo
Greva daleč stran v ArabijoEmbed"
58,Ed Sheeran - Bad Habits,"144 ContributorsTranslationsTürkçeEspañolPortuguês日本語ItalianoDeutschفارسیΕλληνικάNorsk (bokmål / riksmål)Bad Habits Lyrics
(One, two, three, four)
Ooh, ooh

Every time you come around, you know I can't say no
Every time the sun goes down, I let you take control
I can feel the paradise before my world implodes
And tonight had something wonderful

My bad habits lead to late nights endin' alone
Conversations with a stranger I barely know
Swearin' this'll be the last, but it probably won't
I got nothin' left to lose, or use, or do
My bad habits lead to wide eyes starin' at space
And I know I lose control of the things that I say
Yeah, I was lookin' for a way out, now I can't escape
Nothin' happens after two, it's truе, it's true
My bad habits lead to you

Ooh-ooh, ooh-ooh
My bad habits lead to you
Ooh-ooh, ooh-ooh
My bad habits lеad to you
See Ed Sheeran LiveGet tickets as low as $74You might also like
Every pure intention ends when the good times start
Fallin' over everything to reach the first time's spark
It started under neon lights and then it all got dark
I only know how to go too far

My bad habits lead to late nights endin' alone
Conversations with a stranger I barely know
Swearin' this'll be the last, but it probably won't
I got nothin' left to lose, or use, or do
My bad habits lead to wide eyes starin' at space
And I know I lose control of the things that I say
Yeah, I was lookin' for a way out, now I can't escape
Nothin' happens after two, it's true, it's true
My bad habits lead to you

Ooh-ooh, ooh-ooh
My bad habits lead to you
Ooh-ooh, ooh-ooh

We took the long way 'round
And burned till the fun ran out, now
My bad habits lead to late nights endin' alone
Conversations with a stranger I barely know
Swearin' this'll be the last, but it probably won't
I got nothin' left to lose, or use, or do
My bad habits lead to wide eyes starin' at space
And I know I lose control of the things that I say
Yeah, I was lookin' for a way out, now I can't escape
Nothin' happens after two, it's true, it's true
My bad habits lead to you

Ooh-ooh, ooh-ooh
My bad habits lead to you
Ooh-ooh, ooh-ooh
My bad habits lead to you60Embed"
59,The Weeknd - I Was Never There,"133 ContributorsTranslationsEnglishEspañolРусскийPortuguêsDeutschI Was Never There Lyrics
What makes a grown man wanna cry?
(Cry, cry, cry, cry)
What makes him wanna take his life? (Ah, ah)
(Yeah)
His happiness is never real
(Real, real, real, real)
And mindless sex is how he feels, ooh, he heals

When it's time, when it's time, when it's time
It won't matter (It don't matter)
It won't matter (Matter)
When it's time, when it's time, when it's time (Time, it's time, babe)
It won't matter (It won't matter, babe)
It won't matter (Ya)
It was like he was never there
(It was like he was never there)
It was like he was gone in thin air, oh
When it's time, when it's time, when it's time (Oh, baby)
It won't matter (It won't matter, baby)
It won't matter

When it's time, when it's time, when it's time
It won't matter
It won't matter
When it's time, when it's time, when it's time
It won't matter
It won't matter
It was like he was never there
It was like he was gone in thin air
When it's time, when it's time, when it's time
It won't matter, it won't matter
You might also like
When it's time, when it's time, when it's time
It won't matter, it won't matter
When it's time, when it's time, when it's time
It won't matter, it won't matter

Ooh, now I know what love is
And I know it ain't you for sure
You'd rather something toxic
So, I poison myself again, again
'Til I feel nothing
In my soul (In my soul)
I'm on the edge of something breaking
I feel my mind is slowly fadin'
If I keep going, I won't make it
If I keep going, I won't make it

And it's all because of you
It's all because of you
It's all because of you
It's all because of you
Woah, woah
Don't you, baby, hey
It won't matter, baby
Don't you know?
Don't you know?
Oh, ooh, oh
Hey!90Embed"
60,Mom4eto - MARGINALA,"2 ContributorsMARGINALA Lyrics
Момо Рекърдсс...
Gyoky to da' beat

Времето беше огън, а навънка пещ
Тря'а си луд или на зор, за да бръмкаш пеш
И тогава го видях отпред - на хоризонта
Маргинал, спрял с тунингована Хонда
Вика: ""Ела да те науча на чалъм за кеш""
От тия лафове, само акъл береш
А на предната седалка до него Покахонтас
На цял квартал дава сладкиши - Уили Уонка
Стой!
И започва с куките гонка
А багажника на Амстердам фонка
Хич не му се връща в пъкъла на килиите
За т'ва зад ъгъла, изхвърли кесиите
Куките го гепаха и ха, да стане за резил
Но той извади две лилави в европейски стил
По 500 на колега, питам добре ли са?
И с тия двамата до ден днешен авери са

Той
Той е Маргинала
(Бос)
Боса на квартала (Skrrr)
Пред панела лимузина
Е, нищо, че изпял е двама трима (Колко саа)
Той е генерала (To the bones)
Райони разпределя
Знае, около 200 думи и леко срича
Страшен сладур, цяла България го обича (Муа)
You might also like
Всички му дават ред на опашката на КАТ
Питаш някой пишлеме за него - баш тарикат
Даже старите бандити му говорят на бат
Ако и той скочи в бой, всички дават назад
С най-добър приятел, тартор от циганска махала
Тия по изборите батьо напрайха торби с пара
Поршето 30-ка на 100 не върви с вода
Има жена в Германия подпира бизнеса
Направи сделка с чалга певица за Ozempik
Как мислиш, че е свалила 30-ка този бик
Мъжа и се набута 50-ка за онзи клип
Инвестира ги в това - тая да се води VIP (да са чувства)

Ако та' кефят редовете по-нагоре
Имам за тебе малко лоши новини
И ако Маргинала, брат, за теб герой е
Сигурен ли си, че той не си ти?

Той
Той е Маргинала
(Бос)
Боса на квартала (Skrrr)
Пред панела лимузина
Е, нищо, че изпял е двама трима (Колко саа)
Той е генерала (To the bones)
Райони разпределя
Знае, около 200 думи и леко срича
Страшен сладур, цяла България го обича (Муа)
На бицепс, преса и гърди ти са' бръмчи
Батинката дет' ща' овърти
При него нямало районни, мой
Всичко ставало с пари
Всичките си авери до един, ги нареди
Ей, шматка, коленичи!
Как ги прай батко ти в тетрадката запиши
Знам, че искаш от сладкото дет' горчи
От незаконни схеми, мойка, прай ли си бели дни?
Я само легни и се наспи
Само легни и почини
Знам, че цяла вечер искаш ротативката да звучи
Яница въртележката да върти
В клуба, тежката, влизаме
Дай една стоянка, за магистралката да навийм
Искам банката да разбийм
Тоя палил дебелани, не пушил slim
Цял живот живеел живота на Чарли Шийн

Той
Той е Маргинала
(Бос)
Боса на квартала (Skrrr)
Пред панела лимузина
Е, нищо, че изпял е двама трима (Колко саа)
Той е генерала (To the bones)
Райони разпределя
Знае, около 200 думи и леко срича
Страшен сладур, цяла България го обича (Муа)

Ъ-ъ-ъ-ъ Момо РекърдсEmbed"
