,artist_title,lyrics
47,Soolking - Suavemente,"20 ContributorsTranslationsItalianoSuavemente Lyrics

Ah, ah, ah

Suavemente besame
J'sors de la tess et je mets plus les mains en l'air (Ouh)
Suavemente besame (Yeah, yeah, yeah)
J'sors de la tess en moteur Italia (Poh)

Suavemente, j'ai traversé la mer
J'oublie pas ceux qui s'lèvent tôt pour un salaire
J'aime pas me vanter, j'fais c'qu'il y a à faire
Et j'aimerais qu'les miens sortent tous de la galère
Quitter la galère, haraga, dans les rues d'Palerme (Bah ouais)
Une p'tite italienne qui m'aime et qui m'fait des papels
Oh, bébé, t'es douce, mama, comment t'es suave (Ouais)
Les yeux revolvers, c'est une beauté criminelle (Crick, paw)

Suavemente besame
Quand j'sors de la tess, je mets plus les mains en l'air (Ouh)
Suavemente besame
J'sors de la tess en moteur Italia (Yeah, yeah, yeah)
See Soolking LiveGet tickets as low as $59You might also like
J'fais la fête, j'écoute pas les ragots
J'suis à Monaco, le poto fume la Gelato (Ouais)
Si pronto, elle est belle, elle veut une photo
J'l'emmène à Phuket et on se balade en moto (Vroum, vroum)
Oh, madre mia, j'vais arriver, ghir béchwiya
J'vais prendre tout c'qu'il y a, j'm'en fous mel 3alamiya
Ouais, je danse le mia et je dodo dans l'avion
Fierté d'un DZ, c'est moi qui paye l'addition

Suavemente besame
J'sors de la tess, je mets plus les mains en l'air (Ouh)
Suavemente besame
J'sors de la tess en moteur Italia (Yeah)

J'fais des loves (Suave), maintenant, j'fais des loves (Suave)
J'ai quitté la rue, discret comme Manu Le Coq (Suave, ouais)
J'fais des loves (Suave), bébé, j'fais des loves (Suave)
J'ai quitté la rue, discret comme Manu Le Coq (Suave)

Suavemente besame
Quand j'sors de la tess, je mets plus les mains en l'air (Ouh)
Suavemente besame
J'sors de la tess en moteur Italia (Yeah, yeah)
Oh-oh-oh-oh, oh-oh-oh-oh
Oh-oh-oh-oh, oh-oh-oh-oh
Oh-oh-oh-oh, oh-oh-oh-oh
Oh-oh-oh-oh, oh-oh-oh-oh
Suave, suave, suave, suave
SuaveEmbed"
48,Ed Sheeran - Shape of You,"352 ContributorsTranslationsTürkçeEspañolPortuguêsΕλληνικάDeutschFrançaisItalianoالعربيةShape of You Lyrics
A club isn't the best place to find a lover
So the bar is where I go (Mm)
Me and my friends at the table doin' shots
Drinkin' fast and then we talk slow (Mm)
And you come over and start up a conversation with just me
And trust me, I'll give it a chance now (Mm)
Take my hand, stop, put Van the Man on the jukebox
And then we start to dance and now I'm singin' like

Girl, you know I want your love
Your love was handmade for somebody like me
Well, come on now, follow my lead
I may be crazy, don't mind me
Say, ""Boy, let's not talk too much""
Grab on my waist and put that body on me
Well, come on now, follow my lead
Come, come on now, follow my lead, mm

I'm in love with the shape of you
We push and pull like a magnet do
Although my heart is fallin' too
I'm in love with your body
And last night, you were in my room
And now my bed sheets smell like you
Every day, discoverin' somethin' brand new
Well, I'm in love with your body
See Ed Sheeran LiveGet tickets as low as $74You might also like
Oh, I, oh, I, oh, I, oh, I
Well, I'm in love with your body
Oh, I, oh, I, oh, I, oh, I
Well, I'm in love with your body
Oh, I, oh, I, oh, I, oh, I
Well, I'm in love with your body
Every day, discoverin' somethin' brand new
I'm in love with the shape of you

One week in, we let the story begin
We're goin' out on our first date (Mm)
You and me are thrifty, so go all-you-can-eat
Fill up your bag and I fill up a plate (Mm)
We talk for hours and hours about the sweet and the sour
And how your family is doin' okay (Mm)
And leave and get in a taxi, and kiss in the back seat
Tell the driver make the radio play and I'm singin' like

Girl, you know I want your love
Your love was handmade for somebody like me
Well, come on now, follow my lead
I may be crazy, don't mind me
Say, ""Boy, let's not talk too much""
Grab on my waist and put that body on me
Well, come on now, follow my lead
Come, come on now, follow my lead, mm
I'm in love with the shape of you
We push and pull like a magnet do
Although my heart is fallin' too
I'm in love with your body
And last night, you were in my room
And now my bed sheets smell like you
Every day, discoverin' somethin' brand new
Well, I'm in love with your body

Oh, I, oh, I, oh, I, oh, I
Well, I'm in love with your body
Oh, I, oh, I, oh, I, oh, I
Well, I'm in love with your body
Oh, I, oh, I, oh, I, oh, I
Well, I'm in love with your body
Every day, discoverin' somethin' brand new
I'm in love with the shape of you

Come on, be my baby, come on
Come on, be my baby, come on
Come on, be my baby, come on
Come on, be my baby, come on
Come on, be my baby, come on
Come on, be my baby, come on
Come on, be my baby, come on
Come on, be my baby, come on
I'm in love with the shape of you
We push and pull like a magnet do
Although my heart is fallin' too
I'm in love with your body
And last night, you were in my room
And now my bed sheets smell like you
Every day, discoverin' somethin' brand new
Well, I'm in love with your body

Come on, be my baby, come on
Come on, be my baby, come on
I'm in love with your body
Come on, be my baby, come on
Come on, be my baby, come on
I'm in love with your body
Come on, be my baby, come on
Come on, be my baby, come on
I'm in love with your body
Every day, discoverin' somethin' brand new
I'm in love with the shape of you409Embed"
49,Damso - Feu de bois,"145 ContributorsFeu de bois Lyrics

Baby, baby
Oh ba-baby
Baby-y-y-y-y
Feu de bois, jeu de voix, suis-moi
Je te veux pas, fuis-moi, je te veux toi (Dems, Dems)
Feu de bois, jeu de trois, un des deux est de moi
Un des trois est de nous, aidez-nous, aidez-moi
Feu de bois, jeu de voix, tu me dois, Dieu te voit
Montre-moi que du doigt ce que t'as fait de moi
Creux de joie, queue de rois, fée des bois
Fais de moi ce qu'on a fait de toi
Sur le toit, sûre de toi, tu t'y crois
C'est déjà ce qu'on a fait de moi (Sale, sale)
Fais de toi, fais de nous
Prends pas la tête, je n'tiens plus le coup
On bavardait sans dire un mot, le bruit de mon silence en dit long
Sentiments grandissants figeant l'ego
Prison de mots, absence de compliment
J'suis en attente, en apprentissage, très peu sage
J'ai vu l'âge à la nage, je fuis l'alcoolisme
Sur la blanche page, j'agonise
Mille latences entre c'que je pense et ce que je dis, ce que j'obtiens et ce que je vise
Soit c'est le père ou bien le fils, soit la be-her ou bien la tise
Que la nightzer, ouais
You might also like
Je sais c'que tu penses de nous
Quand tu dis que tu n'sais plus quoi penser de nous
Je sais c'que tu veux vraiment
Quand tu dis que tu n'sais plus c'que tu veux vraiment
Je sais qu'tu n'as plus le temps
Quand tu dis que tu penses qu'il te faut plus de temps

Baby (Oh la la), baby (Oh la la)
Oh ba-baby (Oui, c'est sale)
Baby-y-y-y-y
Baby (Oh la la), baby (Oh la la)
Oh ba-baby (Oui, c'est sale)
Baby-y-y-y-y
Oh, oh, oh

Tu parles de moi, craches dans mon dos
Je parle de toi, crache dans ta bouche (Rrk, peuh)
J's'rai toujours un vrai négro, que t'aies tes règles ou que t'accouches (Sale)
J'te vois à travers le rideau, je t'observe quand tu te touches
J'sais pas si c'est toi ou c'est l'eau, j'vois pas quand tu mouilles dans la douche
Fume quand relation s'effrite
Lune, Soleil dans même rayon
Qu'une parole tant que j'écris, brume, gondole dans l'océan
Femmes aux yeux d'hommes sont que des filles
Sentiments plongés dans l'néant
Pluie, averses de ressentis mais silence prend les devants
Je t'aime quand je suis dedans, dehors, je suis plein de mépris
Ta fragilité n'est plus à prouver
Quand tout allait mal et qu'on le savait pas
On passait du temps à essayer d'en passer
À deux pour l'prix d'un, d'un ""nous"" sans ""toi"" et ""moi""
J'ai brûlé tes lettres dans un feu de bois mais j'ai toujours en tête nos jeux de voix
J'ai suivi l'oseille, toi, la fée des bois
J'ai toujours en toi ce que t'as fait de moi
Que la nightzer, ouais
Je sais c'que tu penses de nous
Quand tu dis que tu n'sais plus quoi penser de nous
Je sais c'que tu veux vraiment
Quand tu dis que tu n'sais plus c'que tu veux vraiment
Je sais qu'tu n'as plus le temps
Quand tu dis que tu penses qu'il te faut plus de temps

Baby (Oh la la), baby (Oh la la)
Oh ba-baby (Oui, c'est sale)
Baby-y-y-y-y
Baby (Oh la la), baby (Oh la la)
Oh ba-baby (Oui, c'est sale)
Baby-y-y-y-y
Oh, oh, oh

Pa-pam, pa-pam, pa-pam, pa-pam49Embed"
50,iñigo quintero - Si No Estás,"3 ContributorsTranslationsEspañolEnglishPortuguêsIñigo Quintero - Si No Estás (Deutsche Übersetzung) Lyrics

Hoch zu träumen ist die Kraft
Die dir vom Himmel geschenkt wurde
Nein, nein, nein, nein, nein, nein, nein

Ich weiß nicht, wohin ich gehe, es ist nicht real
Du bist schon lange nur noch einer von vielen
Und ich hasse es, wenn ich voll von diesem Gift bin
Und ich höre Donner, wenn du nicht da bist

Was hast du mit mir gemacht? Wo bin ich?
Tausend Planeten erscheinen plötzlich vor mir, das ist eine Halluzination
Ich will deine andere Hälfte sehen, um aus dieser Stadt zu entkommen
Und mich mit deiner Art zu denken anstecken
Ich schaue in den Himmel, als ich mich erinnere, erkenne ich einmal mehr
Dass es keinen Moment gibt, der vergeht, in dem ich nicht aufhöre, an dich zu denken
Diese Entfernung ist nicht normal, ich habe genug vom Warten
Zwei Scheine, um dich zu lieben, ich will nichts mehr sehen

Unmöglich, es ist zu spät (Zu spät)
Es ist alles ein Desaster (Es ist ein Desaster)
Dies ist eine Besessenheit
Ich habe keine Verwendung für deine wenigen Zeichen (Deine Zeichen)
Nichts ist mehr, wie es einmal war (Wie es einmal war)
Ich vergesse, wer ich bin
You might also like
Was hast du mit mir gemacht, wo bin ich?
Du gehst nicht geradeaus, es ist das gleiche alte Ding
Und plötzlich verliere ich meinen Verstand
Hundert sinnlose Komplexe
Ich werde von deinem Herzschlag und deiner Stimme weggerissen
Und ich kann es nicht mehr ertragen

Ich weiß nicht, wohin ich gehe, es ist nicht real
Du bist schon lange nur noch einer von vielen
Und ich hasse es, wenn ich voll von diesem Gift bin
Und ich höre Donner, wenn du nicht da bist

Unmöglich, es ist zu spät (Zu spät)
Es ist alles ein Desaster (Es ist ein Desaster)
Dies ist eine Besessenheit
Ich habe keine Verwendung für deine wenigen Zeichen (Deine Zeichen)
Nichts ist mehr, wie es einmal war (Wie es einmal war)
Ich vergesse, wer ich bin

Und wo bist du?
Die Wahrheit ist, dass es tausend verdammte Nächte ohne deine Umarmung gewesen sind (Ich höre Donner)
Es ist eine seltsame Sache, ich bin süchtig nach deiner Liebe (Oh-oh-oh-oh), nach deiner Liebe (Oh-oh-oh-oh)
Zu deiner Liebe, Liebe, nein, nein, nein, nein, nein, nein
Und ah-ah-ah, na-na
Ich will dich sehen, dich sehen, dich sehen, lass es jetzt endenEmbed"
51,Damso - Δ. Dieu ne ment jamais,"98 ContributorsΔ. Dieu ne ment jamais Lyrics

Pour être honnête, j'sais pas faire autrement, ma haine n'a pas su cicatriser
La musique, j'l'aimais jusqu'à c'que j'sois dedans, contrats véreux veulent me faire signer
""Personne t'aimera comme moi"" m'a dit Maman, si c'n'est le joint que j'vais rouler
Qui m'f'ra oublier méchanceté d'ce monde ? Le diable et son fessier bien roulé
Très loin des maisons de disques mais près de mon public avisé
Très loin des ventes et des chiffres mais près de la musicalité
Regarde au-d'ssus, il n'y a plus de nuages, la pluie ne risque pas de tomber
Regarde mon cœur, il n'a plus de grillage mais personne ne risque d'y entrer

L'absence de lumière fait qu'j'suis dans le noir
On se dit frères parce qu'on fume quelques noix
La méchanceté des hommes m'attriste beaucoup
La voix des anges résonne moins qu'celle des vautours

J'les porte dans mon cœur, ils me portent l'œil, j'ai tué le game et j'ai fait le deuil
Négro me dit qu'on est ensemble mais qu'en cas d'échec, j's'rai tout seul
Sperme dans la bouche, elle aime le goût du risque, elle croit pas en moi mais veut être sur la liste
J'ai qu'un seul amour, c'est la chanson, solitaire, j'n'ai pas d'besoin d'attention
Je tire et je tue, tu meurs et c'est tout, t'avais qu'à fermer ta grande gueule
Je tire et je fume, j'm'en vais sur la Lune, loin des perquis' à Argenteuil
Esprit torturé, douleur intestinale, j'ai avalé méchanceté de l'Homme
J'l'ai digéré, j'ai pris le bien du mal, j'me sens comme Adam juste avant la pomme
You might also like
L'absence de lumière fait qu'j'suis dans le noir
On se dit frères parce qu'on fume quelques noix
La méchanceté des hommes m'attriste beaucoup
La voix des anges résonne moins qu'celle des vautours

À chaque fois qu'je sors sans prendre des sous, la vie me rappelle que je viens de loin
Pique dans le dos tel le sombre hérisson, trahison sponso' par Louboutin
J'serre plus de meufs que de mains, le genre masculin, je m'en méfie
Trous écartés, genoux fléchis, biatch, j'connais d'jà fin du récit
Enfermé dans cellule, je désaoule, j'reprends conscience de mes soucis
Dans son vagin, je me défoule, à chaque ""je t'aime"", je me détruis
Pour elle, j'suis tout autre chose que Damso, elle voit en moi c'que je n'vois plus
Métissé comme touche de piano, entre le vivre et le vécu
J'fais un malaise eucharistique, j'suis entre sucré et salé
Le diable se cache derrière l'artistique, pour milieu d'la musique, j'étais pas prêt

Dieu ne ment jamais
Nan, Dieu ne ment jamais
Dieu ne ment jamais, yeah
Damso
SantosVie, FuentesVie, tout est Vie13Embed"
52,GAULOIS - Jolie,"10 ContributorsTranslationsEnglishJolie Lyrics

A-Atlas
Eh-eh, mafia
Exi
Eh, eh

Beaucoup d'poids sur les épaules, dur à porter mais ça va, j'me suis déjà sauvé du pays, faudrait qu'j'pense à moi (Moi)
La Gaule, dis-moi, c'est comment (Comment) ? Ils prennent les gens pour des cons (Hum)
La vie d'ma mère, c'est pas comme ça, électrique, j'refais la déco' (Eh-eh)
J'voulais tout, tout d'suite, maintenant (Maintenant), pourquoi j'vais l'avoir demain ? (Demain)
Question d'comportement (Han), dix-huit heures, minuit, j'fais demi (Demi)
Et maman s'inquiète beaucoup (Beaucoup) et papa ne dit plus rien (Plus rien)
Des millions, la corde au cou, j'crois qu'tout ça, ça rime à rien

J'vais acheter plusieurs calibres (Brr), mes amis s'ront mes shooters (Eh)
Mais bon, vaut mieux chuchoter, les murs écoutent à toute heure
Every day, toi, t'es pas là, donc j'sais pas tu parles de quoi (Quoi)
J'sais pas tu parles de qui, j'espère que tu parles pas de moi (Eh-eh)

C'est pas joli, joli, j'crois qu'ils m'ont ché-lâ (Hum), 11.43, plein de soucis mais j'suis là (Là)
11.43, plein de soucis mais j'suis là, une fois, devant, dis-moi, on fait comment ? (Hum)
Cœur au garage, accidenté, j'dois l'réparer
Une fois qu't'as tiré puis, rechargé, c'est plus pareil
Oh la la, c'est plus pareil, eh, eh
Dis-moi, on fait comment ?
You might also like
Meneur de jeu, j'sors à la deuxième, numéro dix, démarre en troisième
Très peu d'acquittés vers chez moi, très peu d'acquittés vers chez moi
Trop d'bénéfices, j'fais que des A/R, ça peut t'allumer vers chez toi
Les keufs nous pistent et y a des affaires, à des prix dérisoires
Souvent en pétard, demande à Joe (Joe), ça claque des la à Monaco
J'suis dans l'huitième, j'visser la coke, mec du neuf-deux, on a la côte
J'ai mon brolique, j'peux pas goûter (J'ai mon brolique, j'peux pas goûter)
J'parle en nouchi, tout est codé et mon re-frè va pas te louper

C'est pas joli, joli, j'crois qu'ils m'ont ché-lâ (Hum), 11.43, plein de soucis mais j'suis là (Là)
11.43, plein de soucis mais j'suis là, une fois, devant, dis-moi, on fait comment ? (Hum)
Cœur au garage, accidenté, j'dois l'réparer
Une fois qu't'as tiré puis, rechargé, c'est plus pareil
Oh la la, c'est plus pareil, eh, eh
Dis-moi, on fait comment ?

C'est la G, c'est la Gaule
C'est Nanterre
Dis-moi, on fait comment ?Embed"
53,Gambi - PETETE,"8 ContributorsPETETE Lyrics

Pew
Grr
Pew, pew, pew, pew
Skrt, rah (Elias Beats)
Rah, rah, rah, rah

Y a la CR partout dans l'bloc (Okay), j’suis khabat, j'suis vite pété (Okay)
Bébé, elle donne ça bien (Okay), bébé, elle fait ça bien (Okay)
J'vois la rue en 1080 full HD (Paw, paw), les p’tits vont t'faire ta voiture au boitier (Paw, paw)
J'suis en fumette, j'suis pété-té (Grr), j'suis en buvette, j'suis pété-té (Rah)

Ma chérie, ma chérie, ma chérie, ma chérie (You-hou), hcheum, y a rien d'officiel (Ah-ah)
J'mets la gasolina dans la Vittel (Ah, ah, ah, ah), avec la vo’-vo’, j'la vois en moins vilaine
J’ai les plans dans ma tête, j'élabore, avec 310 rue du Mont-Thabor (Paw)
Y a qu'les gros montants qui m'donnent la barre (Pew, pew), on s’fait lever à huit heures dans l'appart' (Pew, pew)
Doucement, doucement, doucement, pourquoi mon reuf a retourné sa veste ?
Au quartier, les jaloux, on les v'-esqui, GS-1250, la béquille
Tu prends l'pénalty avec des Track, dans nos narines, on ne met pas les trucs
Ils font que les transactions sur FUT, ils font que les transactions sur FUT
Armes, re-fou et fou d'la gâchette, trois fois X, le prix d'la cassette (Paw, paw)
Cent vingt-cinq, ça nique la bavette, état normal en état d'ivresse
J'suis khabat, j'sens plus la vitesse, j'ai fait sortir la boîte de vitesse (Ouh-ouh)
Calcine à mort, j'diminue le stress, j'suis un raclo qui vient des 3F
Bébé, pourquoi tu m'as zehef ? T'auras pas le LV ni l'Chanel (Ah-ah)
J'ai confiance en moi pas en toi, donc j'fais belek à la mañana
Ça prémédite comme à Atlanta, bouquet final, ça va s'arroser
Tu fais l'lover, elle va t'essorer, be careful, ma gueule
You might also like
Beldi', vo'-vo', trois fois filtre, elle m'demande c'que j'fais dans la vie
Charbon, moula, ça va vite (J'suis pé-pé-pété)
Beldi', vo'-vo', trois fois filtre, elle m'demande c'que j'fais dans la vie
Charbon, moula, ça va vite (J'suis pé-pé-pété)

Y a la CR partout dans l'bloc (Okay), j'suis khabat, j'suis vite pété (Okay)
Bébé, elle donne ça bien (Okay), bébé, elle fait ça bien (Okay)
J'vois la rue en 1080 full HD (Paw, paw), les p'tits vont t'faire ta voiture au boitier (Paw, paw)
J'suis en fumette, j'suis pété-té (Grr), j'suis en buvette, j'suis pété-té (Rah)

J'aime quand baby donne ça bien (Paw)
Baby parle pas trop latin (Ouh, oui)
J'applaudis jusqu'au matin (Ah-ah-ah-ah-ah)
J'aime quand baby donne ça bien
Baby parle pas trop latin (Pew, pew, pew, pew)
J'applaudis jusqu'au matin (J'suis en buvette, j'suis pété-té)
Bébé, elle donne ça bien, bébé, elle donne ça bien
Bébé, elle donne ça bien, j'suis en buvette, j'suis pété-téEmbed"
54,Rema - Calm Down,"37 ContributorsTranslationsEspañolPortuguêsCalm Down Lyrics
(Vibez)
Another banger

Baby, calm down, calm down
Girl, this your body e put in my heart for lockdown, for lockdown, oh lockdown
Girl, you sweet like Fanta ooh, Fanta ooh
If I tell you, say, ""I love you,"" no dey form yanga oh, oh yanga oh
No tell me no, no, no, no, woah, woah, woah, woah
Oh, oh, oh, oh, oh, oh, oh, oh, oh, oh, oh
Baby, come gimme your lo-lo-lo-lo-lo-lo-lo-lo-woah-woah-woah-woah-woah
You got me like, ""woah-woah-woah-woah-woah-woah-woah-woah-woah""
Shawty come gimme your lo-lo-lo-lo-lo-lo-lo-lo-woah-woah-woah-woah-woah, mhmm

I see this fine girl for my party, she wear yellow
Every other girl they dey do too much but this girl mellow
Naim I dey find situation I go use take tell am hello
Finally I find way to talk to the girl but she no wan follow
Who you come dey form for? (Mhmm)
Why you no wan' conform? (Mhmm)
Then I start to feel her bum-bum, warm (Mhmm)
But she dey gimme small, small woah
I know say she sabi pass that one, one (Mhmm)
But she feeling insecure woah
'Cause her friends go dey gum her like chewing gum (Mhmm)
Go dey gum her like chewing gum, woah, woah, ooh
See Rema LiveGet tickets as low as $300You might also like
Baby, calm down, calm down
Girl, this your body e put in my heart for lockdown, for lockdown, oh lockdown
Girl, you sweet like Fanta ooh, Fanta ooh
If I tell you, say, ""I love you,"" no dey form yanga oh, oh yanga oh
No tell me no, no, no, no, woah, woah, woah, woah
Oh, oh, oh, oh, oh, oh, oh, oh, oh, oh, oh
Baby, come gimme your lo-lo-lo-lo-lo-lo-lo-lo-woah-woah-woah-woah-woah
You got me like, ""woah-woah-woah-woah-woah-woah-woah-woah-woah""
Shawty come gimme your lo-lo-lo-lo-lo-lo-lo-lo-woah-woah-woah-woah-woah, mhmm

As I reach my house I say make I rest small (Make a rest small)
As me I wake up na she dey my mind, oh-woah (Na she dey my mind, oh-woah)
Day one, day two-wo, I no fit focus (I no fit focus)
Na so me I call am, say make we link up (I say make we link up)
As I start to dey tell her how I feel, now my heart dey race
Baby girl if you leave me I no go love again
Because e get many girls wey put my heart for pain
Shebi you feel my pain? Yeah, yeah

Baby, calm down, calm down
Girl, this your body e put in my heart for lockdown, for lockdown, oh lockdown
Girl, you sweet like Fanta ooh, Fanta ooh
If I tell you, say, ""I love you,"" no dey form yanga oh, oh yanga oh
No tell me no, no, no, no, woah, woah, woah, woah
Oh, oh, oh, oh, oh, oh, oh, oh, oh, oh, oh
Baby, come gimme your lo-lo-lo-lo-lo-lo-lo-lo-woah-woah-woah-woah-woah
You got me like, ""woah-woah-woah-woah-woah-woah-woah-woah-woah""
Shawty come gimme your lo-lo-lo-lo-lo-lo-lo-lo-woah-woah-woah-woah-woah, mhmm8Embed"
55,Tiakola - Gasolina,"15 ContributorsTranslationsEnglishGasolina Lyrics

Shiruken Music
C'est ma gasolina, y a mes gars solides là
Elle veut rentrer dans ma tête

C'est ma gasolina, y a mes gars solides là
Elle veut rentrer dans ma tête mais j'veux pas continuer
C'est ma gasolina, y a mes gars solides là
Elle veut rentrer dans ma tête mais j'veux pas continuer

11.43, j'fais les tes-comp, les ennemis me font pas peur
Le four ouvre à midi, j'ai des outils dans l'jean
La vengeance veut prendre le dessus, j'coffre ça dans l'congélateur
Elle m'attire des ennuis, c'est la rue, c'est comme ça

Ça casse à six heures, pas à sept, quatre sorties de pot, j'suis dans l'seize
Faut mettre les dièses avant l'zéro-sept, c'est qui les opp's ? Qui veut s'faire crosser ?
Gasolina veut sac Hermès, les potes, les proches veulent gratte une pièce
Donne-moi le brassard, donne-moi l'siete, neuf millimètres et tu fais une sieste

Les écoutes au bigo (Bigo), faut rester dans l'anonymat ('nymat)
Gasolina atteint un niveau (Niveau), ceux qui friment le plus sont les plus pauvres (Plus pauvres)
Et contrôle ta libido ('bido), guet-apens au tél' par petite go
Couleur qui brille sur nos petits doigts (C'est mes gars solides, là)
J'peux t'la ramener sur un autre niveau (C'est ma Gasolina)
See Tiakola LiveGet tickets as low as $80You might also like
C'est ma gasolina, y a mes gars solides, là
Elle veut rentrer dans ma tête mais j'veux pas continuer
C'est ma gasolina, y a mes gars solides, là
Elle veut rentrer dans ma tête mais j'veux pas continuer

11.43, j'fais les tes-comp, les ennemis me font pas peur
Le four ouvre à midi, j'ai des outils dans l'jean
La vengeance veut prendre le dessus, j'coffre ça dans l'congélateur
Elle m'attire des ennuis, c'est la rue, c'est comme ça

Elle sait ce que j'fais, ce que j'aime (Han-han), pilons, beuh, massa : tout c'que j'ai (Han-han)
C'est beaucoup trop noir c'qu'on projette (Han-han), à part la santé, tout s'achète (Han-han)
J'arrache le sol en séquentiel (Han-han), j'envoie mes prières vers le ciel (Han-han)
Dans l'auto : chauffants sont les sièges (Han-han)
Mélo' d'la callé sans solfège

Et quand j'entends : ""Akha"", la première chose à faire, c'est d'me benda
Gasolina veut qu'j'lui prenne sa main mais j'manipule encore trop d'tos-ma, eh
Les écoutes au bigo, donc faut rester dans l'anonymat
J'te ramènerai dans un autre niveau si t'es ma, si t'es ma Gasolina (Yeah, eh, eh)

Elle veut que j'prenne soin d'elle, de rester, c'est pas facile
Une fois qu'on est montés, y a les keufs qui descendent
Ramène le 200G, j'découpe de mieux en mieux, une kichta, j'me sens mieux
J'la considérais comme ma princesse mais je n'étais pas son roi (Hum, hum, hum)
Elle apporte toujours des problèmes, même quand on fait bien son rôle
Et des fois, j'me sens comme un enfant qui n'a pas eu c'qui voulait
Le Sheitan qui conseille d'faire un choix entre la stup' ou le vol (Bang, bang, bang, bang, bang)2Embed"
