,artist_title,lyrics
74,KeBlack - LAISSE MOI,"6 ContributorsLAISSE MOI Lyrics
J'suis rentré chez toi, j'ai tout pris
Même ton cœur j'suis parti avec
Bébé a l'bras long comme Luffy
J'sais pas si t'as la ref
Pour t'emmener au soleil t'sais pas c'que j'ai fait
J'ai dû vendre de la neige
Elle c'est ma sicarios, elle est restée même quand c’tait la hess
J'la vois dans mes DM, elle veut revenir
J'lui dis : ""c'est mort""
Elle dit : ""j'suis mieux qu't’as baby’s"" mais j'lui dis : ""qu’c'est mort""

Porte pas, porte pas l'œil
S'te plaît porte pas l'œil
Nous deux c'est plus pareil, еlle veut qu'on s'voit t’à l'heurе
Porte pas, porte pas l'œil
S'te plaît porte pas l'œil
Nous deux c'est plus pareil, elle veut qu'on s'voit t’à l'heure

Laisse moi, s'te plaît laisse moi
J't'ai dit : ""c'est mort"", s'te plaît laisse moi
Laisse moi, s'te plaît laisse moi
J't'ai dit : ""qu’c'est mort"", s'te plaît laisse moi
You might also like
J'suis rentré dans son cœur pour voir mon avenir
Je m'suis pas vu avec
Entre nous trop d’latence, j'suis pas dans les temps
J'sais qu't'as capté la ref
Qu'est-ce que tu veux au final ?
Nous deux y a plus de feeling
Elle veut me rendre fêlé
Nous deux c'est de l'histoire ancienne comme les FILA

Porte pas, porte pas l'œil
S'te plaît porte pas l'œil
Nous deux c'est plus pareil, elle veut qu'on s'voit t’à l'heure
Porte pas, porte pas l'œil
S'te plaît porte pas l'œil
Nous deux c'est plus pareil, elle veut qu'on s'voit t’à l'heure

Laisse moi, s'te plaît laisse moi
J't'ai dit : ""c'est mort"", s'te plaît laisse moi
Laisse moi, s'te plaît laisse moi
J't'ai dit : ""qu’c'est mort"", s'te plaît laisse moiEmbed"
75,Gazo - RAPPEL,"25 ContributorsTranslationsEnglishRAPPEL Lyrics

D'aussi loin que j'me rappelle
Hey, hein, hey
Shiruken Music
Hey

D'aussi loin que j'me rappelle, ils ont rien fait pour oi-m, y a ceux qui voudraient ma tête, y a ceux qui prient pour oi-m
Tu voulais qu'j'sois plus méchant ? Tiens, me voilà dans toi, aucune pitié, on les grr, en mode, bien fait pour toi
D'aussi loin que j'me rappelle et j'sais plus comment ils s'appellent
J'la veux plus la vue sur la mer, mon négro, je coffre pour quitter la Terre
J'suis mêmе pas monté dans la bre-cham qu'elle еst d'jà prête pour oi-m, aucune pitié, je la grr, c'est bien fait pour toi

J'me rappelle, j'me rappelle (Sur eux, j'pouvais pas compter, je me rappelle)
J'me rappelle, j'me rappelle (Sur eux, j'pouvais pas compter, je me rappelle)
J'me rappelle (La plupart)

La plupart me prenaient pour un idiot, j'savais qu'leur amitié était bidon
J'me suis débrouillé sans dire : ""I need you"", j'ai fait bosser, j'ai vendu du bédo
Pour du seille-o, j'ai fait des trucs bre-som, j't'avoue qu'plus d'une fois, j'allais y rester
Mais nous suis pas si t'as peur de bé-tom, si tu prends mes patins, tu vas glisser
Dès qu'on ramasse, on construit au pays (Pays), faut des Glock et une bitch qui obéit ('béit)
Dans mon salon, j'veux un lion empaillé (Empaillé), baby, come, welcome to my home
Dès qu'on ramasse, on construit au pays, faut des Glock et une bitch qui obéit
Dans mon salon, j'veux un lion empaillé, baby, come, welcome to my home
You might also like
D'aussi loin que j'me rappelle, ils ont rien fait pour oi-m, y a ceux qui voudraient ma tête, y a ceux qui prient pour oi-m
Tu voulais qu'j'sois plus méchant ? Tiens, me voilà dans toi, aucune pitié, on les grr, en mode : bien fait pour toi
D'aussi loin que j'me rappelle et j'sais plus comment ils s'appellent
J'la veux plus la vue sur la mer, mon négro, je coffre pour quitter la Terre
J'suis même pas monté dans la bre-cham qu'elle est d'jà prête pour oi-m, aucune pitié, je la grr, c'est bien fait pour toi

J'me rappelle, j'me rappelle (Sur eux, j'pouvais pas compter, je me rappelle)
J'me rappelle, j'me rappelle (Sur eux, j'pouvais pas compter, je me rappelle)
J'me rappelle (Qui s'ra là ?)

Qui s'ra là si demain, je meurs ? Qui sourira quand j'serais parti ? À mon enterrement, ne pleure pas, encore moins si tu n'étais pas mon ami
Qui s'ra là si demain, je meurs ? Qui sourira quand j'serais parti ? À mon enterrement, ne pleure pas, encore moins si tu n'étais pas mon ami
On connaît leur gang, il est faible, eux, ils ont jamais fait la rre-gue, on t'allume comme la Tour Eiffel et pour oublier, j'me suis drogué
Toute ma vie, j'ai vécu en danger et la rue m'a nourri, logé, t'as tiré sur eux, j'me suis vengé, qui allait nous donner à manger ?

D'aussi loin que j'me rappelle, ils ont rien fait pour oi-m, y a ceux qui voudraient ma tête, y a ceux qui prient pour oi-m
Tu voulais qu'j'sois plus méchant ? Tiens, me voilà dans toi, aucune pitié, on les grr, en mode, bien fait pour toi
D'aussi loin que j'me rappelle et j'sais plus comment ils s'appellent
J'la veux plus la vue sur la mer, mon négro, je coffre pour quitter la Terre
J'suis même pas monté dans la bre-cham qu'elle est d'jà prête pour oi-m, aucune pitié, je la grr, c'est bien fait pour toi

J'me rappelle, j'me rappelle (Sur eux, j'pouvais pas compter, je me rappelle)
J'me rappelle, j'me rappelle (Sur eux, j'pouvais pas compter, je me rappelle)
J'me rappelle4Embed"
76,Lewis Capaldi - Someone You Loved,"222 ContributorsTranslationsSvenskaEspañolPortuguêsDeutschNederlandsFrançaisTürkçeالعربيةSomeone You Loved Lyrics
I'm going under, and this time, I fear there's no one to save me
This all or nothing really got a way of driving me crazy
I need somebody to hear,  somebody to know
Somebody to have, somebody to hold
It's easy to say, but it's never the same
I guess I kinda liked the way you numbed all the pain

Now, the day bleeds into nightfall
And you're not here to get me through it all
I let my guard down and then you pulled the rug
I was getting kinda used to being someone you loved

I'm going under, and this time, I fear there's no one to turn to
This all or nothing way of loving got me sleeping without you
Now, I need somebody to know, somebody to hear
Somebody to have, just to know how it feels
It's easy to say, but it's never the same
I guess I kinda like the way you help me escape

Now, the day bleeds into nightfall
And you're not here to get me through it all
I let my guard down and then you pulled the rug
I was getting kinda used to being someone you loved
You might also like
And I tend to close my eyes when it hurts sometimes
I fall into your arms
I'll be safe in your sound till I come back around

For now, the day bleeds into nightfall
And you're not here to get me through it all
I let my guard down and then you pulled the rug
I was getting kinda used to being someone you loved
But now the day bleeds into nightfall
And you're not here to get me through it all
I let my guard down and then you pulled the rug
I was getting kinda used to being someone you loved
I let my guard down and then you pulled the rug
I was getting kinda used to being someone you loved168Embed"
77,Maes - Blanche,"43 ContributorsTranslationsEnglishBlanche Lyrics

Unprediktable
Denza
Gérald got that fire, boy

Très loin d’être parfait mais t’inquiète pas, ça ira
Au ciel, on va aller, j'vais laisser mes biens en bas
Toutes mes années d’galère où j’me disais ""ça ira""
Fais un pas de travers, une bécane, tu t’en iras
J’v'-esqui le parquet, c’est soit Bercy soit du ferme
J’suis dans le carré, loin d’Bois-d’Arcy, j’ai mon fer
J’barode dans la ville, sept cents chevaux : Ferrari
Tu connais l’tarif, fais pas l’grossiste pour un kil'
J’bicrave à pas d’heure, j’vends la moula dans le bendo
Douze heures à douze heures, j’fais partir trois kilos d’aya
Ta go' veut un marmot, moi, j’voulais juste la ken
Te-shi m'rend paro, j’me rappelle plus d’la veille

J'visser la night, elle va s'en remettre, si tu savais
Blanche ou caramel, j'ai son remède
J'visser la night, elle va s'en remettre, si tu savais
Blanche ou caramel, j'ai son remède
Nous restâmes sur le bateau, jamais il ne chavira
Je devais voir Anne-So', au final, j’ai vu Samira
Passe-moi à travers, jamais tu n’me graviras
Tu n’as pas de valeur, jamais on n’se ralliera
You might also like
Je n’connais pas le banc à part celui de la G.A.V
Drapeau est noir et blanc, je reste devant, je préfère être à l’attaque
Si j'n’ai plus d’limite, je m’arrête où ? J’pends mon linge sale devant personne, je rachète tout
Je ne demande qu’à t’aimer, te montrer mon Makélélé
Le Versace, le D&G, elle est trop bonne, wallaye, c'est B
Je vais l’emmener à l’étranger, peut-être sur place, j’vais l’échanger
Faire le hlel ou l’étrangler, j’suis qu’en léger, que la CB
J’drague à la Momo Henni, beaucoup de cash, je la séduis
On m'tire dessus, j’entends des bruits, même en réserve, je la détruis
J’viens du 9.2, la quality, tu connais d’jà l’état d’esprit
Elle m'a d'mandé combien ça coûte comme si j’avais regardé l’prix

J'visser la night, elle va s'en remettre, si tu savais
Blanche ou caramel, j'ai son remède
J'visser la night, elle va s'en remettre, si tu savais
Blanche ou caramel, j'ai son remède
Nous restâmes sur le bateau, jamais il ne chavira
Je devais voir Anne-So', au final, j’ai vu Samira
Passe-moi à travers, jamais tu n’me graviras
Tu n’as pas de valeur, jamais on n’se ralliera

Oh, oh, oh
Oh, oh, oh
Oh, oh, oh
Oh, oh, oh
Elle va s’en remettre, si tu savais
Blanche ou caramel, j'ai son remède
Elle va s’en remettre, si tu savais4Embed"
78,SDM - Mr. Ocho,"13 ContributorsMr. Ocho Lyrics

Liens du 100
8 seconds, ah

Ma-ma-malheureusement, je sais pas faire semblant d'aimer, plaire aux autres, ça fait longtemps qu'j'ai abandonné
Le ciel m'en est témoin, j'ai tant donné, pour eux, j'suis qu'un artiste d'la pandémie
On m'a toujours dit : ""Respecte les aînés"" mais j'fais comment quand les aînés, c'est des haineux ?
J'les baise, je sais pas faire semblant d'aimer, dans la street, poto, personne m'a parrainé

SDM, cent moins huit, j'suis tout en haut, j'suis dans la suite
J'peux tout t'expliquеr sur un hit, j'peux tout t'expliquer sur un huit
SDM, cеnt moins huit, j'te dit que j'peux tout expliquer sur un hit
J'peux tout t'expliquer sur un huit, d'après les autres, je n'suis qu'un mytho

Eh, à écouter mes profs, poto, la vie d'SDM, c'était pas ça
À écouter mes profs, j'allais finir par terre, en manque de mapessas (Y a ma tête dans la Passat)
Mais leur rêve s'est arrêté, maintenant, j'fais des ronds, j'claque leur salaire dans d'la pe-sa, j'les baise (C'est réel)
D'mande aux autres, faire du le-sa (C'est réel), j'l'ai fait, que devant l'OPJ qu'j'ai nié les faits (C'est réel, gros)
J'ai dit au ciel tout c'que j'veux, liasses de billets, j'voulais toucher
C'est où l'bonheur ? Moi-même, à pied, j'y vais, bonheur, richesse, je veux tout
J'me suis couché tard, levé tôt, chien d'la casse, j'suis intraitable chez l'véto
Ganté, j'laisse pas d'traces sur l'métal (Rah), poto, t'endors pas quand tu dois des tales, yah, yah, yah, yah
You might also like
Des fois, j'suis grave indécis (Grave indécis), j'avais pas d'tales, dans la nuit, c'est le Sheitan qui m'emmenait danser (Qui m'emmenait danser)
J'ai grave avancé (Grave avancé) mais à la rue, j'suis grave attaché (Grave attaché)
Maintenant, c'est moi l'grand qui influence les jeunes à bosser (Jeunes à bosser)

Malheureusement, je sais pas faire semblant d'aimer, plaire aux autres, ça fait longtemps qu'j'ai abandonné
Le ciel m'en est témoin, j'ai tant donné, pour eux, j'suis qu'un artiste d'la pandémie
On m'a toujours dit : ""Respecte les aînés"" mais j'fais comment quand les aînés, c'est des haineux ?
J'les baise, je sais pas faire semblant d'aimer, dans la street, poto, personne m'a parrainé

SDM, cent moins huit, j'suis tout en haut, j'suis dans la suite
J'peux tout t'expliquer sur un hit, j'peux tout t'expliquer sur un huit
SDM, cent moins huit, j'te dit que j'peux tout expliquer sur un hit
J'peux tout t'expliquer sur un huit, d'après les autres, je n'suis qu'un mytho

Dans la ciudad (9.2.1.4.0), tout seul, j'me suis fait avec mes gars dans la ciudad (Ocho), maintenant, ça va, j'veux plus d'la vie d'avant (Yah, yah)
Et des fois, j'pense à la mort, j'pense à mon feat avec Biggie, 2Pac, parano, j'vois des ennemis tout-par (Piou-piouh), j'peux plus regretter quand le coup part (Rah)
Eh, la détente, on charbonnait quand on séchait l'école, tits-pe, on avait d'jà la mentale et les codes
C'est pas la prison qu'va nous arrêter, c'est la mort ou la femme qui m'a allaité (Ouh)
Allez, j'suis un mec du parking, mec de l'allée (C'est réel), j'fais du mal pour mon bien, j'le fais à l'aise (C'est réel) mais quand j'y repense, j'suis mal à l'aise, yah, yah, yah, yah

Des fois, j'suis grave indécis, j'avais pas d'tales, dans la nuit, c'est le Sheitan qui m'emmenait danser
J'ai grave avancé mais à la rue, j'suis grave attaché
Maintenant, c'est moi l'grand qui influence les jeunes à bosser
Malheureusement, je sais pas faire semblant d'aimer (Réel), plaire aux autres, ça fait longtemps qu'j'ai abandonné (Gros, c'est réel)
Le ciel m'en est témoin, j'ai tant donné, pour eux, j'suis qu'un artiste d'la pandémie (Allez niquez vos mères)
On m'a toujours dit : ""Respecte les aînés"" mais j'fais comment quand les aînés, c'est des haineux ? (Mais j'ai l'démon, moi)
J'les baise, je sais pas faire semblant d'aimer (Donc j'les baise), dans la street, poto, personne m'a parrainé (Ouais, ouais, ouais, ouais)

SDM, cent moins huit (Ocho), j'suis tout en haut, j'suis dans la suite (Ouais, ouais)
J'peux tout t'expliquer sur un hit, j'peux tout t'expliquer sur un huit (Ou sur un seize)
SDM, cent moins huit, j'te dit que j'peux tout expliquer sur un hit (Ocho)
J'peux tout t'expliquer sur un huit, d'après les autres, je n'suis qu'un mytho (Ocho)

Malheureusement, je sais pas faire semblant d'aimer, plaire aux autres, ça fait longtemps qu'j'ai abandonné
Le ciel m'en est témoin, j'ai tant donné, pour eux, j'suis qu'un artiste d'la pandémie
On m'a toujours dit : ""Respecte les aînés"" mais j'fais comment quand les aînés, c'est des haineux ?
Liens du 100
J'les baise, je sais pas faire semblant d'aimer, dans la street, poto, personne m'a parrainéEmbed"
79,Bosh - Djomb,"38 ContributorsDjomb (Bien ou quoi) Lyrics

Lunettes sur le nez, j’essaye de passer incognito
Sur le B, j'v-esqui les condés, le comico
J'vois une go passer, j'la verrai p't-être pas deux fois
Donc je vais la voir, j'prends ma meilleure voix
Bien ou quoi ? T’habites dans l’coin ou quoi ?
J't’ai vu passer dans l’allée, ton boule me rend romantique, pièce
Il fait des appels de phare quand il bouge de gauche à droite, j'suis obligé d'réagir
Parce qu'elle est djomb, elle fait la meuf qui a plein d'principes, j'lâche l'affaire, j'retourne faire mon biff
Le soir, elle m'voit sur YouTube, maintenant c'est elle qu'insiste, elle qu'insiste, elle qu'insiste (yeah, yeah)

Elle est djomb, le bas du dos est bien bombé, elle est djomb
Tout l'monde veut la gérer, elle est djomb
Elle fait que d'me regarder mais je bombe, qu'est-c'qu'elle est djomb, qu'est-c'qu'elle est djomb

Il est quatre heures passé (quatre heures passé), faut qu'je rentre chez moi (faut qu'je rentre chez moi)
Non, j'peux pas rentrer seul, des belles gos dans la boite, il s'agit d'faire un choix (il s'agit d'faire un choix)
Il est cinq heures passé (cinq heures passé), j'suis toujours pas chez moi (j'suis toujours pas chez moi)
Il est six heures passé, j'suis même pas fatigué, y aura after, suis-moi

Jamais sans mon kamas, jamais sans mes potos, jamais sans mon cke-Glo (jamais, jamais)
Kichta pour le coco, kichta pour les teilles-bou, kichta pour le tel-hô
Si t'es belle, bonne, ma chérie, donne ton number
De dos, tu ressembles beaucoup à Amber
T'as déjà posé ton histoire d'amour, j'm'en beurre
Tu veux pas te faire gérer alors ka ou ka fé la ?
Pourquoi tu m'regardes, tu veux savoir si j'guette ton terma' ?
La go est douce, le négro est brut (ola)
Ça va finir par coller car les opposés s'attirent
La drogue est douce mais l'ton-car est dur
Chaque taffe me rapproche de l'espace, j'vais finir dans sa lune (ola, ola, yeah, yeah)
You might also like
Elle est djomb, le bas du dos est bien bombé, elle est djomb (elle est djomb)
Tout l'monde veut la gérer, elle est djomb (elle est djomb)
Elle fait que d'me regarder mais je bombe (mais je bombe), qu'est-c'qu'elle est djomb, qu'est-c'qu'elle est djomb

Il est quatre heures passé (quatre heures passé), faut qu'je rentre chez moi (faut qu'je rentre chez moi)
Non j'peux pas rentrer seul, des belles gos dans la boite, il s'agit d'faire un choix (ola, ola, ola)
Il est cinq heures passé (cinq heures passé), j'suis toujours pas chez moi (j'suis toujours pas chez moi)
Il est six heures passé, j'suis même pas fatigué, y aura after, suis-moi

Elle est djomb, la go est douce
Elle est djomb, le négro est brut
Elle est djomb, la go est douce
Mais je bombe, qu'est-c'qu'elle est djomb, qu'est-c'qu'elle est bonne
Vodka, pilon, pillave, tel-hô
Dès l'aube, j'm'arrache, j'retourne dans l'bendo
T'es djomb, on s'reverra p't-être bientôt
J'ai vidé mes couilles, pas l'sac à dos

Elle est djomb, le bas du dos est bien bombé, elle est djomb (elle est djomb)
Tout l'monde veut la gérer, elle est djomb (elle est djomb)
Elle fait que d'me regarder mais je bombe (mais je bombe), qu'est-c'qu'elle est djomb, qu'est-c'qu'elle est djomb
Il est quatre heures passé (quatre heures passé), faut qu'je rentre chez moi (faut qu'je rentre chez moi)
Non j'peux pas rentrer seul, des belles gos dans la boite, il s'agit d'faire un choix (ola, ola, ola, qu'est-c'qu'elle est djomb)
Il est cinq heures passé (cinq heures passé), j'suis toujours pas chez moi (ola, ola, ola)
Il est six heures passé, j'suis même pas fatigué, y aura after, suis-moi

Qu'est-c'qu'elle est djomb2Embed"
80,Alonzo - La Seleçao,"15 ContributorsLa Seleçao Lyrics

Ok
Ah, ouh
Volume 3, Capo Dei Capi

J'suis en fumette dans la location,                     là j'accélère, elle a des sensations
J'fais des délits, la beuh dans l'caleçon, et j'fais l'signe JuL en célébration
Ne te mêle pas de nos conversations, au quartier, ça tombe pour association
Pour braquer la SNEP, faire des rotations, y a pas qu'chez les schmitts, qu'y a des convocations
Un peu d'vodka aux fruits de la passion, à deux doigts de faire sauter la caution
Tout l'monde qui est hess quand j'suis à la station, y a mon disque d'or à l'alimentation (okey)

Oh, j'entends les pim-pom, pim-pom, pim-pom
Descente, ça prend des 20 ans, 20 ans, 20 ans
Pour rien, ça sort le pe-pom, pe-pom, pe-pom
Oh, j'vais lui mettre un plan, elle a des implants (ok)

C'est la Seleção
C'est la Seleção
C'est la Seleção
You might also like
Tu reviens comme si de rien n'était mais où t'étais ? (Mais où t'étais ?)
Et dire qu'avant d'percer, j'ai pensé à tout laisser (à tout laisser)
Je traînais, la mama, pour moi, elle s'inquiétait (elle s'inquiétait)
Maintenant, j'fais d'la 'sique, j'fais danser les chicas tout l'été (tout l'été)
Je suis pas un héro, j'peux pas tout remettre à zéro (ouais)
Déjà khapta avant l'apéro, avec les sanchos, les frérots (ok)
Moi, j'ai des trucs à faire, ça m'emboucane à boire des verres (ouh)
À l'ancienne, y avait R, gros, j'faisais mes p'tites affaires (ah, ah, ah)

Oh, j'entends les pim-pom, pim-pom, pim-pom (ok)
Descente, ça prend des 20 ans, 20 ans, 20 ans (gamberge)
Pour rien, ça sort le pe-pom, pe-pom, pe-pom
Oh, j'vais lui mettre un plan, elle a des implants

C'est la Seleção
C'est la Seleção
C'est la Seleção

On est à trois, c'est la Seleção et de toute façon, ils le savent
On a fait la fus', on leur met des KO, obrigado, lá j'vous dis ""ciao""
On est à trois, là c'est mythique, on fait pas attention à tes p'tits piques
Tu peux nous rah, rah, comme un p'tit pit, mais on te calcule pas, on est en gigitte
Que elle fait la folle, elle m'fait la nia, allez, va danser le mia
Elle a bien changé Cendrillon, elle est sous pétard, sangria (ok)
Oh, j'entends les pim-pom, pim-pom, pim-pom (ok)
Descente, ça prend des 20 ans, 20 ans, 20 ans
Pour rien, ça sort le pe-pom, pe-pom, pe-pom
Oh, j'vais lui mettre un plan, elle a des implants (ok)

J'ai bu de la vodka, j'ai planté la loc'
Pétard à la boca, parle à mon avocat
J'ai bu de la vodka, j'ai planté la loc'
Pétard à la boca, parle à mon avocat1Embed"
81,Jul - La bandite,"29 ContributorsLa bandite Lyrics
On n’aime pas les putos, les moutons, les matons
J'les fume comme le pét' du matin, c'que j’entends, je m’en tape
On n’aime pas les putos, les moutons, les matons
J'les fume comme le pét' du matin, c'que j’entends, je m’en tape
Bon qu’à faire des braquages vocals, la mentale, tu connais
J'vais leur casser la tête, fils
J'vais leur casser la tête, fils

J'vais leur casser la tête, fils, y a rien qui m'arrête
L'inspi' vient d'la barrette, la moula dans la cigarette
Vénère au démarrage comme Sterling ou Mahrez
Moi c'est JuL, j'envoie la rafle, le stud' dans la RS
Gros, tu l'ouvres trop, j'vais t'éjecter, j'fais monter ma caisse, pas d'traqueur détecté
Une fausse amitié, suspectée
J'crois qu'j'vais m'faire une pause dedans histoire qu'ils puissent becqueter
J'vais tout casser, fils de, laisse-moi passer, j'pense à tracer, souvenirs effacés
Parce que y en assez d'se ressasser les choses du passé
Faut faire d'la vente tout le temps même si l'malheur continue à avancer
De bon matin, je me lève, j'me fais un perso
Génération la débrouille, j'ai pas sucé pour percer
Au cas où, si tu as oublié, là, c'est la zone en personne
Par les gyro' et les ""akha"", j'ai été bercé
J'suis pas l'boss mais j’les crosse, en boîte, j'pourrais faire danser Rick Ross
D’origine corse, j’mets droit l'cross, j’arrive en crabe, pour eux, c’est atroce
Lunettes comme Matrix, gazeuse, matraque
Il m'reste un point au volant, ouais, j’fume la drogue
Elle veut qu'j'la drague, qu'j’lui fasse une Drake
Elle veut la bague mais moi, je bugue
Que elle tourne la BAC, en boucle, sont même sur Snap et sur Facebook
J’fais que des plans, j’fais le pain, j’fais le plein, j'passe par Val Plan
J'récup' le 'sin à la 'son, oh la 'sine m'a vu mettre des coups de frein, ouais
Oh le 'sin, oh le 'sin, oh la 'sine m'a vu mettre des coups de frein, ouais
Tu t'équipes en soum, soudés ensemble
Pas d'poussette, entre nous, on s’aide
Qui est qui ? On l'sait, s'il faut, on l'sent
Si y en a un qui fait l'fou, direct on l'sort
Évite de faire le bouill' (bouill')
Faut qu't'arrêtes d'porter des couilles (couilles)
C’est pas tes affaires et tu fouilles (fouille)
Tu vas avoir des embrouilles (-brouille)
Sous le casque intégral, y a des mauvais garçons
Sous l’ensemble Quechua, y a un cœur en glaçon
Le bout du calibre touche les couilles quand tu l'mets dans l'caleçon
Il fait le mec plein, tout bidon, que des contrefaçons
See JuL LiveGet tickets as low as $160You might also like
On n’aime pas les putos, les moutons, les matons
J'les fume comme le pét' du matin, c'que j’entends, je m’en tape
Bon qu’à faire des braquages vocals, la mentale, tu connais
On n’aime pas les putos, les moutons, les matons
J'les fume comme le pét' du matin, c'que j’entends, je m’en tape
Bon qu’à faire des braquages vocals, la mentale, tu connais
On n’aime pas les putos, les moutons, les matons
J'les fume comme le pét' du matin, c'que j’entends, je m’en tape
Bon qu’à faire des braquages vocals, la mentale, tu connais, tu connais1Embed"
