,artist_title,lyrics
58,Morad - Se Grita,"11 ContributorsSe Grita Lyrics

Pa-pa-pa-pa-pa-pa-pa-pa-pa-pa-pa, pa-pa-pa-pa-pa-pa, pa, pa
Pa-pa-pa-pa-pa-pa, pa-pa-pa-pa

Po-po-po-po-po-po, po-po-po-po-po-po, se grita si amigo está detenido al la'o
Po-po-po-po-po-po, po-po-po-po-po-po, dinero no compra la palabra de mi lao’
Po-po-po-po-po-po, po-po-po-po-po-po, familia no toca, familia nunca nombrao'
Po-po-po-po-po-po, po-po-po-po-po-po, familia cerrada y el vínculo que es cerrao'

Ah-ah-ah-ah-ah-ah, j’viens gâter à ma chérie
Ah-ah-ah-ah-ah, j'fais mangué, ouais, pour la série
Ah-ah-ah-ah-ah, j'viens gâter à ma chérie
Ah-ah-ah-ah-ah, j'fais mangué, ouais, pour la série
J'pourrais investir dans un pistolet, me faire des selfies avec la Daytona
J'ai passé ma vie, moi à bétonner, j'vais tout oublier dans le sauna
T'as fait des sous faudra t’isoler
Après, ils deviennent jaloux, tous ces p’tits connards
J'ai tellement d’givre, j'me suis fait frissonnеr
Parce que j'ai raconté un peu la viе qu'on a
Poto parles pas mal de lui c’est mon soss'
En fumette en vingt minutes j'ai croisé dix mossos
Y'a d'la beuh dans la boite à gants, mais ça clame l'innocence
Aqua' dans l'RS4 j'sais même plus si on est dans l'bon sens
You might also like
Po-po-po-po-po-po, po-po-po-po-po-po, se grita si amigo está detenido al la'o
Po-po-po-po-po-po, po-po-po-po-po-po, dinero no compra la palabra de mi lao'
Po-po-po-po-po-po, po-po-po-po-po-po, familia no toca, familia nunca nombrao'
Po-po-po-po-po-po, po-po-po-po-po-po, familia cerrada y el vínculo que es cerrao'

De pequeño era raro, me miraban todo el rato
Crecí yo pensando en querer los aparato'
Crecí yo pensando que la vida es solo un rato
Y si me la para', la tuya te la mato
Ib-Iban en la moto, haciendo alboroto
Ninguno era chota, y todo' eran loco'
Loco' guerrillero', odio a lo' madero'
Tiempo pasajero, problemas que exagero
Que aquí ya pistoleros y balas extranjeras
Grupo' carroñeros y otros bandolero'
Para hacer un trato siempre hay que tener dinero
Otro por el tiempo, te sale un ruinero
Ay, el dinero, ¿qué pasa el dinero?
Que hace que un sabio, sea un embustero
Ay, el dinero, ¿qué le pasa al dinero?
Que tu amigo se hace pasajero

Eso ya lo sé, que vivo cosas que yo no lo imaginé
Es con lo malo que yo tuve que crecer y no lo digo pa' que tú lo vaya' a hacer, lo vaya' a hacer
¿Y qué pasará? Seguro que todo lo malo pasará
La vida incluso a vece' a mí me pisará
Y algo bueno y algo malo quitará, lo quitará
Po-po-po-po-po-po, po-po-po-po-po-po, se grita si amigo está detenido al la'o
Po-po-po-po-po-po, po-po-po-po-po-po, dinero no compra la palabra de mi lao'
Po-po-po-po-po-po, po-po-po-po-po-po, familia no toca, familia nunca nombrao'
Po-po-po-po-po-po, po-po-po-po-po-po, familia cerrada y el vínculo que es cerrao'

J'suis calé dans l'audi, oh-oh, j'suis calé dans l'Audi
J'suis calé dans l'audi, j'suis coté passager
J'repense à mes problèmes quand j'ai pas lâché
Quand j'savais pas nager, quand ça m'a pas aidé
Maintenant niquez vos mères mais j'préfère qu'on soit pas fâchés
Marseille c'est kalashé pour les braquos c'est cagoulé
Quand j'pense à faire des sous eux ils pensent à m'voir couler
Autoroute du Soleil en crabe, on va débouler
J'construit la vitre ouverte poto j'arrive plus à rouler, eh-eh-eh

Dedicado pa' la gente que quiere a su familia
A los que no hablan, a los que siguen y no tienen que hablarlo, ah
Oye, los de la L
Hay que llegar pa' saber hablarlo, para hablarlo hay que saber vivirlo
Y pa' vivirlo, pa' tú no contarlo, ah
Tu-tu-tu-tu-tu-tu-tu-tu, ru-tu-tu-tu-tu
Tu, tu-tu-tu-tu-tu-tu-tu-tu, ru-tu-tu-tu-tu
Tu, tu-tu-tu-tu-tu-tu-tu-tu, ru-tu-tu-tu-tu
Tu, tu-tu-tu-tu-tu-tu-tu-tu, ru-tu-tu-tu-tuEmbed"
59,Stormy - Tchin Tchin,"16 ContributorsTchin Tchin Lyrics

Jamais nhez lik rayti, f'2ardek w 2ardi
Bdina wast la crise, se7a ta reddina l3am zine
Rekbou dyal n7ass, bekri bach beddelna l'argile
Public fl OLM, public 3endi f Jbel Raissi
Dorka gha n9ett3o l'yeddin, sed9o la mella la dine
Li ddali dyali yefdi b demmo wella yekhra b'centime
Zebbi ma kayench bine w bine, li bnina gha yeb9a sinine
Ma t9arennich m3a zobbiyat, li ma 3erfou ta ach sanine
Aha, ha, aha! triple seven, f bali triple seven
7ett 9ezzibtek l'ard a baba, w aji ghir testafed (Yeah!)
Yak ghi l'bare7 bach sedditi babek
Daba tle3 m3ak kber men dak li ma bine fkhadek

Ya lili ya 3ine, ya lili ya 3ine (3ine 3ine)
Lyouma jebna win, ghedda ndiro tchin tchin (tchin tchin)
Ya lili ya 3ine, ya lili ya 3ine (3ine 3ine)
Lyouma jebna win, lyouma jebna win  (win win)
Ya lili ya 3ine, ya lili ya 3ine
Lyouma jebna win, lyouma jebna win
Ya lili ya 3ine, ya lili ya 3ine
Lyouma jebna win, lyouma jebna win
You might also like
Hermano chouf ki m'dosé, f'yeddi bédo d'Chicago west l'perif
F'derb l'gouza wsst Raibi kaber nervouzi, nta f'Calif
Téma ki posé, wakha nbanlek filston dayer ch7al men délis
Flow d'Mendoza, m3a Stormy w Tagne dabbouza, f'yeddi jayeb 9anboula
Surevette khitafi, chbabi kalatou l'ghalghoula
Bénéf ki triplé, dmagh ki trippi, kolchi baghi moula
Skayri sa7i ki chi Polak, berka, briquet, brika, cliqua, cliquez, milli hola
Security C tassa, cheftha men bekri
F'session kami 9ertassa bedav' que d'la haze
Charika, beldi, tabac, jay men jil accusé
Gha lli ga3ma bgha ygoul : ""Grande jab technique de baisés""
20 ze-trei To' mchane9 pila contre l'principal
Dorka du fils du principal, impressionné par capital
Bénéf' wesst l'Calvin, Biggy chari, ga3ma kari étage
BNJ la city bayna men Casa tal l'capitale (Ah oui!)

Ya lili ya 3ine, ya lili ya 3ine (3ine 3ine)
Lyouma jebna win, ghedda ndiro tchin tchin (tchin tchin)
Ya lili ya 3ine, ya lili ya 3ine (3ine 3ine)
Lyouma jebna win, lyouma jebna win  (win win)
Ya lili ya 3ine, ya lili ya 3ine
Lyouma jebna win, lyouma jebna win
Ya lili ya 3ine, ya lili ya 3ine
Lyouma jebna win, lyouma jebna win
Nrej3o lbedya la jamais, ghadi yetcheffaw a l'ami
Nhebbet rassi la jamais, ghadi ydessrou talamid
Nta ma fhemtich ghi dawi, jwan f'yeddi beldi rajawi
S7aybi wine l'herba wine, wine 7na ma nherbou fine
Projet comptant, rwappa machi contents
Tagna indépendant, la paille depuis longtemps
3edyan daro trente ans, mais fjib 3endna tonton
Nta ba9i ghi mora la gamelle, rap game fih ri7et la javel
Tssena le jour de la paie, Nkhsserha le jour d’aprés
F yeddi microphone  nakol b7alli kan'rappi
Nfucki les centres d'appels, kan'facturer la feuille
Kan niquer kandouz, kan'zappihom
Ba9i m'dosé mn la veille(ya)

Ya lili ya 3ine, ya lili ya 3ine (3ine 3ine)
Lyouma jebna win, ghedda ndiro tchin tchin (tchin tchin)
Ya lili ya 3ine, ya lili ya 3ine (3ine 3ine)
Lyouma jebna win, lyouma jebna win  (win win)
Ya lili ya 3ine, ya lili ya 3ine
Lyouma jebna win, lyouma jebna win
Ya lili ya 3ine, ya lili ya 3ine
Lyouma jebna win, lyouma jebna winEmbed"
60,TIF - SHADOW BOXING,"19 ContributorsSHADOW BOXING Lyrics

Dans mes sons, j'parle de paix mais j'suis prêt à la guerre, l'sais-tu ?
Avec Khalil, on cherche des thunes, on a deux-trois tuyaux pour faire des tubes
Faut déjà en mettre pour qu'l'oseille s'décuple, y a aucun doute
Et mon reuf sait que j'me salirais pour qu'il reste secure
Fin justifie mesures draconiennes, j'fais ma barque, j'attends pas que le bateau vienne
Cœur cassé comme les lattеs du sommier
Mon pays est bien plus еnsoleillé, mais c'est moi qui t'vendais l'éolienne
Ça, c'est rare, j'le ferais pas Koul-youm

J'me suis senti comme à l'étroit, j'ai compté sur ma bonne étoile
Ça m'coûte d'être solo, si tu savais (Ça m'coûte d'être solo, si tu savais)
Tu mérites piscine sur le toit, recevoir virement tous les mois
Pour toutes les galères que t'as bravées (Pour les galères que t'as bravées)
Quand la vie ne t'en donne pas la force, où est le bonheur ? Elle stipule jamais
J'ai dû m'éloigner d'mi amor (J'ai dû m'éloigner d'mi amor)
Pour m'rapprocher en simultané

Encore une prod sur une table d'autopsie
J'combats mes démons, c'est pas du shadow boxing
Faire l'magot m'obstine, j'en oublie les DM de ta go' toxique
T'as connu la galère, j't'offrirai le luxe, liasses de billets compensera les excès
Poisse sur le dos, j'crois qu'elle veut nous pacser mais j'ai brouillé les proxys
Y avait des brèches, j'ai créé mon accès, pas trop de détails, la déterre, on n'a qu'ça
Pas trop les paroles, moi c'est plus dans l'action et avec, on fera des big sous
You might also like
Plaisir, accès ailleurs, khaliss augmente la dopamine
Faut s'armer dans l'calme, anticiper l'chaos qu'arrive
Ma conscience fait des sparrings, l'impression d'être dans un ring
Faut que j'pense à réclamer l'loyer aux démons qui cohabitent
Ça bibi la pop, ça vend, j'fume plus la même drogue qu'avant
Pas l'choix, faut qu'j'tente ma chance, t'arrêtes pas, même si y a les cops, avance
J'traîne plus avec c'fils de tains-p', j'suis plus haschich que pinte
Pas sûr que l'on vive demain, faut cer-per avant l'générique de fin

J'me suis senti comme à l'étroit, j'ai compté sur ma bonne étoile
Ça m'coûte d'être solo, si tu savais (Ça m'coûte d'être solo, si tu savais)
Tu mérites piscine sur le toit, recevoir virement tous les mois
Pour toutes les galères que t'as bravées (Pour les galères que t'as bravées)
Quand la vie ne t'en donne pas la force, où est le bonheur ? elle stipule jamais
J'ai dû m'éloigner d'mi amor (J'ai dû m'éloigner d'mi amor)
Pour m'rapprocher en simultané

Encore une prod sur une table d'autopsie
J'combats mes démons, c'est pas du shadow boxing
Faire l'magot m'obstine, j'en oublie les DM de ta go' toxique
T'as connu la galère, j't'offrirai le luxe, liasses de billets compensera les excès
Poisse sur le dos, j'crois qu'elle veut nous pacser mais j'ai brouillé les proxys
Y avait des brèches, j'ai créé mon accès, pas trop de détails, la déterre, on n'a qu'ça
Pas trop les paroles, moi c'est plus dans l'action et avec, on fera des big sousEmbed"
61,Raste - Hickey,"5 ContributorsHickey LyricsIf you love me let me know
If you hate me let me go
If you lose me catch me now
If you can’t, let me do
Kanchouf khyalek f7lami
Kolchi kan sahel m3ak sans effort
Kolchi kan zwin w wonderful yeyeah
Aaah zidini
Zidini mn 7oubk zidini
Nti docteura li ba9a ka dawini
Dawiti li jra7i li kat adini
Aaah zidini
Zidini mn 7oubk zidini
Nti l ostada li ba9a kat fidini
Ghatl9ayni fjnbek finma 7tajitini
7ta 3rftek 3ad 3reft rasi
Koun ma nti ga3ma nktachefni aaah
Katfehmini blama ndwi aaah
Dowiti li dlam li fya
Let me know if you feel so good
Let me know wakha 3arf ach tari
Khallini nsem3ek w berdi li nari
Fach kangoulik m3ak kantbourch 3adi
Fach ka touchili my body
Zouwe9ti Ch7al mn 7aja f ma vie
L9it fik lwalida w ta sehabi
Aah blitini bik ya tefla
Nti la drogue lwa7id li ba9i ma 9ta3-touch
Ba9i ma 9ta3-touch
F7al chi sijara f ma-bouche
You might also likeIf you love me let me know
If you hatе me let me go
If you losе me catch me now
If you can’t, let me do
Kanchouf khyalek f7lami
Kolchi kan sahel m3ak sans effort
Kolchi kan zwin w wonderful yeyeah
Aaah zidini
Zidini mn 7oubk zidini
Nti docteura li ba9a ka dawini
Dawiti li jra7i li kat adini
Aaah zidini
Zidini mn 7oubk zidini
Nti l ostada li ba9a kat fidini
Ghatl9ayni fjnbek finma 7tajitini
Allo mi amor fink daba
Kansaynk fl blassa dyal dima
Tiri bya f7al chi s7aba
Twahachtek wakha 3ad daba tla9ina
3ejbatek lgelsa fi bali
Yakma kisehbalik galsa f bali
Mi amor zinek ra habelni
7ta chi ounta khra mn ghirek ma ghatbanli
Kanbghik w kangoulha lik w ma so9ich ach ghaygoulo li nas
Kanbghik w kangoulha lik w ba9i ghandiro bjoujna labas
Kanbghik w kangoulha lik w ma so9ich ach ghaygoulo li nas
Kanbghik w kangoulha lik w ba9i ghandiro bjoujna labas2Embed"
62,MA3IZ - JRO7I,"2 ContributorsJRO7I Lyricsكنبكي بالدموع و سبابي poto مشاكلي
سبابي الناس لي تلاقيني و ضل تشكيلي
سبابي الخوف لي راكبني صباح و ليلي
سبابي الطريق لي كتبان ليا مظلاما
فطريق lvida شحال دالحفاري كنسكيفي
فبلاد الفرص جيب الأب و لوح CV
بسيف أنفسي من العباد ضلي تعيفي
بسيف شباب تقصد بحورا وسط ضلامها
جروحي و ألامي
كنعيش فبلاد ماباغاني
كنواسي همومي بأغاني
كنشوف بنادم أناني
كنسمح لبنادم أداني
كنسمح فحقوقي لا جاوني
وكنقول لعفووووو
وسط أحلامي و أمالي
كنسمع لميمة داعالي
كي طافي الواليد ليالي
كندور فبلاصتي و مكاني
كنشوف أحلامي ضاعالي
وكنسول راسي تا مالي و كنقول لعفووووو
Oh.. oh ..
يا مَّا بنادم مسموم
وسط الحسد لي فهاد القوم
نفضل بين الحيتان نعوم
Oh.. oh ..
يا مَّا بنادم مسموم
يا وسط الحسد لي فهاد القوم
نفضل بين الحيتان نعوم
كيف بغيتوني نشوف النوم قلبي مهموم
الجروح الكبيرة متشوفوها فبدني نضحك ساعة و نبكي يوم
ذنوب حياتي فعيني نشوفها أمامي
صاحبي الصاحب كيف يدور
يا كيف يدور
La vida plaisir جامي يديروه مجاني ربي فبابك واقفون .. يا واقفون يا فاجي همومي نتا لي عالم حزني وقت حياتي معدود .. ملي تجي وقتي غير ترحمو علياااااا No.. No.. No.. No.. مابغيتشي الفلوس يا بغيت أناياا .. غير رضا والدياااا
جروحي و ألامي
كنعيش فبلاد ماباغاني
كنواسي همومي بأغاني
كنشوف بنادم أناني
كنسمح لبنادم أداني
كنسمح فحقوقي لا جاوني
وكنقول لعفووووو
وسط أحلامي و أمالي
كنسمع لميمة داعالي
كي طافي الواليد ليالي
كندور فبلاصتي و مكاني
كنشوف أحلامي ضاعالي
وكنسول راسي تا مالي و كنقول لعفووووو
You might also likeOh.. oh.. يا مَّا بنادم مسموم وسط الحسد لي فهاد القوم نفضل بين الحيتان نعوم Oh.. oh.. يا مَّا بنادم مسموم وسط الحسد لي فهاد القوم نفضل بين الحيتان نعومEmbed"
63,Manal - Makhelaw magalou,"5 ContributorsMakhelaw Magalou Lyrics
Nhar sheftek 9dami, banli zhri ana
Ntaya mktabi, w nta 3ini ana
Kat7ama9ni kat7ama9ni, wmajayb khbar
Loukan bidiya, ana 9lbi nsh3l fih nar

Lyouma 7alfa b7loufi, man di ghirek ana
Wllina ma3roufin, 9ssa mabin jma3a
Kanfakar fik, kanfakar fik, bi lil wnhar
Garma mllit a3mri, khelli nas tahdar

Makhelaw magalou
Makhelaw walou fiya wfik
Makhelaw madarou
Wa kan7ebek wnmout 3lik
Makhelaw magalou
Makhelaw walou fiya wfik
Makhelaw madarou
Wa kan7ebek wnmout 3lik

Ba9a haza rassi bydih, gali n7etek frasi f3ini
Tb3t liyam ma3rft 9lbi, fin ghay wsselni
Bhitek lbar7 wlyum nsit, nbghik men jdid
You might also like
Ya li shaghel bali, bagha m3ak nthenna
Rebi shuf men 7ali, f 9elbi sha3la jamra
Bghiti tguli nsay lmadi , lyuma nhar jdid
B9ay 7daya tri9 twila, ghanmshiw b3id
Nshuf fik khyali, wana ftriqi ghada
Nas ysoulu mali, hada 7ali ana

Kanfakar fik, kanfakar fik, bi lil wnhar
Ga3ma mllit a3mri
Khelli nas tahdar (kolchi mbarek o mas3oud)

Makhelaw magalou
Makhelaw walou fiya wfik
Makhelaw madarou
Wa kan7ebek wnmout 3lik
Makhelaw magalou
Makhelaw walou fiya wfik
Makhelaw madarou
Wa kan7ebek wnmout 3lik

Ba9a haza rasi bydih, gali n7etek frasi f3ini
Tb3t liyam ma3rft 9lbi, fin ghay weselni
Bghitek lbar7 wlyum nsit, nbghik men jdid
Makhеlaw magalou
Makhelaw walou fiya wfik
Makhelaw madarou
Wa kan7ebеk wnmout 3lik

Makhelaw magalou
Makhelaw walou fiya wfik
Makhelaw madarou
Wa kan7ebek wnmout 3likEmbed"
64,Saad Lamjarred - Lewjah Tani,"2 ContributorsLewjah Tani - لوجه التاني LyricsAllahoma nbaad elik wala del
Ghan télécharger zouhair tani w netbedel
Tnegri kola dqiqa kola sa3a lil w sbah
Hit nti meghnana w rasek men lhjar qsah
Allahoma nbaad elik wala del
Ghan télécharger saad tani w netbedel
Tnegri kola dqiqa kola sa3a lil w sbah
Hit nti meghnana w rasek men lhjar qsah
Ahahayaya ghir nsini
Ahahayaya Lewjah tani
Ahahayaya ghir siri
Ahahayaya lbhar kbir
Ahahayaya kenti zin diali
Ahahayaya daba lewjah tani
Ahahayaya ghir siri
Ahahayaya lbhar kbir
Dak lhob li kan zwin gae mabqa
L messagat b lil w teli l zanqa
Khalina ghir shab w nsayni
Meshi sowar li fato binek w bayni
Dak lhob li kan mziwen gae mabqa
L messagat b lil w teli l zanqa
Khalina ghir shab w nsayni
Meshi sowar li fato binek w bayni
You might also likeLhob meak mrara
Wel eicha meak khssara
Madanitek ghadara
B rabi manweli likEmbed"
65,ElGrandeToto - RAZONES,"20 ContributorsRAZONES Lyrics

SHB
Scar

Y ni quiero estar antes de que digan algo
Soy un solitario galgo, yo por mí solo me valgo
Y no suelo hablar cuando de casa yo salgo
Pocos saben lo que cargo, todo se me hace amargo
Hay momentos en la vida que salen problemas que se hacen largos
Tú quieres tener amigos y en los malos momentos tú ya te largas
Algunos miran a los ojos, te dicen ""tranquilo"", mientras te la cargan
Hay que aprender en la vida que quien más calla es quien más otorga

Y no todo el que otorga acaba siendo el más leal (No)
No todo lo que ves acaba siendo luego igual (No acaba)
Me enseñan a diferenciar, el querer, el odiar
El rencor y la paz, el callar y no hablar

Al tiempo no pude querer por culpa de la ambición
Al tiempo no pude querer por culpa de alguna traición
Al tiempo no pude querer porque el dinero cambia a las persona'
Al tiempo no pude querer y no acepto ni un ""perdona""
Un clavo a otro no lo saca, el malo siempre aquí destaca
Los niños por una paca te hacen jugar a la vaca
Y gana el primero que ataca, batallas como las de Mbacca
Y hablale claro, Eladio el que habla nunca aquí la saca
El que la usa la destaca, y partido no queda en empate
Sentado en una mesa con siete, y todos con la misma mente
Que nadie es más que gente, y gente también matan gente
Y tanto que son diferentes cuando están todos de frente
See ElGrandeToto LiveGet tickets as low as $66You might also like
Yo tengo veintisiete razones para vivir aquí, khouya
Siete kilos d’coco, flossha datni l'Pattaya
Très drôle d’effet fach knchof mes proches chemtoni b'3inaya
Skhfatni zatla, souffli tla9to f war9a lil faya
Ch’Hadshi Joder, Joder tío, f mi coche knbki 3la Dio
Jeune kaber mafieux baghi Phantom face la piaule
Talba dior couper l'anneau villa w dyor
Puta miaule, aller-retour Casa, Rio

Hadchi li 3ta Allah
Ch7al 9eddi nb9a n7sseb f'les décès
Déjà blessé mchat la Mama
Ch7al 9eddi nb9a ndoukh w n'tester dosa jenni ga3ma t'calma
Ch7al 9eddi nb9a saket apprécié précis bla mandir chi drama
Rah 7na kima hokka sex w droga l3a9a la misión
Khyabet 9bel mando9 chi CP nharna k7al sin ambición
L3zara tghaw fo9 la scène baghyin l'papel ta3 Punta Cana
Tfrge3t mn 2017 tal daba boss hadchi li3ta Allah
Rah 7na kima hokka sex w droga l3a9a la misión
Khyabet 9bel mando9 chi CP nharna k7al sin ambición
L3zara trop fo9 la scène baghyin l'papel ta3 Punta Cana
Tfrge3t mn 2017 tal daba boss hadchi li3ta AllahEmbed"
66,Lbenj - KIF KIF,"3 ContributorsKif kif Lyrics

Cheftini banka cheft m3ak familia
Kenti mchta9a werritek la vie
Au lieu tchokri w sde9ti madiya
Rohi yal poupia, nti machi liya
Niya sla7i f 7erbi bla 7oulafa
Contre terrika del bkhor w chowwafat
3arfek katsoufri wakha tgouli ça va
Mentalité korafa, rebbawk l7esrafa

W nti, ya mouti b jou3
Ki chbabek nrou7, ma kayen rjou3
Nti li derti, l’amour mechrou3
Siri gha rou7i daba, lma w chettaba
W nti, ya mouti b jou3
Ki chbabek nrou7, ma kayen rjou3
Nti li derti, l’amour mechrou3
Siri gha rou7i daba, lma w chettaba

Tiya rou7i bla ma tji tnebchi f jrou7i
W jfouni li tester dmo3i
Nekhser mali f tle9 sra9i
Machi m3a sla7i
W kif kif, kif chta kif sif
W ch7al man 3ala9a khellat lgalb nzif
Ma b9itch 9ader nti9 hta f moulat zif
Ya kolchi manatif yalatif alatif
You might also like
W nti, ya mouti b jou3
Ki chbabek nrou7, ma kayen rjou3
Nti li derti, l’amour mechrou3
Siri gha rou7i daba, lma w chettaba
W nti, ya mouti b jou3
Ki chbabek nrou7, ma kayen rjou3
Nti li derti, l’amour mechrou3
Siri gha rou7i daba, lma w chettaba

Wana 3ndi kif kif (Kif kif), kif kif (kif kif)
Kif kif (Kif kif kif kif)
Yak galou li zine zine (Zine zine), zine zine (Zine zine)
Ya zine zine (Zine zine zine zine)
Bghiti terta7 sebbe9 l'mim mim (Mim mim), w lmim mim (Mim mim)
L'mim mim (Mim mim mim mim)
Wakha tbadal wil wil (Wil wil), wil wil (Wil wil)
Wil wil (Wil wil wil wil)

7sebtini yemken Kalenji m3aya bghiti tester
Ghada tjerri wara 7ta nti ki DST
Ach gha diri bel flouss w ma 3endekch respect
Ma testahli 7ob ma testahli n détesték
3aref rassi mkemmel solo, 7it ana li chadd l volant
Kolchi wella donnant donnant (Donnant donnant)
Teb3ini gha twelli folle khellini kandir drahem
Khellik nti diri donob (Donob donob donob)
Kedbi w gouli tle3ti f rassi fima tchoufi storiati
Ghadi menni yjik lmono (Lmono lmono lmono)
Gha quittetek Rebbi yessar kenti gha dos d’âne f tri9i
7besti rez9i kter man Bounou (Bounou Bounou Bounou)
Wana 3ndi kif kif (Kif kif), kif kif (kif kif)
Kif kif (Kif kif kif kif)
Yak galou li zine zine (Zine zine), zine zine (Zine zine)
Ya zine zine (Zine zine zine zine)
Bghiti terta7 sebbe9 l'mim mim (Mim mim), w lmim mim (Mim mim)
L'mim mim (Mim mim mim mim)
Wakha tbadal wil wil (Wil wil), wil wil (Wil wil)
Wil wil (Wil wil wil wil)Embed"
67,Soolking - Y Dor,"8 ContributorsY Dor Lyrics

Bah-bah-bah, bah-bah-bah
Machi khalat, ila bghitek nti
Rani malade, w fiya w ma derti
Youh, ouh, ouh, ouh, ouh
Youh, ouh, ouh, ouh, ouh
Unleaded

F dem Y Dor, 7obek nti
Y Dor Y Dor, Y Dor Y Dor
C'est mon amour, yeah, et pour la vie
C'est mon amour, c'est mon amour

Uh-huh, eh, heh
Machi normal zinek nti
Rani nhbel 3lik nti
Mali, mali, raki fi bali
Suis-moi sur ma route, y a pas de doute
Juste à tes côtés, meziane lwa9t y fout
Bla bik mal à l'aise
Bla bik machi à l'aise
M3ak rani labess, ooh, ooh, ooh
See Soolking LiveGet tickets as low as $59You might also like
F dem Y Dor, 7obek nti
Y Dor Y Dor, Y Dor Y Dor
C'est mon amour, yeah, et pour la vie
C'est mon amour, c'est mon amour

Han, han, eh, eh
Machi normal zinek nti
Elle est trop belle еt trop gentille
On se connait dеpuis petits
Elle m'rendait déjà loco, moi, j'revois toutes nos photos
C'est la voisine d'à côté, c'est elle, mon premier amour, ah
C'est pas trop tard pour mettre la bague au doigt
C'est pas trop tard, ana wyak ndiro dar

F dem Y Dor, 7obek nti
Y Dor Y Dor, Y Dor Y Dor
C'est mon amour, yeah, et pour la vie
C'est mon amour, c'est mon amour

Machi khalat, ila bghitek nti
Rani malade, w fiya w ma derti
Machi ghalat, w ila bghitek nti
Machi ghalat, t'es la plus belle de la cité, yeah, yeah yeah
F dem Y Dor, 7obek nti
Y Dor Y Dor, Y Dor Y Dor
C'est mon amour, yeah, et pour la vie
C'est mon amour, c'est mon amourEmbed"
68,Duke - Hyati,"1 ContributorHyati Lyrics{Intro}
Chofa lwla dakh 9albi dakh
{?}
Nti li fi bali...
Nti li fi bali...
{Verse 1}
Kif l gmra f smaya mdwya lili
Blasstk f 9lbi m3a l family
Nassi machakili mafini
Ghir 7obk lia ra kafini
Ma b ydi 7ila ki nkon m3ak
O ghramk 7ass brassi mrta7
Nti li fahmani w 3arfa chno baghi
Nti li dayma li w fahma l m3ani, yeah
{Refrain}
Tracit 7yati bghitha tsali wana 7dak
Bla bik kayban li rassi ghadi w7di talf
Ti9i bia i7ssassi lik malo mtil
Mtil...
{Verse 2}
Khodi ro7i ya zina
Inti 3omri w 7ayati
N3icho bjuj kifma bghina
Ma7laha dnya ma3aki
D7ka f wjhk mali7a
Chaba7 fi donya wallahi
Nor 3ala nor ya3ini
Jamalk w7do kafini
You might also like{Refrain}
Tracit 7yati bghitha tsali wana 7dak
Bla bik kayban li rassi ghadi w7di talf
Ti9i bia i7ssassi lik malo mtil
Mtil...
{Verse 3}x2
Baby
9rbi li khlik m3aya
Ntia ma vie ntia dwaya
Dima f bali b7alla 7daya, ahaaa
{Refrain}
Tracit 7yati bghitha tsali wana 7dak
Bla bik kayban li rassi ghadi w7di talf
Ti9i bia i7ssassi lik malo mtil
Mtil...Embed"
69,Stormy - MARADONA,"24 ContributorsMaradona Lyrics

Ki Diego Maradona
(Huss)

Ana dertha b yeddi, b yeddi Diego Maradonna
7e99ada ghi rta7o, khoutna 9bel menkom kerhouna
Ji-ji-ji tchouf fel 7oma da3 ch7al men Mbappé w Leo Messi
Nhar bghit nechki w nessi, l9it l'Maghrib kollo m'blessé

Jiti 7ta nti sre9ti 9elbi ki ser9at Fransa l’Afrique
Ga3ma dennit hadchi gha yetra, 7it kan kays7ab 9elbi 7ejra
Had l3am koulchi ra ghla, tanti zedtini takalif
Ta 7aja ma gha tghla 3lik, ghir khass salaire Hakimi f Bariz
W khasni ndir koulchi b setra, rak 3aref ila teb3ok fiha l3rab
Mama galetli sebbe9 lmim, wakha tkoun nta fahem w te3ref
Wallah khoya zina l’misère, misère
Khebz dar zayt zaytoun
Ghi l'madré li tebghik wakha 3youbek million

Ana dertha b yeddi, b yеddi Diego Maradonna
7e99ada ghi rta7o, khoutna 9bel mеnkom kerhouna
Ji-ji-ji tchouf fel 7oma da3 ch7al men Mbappé w Leo Messi
Nhar bghit nechki w nessi, l9it l'Maghrib kollo m'blessé
You might also like
7na Jamais kalatna l’état
Ghi ssour wella poteau
3endak takel mon poto
Ma kayench wellah fommek ma y7etto
Ra l’omma cha3la w 3ad zaydine kaysouto
Jina n9elbo tebla kif Ramos f akhir minuto
Ma 7dertich nhar dial lgnaza
W baghi tji nhar la fête
F 3inik bayna l’affaire
Bouquet f yeddek f westo machette
W men ghir la Rebbi dali l’ajal
Ateb9ay jenbi talin
9ertassi ga3ma ysali
Ta ysalili ga3 3edyani

W ma 3lich ana dertha b yeddi ki Diego
Ma 3lich ana dertha b yeddi ki Diego
Ma 3lich ana dertha b yeddi ki Diego Maradona
Ma 3lich ana dertha b yeddi ki Diego Maradona

Ana dertha b yeddi, b yeddi Diego Maradonna
7e99ada ghi rta7o, khoutna 9bel menkom kerhouna
Ji-ji-ji tchouf fel 7oma da3 ch7al men Mbappé w Leo Messi
Nhar bghit nechki w nessi, l9it l'Maghrib kollo m'blesséEmbed"
