,Unnamed: 0,artist_title,lyrics,emotions
21,21,Post Malone - I Fall Apart,"140 ContributorsTranslationsTürkçeEspañolNederlandsI Fall Apart Lyrics
Ooh, I fall apart
Ooh, yeah, mmm, yeah

She told me that I'm not enough (Yeah)
And she left me with a broken heart (Yeah)
She fooled me twice and it's all my fault (Yeah)
She cut too deep, now she left me scarred (Yeah)
Now there's so many thoughts goin' through my brain (Yeah)
And now I'm takin' these shots like it's Novocaine, yeah

Ooh, I fall apart
Down to my core
Ooh, I fall apart
Down to my core
Ooh, didn't know it before
Surprised when you caught me off guard
All this damn jewelry I bought
You was my shorty, I thought

Never caught a feelin' this hard
Harder than the liquor I pour
Tell me you don't want me no more
But I can't let go, everybody told me so
Feelin' like I sold my soul
Devil in the form of a whore
Devil in the form of a whore
You said it, no, you said it
No, you said that shit, we'd be together, oh
See Post Malone LiveGet tickets as low as $149You might also like
Ooh, I fall apart
Down to my core
Ooh, I fall apart
Down to my core
Ooh, didn't know it before
Surprised when you caught me off guard
All this damn jewelry I bought
You was my shorty, I thought

Ice keep pourin' and the drink keep flowin'
Try to brush it off, but it keep on goin'
Covered in scars and I can't help showin'
Whippin' in the foreign and the tears keep rollin'
Ice keep droppin' and the drink keep flowin'
Try to brush it off, but it keep on goin'
All these scars, can't help from showin'
Whippin' in the foreign and the tears keep blowin', yeah

Ooh, I fall apart
Down to my core
Ooh, I fall apart
Down to my core
Ooh, didn't know it before
Surprised when you caught me off guard
All this damn jewelry I bought
You was my shorty, I thought208Embed","[['realization', 'sadness'], ['excitement', 'neutral'], ['neutral'], ['sadness'], ['annoyance'], ['disappointment'], ['neutral'], ['neutral'], ['realization', 'sadness'], ['neutral'], ['realization', 'sadness'], ['neutral'], ['realization'], ['surprise'], ['annoyance'], ['neutral'], ['disappointment', 'neutral'], ['neutral'], ['anger', 'annoyance'], ['neutral'], ['neutral'], ['neutral'], ['neutral'], ['disapproval'], ['annoyance', 'disapproval'], ['approval', 'neutral'], ['realization', 'sadness'], ['neutral'], ['realization', 'sadness'], ['neutral'], ['realization'], ['surprise'], ['annoyance'], ['neutral'], ['neutral'], ['neutral'], ['neutral'], ['neutral'], ['neutral'], ['neutral'], ['neutral'], ['neutral'], ['realization', 'sadness'], ['neutral'], ['realization', 'sadness'], ['neutral'], ['realization'], ['surprise'], ['annoyance'], ['neutral']]"
22,22,Drake - God's Plan,"657 ContributorsTranslationsРусскийTürkçeEspañolPolskiItalianoDeutschFrançaisAzərbaycanca / آذربايجانGod’s Plan Lyrics
And they wishin' and wishin'
And wishin' and wishin', they wishin' on me
Yeah

I been movin' calm, don't start no trouble with me
Tryna keep it peaceful is a struggle for me
Don't pull up at 6 AM to cuddle with me
You know how I like it when you lovin' on me
I don't wanna die for them to miss me
Yes, I see the things that they wishin' on me
Hope I got some brothers that outlive me
They gon' tell the story, shit was different with me

God's plan, God's plan
I hold back, sometimes I won't, yeah
I feel good, sometimes I don't (Ayy, don't)
I finessed down Weston Road (Ayy, 'nessed)
Might go down a G-O-D (Yeah, wait)
I go hard on Southside G (Yeah, wait)
I make sure that north-side eat
And still

Bad things
It's a lot of bad things that they wishin' and wishin'
And wishin' and wishin', they wishin' on me
Bad things
It's a lot of bad things that they wishin' and wishin'
And wishin' and wishin', they wishin' on me
Yeah, ayy, ayy
You might also like
She say, ""Do you love me?"" I tell her, ""Only partly
I only love my bed and my mama, I'm sorry""
Fifty Dub, I even got it tatted on me
Eighty-one, they'll bring the crashers to the party
And you know me
Turn the O2 into the O3, dog
Without 40, Oli, there'd be no me
'Magine if I never met the broskies

God's plan, God's plan
I can't do this on my own, ayy (No, ayy)
Someone watchin' this shit close (Yep, close)
I've been me since Scarlett Road, ayy (Road, ayy)
Might go down as G-O-D (Yeah, wait, yeah)
I go hard on Southside G (Ayy, wait, ayy)
I make sure that north-side eat, yeah
And still

Bad things
It's a lot of bad things that they wishin' and wishin'
And wishin' and wishin', they wishin' on me
Yeah, yeah
Bad things
It's a lot of bad things that they wishin' and wishin'
And wishin' and wishin', they wishin' on me
Yeah941Embed","[['neutral'], ['neutral'], ['approval', 'neutral'], ['neutral'], ['neutral'], ['neutral'], ['love'], ['sadness'], ['neutral'], ['optimism', 'sadness'], ['disappointment'], ['neutral'], ['neutral'], ['joy'], ['neutral'], ['optimism'], ['neutral'], ['neutral'], ['neutral'], ['fear', 'neutral'], ['neutral'], ['neutral'], ['fear', 'neutral'], ['neutral'], ['neutral'], ['approval', 'neutral'], ['confusion', 'neutral'], ['neutral'], ['love'], ['neutral'], ['neutral'], ['neutral'], ['neutral'], ['neutral'], ['neutral'], ['neutral'], ['disapproval', 'neutral'], ['neutral'], ['neutral'], ['optimism'], ['neutral'], ['neutral'], ['neutral'], ['fear', 'neutral'], ['neutral'], ['neutral'], ['approval', 'neutral'], ['fear', 'neutral'], ['neutral'], ['neutral'], ['neutral']]"
23,23,SZA - Kill Bill,"155 ContributorsTranslationsEspañolPortuguêsItalianoTürkçeDeutschNederlands日本語සිංහලΕλληνικάРусскийBahasa IndonesiaFrançaisالعربيةKill Bill Lyrics
I'm still a fan even though I was salty
Hate to see you with some other broad, know you happy
Hate to see you happy if I'm not the one drivin'

I'm so mature, I'm so mature
I'm so mature, I got me a therapist to tell me there's other men
I don't want none, I just want you
If I can't have you, no one should

I might
I might kill my ex, not the best idea
His new girlfriend's next, how'd I get here?
I might kill my ex, I still love him though
Rather be in jail than alone

I get the sense that it's a lost cause
I get the sense that you might really love her
This text gon' be evidence, this text is evidence
I tried to ration with you, no murders or crime of passion, but damn
You was out of reach
You was at the farmer's market with your perfect peach
Now I'm in the basement plannin' home invasion
Now you layin' face-down, got me singin' over a beat
See SZA LiveGet tickets as low as $86You might also like
I'm so mature, I'm so mature
I'm so mature, I got me a therapist to tell me there's other men
I don't want none, I just want you
If I can't have you, no one will

I might (I)
I might kill my ex, not the best idea
His new girlfriend's next, how'd I get here?
I might kill my ex, I still love him though
Rather be in jail than alone

I did it all for love (Love)
I did it all on no drugs (Drugs)
I did all of this sober
I did it all for us, oh
I did it all for love (Love)
I did all of this on no drugs (Drugs)
I did all of this sober
Don't you know I did it all for us? (I'm gon' kill your ass tonight)

Oh, I just killed my ex (My ex, oops), not the best idea (Idea)
Killed his girlfriend next, how'd I get here? (He left me no choice)
I just killed my ex (My ex), I still love him though (I do)
Rather be in Hell than alone73Embed","[['neutral'], ['joy'], ['joy', 'sadness'], ['pride', 'neutral'], ['realization'], ['disapproval'], ['neutral'], ['neutral'], ['anger', 'disapproval'], ['neutral'], ['love'], ['neutral'], ['disappointment', 'neutral'], ['love', 'optimism'], ['neutral'], ['neutral'], ['neutral'], ['admiration', 'neutral'], ['neutral'], ['neutral'], ['neutral'], ['pride', 'neutral'], ['realization'], ['disapproval'], ['neutral'], ['neutral'], ['anger', 'disapproval'], ['neutral'], ['love'], ['neutral'], ['love'], ['approval', 'relief', 'neutral'], ['approval', 'neutral'], ['joy', 'neutral'], ['love'], ['neutral'], ['approval', 'neutral'], ['anger', 'curiosity'], ['disappointment'], ['curiosity'], ['love'], ['neutral']]"
24,24,Morgan Wallen - Whiskey Glasses,"29 ContributorsWhiskey Glasses Lyrics
Poor me, pour me another drink
'Cause I don't wanna feel a thing
No more, hell nah
I just wanna sip 'til the pain wears off
Poor me, pour me another round
Line 'em up and knock 'em down
Two more let's go
'Cause I ain't never hurt like this before

Don't wanna think about her
Or wear a ring without her
Don't wanna hit the karaoke bar
Can't sing without her
So make them drinks strong
'Cause brother she's gone
And if I'm ever gonna move on

I'ma need some whiskey glasses
'Cause I don't wanna see the truth
She's probably making out on the couch right now
With someone new
Yeah, I'ma need some whiskey glasses
If I'm gonna make it through
If I'ma be single
I'ma need a double shot of that heartbreak proof
And see the world through whiskey glasses
(Ain't nothing else to do, but sip around the truth)
And see the world through whiskey glasses
(I need a better view, where I don't drink to you)
See Morgan Wallen LiveGet tickets as low as $17You might also like
Last call
I swear this will be my last call
Now I ain't drunk dialing no more at 3 am
Mr. Bartender hittin' me again

Don't wanna think about her
Or wear a ring without her
Don't wanna hit the karaoke bar
Can't sing without her
So make them drinks strong
'Cause brother she's gone
And if I'm ever gonna move on

I'ma need some whiskey glasses
'Cause I don't wanna see the truth
She's probably making out on the couch right now
With someone new
Yeah, I'ma need some whiskey glasses
If I'm gonna make it through
If I'ma be single
I'ma need a double shot of that heartbreak proof
And see the world through whiskey glasses
(Ain't nothing else to do, but sip around the truth)
Oh, see the world through whiskey glasses
(I need a better view, where I don't drink to you)
Line 'em up, line 'em up, line 'em up, line 'em up
Knock 'em back, knock 'em back, knock 'em back, knock 'em back
Fill 'em up, fill 'em up, fill 'em up, fill 'em up
'Cause if she ain't ever coming back
Line 'em up, line 'em up, line 'em up, line 'em up
Knock 'em back, knock 'em back, knock 'em back, knock 'em back
Fill 'em up, fill 'em up, fill 'em up, fill 'em up
'Cause if she ain't ever coming back

I'ma need some whiskey glasses
'Cause I don't wanna see the truth
She's probably making out on the couch right now
With someone new
Yeah, I'ma need some whiskey glasses
If I'm gonna make it through
If I'ma be single
I'ma need a double shot of that heartbreak proof
And see the world through whiskey glasses
(Ain't nothing else to do, but sip around the truth)
Oh, see the world through whiskey glasses
(I need a better view, where I don't drink to you)
Yeah

(Ain't nothing else to do, but sip around the truth)
And see the world through whiskey glasses
(I need a better view, where I don't drink to you)
Yeah12Embed","[['sadness'], ['neutral'], ['anger'], ['desire', 'neutral'], ['sadness'], ['neutral'], ['neutral'], ['realization', 'neutral'], ['disapproval', 'neutral'], ['neutral'], ['disapproval'], ['neutral'], ['approval', 'neutral'], ['sadness', 'neutral'], ['optimism'], ['neutral'], ['disapproval', 'neutral'], ['neutral'], ['neutral'], ['approval', 'neutral'], ['neutral'], ['neutral'], ['desire', 'neutral'], ['neutral'], ['neutral'], ['neutral'], ['approval', 'desire'], ['neutral'], ['neutral'], ['anger', 'annoyance', 'neutral'], ['neutral'], ['neutral'], ['disapproval', 'neutral'], ['neutral'], ['disapproval'], ['neutral'], ['approval', 'neutral'], ['sadness', 'neutral'], ['optimism'], ['neutral'], ['disapproval', 'neutral'], ['neutral'], ['neutral'], ['approval', 'neutral'], ['neutral'], ['neutral'], ['desire', 'neutral'], ['neutral'], ['neutral'], ['neutral'], ['approval', 'desire'], ['neutral'], ['neutral'], ['neutral'], ['neutral'], ['neutral'], ['neutral'], ['neutral'], ['neutral'], ['neutral'], ['disapproval', 'neutral'], ['neutral'], ['neutral'], ['approval', 'neutral'], ['neutral'], ['neutral'], ['desire', 'neutral'], ['neutral'], ['neutral'], ['neutral'], ['approval', 'desire'], ['approval', 'neutral'], ['neutral'], ['neutral'], ['approval', 'desire'], ['neutral']]"
25,25,Drake - One Dance,"305 ContributorsTranslationsTürkçeEspañolPolskiDeutschFrançaisOne Dance Lyrics
Baby, I like your style

Grips on your waist, front way, back way
You know that I don't play
Streets not safe but I never run away
Even when I'm away
Oti, oti
There's never much love when we go OT
I pray to make it back in one piece
I pray, I pray

That's why I need a one dance
Got a Hennessy in my hand
One more time 'fore I go
Higher powers taking a hold on me
I need a one dance
Got a Hennessy in my hand
One more time 'fore I go
Higher powers taking a hold on me
Baby, I like your style
You might also like
Strength and guidance
All that I'm wishing for my friends
Nobody makes it from my ends
I had to bust up the silence
You know you gotta stick by me
Soon as you see the text, reply me
I don't wanna spend time fighting
We've got no time, and that's why

I need a one dance
Got a Hennessy in my hand
One more time 'fore I go
Higher powers taking a hold on me
I need a one dance
Got a Hennessy in my hand
One more time 'fore I go
Higher powers taking a hold on me

Got a pretty girl and she love me long time
Wine it, wine it, she love me long time
Oh, yeah, very long time
Back up, back up, back up, and wine am
Back up, back up, and wine am, girl, just
Back up, back up, back up, and wine am
Oh, yeah, very long time
Back, up, back up and wine am, girl
Oh, tell me, I need to know
Where do you wanna go?
'Cause if you're down, I'll take it slow
Make you lose control

Where, where, where
Where, where, where, where (Oh, yeah, very long time)
Where, where, where (Back up, back up, and wine am, girl)
Where, where, where, where
'Cause if you're down (Back up, back up, and–)
'Cause if you're down (Back up, back up, and–)
'Cause if you're down (Back up, back up, and–)

I need a one dance (Where, where, where)
Got a Hennessy in my hand (Where, where, where, where)
One more time 'fore I go (Where)
Higher powers taking a hold on me (Where, where, where, where)
I need a one dance
Got a Hennessy in my hand
One more time 'fore I go
Higher powers taking a hold on me
How do you spell ""Hennessy?""
I put two ""N""s and two ""S""es, is it like that? Hen... Henn... Henn...
It's definitely not showing up
I know ""Hennessy"" has two ""S""es for sure, so I'm gonna take out one of the ""N""s234Embed","[['admiration', 'love'], ['neutral'], ['neutral'], ['realization', 'neutral'], ['neutral'], ['neutral'], ['love', 'neutral'], ['caring', 'desire'], ['caring', 'neutral'], ['approval', 'neutral'], ['neutral'], ['neutral'], ['neutral'], ['approval', 'neutral'], ['neutral'], ['neutral'], ['neutral'], ['admiration', 'love'], ['confusion', 'neutral'], ['neutral'], ['desire', 'optimism'], ['neutral'], ['annoyance', 'neutral'], ['neutral'], ['neutral'], ['disapproval'], ['neutral'], ['approval', 'neutral'], ['neutral'], ['neutral'], ['neutral'], ['approval', 'neutral'], ['neutral'], ['neutral'], ['neutral'], ['love'], ['love'], ['neutral'], ['joy', 'neutral'], ['neutral'], ['joy', 'neutral'], ['neutral'], ['neutral'], ['curiosity', 'neutral'], ['curiosity', 'neutral'], ['neutral'], ['annoyance', 'neutral'], ['neutral'], ['curiosity', 'neutral'], ['neutral'], ['neutral'], ['neutral'], ['neutral'], ['neutral'], ['approval', 'desire'], ['neutral'], ['neutral'], ['neutral'], ['approval', 'neutral'], ['neutral'], ['neutral'], ['neutral'], ['curiosity'], ['curiosity', 'neutral'], ['neutral'], ['neutral']]"
26,26,Morgan Wallen - Wasted On You,"29 ContributorsWasted on You Lyrics
I don't always wake up in the mornin', pour myself a strong one
Aw, but when I get lonely I do
Your memory gets to burnin', lean back on the bourbon
Sure as hell can't keep leanin' on you

Looks like I'm learnin' the hard way again
It's all my fault, yeah, I dropped the ball
You're gone and I'm gone three sheets to the wind
Thinkin' 'bout all

I've wasted on you
All of this time and all of this money
All of the these sorries I don't owe you honey
All of these miles on this Chevy, and prayers in a pew
All them days I spent wasted on you
Wasted on you

Yeah, I swore this one'd be different, my heart wouldn't listen
To my head and these boots on my feet
Looks like I'm learnin' the hard way again
That's why I've been
See Morgan Wallen LiveGet tickets as low as $17You might also like
Wasted on you
All of this time and all of this money
All these sorries I don't owe you, honey
All of these miles on this Chevy and prayers in a pew
All them days I spent wasted on you
Wasted on you

Like this pile of your stuff that's packed up in a bag
Right down to the flame of this match
Wasted on you, wasted on you
Wasted on you, wasted on you

Wasted on you
All of this time and all of this money
All these sorries I don't owe you, honey
All of these miles on this Chevy and prayers in a pew
All them days I spent wasted on you
Wasted on you

Wasted on you, wasted on you18Embed","[['neutral'], ['sadness'], ['neutral'], ['annoyance'], ['realization'], ['realization', 'remorse'], ['disappointment', 'neutral'], ['neutral'], ['disappointment'], ['neutral'], ['neutral'], ['neutral'], ['disappointment'], ['annoyance', 'neutral'], ['realization'], ['neutral'], ['realization'], ['neutral'], ['neutral'], ['annoyance', 'neutral'], ['neutral'], ['neutral'], ['neutral'], ['disappointment'], ['annoyance', 'neutral'], ['neutral'], ['neutral'], ['annoyance', 'disappointment', 'neutral'], ['annoyance', 'disappointment', 'neutral'], ['annoyance', 'neutral'], ['neutral'], ['neutral'], ['neutral'], ['disappointment'], ['annoyance', 'neutral'], ['neutral']]"
27,27,Zach Bryan - Something in the Orange,"19 ContributorsSomething in the Orange Lyrics
It'll be fine by dusk light, I'm tellin' you, baby
These things eat at your bones and drive your young mind crazy
But when you place your head between my collar and jaw
I don't know much, but there's no weight at all

And I'm damned if I do and I'm damned if I don't
'Cause if I say I miss you, I know that you won't
But I miss you in the mornings when I see the sun
Somethin' in the orange tells me we're not done

To you, I'm just a man; to me, you're all I am
Where the hell am I supposed to go?
I poisoned myself again, somethin' in the orange
Tells me you're never comin' home

I need to hear you say you've been waitin' all night
There's orange dancin' in your eyes from bulb light
Your voice only trembles when you try to speak
Take me back to us dancin', this wood used to creak

To you, I'm just a man; to me, you're all I am
Where the hell am I supposed to go?
I poisoned myself again, somethin' in the orange
Tells me you're never comin' home
See Zach Bryan LiveGet tickets as low as $33You might also like
To you, I'm just a man; to me, you're all I am
Where the hell am I supposed to go?
I poisoned myself again, somethin' in the orange
Tells me you're never comin' home
If you leave today, I'll just stare at the way
The orange touches all things around
The grass, trees, and dew, how I just hate you
Please turn those headlights around
Please turn those headlights around1Embed","[['neutral'], [], ['neutral'], ['neutral'], ['neutral'], ['sadness', 'neutral'], ['sadness'], ['neutral'], ['neutral'], ['anger', 'annoyance'], [], ['neutral'], ['neutral'], ['neutral'], ['fear', 'neutral'], ['neutral'], ['neutral'], ['anger', 'annoyance'], [], ['neutral'], ['optimism', 'neutral'], ['neutral'], ['anger', 'annoyance'], [], ['neutral'], ['neutral'], ['neutral'], ['anger'], ['neutral'], ['neutral']]"
28,28,Roddy Ricch - The Box,"382 ContributorsTranslationsEspañolPortuguêsDeutschFrançaisفارسیChinese TraditionalAzərbaycanca / آذربايجانРусскийTürkçeThe Box Lyrics
Pullin' out the coupe at the lot
Told 'em fuck 12, fuck SWAT
Bustin' all the bells out the box
I just hit a lick with the box
Had to put the stick in the box, mmh
Pour up the whole damn seal, I'ma get lazy
I got the mojo deals, we been trappin' like the '80s
She sucked a nigga soul, gotta Cash App
Told 'em wipe a nigga nose, say slatt, slatt
I won't never sell my soul, and I can back that
And I really wanna know where you at, at

I was out back where the stash at
Cruise the city in a bulletproof Cadillac (Skrrt)
'Cause I know these niggas after where the bag at (Yeah)
Gotta move smarter, gotta move harder
Nigga try to get me for my water
I'll lay his ass down, on my son, on my daughter
I had the Draco with me, Dwayne Carter
Lotta niggas out here playin', ain't ballin'
I done put my whole arm in the rim, Vince Carter (Yeah)
And I know probably get a key for the quarter
Shawty barely seen in double C's, I bought 'em
Got a bitch that's looking like Aaliyah, she a model
I got the pink slip, all my whips is key-less
Compton, I'm about to get the key to the city
Patek like the sea, forgive me
You might also like
Pullin' out the coupe at the lot
Told 'em fuck 12, fuck SWAT
Bustin' all the bells out the box
I just hit a lick with the box
Had to put the stick in the box, mmh
Pour up the whole damn seal, I'ma get lazy
I got the mojo deals, we been trappin' like the '80s
She sucked a nigga soul, gotta Cash App
Told 'em wipe a nigga nose, say slatt, slatt
I won't never sell my soul, and I can back that
And I really wanna know where you at, at, hah

Hahaha, I been movin' 'em out
If Steelo with me, then he got the blues in the pouch (Yeah)
Took her to the forest, put the wood in her mouth
Bitch, don't wear no shoes in my house
The private I'm flyin' in, I never wan' fly again
I'll take my chances in traffic (Yeah)
She suckin' on dick, no hands with it
I just made the Rollie plain like a landing strip
I'm a 2020 president candidate
I done put a hundred bands on Zimmerman, shit
I been movin' real gangster, so that's why she picked a Crip
Shawty call me Crisco 'cause I pop my shit
Got it out the mud, there's nothin' you can tell me, yeah
When I had the drugs, I was street wealthy, yeah
Pullin' out the coupe at the lot
Told 'em fuck 12, fuck SWAT
Bustin' all the bells out the box
I just hit a lick with the box
Had to put the stick in the box, mmh
Pour up the whole damn seal, I'ma get lazy
I got the mojo deals, we been trappin' like the '80s
She sucked a nigga soul, gotta Cash App
Told 'em wipe a nigga nose, say slatt, slatt
I won't never sell my soul, and I can back that
And I really wanna know where you at, at339Embed","[['neutral'], ['anger', 'neutral'], ['neutral'], ['neutral'], ['neutral'], ['annoyance', 'disappointment', 'neutral'], ['neutral'], ['neutral'], ['neutral'], ['approval', 'neutral'], ['curiosity', 'neutral'], ['neutral'], ['neutral'], ['neutral'], ['admiration', 'optimism'], ['neutral'], ['caring', 'neutral'], ['neutral'], ['neutral'], ['neutral'], ['neutral'], ['neutral'], ['admiration', 'anger'], ['neutral'], ['neutral'], ['neutral'], ['confusion', 'neutral'], ['neutral'], ['anger', 'neutral'], ['neutral'], ['neutral'], ['neutral'], ['annoyance', 'disappointment', 'neutral'], ['neutral'], ['neutral'], ['neutral'], ['approval', 'neutral'], ['curiosity', 'neutral'], ['amusement'], ['neutral'], ['neutral'], ['anger', 'annoyance'], ['neutral'], ['neutral'], ['anger', 'neutral'], ['neutral'], ['neutral'], ['annoyance', 'neutral'], ['neutral'], ['annoyance'], ['neutral'], ['realization'], ['neutral'], ['anger', 'neutral'], ['neutral'], ['neutral'], ['neutral'], ['annoyance', 'disappointment', 'neutral'], ['neutral'], ['neutral'], ['neutral'], ['approval', 'neutral'], ['neutral']]"
