,Unnamed: 0,artist_title,lyrics,emotions
72,72,d4vd - Romantic Homicide,"59 ContributorsRomantic Homicide Lyrics
I'm scared (Oh-oh-oh)
It feels like you don't care (Ooh-ooh)
Enlighten me, my dear  (Ooh-ooh-ooh)
Why am I still here? Mm (Oh-oh)
I don't mean to be
Complacent with the decisions you made
But why? Mm

In the back of my mind
You died
And I didn't even cry
No, not a single tear
And I'm sick of waiting patiently
For someone that won't even arrive

Ooh-ooh-ooh-ooh-ooh-oh

In the back of my mind
I killed you
And I didn't even regret it
I can't believe I said it
But it's true
I hate youSee ​d4vd LiveGet tickets as low as $54You might also like10Embed","[['fear'], ['joy'], ['approval', 'caring', 'love'], ['confusion', 'curiosity'], ['annoyance'], ['neutral'], ['curiosity', 'neutral'], ['neutral'], ['neutral'], ['neutral'], ['disapproval', 'neutral'], ['annoyance', 'disappointment'], ['neutral'], ['excitement'], ['neutral'], ['anger'], ['remorse'], ['surprise'], ['approval'], ['anger']]"
73,73,Brenda Lee - Rockin' Around The Christmas Tree,"35 ContributorsRockin’ Around the Christmas Tree Lyrics
Rockin' around the Christmas tree
At the Christmas party hop
Mistletoe hung where you can see
Every couple tries to stop
Rockin' around the Christmas tree
Let the Christmas spirit ring
Later, we'll have some pumpkin pie
And we'll do some caroling

You will get a sentimental feeling
When you hear
Voices singing, ""Let's be jolly
Deck the halls with boughs of holly""

Rockin' around the Christmas tree
Have a happy holiday
Everyone's dancin' merrily
In the new old-fashioned way


You will get a sentimental feeling
When you hear
Voices singing, ""Let's be jolly
Deck the halls with boughs of holly""
You might also like
Rockin' around the Christmas tree
Have a happy holiday
Everyone's dancin' merrily
In the new old-fashioned way9Embed","[['neutral'], ['neutral'], ['neutral'], ['neutral'], ['neutral'], ['neutral'], ['neutral'], ['neutral'], ['neutral'], ['neutral'], ['neutral'], ['neutral'], ['neutral'], ['excitement', 'neutral'], ['joy', 'neutral'], ['neutral'], ['neutral'], ['neutral'], ['neutral'], ['neutral'], ['confusion', 'neutral'], ['neutral'], ['excitement', 'neutral'], ['joy', 'neutral'], ['neutral']]"
74,74,Kanye West - Heartless,"215 ContributorsTranslationsSvenskaTürkçeDeutschFrançaisEspañolEnglishPortuguêsDanskHeartless Lyrics
In the night, I hear 'em talk
The coldest story ever told
Somewhere far along this road
He lost his soul to a woman so heartless
How could you be so heartless?
Oh, how could you be so heartless?

How could you be so
Cold as the winter wind when it breeze, yo?
Just remember that you talkin' to me though
You need to watch the way you talkin' to me, yo
I mean, after all the things that we been through
I mean, after all the things we got into
Ayo, I know of some things that you ain't told me
Ayo, I did some things but that's the old me
And now you wanna get me back and you gon' show me
So you walk around like you don't know me
You got a new friend, well, I got homies
But in the end, it's still so lonely

In the night, I hear 'em talk
The coldest story ever told
Somewhere far along this road
He lost his soul to a woman so heartless
How could you be so heartless?
Oh, how could you be so heartless?
You might also like
How could you be so Dr. Evil?
You're bringin' out a side of me that I don't know
I decided we wasn't gon' speak so
Why we up 3 AM on the phone?
Why do she be so mad at me fo'?
Homie, I don't know, she's hot and cold
I won't stop, won't mess my groove up
‘Cause I already know how this thing go
You run and tell your friends that you're leavin' me
They say that they don't see what you see in me
You wait a couple of months, then you gon' see
You'll never find nobody better than me

In the night, I hear 'em talk (Me)
The coldest story ever told
Somewhere far along this road
He lost his soul to a woman so heartless
How could you be so heartless?
Oh, how could you be so heartless?

Talk and talk and talk and talk
Baby, let's just knock it off
They don't know what we been through
They don't know 'bout me and you
So I got somethin' new to see
And you just gon' keep hatin' me
And we just gon' be enemies
I know you can't believe
I could just leave it wrong
And you can't make it right
I'm gon' take off tonight into the night
In the night, I hear 'em talk
The coldest story ever told
Somewhere far along this road
He lost his soul to a woman so heartless
How could you be so heartless? (How, how?)
Oh, how could you be so heartless?

On and on and on and on
And on and, and on and on and on220Embed","[['neutral'], ['neutral'], ['neutral'], ['sadness'], ['anger'], ['anger'], ['neutral'], ['neutral'], ['neutral'], ['neutral'], ['approval', 'neutral'], ['approval', 'realization', 'neutral'], ['neutral'], ['neutral'], ['neutral'], ['annoyance'], ['relief', 'neutral'], ['sadness'], ['neutral'], ['neutral'], ['neutral'], ['sadness'], ['anger'], ['anger'], ['confusion', 'neutral'], ['curiosity', 'neutral'], ['neutral'], ['neutral'], ['curiosity'], ['annoyance', 'curiosity'], ['neutral'], ['anger', 'annoyance'], ['optimism', 'neutral'], ['anger', 'neutral'], ['neutral'], ['neutral'], ['neutral'], ['neutral'], ['neutral'], ['neutral'], ['sadness'], ['anger'], ['anger'], ['neutral'], ['neutral'], ['neutral'], ['neutral'], ['neutral'], ['neutral'], ['neutral'], ['surprise', 'neutral'], ['disapproval', 'neutral'], ['neutral'], ['neutral'], ['neutral'], ['neutral'], ['neutral'], ['sadness'], ['anger', 'curiosity'], ['anger'], ['neutral'], ['neutral']]"
75,75,Meek Mill - Going Bad,"203 ContributorsGoing Bad Lyrics
Yeah
(Wheezy outta here)
Jeez, jeez

Back home, smokin' legal (Legal)
I got more slaps than The Beatles (Beatles)
Foreign shit runnin' on diesel, dawg
Playin' with my name, that shit is lethal, dawg (Who you say you was?)
Don Corleone
Trust me, at the top it isn't lonely (Strapped)
Everybody actin' like they know me, dawg
Don't just say you're down, you gotta show me (What you gotta do?)
Bring the clip back empty (It's empty)
You asked to see the boss, so they sent me, dawg (Sent me, dawg)
I just broke her off with a 10-piece, dawg (10-piece, dawg)
That ain't nothin', I'm just bein' friendly, dawg

It's just a lil' 10-piece for her
Just to blow it in the mall, doesn't mean that we're involved
I just... what? I just... uh, put a Richard on the card
I ain't grow up playin' ball, but I'll show you how the fuck you gotta do it
If you really wanna ball 'til you fall
When your back against the wall
And a bunch of niggas need you to go away
Still goin' bad on 'em anyway
Saw you last night, but did it broad day
You might also like
Yeah, lot of Murakami in the hallway (What?)
Got a sticky and I keep it at my dawg's place
Girl, I left your love at Magic, now it's all shade
Still goin' bad on you anyway

Woah, woah, ooh, woah
Woah, woah, ah

I could fit like 80 racks in my Amiris (80 racks)
Me and Drizzy back-to-back, it's gettin' scary (Back-to-back)
If you fuckin' with my opps, just don't come near me (Get outta my way)
Put some bands all on your head like Jason Terry (Brrt, brrt, ooh)
Richard Mille cost a Lambo (That's a Lambo)
Known to keep the baddest bitches on commando (Salute)
Every time I'm in my trap, I move like Rambo (Extended)
Ain't a neighborhood in Philly that I can't go (That's a Fendi)
For real
She said, ""Oh, you rich rich?"" (""You rich rich"")
Bitch, I graduated, call me ""Big Fish"" (Marlin)
I got Lori Harvey on my wish list (That's Lori)
That's the only thing I want for Christmas (True story, uh)
I've been had my way out here, yeah, know that's facts (Facts)
You ain't livin' that shit you say, yeah, we know that's cap (That's cap)
You ain't got to ask me when you see me, know I'm strapped (Brrt)
DC, OVO, we back again, we goin' plat' (Ooh, ooh)
It's just a lil' 10-piece for her
Just to blow it in the mall, doesn't mean that we're involved
I just... what? I just... uh, put a Richard on the card
I ain't grow up playin' ball, but I'll show you how the fuck you gotta do it
If you really wanna ball 'til you fall
When your back against the wall
And a bunch of niggas need you to go away
Still goin' bad on 'em anyway
Saw you last night, but did it broad day

Wheezy outta here77Embed","[['approval', 'neutral'], ['neutral'], ['neutral'], ['neutral'], ['neutral'], ['neutral'], ['admiration', 'fear'], ['neutral'], ['approval', 'neutral'], ['neutral'], ['neutral'], ['neutral'], ['neutral'], ['sadness', 'neutral'], ['neutral'], ['neutral'], ['disapproval', 'neutral'], ['neutral'], ['anger', 'annoyance'], ['neutral'], ['neutral'], ['annoyance', 'neutral'], ['neutral'], ['neutral'], ['confusion', 'neutral'], ['surprise', 'neutral'], ['neutral'], ['love', 'neutral'], ['disappointment'], ['surprise'], ['surprise'], ['approval', 'neutral'], ['fear'], ['anger'], ['neutral'], ['neutral'], ['neutral'], ['neutral'], ['disapproval', 'neutral'], ['neutral'], ['curiosity', 'neutral'], ['annoyance'], ['desire', 'neutral'], ['desire'], ['approval', 'neutral'], ['neutral'], ['neutral'], ['excitement', 'joy', 'neutral'], ['neutral'], ['disapproval', 'neutral'], ['neutral'], ['anger', 'annoyance'], ['neutral'], ['neutral'], ['annoyance', 'neutral'], ['neutral'], ['neutral'], ['neutral']]"
76,76,Lil Mosey - Blueberry Faygo,"194 ContributorsTranslationsРусскийBlueberry Faygo Lyrics
Damn, Callan (Damn, Callan)

One bad bitch and she do what I say so (Yeah)
Two big 40's and a big-ass Draco (Boom, boom)
Three more millions when you ask how my day go (Yeah)
Poured up a four, now that's blueberry Faygo (Lean)
One false move and we straight to shootin' shit
Two small bands just to take you out real quick (Bands)
Three more hoes, pull up, I'm fucking shit (Yeah)
That's how it go, big bands, I'm thumbin' shit
Ayy, one bad bitch and she do what I say so (Yeah)
Two big 40's and a big-ass Draco (Boom, boom)
Three more millions when you ask how my day go (Yeah)
Poured up a four, now that's blueberry Faygo (Lean)
One false move and we straight to shootin' shit
Two small bands just to take you out real quick (Bands)
Three more hoes, pull up, I'm fucking shit (Yeah)
That's how it go, big bands, I'm thumbin' shit

I'm with my niggas, yeah, we some rockstars
And I'm with my nigga, yeah, KK Wokhardt (KK Wokhardt)
This not my dick, lil' bitch, my Glock hard (Lil' bitch)
Straight to the cash (Cash), I'm a trapstar
Straight to the bag (Bag), I'm that nigga, huh?
Got me some gas, rollin' up some
Pfft, pfft, cash, yeah, I got me some
I ain't fucked since yesterday, I'ma fuck somethin'
You might also like
One bad bitch and she do what I say so (Yeah)
Two big 40's and a big-ass Draco (Boom, boom)
Three more millions when you ask how my day go (Yeah)
Poured up a four, now that's blueberry Faygo (Lean)
One false move and we straight to shootin' shit
Two small bands just to take you out real quick (Bands)
Three more hoes, pull up, I'm fucking shit (Yeah)
That's how it go, big bands, I'm thumbin' shit

Three-oh clip in my nina (Boom, boom)
On my toes, Gucci, Valentino
She on go, your bitch for the team, uh (Lil' bitch)
'Cause you know your bitch want a winner (Winner)
I just went back to my city (To my city)
And you know they all fuckin' with me (Yeah, they is)
But it ain't safe, poles with me (Poles)
I'ma chase bands 'til they end me

One bad bitch and she do what I say so (Yeah)
Two big 40's and a big-ass Draco (Boom, boom)
Three more millions when you ask how my day go (Yeah)
Poured up a four, now that's blueberry Faygo (Lean)
One false move and we straight to shootin' shit
Two small bands just to take you out real quick (Bands)
Three more hoes, pull up, I'm fucking shit (Yeah)
That's how it go, big bands, I'm thumbin' shit
Ayy, one bad bitch and she do what I say so (Yeah)
Two big 40's and a big-ass Draco (Boom, boom)
Three more millions when you ask how my day go (Yeah)
Poured up a four, now that's blueberry Faygo (Lean)
One false move and we straight to shootin' shit
Two small bands just to take you out real quick (Bands)
Three more hoes, pull up, I'm fucking shit (Yeah)
That's how it go, big bands, I'm thumbin' shit126Embed","[['annoyance'], ['anger', 'annoyance'], ['neutral'], ['neutral'], ['neutral'], ['neutral'], ['neutral'], ['anger', 'annoyance'], ['annoyance', 'neutral'], ['anger'], ['neutral'], ['neutral'], ['neutral'], ['neutral'], ['neutral'], ['anger', 'annoyance'], ['annoyance', 'neutral'], ['approval'], ['neutral'], ['annoyance'], ['neutral'], ['curiosity', 'neutral'], ['neutral'], ['neutral'], ['anger'], ['confusion', 'neutral'], ['anger', 'annoyance'], ['neutral'], ['neutral'], ['neutral'], ['neutral'], ['neutral'], ['anger', 'annoyance'], ['annoyance', 'neutral'], ['neutral'], ['neutral'], ['anger', 'neutral'], ['neutral'], ['neutral'], ['anger'], ['disapproval'], ['neutral'], ['anger', 'annoyance'], ['neutral'], ['neutral'], ['neutral'], ['neutral'], ['neutral'], ['anger', 'annoyance'], ['annoyance', 'neutral'], ['anger'], ['neutral'], ['neutral'], ['neutral'], ['neutral'], ['neutral'], ['anger', 'annoyance'], ['neutral']]"
77,77,Khalid - Young Dumb & Broke,"174 ContributorsYoung Dumb & Broke Lyrics
So you're still thinking of me
Just like I know you should
I can not give you everything, you know I wish I could
I'm so high at the moment
I'm so caught up in this
Yeah, we're just young, dumb and broke
But we still got love to give

While we're young dumb
Young, young, dumb and broke
Young, dumb
Young, young, dumb and broke
Young, dumb
Young, young, dumb and broke
Young, dumb, broke high school kids
Yadadadadadadada
Yadadadadadada
Yadadadadadadada
Young, dumb, broke high school kids

We have so much in common
We argue all the time
You always say I'm wrong
I'm pretty sure I'm right
What's fun about commitment?
When we have our life to live
Yeah, we're just young dumb and broke
But we still got love to give
You might also like
While we're young, dumb
Young, young, dumb and broke
Young, dumb
Young, young, dumb and broke
Young, dumb
Young, young, dumb and broke
Young, dumb, broke high school kids
Yadadadadadadada
Yadadadadadada
Yadadadadadadada
Young, dumb, broke high school kids

Jump and we think, ""Leave it all in the game of love, love""
Run into sin, do it all in the name of fun, fun
Woah-oa-oa
I'm so high at the moment
I'm so caught up in this
Yeah, we're just young, dumb and broke
But we still got love to give

While we're young, dumb
Young, young, dumb and broke
Young, dumb
Young, young, dumb and broke
Young, dumb
Young, young, dumb and broke
Young, dumb, broke high school kids
Yadadadadadadada
Yadadadadadada
Yadadadadadadada
Young, dumb, broke high school kids
Yadadadadadadada
Yadadadadadada
Yadadadadadadada
Young dumb broke high school kids103Embed","[['confusion'], ['neutral'], ['desire'], ['neutral'], ['approval', 'realization', 'neutral'], ['disappointment', 'sadness'], ['love'], ['annoyance'], ['disappointment', 'sadness'], ['annoyance'], ['disappointment', 'sadness'], ['annoyance'], ['disappointment', 'sadness'], ['annoyance', 'disappointment'], ['neutral'], ['neutral'], ['neutral'], ['annoyance', 'disappointment'], ['approval', 'neutral'], ['annoyance'], ['neutral'], ['approval'], ['curiosity'], ['neutral'], ['disappointment', 'sadness'], ['love'], ['confusion', 'neutral'], ['annoyance'], ['disappointment', 'sadness'], ['annoyance'], ['disappointment', 'sadness'], ['annoyance'], ['disappointment', 'sadness'], ['annoyance', 'disappointment'], ['neutral'], ['neutral'], ['neutral'], ['annoyance', 'disappointment'], ['love', 'neutral'], ['amusement'], ['surprise'], ['neutral'], ['approval', 'realization', 'neutral'], ['disappointment', 'sadness'], ['love'], ['annoyance'], ['disappointment', 'sadness'], ['annoyance'], ['disappointment', 'sadness'], ['annoyance'], ['disappointment', 'sadness'], ['annoyance', 'disappointment'], ['neutral'], ['neutral'], ['neutral'], ['annoyance', 'disappointment'], ['neutral'], ['neutral'], ['neutral'], ['annoyance']]"
78,78,Drake - Passionfruit,"265 ContributorsTranslationsEspañolDeutschPortuguêsPassionfruit Lyrics
Hold on, hold on, fuck that
Fuck that shit
Hold on, I got to start this motherfuckin' record over again, wait a minute
Fuck that shit
Still on this motherfuckin’ record
I'ma play this motherfucker for y'all
Ayy, y’all get some more drinks goin' on
I'll sound a whole lot better

Listen
Seein' you got ritualistic
Cleansin' my soul of addiction for now
'Cause I'm fallin' apart, yeah
Tension
Between us just like picket fences
You got issues that I won’t mention for now
’Cause we're fallin’ apart

Passionate from miles away
Passive with the things you say
Passin' up on my old ways
I can't blame you, no, no
Passionate from miles away
Passive with the things you say
Passin' up on my old ways
I can’t blame you, no, no
You might also like
Listen
Harder buildin' trust from a distance
I think we should rule out commitment for now
'Cause we're fallin' apart
Leavin'
You're just doing that to get even
Don't pick up the pieces, just leave it for now
They keep fallin' apart

Passionate from miles away
Passive with the things you say
Passin' up on my old ways
I can't blame you, no, no
Passionate from miles away
Passive with the things you say
Passin' up on my old ways
I can't blame you, no, no

Um, trying to think of the right thing to say238Embed","[['caring'], ['anger'], ['anger', 'annoyance'], ['anger'], ['anger', 'annoyance'], ['anger'], ['neutral'], ['approval', 'optimism'], ['neutral'], ['optimism', 'neutral'], ['neutral'], ['neutral'], ['neutral'], ['neutral'], ['annoyance', 'neutral'], ['neutral'], ['admiration', 'neutral'], ['neutral'], ['neutral'], ['disapproval'], ['admiration', 'neutral'], ['neutral'], ['neutral'], ['disapproval'], ['confusion', 'neutral'], ['neutral'], ['neutral'], ['neutral'], ['neutral'], ['neutral'], ['annoyance', 'neutral'], ['neutral'], ['neutral'], ['admiration', 'neutral'], ['neutral'], ['neutral'], ['disapproval'], ['admiration', 'neutral'], ['neutral'], ['neutral'], ['disapproval'], ['neutral']]"
79,79,Ed Sheeran - Shape of You,"352 ContributorsTranslationsTürkçeEspañolPortuguêsΕλληνικάDeutschFrançaisItalianoالعربيةShape of You Lyrics
A club isn't the best place to find a lover
So the bar is where I go (Mm)
Me and my friends at the table doin' shots
Drinkin' fast and then we talk slow (Mm)
And you come over and start up a conversation with just me
And trust me, I'll give it a chance now (Mm)
Take my hand, stop, put Van the Man on the jukebox
And then we start to dance and now I'm singin' like

Girl, you know I want your love
Your love was handmade for somebody like me
Well, come on now, follow my lead
I may be crazy, don't mind me
Say, ""Boy, let's not talk too much""
Grab on my waist and put that body on me
Well, come on now, follow my lead
Come, come on now, follow my lead, mm

I'm in love with the shape of you
We push and pull like a magnet do
Although my heart is fallin' too
I'm in love with your body
And last night, you were in my room
And now my bed sheets smell like you
Every day, discoverin' somethin' brand new
Well, I'm in love with your body
See Ed Sheeran LiveGet tickets as low as $74You might also like
Oh, I, oh, I, oh, I, oh, I
Well, I'm in love with your body
Oh, I, oh, I, oh, I, oh, I
Well, I'm in love with your body
Oh, I, oh, I, oh, I, oh, I
Well, I'm in love with your body
Every day, discoverin' somethin' brand new
I'm in love with the shape of you

One week in, we let the story begin
We're goin' out on our first date (Mm)
You and me are thrifty, so go all-you-can-eat
Fill up your bag and I fill up a plate (Mm)
We talk for hours and hours about the sweet and the sour
And how your family is doin' okay (Mm)
And leave and get in a taxi, and kiss in the back seat
Tell the driver make the radio play and I'm singin' like

Girl, you know I want your love
Your love was handmade for somebody like me
Well, come on now, follow my lead
I may be crazy, don't mind me
Say, ""Boy, let's not talk too much""
Grab on my waist and put that body on me
Well, come on now, follow my lead
Come, come on now, follow my lead, mm
I'm in love with the shape of you
We push and pull like a magnet do
Although my heart is fallin' too
I'm in love with your body
And last night, you were in my room
And now my bed sheets smell like you
Every day, discoverin' somethin' brand new
Well, I'm in love with your body

Oh, I, oh, I, oh, I, oh, I
Well, I'm in love with your body
Oh, I, oh, I, oh, I, oh, I
Well, I'm in love with your body
Oh, I, oh, I, oh, I, oh, I
Well, I'm in love with your body
Every day, discoverin' somethin' brand new
I'm in love with the shape of you

Come on, be my baby, come on
Come on, be my baby, come on
Come on, be my baby, come on
Come on, be my baby, come on
Come on, be my baby, come on
Come on, be my baby, come on
Come on, be my baby, come on
Come on, be my baby, come on
I'm in love with the shape of you
We push and pull like a magnet do
Although my heart is fallin' too
I'm in love with your body
And last night, you were in my room
And now my bed sheets smell like you
Every day, discoverin' somethin' brand new
Well, I'm in love with your body

Come on, be my baby, come on
Come on, be my baby, come on
I'm in love with your body
Come on, be my baby, come on
Come on, be my baby, come on
I'm in love with your body
Come on, be my baby, come on
Come on, be my baby, come on
I'm in love with your body
Every day, discoverin' somethin' brand new
I'm in love with the shape of you409Embed","[['disapproval'], ['neutral'], ['neutral'], ['neutral'], ['neutral'], ['approval'], ['annoyance'], ['excitement', 'neutral'], ['love'], ['love'], ['approval', 'neutral'], ['approval', 'excitement'], ['neutral'], ['caring', 'neutral'], ['approval', 'neutral'], ['approval', 'neutral'], ['love'], ['neutral'], ['sadness', 'neutral'], ['love'], ['neutral'], ['disgust'], ['neutral'], ['love'], ['optimism', 'neutral'], ['neutral'], ['love'], ['neutral'], ['love'], ['neutral'], ['love'], ['neutral'], ['love'], ['neutral'], ['excitement', 'neutral'], ['annoyance'], ['neutral'], ['neutral'], ['curiosity'], ['neutral'], ['neutral'], ['love'], ['love'], ['approval', 'neutral'], ['approval', 'excitement'], ['neutral'], ['caring', 'neutral'], ['approval', 'neutral'], ['approval', 'neutral'], ['love'], ['neutral'], ['sadness', 'neutral'], ['love'], ['neutral'], ['disgust'], ['neutral'], ['love'], ['neutral'], ['love'], ['neutral'], ['love'], ['neutral'], ['love'], ['neutral'], ['love'], ['neutral'], ['neutral'], ['neutral'], ['neutral'], ['neutral'], ['neutral'], ['neutral'], ['neutral'], ['love'], ['neutral'], ['sadness', 'neutral'], ['love'], ['neutral'], ['disgust'], ['neutral'], ['love'], ['neutral'], ['neutral'], ['love'], ['neutral'], ['neutral'], ['love'], ['neutral'], ['neutral'], ['love'], ['neutral'], ['love']]"
80,80,Luke Combs - Beautiful Crazy,"27 ContributorsBeautiful Crazy Lyrics
Her day starts with a coffee and ends with a wine
Takes forever getting ready so she's never on time for anything
When she gets that ""come get me"" look in her eyes
Well, it kinda scares me, the way that she drives me wild
When she drives me wild

Beautiful, crazy, she can't help but amaze me
The way that she dances, ain't afraid to take chances
And wears her heart on her sleeve
Yeah, she's crazy but her crazy's beautiful to me

She makes plans for the weekend, can't wait to go out
Till she changes her mind
Says, ""Let's stay on the couch and watch TV""
And she falls asleep

Beautiful, crazy, she can't help but amaze me
The way that she dances, ain't afraid to take chances
And wears her heart on her sleeve
Yeah, she's crazy but her crazy's beautiful to me

She's unpredictable, unforgettable
It's unusual, unbelievable
How I'm such a fool, yeah, I'm such a fool for her
See Luke Combs LiveGet tickets as low as $46You might also like
Beautiful, crazy, she can't help but amaze me
The way that she dances, ain't afraid to take chances
And wears her heart on her sleeve
Yeah, she's crazy, she's crazy, she's crazy
But her crazy's beautiful to me
Her crazy's beautiful to me22Embed","[['neutral'], ['neutral'], ['neutral'], ['fear'], ['neutral'], ['admiration'], ['neutral'], ['neutral'], ['admiration'], ['excitement', 'neutral'], ['neutral'], ['annoyance', 'neutral'], ['sadness', 'neutral'], ['admiration'], ['neutral'], ['neutral'], ['admiration'], ['admiration', 'fear'], ['surprise'], ['anger'], ['neutral'], ['admiration'], ['neutral'], ['neutral'], ['excitement'], ['admiration'], ['admiration']]"
