,Unnamed: 0,artist_title,lyrics,emotions
A Vampire is generally described as being exceedingly gaunt and lean with a hideous countenance and eyes wherein are glinting the red fire of perdition. When, however, he has satiated his lust for warm human blood his body becomes horribly puffed and bloated, as though he were some great leech gorged and replete to bursting. Cold as ice, or it may be fevered and burning as a hot coal, the skin is deathly pale, but the lips are very full and rich, blub and red; the teeth white and gleaming, and the canine teeth wherewith he bites deep into the neck of his prey to suck thence the vital streams which re-animate his body and invigorate all his forces appear notably sharp and pointed. Often his mouth curls back in a vulpine snarl which bares these fangs, ""a gaping mouth and gleaming teeth,"" says Leone Allacci, and so in many districts the hare-lipped are avoided as being certainly vampires. In Bulgaria, it is thought that the Vampire who returns from the tomb has only one nostril; and in certain districts of Poland he is supposed to have a sharp point at the end of his tongue, like the sting of a bee. It is said that the palms of a Vampire's hands are downy with hair, and the nails are always curved and crooked, often well-nigh the length of a great bird's claw, the quicks dirty and foul with clots and gouts of black blood. His breath is unbearably fetid and rank with corruption, the stench of the charnel. Dr. Henry More in his An Antidote against Atheism, III, ix, tells us that when Johannes Cuntius, an alderman of Pentsch in Silesia and a witch returned as a Vampire he much tormented the Parson of the Parish. One evening, ""when this Theologer was sitting with his wife and Children about him, exercising himself in Musick, according
p. 180
to his usual manner, a most grievous stink arose suddenly, which by degrees spread itself to every corner of the room. Here upon he commends himself and his family to God by Prayer. The smell nevertheless encreased, and became above all measure pestilently noisom, insomuch that he was forced to go up to his chamber. He and his Wife had not been in bed a quarter of an hour, but they find the same stink in the bedchamber; of which, while they are complaining one to another out steps the Spectre from the Wall, and creeping to his bedside, breathes upon him an exceeding cold breath, of so intolerable stinking and malignant a scent, as is beyond all imagination and expression. Here upon the Theologer, good soul, grew very ill, and was fain to keep his bed, his face, belly, and guts swelling as if he had been poysoned; whence he was also troubled with a difficulty of breathing, and with a putrid inflamation of his eyes, so that he could not well use them of a long time after."" In the Malleus Maleficarum, Part II, Qn. 1., Ch. 11, the following is related: ""In the territory of the Black Forest, a witch was being lifted by a gaoler on to the pile of wood prepared for her burning and said: 'I will pay you,' and blew into his face. And he was at once afflicted with a horrible leprosy all over his body and did not survive many days."" Boguet, Discours des Sorciers, gives as his rubric to Chapter XXV, Si les Sorciers tuent de leur souffle & haleine. He tells us: ""Les Sorciers tuent & endommagent de lour souffle & haleine: en quoy Clauda Gaillard dicte la Fribolette nous seruita de tesmoignage; car ayant soufflé contre Clauda Perrier, qu'elle r'encontra en l'Eglise d'Ebouchoux, tout aussi test ceste femme tomba malade, & fut rendue impotente, & en fin mourut apres auoir trainé par l'espace d'vn an en toute pauurieté, & langueur: de mesme aussi comme Marie Perrier luy eut vne fois refusé l'aumosne, elle luy souffla fort rudement contre, de façon quo Marie tomba par terre, & s'estant releuée ause peine elle demeura malade par quelques iours, & iusques à tant que Pierre Perrier son neueu out menacé la Sorciere.""
Sinistrari in his Demoniality (24) says that if we ask how it is possible that the Demon, who has no body, yet can perform actual coitus with man or woman, most authorities answer that the demon assumes or animates the corpse of another human being, male or female, as the case may be, and Delrio
p. 181
(Disquisitiones Magicae, Liber II, Q. xxviii, sec. 1). comments: ""Denique multae falsae resurrectiones gentilium huc sunt referendae; & constat cum sagis ut plurimum induto cadauere diabolum sine incubum, sine succubum, rem habere; unde & in hoc genere hominum, cadauerosus quidam faetor graueolentiae, cernitur.""
Some remoter country districts, indeed, are apt to regard any poor wretch who is sadly deformed as a Vampire, especially if the distortion be altogether unsightly, prominent, or grotesque. It has even been known that a peasant whose face was deeply marked with wine-coloured pigment, owing it was thought to some accident which befell his mother during her late pregnancy, was shunned and suspected of being a malignant vrykolakas. Chorea, they say, is a certain sign of vampirism, and it may be remarked that in Shoa this disorder is regarded as the result of demoniacal possession, or due to the magic spell of an enemy's shadow having fallen upon the sufferer. An epileptic there is also often considered as being in the power of some devil, and unless proper precautions are taken he will assuredly not rest in his grave. The Vampire is endowed with strength and agility more than human, and he can run with excessive speed, outstripping the wind.
It is curious to find that in many countries persons with blue eyes are considered extremely liable to become vampires. This is the case in some parts of Greece, but there does not seem to be preserved any oral tradition to explain the particular belief. It may, of course, have arisen owing to the fact that persons with eyes of this colour would seldom, if over, have been met with, and a stranger with blue eyes would be regarded with wonder and awe. (Thus in Ireland persons with bluish-grey eyes, especially if there be a streak of black on the pupil, which is common, are accounted to have the power of seeing ghosts.) We cannot, I think, connect the Greek idea with the Homeric epithet for the goddess Athene, γλαυκῶπις, which has been rendered ""bright-eyed,"" ""grey-eyed"" or ""blue-eyed,"" an old interpretation that proves utterly erroneous, since there can be no doubt that γλαυκῶπις means ""owl-faced"" (γλαύξ;) and originally Athene was a deity who was literally imagined and represented as having the face of an owl, even if she did not, as is most probable,
p. 182
actually appear in the shape of an owl. Among the Australian aborigines the owl is regarded as a sex totem of women and is most jealously protected by them. We find too, that the owl is a sacred bird among the Indians of North-West America, and in their ritual dances a solemnity revealed to them, as they suppose, by their guardian spirits, wherein they mime ancient story, the masqueraders often personate by dress, voice, and gesture the owl."" The dukwally (i.e., lokoala) and other tamanawas performances are exhibitions intended to represent incidents connected with their mythological legends. . . An Indian, for instance, who has been consulting with his guardian spirit, which is done by going through the washing and fasting process before described, will imagine or think he is called upon to represent the owl. He arranges in his mind the style of dress, the number of performers, the songs and dances or other movements, and, having the plan perfected, announces at a tamanawas meeting that he has had a revelation which he will impart to a select few. These are then taught and drilled in strict secrecy, and when they have perfected themselves, will suddenly make their appearance and perform before the astonished tribe."" The owl gives mystic qualities; for in Northern India it is believed that a man who eats the eyes of an owl will be able to see, even as that bird, in the dark. In Nigeria, the owl is regarded with great awe, and the natives tremble even to pronounce its name on account of the ill omen, preferring to speak of ""the bird that makes one afraid."" It may be remembered that Vampires are credited with being able to see in the dark, and that in many countries peasants dread to utter the word, employing some elaborate and often not very intelligible, periphrasis.
Those whose hair is red, of a certain peculiar shade, are unmistakably vampires. It is significant that in ancient Egypt, as Manetho tells us, human sacrifices were offered at the grave of Osiris, and the victims were red-haired men who were burned, their ashes being scattered far and wide by winnowing-fans. It is held by some authorities that this was done to fertilize the fields and produce a bounteous harvest, red-hair symbolizing the golden wealth of the corn. But these men were called Typhonians, and were representatives not of Osiris but of his evil rival Typhon, whose hair
p. 183
was red. Francesco Redi says: ""Fra gli Egizii era tradizione che Tifone, il genio della distruzione, simile al Arimane Persiano al Satano Ebriaco fosse di pelo rosso, forse per memoria di invasioni di barbari di pelo rosso e presso noi dura tutta via la tradizione, 'Guardati dal pelo rosso nè valse a toglierla la barba rossa del Redentore.'"" Red was the colour of the hair of Judas Iscariot, and of Cain, and an old Latin rhyme of the thirteenth century has:
Monet nos haec fabula rufos euitare
Quos color et fama notat, illis sociare.
The Italians say:
Capelli rossi
O tutto foco, O tutto mosci.
John Wodroephe in The Spared Hours of a Soldier in hie Travels, Dort, 1623, quotes: ""Garde toi bien des hommes rousseaux, des femmes barbues, et des ceux qui sont marqués an visage."" I have not met with the following tradition save orally, but it is believed in Serbia, Bulgaria, and Rumania, that there are certain red-polled vampires who are called ""Children of Judas,"" and that these, the foulest of the foul, kill their victim with one bite or kiss which drains the blood as it were at a single draught. The poisoned flesh of the victim is wounded with the Devil's stigmata, three hideous scars shaped thus, XXX, signifying the thirty pieces of silver, the price of blood.
It is curious to note that the ancient ideas of the physiognomy of amorous persons are not at all unlike the distinctive marks of the vampire. The old belief has thus been summed up by G. Tourdes, ""Aphrodisie,"" Dictionnaire Encyclopédique des Sciences Médicales: ""The erotic temperament has been described as marked by a lean figure, white and well-ranged teeth, a developed hairy system, a characteristic voice, air, and expression, and even a special odour.""
Since the vampire bites his prey with sharp teeth and greedily sucks forth the blood it is not surprising to find that those who are born with teeth in their heads are considered to be already marked down as vampires. Even in countries where the vampire belief was lost this circumstance was considered of the unluckiest, and in Chapman and Shirley's
p. 184
Chabot, Admiral of France, V, 2, Master Advocate exposing the villainies of the Chancellor declares: ""He was born with teeth in his head, by an affidavit of his midwife, to note his devouring, and hath one toe on his left foot crooked, and in the form of an eagle's talon, to foretel his rapacity. What shall I say? branded, marked, and designed in his birth for shame and obloquy, which appeareth further, by a mole under his right ear, with only three witch's hairs in it; strange and ominious predictions of nature!"" According to Allacci those children who were thought likely to become Callicantzari were taken to a fire which had been lighted in the market-square, and here the soles of their feet were held to the flames until the nails were singed and the danger of their attacks averted. The allusion in Chabot to the ""toe on his left foot crooked, and in the form of an eagle's talon"" is particularly interesting in this connexion. It is evident that the old physical characteristics which mark a creature of demoniacal propensities had been remembered as of ill-omen and horror when exactly what they portended and betrayed had been lost in the mists of ancient lore. Moreover it should be noted that persons and animals attack with the hands or the claws, not generally with the feet to scratch and rend. Accordingly the custom in the days even of Allacci was practised but not understood, and it points to some belief reaching back to old Greek mythology, it is probably some. link between the Callicantzaros and the Centaurs as Lawson suggests in well-founded detail.
The vampire is, as we have said, generally believed to embrace his victim who has been thrown into a trance-like sleep, and after greedily kissing the throat suddenly to bite deep into the jugular vein and absorb the warm crimson blood. It has long since been recognized by medico-psychologists that there exists a definite connexion between the fascination of blood and sexual excitation. Owing to custom, to inhibitions and education this emotion generally remains latent, although a certain mental sadism is by no means a mark of degeneracy. Dr. Havelock Ellis says: ""It is probable that the motive of sexual murders is nearly always to shed blood, and not to cause death,"" an extremely significant fact. Since the vampire is generally held to seize the throat it is very striking that Leppmann points out
p. 185
that such murders are almost always produced by wounds in the neck or mutilation of the abdomen, never by wounds of the head.
Paul d'Enjoy defines the kiss as ""a bite and a suction,"" and a high authority says: ""The impulse to bite is also a part of the tactile element which lies at the origin of kissing."" The tactile kiss which doubtless is very primitive has developed into the olfactory and gustatory, extending thence into many elaborations and variants. Under the stress of strong sexual emotion when love is closely knit with pain there is often an overwhelming tendency to bite the partner of the act, and the love-bite is often referred to in Latin literature. Thus Plautus, Pseudolus, I, 1, ll. 62-66, speaks of amorous dalliance:
Nunc nostri amores, mores, consuetudines,
Iocus, ludus, sermo, suauis suauiatio
Compressiones arctae amantum comparum,
Tencris labellis molles morsiunculae,
Papillarum horridularum oppressiunculae.
And Catullus, VIII, 17, 18, writes after a quarrel:
Quem nunc amabis? cuius esse diceris?
Quem basiabis? cui labella mordebis?
In a well-known Ode, Horace Carmin I, xiii, 11, 12:
siue puer furens
impressit memorem dente labris notam.
which Francis Englishes:
I burn, when in excess of wine
He soils those snowy arms of thine,
Or on thy lips the fierce-fond boy
Marks with his teeth the furious joy.
Tibullus, 1, vi, 14, 15, writes:
Tune succos herbasque dedi, queis liuor abiret,
Quem facit impresso mutua dente Uenus.
And again, I, viii, 35-38:
At Uenus inueniet puero succumbere furtim,
Dum tumet, et teneros conserit usque sinus.
Et dare anhelanti pugnantibus humida linguis
Oscula, et in collo figere dente notas.
But fav'ring Venus watchful o'er thy joy,
Shall lay thee secret near th' impassion'd boy; p. 186
His panting bosom shall be prest to thine,
And his dear lips thy breathless lips shall join;
With active tongue he'll dart the humid kiss,
And on thy neck indent his eager bliss.
Ovid, Amores, III, xiv, 34, asks his mistress:
Cur plus, quam somno, turbatos esse capillos;
Collaque conspicui dentis habere notam?
which is rendered by the translator in Dryden's Ovid, ""by many hands"":
Why do your looks and rumpled head-clothes show
'Tis more than usual sleep that made them so?
Why are the kisses which he gave betray'd,
By the impression which his teeth has made?
Many further passages from the older Latin poets might be quoted, and amongst the moderns, Joannes Secundus and Jean Bonnefons have not neglected to celebrate the love-bite in their verses. From the latter it will suffice to cite the elegant Basium IV, Execratur dentes, quibus inter osculandum papillas Dominae laeserat, which commences:
O dens improbe, dire, ter sceleste,
Dens sacerrime, dens inauspicate,
Tun' tantum scelus ausus, ut papillas,
Illas Pancharidis meae papillas,
Quas Uenus ueneratur et Cupido,
Feris morsibus ipse uulnerares?
Of Joannes Secundus the Basium VII in the Basium Liber is very celebrated:
Quis te furor, Neaera,
Mepta quis iubebat,
Sic inuolare nostram
Sic uellicare linguam,
Ferociente morsu?
An, quas tot unus abs te
Pectus per omne gesto
Penetrabileis sagittas,
Parum uidentur? istis.
Ni dentibus proteruis
Exerceas nefandum
Membrum nefas in illud,
Quo saepe solo prime,
Quo saepe solo sere,
Quo per dieisque longas
Nocteisque amarulentas
Laudes tuas canebam?
p. 187
This has been charmingly tuned by Nott:
Ah! what ungovern'd rage, declare,
Neaera, too capricious fair!
What unrevenged, unguarded wrong,
Could urge thee thus to wound my tongue
Perhaps you deem th' afflictive pains
Too trifling, which my heart sustains;
Nor think enough my bosom smarts
With all the sure, destructive darts
Incessant sped from every charm;
That thus your wanton teeth must harm,
Must harm that little tuneful thing,
Which wont so oft thy praise to sing;
What time the morn has streak'd the skies,
Or evening's faded radiance dies;
Through painful days consuming slow
Through ling'ring night of amorous woe.
Dorat, Baiser XI, has daintily paraphrased, Secundus:
Tes dents, ces perles que j'adore,
D'ou s'échappe à mon oeil trompé
Ce sourire développé,
Transfuge des lèvres de flore;
Devroient-elles blesser, dis moi,
Une organe tendre et fidelle,
Qui t'assure ici de ma foi,
Et nomma Thais la plus belle?
The Supplementum Lexicorum Eroticorum Linguae Latinae, Paris, 1911, has: ""Morsiunculae.--Gallice: Suçons."". Much Oriental erotic literature gives attention to this subject. The Indian Kama Sutra of Vatsyayana devotes no less than one chapter to the love-bite, and there are many references to be found in such manual as the Arabic Perfumed Garden of the Sheik Nefzaoui. When it is borne in mind how markedly Slavonic a tradition is the bite of the vampire it becomes extremely significant to know that biting in amorous embraces is very common among the Southern Slavs.
The peasant women of Sicily, especially says Alonzi, in the districts where crimes of blood are prevalent often in their affection for their children kiss them violently, even biting them and sucking their blood until the infant wails in pain. If a child has done wrong they will not only strike it, but also bite it fiercely on the face, ears, or arms, till blood flows. Both men and women often use the threat: ""I will drink
p. 188
your blood."" There is ocular evidence that a man who had knifed another in a quarrel licked the hot blood from the victim's hand.
A very curious case was reported in the London police news of 1894. A man aged thirty, was charged with ill-treating his wife's illegitimate daughter, aged three. The acts had lasted over a period of many months; her lips, eyes, and hands were bitten and covered with bruises from sucking, and often her little pinafore was stained with blood. ""Defendant admitted he had bitten the child because he loved it."" Here we have true vampirish qualities and inclinations.
The Daily Express, 17th April, 1925, gave the following:
""VAMPIRE BRAIN. PLAN TO PRESERVE IT FOR SCIENCE."" Berlin. Thursday, April 16th. The body of Fritz Haarmann, executed yesterday at Hanover for twenty-seven murders, will not be buried until it has been examined at Göttingen University.
""Owing to the exceptional character of the crimes-most of Haarmann's victims were bitten to death--the case aroused tremendous interest among German scientists. It is probable that Haarmann's brain will be removed and preserved by the University authorities.--Central News.""
The case of Fritz Haarmann, who was dubbed the ""Hanover Vampire"" was reported in some detail in The News Of the World, 21st December, 1924, under the heading: ""VAMPIRE'S VICTIMS."" Haarmann was born in Hanover, 26th October, 1879. The father, ""Olle Harmann,"" a locomotive-stoker, was well-known as a rough, cross-grained, choleric man, whom Fritz, his youngest son, both hated and feared. As a youth, Fritz Haarmann was educated at a Church School, and then at a preparatory school for non-commissioned officers at New Breisach. It is significant that he was always dull and stupid, unable to learn; but it appears a good soldier. When released from military service owing to ill-health he returned home, only to be accused in a short while of offences against children. Being considered irresponsible for his actions the Court sent him to an asylum at Hildesheim, whence however he managed to escape and took refuge in Switzerland. Later he returned to Hanover, but the house became unbearable owing to the violent quarrels which were of daily occurrence between him and his father. Accordingly he enlisted and was
p. 189
sent to the crack 10th Jäger Battalion, at Colmar in Alsace. Here he won golden opinions, and when released owing to illness, with a pension his papers were marked ""Recht gut."" When he reached home there were fresh scenes of rancour whilst blows were not infrequently exchanged, and in 1903 he was examined by a medical expert, Dr. Andrae, who considered him morally lacking but yet there were no grounds for sending him to an asylum. Before long he sank to the status of a tramp; a street hawker, at times; a pilferer and a thief. Again and again he was sent to jail, now charged with larceny, now with burglary, now with indecency, now with fraud. In 1918, he was released after a long stretch to find another Germany. He returned to Hanover, and was able to open a small cook shop in the old quarter of the town, where he also hawked meat which was eagerly sought at a time of general hunger and scarcity. He drove yet another trade, that of ""copper's nark,"" an old lag who had turned spy and informer, who gave secret tips to the police as to the whereabouts of men they wanted. ""Detective Haarmann"" he was nicknamed by the women who thronged his shop because he always had plenty of fresh meat in store, and he invariably contrived to undersell the other butchers and victuallers of the quarter.
The centre of Hanover was the Great Railway Station, and Hanover was thronged especially at its centre with a vast ever-moving population, fugitive, wanderers and homeless from all parts of dislocated Germany. Runaway lads from towns in every direction made their way here, looking for work, looking for food, idly tramping without any definite object, without any definite goal, because they had nothing else to do. It can well be imagined that the police, a hopelessly inadequate force, kept as sharp a watch as possible on the Station and its purlieus, and Haarmann used to help them in their surveyance. At midnight, or in the early morning he would walk up and down among the rows of huddled sleeping forms in the third-class waiting halls and suddenly waking up some frightened youngster demand to see his ticket, ask to know whence he had come and where he was going. Some sad story would be sobbed out, and the kindly Haarmann was wont to offer a mattress and a meal in his own place down town.
p. 190
So far as could be traced the first boy he so charitably took to his rooms was a lad of seventeen named Friedel Rothe, who had run away from home. On 29th September, 1918, his mother received a postcard, and it so happened the very same day his father returned from the war. The parents were not going to let their son disappear without a search, and they soon began to hunt for him in real earnest. One of Friedel's pals told them that the missing boy had met a detective who offered him shelter. Other clues were traced and with extraordinary trouble, for the authorities had more pressing matters in hand than tracking truant schoolboys, the family obliged the police to search Cellarstrasse 27, where Haarmann lived. When a sudden entry was made Haarmann was found with another boy in such an unequivocal situation that his friends, the police, were obliged to arrest him there and then, and he received nine months imprisonment for gross indecency under Section 175 of the German Code. Four years later when Haarmann was awaiting trial for twenty-four murders he remarked: ""At the time when the policeman arrested me the head of the boy Friedel Rothe was hidden under a newspaper behind the oven. Later on, I threw it into the canal.""
In September, 1919, Haarmann first met Hans Grans, the handsome lad, who was to stand beside him in the dock. Grans, the type of abnormal and dangerous decadent which is only too common to-day, was one of the foulest parasites of society, pilferer and thief, bully, informer, spy, agent provocateur, murderer, renter, prostitute, and what is lower and fouler than all, blackmailer. The influence of this Ganymede over Haarmann was complete. It was he who instigated many of the murders--Adolf Harmappel a lad of seventeen was killed in November, 1923, because Grans wanted his pair of new trousers; Ernst Spiecker, likewise aged seventeen was killed on 5th January, 1924, because Grans coveted his ""toff shirt""--it was he who arranged the details, who very often trapped the prey.
It may be said that in 1918, Hanover, a town of 450,000 inhabitants was well-known as being markedly homosexual. These were inscribed on the police lists no less than 500 ""Männliche Prostituierten,"" of whom the comeliest and best-dressed, the mannered and well-behaved elegants frequented
p. 191
