,Unnamed: 0,artist_title,lyrics,emotions
46,46,Mizzy Miles - EUROPA,"10 ContributorsEuropa Lyrics

Giro pela Europa, 'tou fazendo show
'Tou a fazer por mim à procura d'um lugar melhor
Vida de marola, 'tou em Amesterdão
Depois quero conhecer a Gucci de Milão
Eu depois do meu show, conto o meu dinheiro no avião
Conto o meu dinheiro no avião
Depois do meu show, conto o meu dinheiro no avião
Vou gastar na Gucci de Milão
Eu giro pela Europa, 'tou fazendo show
'Tou a fazer por mim à procura d'um lugar melhor
Vida de marola, 'tou em Amesterdão
Depois quero conhecer a Gucci de Milão
Eu depois do meu show, conto o meu dinheiro no avião
Conto o meu dinheiro no avião
Depois do meu show, conto o meu dinheiro no avião
Vou gastar na Gucci de Milão

Já me resolvi, paguei minha dívida
No terceiro copo me joguei nessa bebida (Wow-ahn)
Olha no meu pescoço, um pingente (Woi)
Se eu 'tô no clima, você sabe, ele é quente (Yeah)
Dá uns puxo, pega esse guru (Ahn)
Já vivi e sei bem qual é a sensação
De ficar em cima do muro (Yeah)
Tive que aprender a lidar com toda essa solidão
Fé (Fé), Nike no meu pé (Pé)
Faça o que quiser (O que quiser)
Tudo muda, mas nunca me esqueço da minha fé (Ahn, não)
Então entra no carrão (Vroom)
'Tá com medo? Segura minha mão
Fim da sua solidão (Não)
'Tá carente? Conta minhas nota'
Me engole ou morde as costa'
You might also like
Giro pela Europa, 'tou fazendo show
'Tou a fazer por mim à procura d'um lugar melhor
Vida de marola, 'tou em Amesterdão
Depois quero conhecer a Gucci de Milão
Eu depois do meu show, conto o meu dinheiro no avião
Conto o meu dinheiro no avião
Depois do meu show, conto o meu dinheiro no avião
Eu vou gastar na Gucci de Milão

(Wet Bed Gang, Wet Bed Gang)
Broto na wave, ela diz: ""Uau"" (Wow, wow, wow)
Baby quer fumar comigo, embrulha o pica (Embrulha o pica)
Eu disse: ""Baby, eu não fumo, eu sou fogo
E por consequência faço fumo e esse fumo te purifica""
Fumos se multiplicam, ela é de Curitiba (E aí)
E p'a esse pouco sucesso, eu tenho a certeza
Que ela ainda não sabe o mal que eu durmo (Uh)
Eu vivo entro o palco e o túmulo, conto o dinheiro no avião
E certifico-me que as notas não falham, auto-tune
(Ah-ah-ah-ah-ah) Essa correria é toda nosso mérito (Uh)
Então corro mais porque os meus irmãos querem tudo (Uh)
No fim descanso os pés, o Balenciaga é ortopédico
Oh baby, nas costas tenho marcas da cruz
Mas no meu corpo tenho marcas de luxo
Ainda assim o meu nome é a melhor marca que eu uso
(Acordei num sítio longe, baby, eu giro pela Europa)
Giro pela Europa, 'tou fazendo show
'Tou a fazer por mim à procura d'um lugar melhor
Vida de marola, 'tou em Amesterdão
Depois quero conhecer a Gucci de Milão
Eu depois do meu show, conto o meu dinheiro no avião
Eu conto o meu dinheiro no avião
Depois do meu show, conto o meu dinheiro no avião
Eu vou gastar na Gucci de Milão
Giro pela Europa, 'tou fazendo show
'Tou a fazer por mim à procura d'um lugar melhor
Vida de marola, 'tou em Amesterdão
Depois quero conhecer a Gucci de Milão
Eu depois do meu show, conto o meu dinheiro no avião
Conto o meu dinheiro no avião
Depois do meu show, conto o meu dinheiro no avião
Eu vou gastar na Gucci de Milão1Embed","[['neutral'], ['neutral'], ['neutral'], ['neutral'], ['neutral'], ['neutral'], ['neutral'], ['neutral'], ['neutral'], ['neutral'], ['neutral'], ['neutral'], ['neutral'], ['neutral'], ['neutral'], ['neutral'], ['neutral'], ['excitement'], ['neutral'], ['neutral'], ['neutral'], ['neutral'], ['neutral'], ['neutral'], ['neutral'], ['neutral'], ['neutral'], ['neutral'], ['curiosity', 'neutral'], ['neutral'], ['curiosity', 'neutral'], ['neutral'], ['confusion', 'neutral'], ['neutral'], ['neutral'], ['neutral'], ['neutral'], ['neutral'], ['neutral'], ['neutral'], ['neutral'], ['neutral'], ['excitement'], ['neutral'], ['neutral'], ['neutral'], ['neutral'], ['neutral'], ['neutral'], ['neutral'], ['neutral'], ['neutral'], ['neutral'], ['neutral'], ['excitement', 'neutral'], ['neutral'], ['neutral'], ['neutral'], ['neutral'], ['neutral'], ['neutral'], ['neutral'], ['neutral'], ['neutral'], ['neutral'], ['neutral'], ['neutral'], ['neutral'], ['neutral'], ['neutral'], ['neutral'], ['neutral'], ['neutral'], ['neutral']]"
47,47,Calema - Onde Anda,"4 ContributorsOne and One Lyrics
One and one (One and one)
One and one (One and one)
One and one (One and one)
One and one (One and one)

One and one is one I hear
But it breaks my heart to come so near
And find division standing in our way
As London burns I lie awake
And wrestle with this passive state
But a broken heart is useless in these days

When I close my eyes to trouble
Baby, I see you
And now I have the need to double
Everything I do
So I close my eyes and make a wish
Yeah, dream a dream for me
That one and one will someday be free

Oh boy I know
The crucial blow
They deal us every day
I feel it too
But need for you
To chase your blues away
But if my heart
Should come apart
My love should turn inside
I'll understand
You're just a man
I'll still be on your side
You might also like
When I close my eyes to trouble
Baby, I see you (Baby, I see you)
And now I have the need to double
Everything I do (Everything I do)
So I close my eyes and make a wish
Yeah, dream a dream for me
That one and one will someday be free

One and, and one
And one
And one
And one

When I close my eyes to trouble
Baby, I see you (Baby, I see you)
And now I have the need to double
Everything I do (Everything I do)
So I close my eyes and make a wish
Yeah, dream a dream for me
One and one will someday be free

One and one (One and one and)
One and one (One and one and)
One and one and one (One)
One and one (One, one and one)
One and one (One and one and)
One and one (One and one and)
One and one (One and one and)
One and one (One and one, one and one)
One and one (One and one and)
One and one (One and one and)
One and one (One and one and)
One and one (One, one and one)Embed","[['neutral'], ['neutral'], ['neutral'], ['neutral'], ['neutral'], ['sadness'], ['neutral'], ['sadness', 'neutral'], ['neutral'], ['disappointment', 'sadness'], ['neutral'], ['love', 'neutral'], ['neutral'], ['neutral'], ['desire', 'neutral'], ['desire'], ['approval', 'optimism'], ['excitement', 'neutral'], ['neutral'], ['neutral'], ['approval'], ['caring', 'neutral'], ['neutral'], ['neutral'], ['neutral'], ['love'], ['approval'], ['neutral'], ['caring'], ['confusion', 'neutral'], ['neutral'], ['joy', 'love'], ['neutral'], ['neutral'], ['desire', 'neutral'], ['desire'], ['approval', 'optimism'], ['neutral'], ['neutral'], ['neutral'], ['neutral'], ['neutral'], ['joy', 'love'], ['neutral'], ['neutral'], ['desire', 'neutral'], ['desire'], ['approval', 'optimism'], ['neutral'], ['neutral'], ['neutral'], ['neutral'], ['neutral'], ['neutral'], ['neutral'], ['neutral'], ['neutral'], ['neutral'], ['neutral'], ['neutral']]"
48,48,David Guetta - I'm Good (Blue),"65 ContributorsTranslationsPortuguêsEspañolTürkçeDeutschI’m Good (Blue) Lyrics
I'm good, yeah, I'm feelin' alright
Baby, I'ma have the best fuckin' night of my life
And wherever it takes me, I'm down for the ride
Baby, don't you know I'm good, yeah, I'm feelin' alright
'Cause I'm good, yeah, I'm feelin' alright
Baby, I'ma have the best fuckin' night of my life
And wherever it takes me, I'm down for the ride
Baby, don't you know I'm good, yeah, I'm feelin' alright

Don't you know I'm good, yeah, I'm feelin' alright

You know I'm down for whatever tonight
I don't need the finer things in life
No matter where I go, it's a good time, yeah
And I, I don't need to sit in VIP
Middle of the floor, that's where I'll be
Don't got a lot, but that's enough for me, yeah

'Cause I'm good, yeah, I'm feelin' alright
Baby, I'ma have the best fuckin' night of my life
And wherever it takes me, I'm down for the ride
Baby, don't you know I'm good, yeah, I'm feelin' alright
You might also like
I'm good
Good
I'm good
Don't you know I'm good, yeah, I'm feelin' alright

So I just let it go, let it go
Oh, na-na-na-na-na
No, I don't care no more, care no more
Oh, na-na-na-na-na
So come on, let me know, let me know
Put your hands up, na-na-na
No, baby, nothing's gonna stop us tonight

'Cause I'm good, yeah, I'm feelin' alright
Baby, I'ma have the best fuckin' night of my life
And wherever it takes me, I'm down for the ride
Baby, don't you know I'm good, yeah, I'm feelin' alright37Embed","[['approval'], ['anger'], ['approval', 'excitement'], ['approval'], ['approval'], ['anger'], ['approval', 'excitement'], ['approval'], ['approval'], ['neutral'], ['disapproval'], ['admiration', 'approval'], ['disapproval', 'neutral'], ['neutral'], ['neutral'], ['approval'], ['anger'], ['approval', 'excitement'], ['approval'], ['confusion', 'neutral'], ['admiration'], ['admiration'], ['admiration'], ['approval'], ['neutral'], ['neutral'], ['anger'], ['neutral'], ['neutral'], ['neutral'], ['disapproval'], ['approval'], ['anger'], ['approval', 'excitement'], ['neutral']]"
49,49,Kappa Jotta - ROSAS,"3 ContributorsRosas Lyrics

Sempre soube que essa história não tem quem nos roube
Foi o destino que nos abraçou
Tanta força, nem mais nos largou, hm
Que eu sempre soube que a nossa vida mudaria um dia
Se é p'a ser p'a sempre, alguém que o decida
O vento não sopra a favor de quem não sabe p'ra onde ir
Mas p'ra onde eu for, tu vens comigo
É a teu lado que eu caminho
No final vai dar sempre ao mesmo sítio, yeah

Quanto mais eu te quero, baby, eu mais desespero
Se é possível viver com saudade
Talvez não me agrade viver com ela
Quanto mais eu te quero, baby, eu mais desespero

Quem ama, de facto confia
Nossa promessa, nossa jura
Minha deusa, minha musa
Minha doença, minha cura
Tu não és como essas miúdas com quem me envolvi
Mas tanto amor na minha vida pode ser tóxico
Que eu 'tou demasiado habituado a lidar c'o ódio
Então por vezes o silêncio é o nosso código, é o nosso código
No fundo, não era só o rubi que querias
Trabalhei tanto p'a te poder dar o anel
Eu 'tava perto e era longe que me vias
Acabei a 'tar em falta quando o mundo foi cruel
Que apareceste na minha vida e eu 'tava no zig-zag
Desculpa baby, se até hoje em dia ainda não ligo logo
Talvez esteja até agora a tentar não me habituar
Ao teu perfume que até hoje mora no meu lençol
Que eu prefiro entregar as minhas prosas que buquês de rosas
P'a que elas nunca murchem enquanto houver tinta
Amor, hoje eu escrevi uma música nova
Mas ela vai ser muito mais tua do que minha
Portanto, qualquer coisa apita se tu 'tiveres lonely
Que eu hei-de 'tar na minha zona a girar com os homies
Disse muita merda da boca p'a fora, sorry
O me'mo número, 'tou à distância do ""call me"" (Hm-hm)
You might also like
Quanto mais eu te quero, baby, eu mais desespero
Se é possível viver com saudade
Talvez não me agrade viver com ela
Quanto mais eu te quero, baby, eu mais desespero
Se é possível viver com saudade
Talvez não me agrade viver com ela

Viver com ela, viver com ela
Se é possível viver com saudade
Talvez não me agrade viver com elaEmbed","[['neutral'], ['neutral'], ['neutral'], ['neutral'], ['neutral'], ['neutral'], ['neutral'], ['neutral'], ['approval'], ['neutral'], ['neutral'], ['neutral'], ['neutral'], ['neutral'], ['neutral'], ['neutral'], ['neutral'], ['neutral'], ['neutral'], ['neutral'], ['neutral'], ['neutral'], ['neutral'], ['neutral'], ['neutral'], ['neutral'], ['neutral'], ['neutral'], ['neutral'], ['neutral'], ['neutral'], ['joy', 'neutral'], ['neutral'], ['disappointment', 'sadness', 'neutral'], ['neutral'], ['remorse'], ['neutral'], ['confusion', 'neutral'], ['neutral'], ['neutral'], ['neutral'], ['neutral'], ['neutral'], ['neutral'], ['neutral'], ['neutral'], ['neutral']]"
50,50,Matias Damásio - Como Antes,"1 ContributorComo Antes LyricsPega nas tuas coisas e vem morar na minha vida
Tu tens cara de tudo o que eu sonhei
Quero ser feliz contigo, quero ser teu ombro amigo
Tu tens tudo que eu procurei
Mas olha nós, às vezes tropeçamos
E há dias que quase caímos
Olha nós, somos humanos
Sorrimos mas também choramos
Quero que tudo, seja como antes
Nossas mãos no mesmo volante
Em direção à Lua
Em direção à Lua
Olha nós, às vezes tropeçamos
E há dias que quase caímos
Olha nós, somos humanos
Sorrimos mas também choramos
Quero que tudo, seja como antes
Nossas mãos no mesmo volante
Em dirеção à Lua
Em direção à Lua
Quero que tudo, sеja como antes
Nossas mãos no mesmo volante
Em direção à Lua
Em direção à Lua
You might also likeE viva ao nosso amor
E viva ao nosso amor
E viva ao nosso amor
E viva ao nosso amor
Quero que tudo, seja como antes
Nossas mãos no mesmo volante
Em direção à Lua
Em direção à Lua
Em direção à Lua
Em direção à LuaEmbed","[['neutral'], ['neutral'], ['neutral'], ['neutral'], ['neutral'], ['neutral'], ['neutral'], ['neutral'], ['neutral'], ['neutral'], ['neutral'], ['neutral'], ['neutral'], ['neutral'], ['neutral'], ['neutral'], ['neutral'], ['neutral'], ['neutral'], ['neutral'], ['neutral'], ['neutral'], ['neutral'], ['neutral'], ['neutral'], ['neutral'], ['neutral'], ['neutral'], ['neutral'], ['neutral'], ['neutral'], ['neutral'], ['neutral']]"
51,51,Bispo - Planeta,"5 ContributorsPlaneta Lyrics
Contigo 'tou noutro planeta
Quero congelar o tempo, aproveitar o momento
E ficar nesse planeta
Mesmo que não seja p'a sempre
Vamos beijar o presente até deixar esse planeta
Nós dois é oito ou oitenta
Até deixar esse planeta, até deixar esse planeta

(Yeah) Hoje mereces continência pela presença notória
Foi tudo muito intenso, é essa a essência desta história
Talvez tenha sido o preço, esse peso na memória
Minha atitude fez-me preso antes da mesma dar vitória
Hoje nós dois deu match, gosto de ti como és
Mesmo que às vezes a paciência te queira dar pontapés
Nós dois é nota 10, equipa que ganha não mexe
Aqui só se expulsa a cabeça se for p'a fazer bebés

Contigo 'tou noutro planeta
Quero congelar o tempo, aproveitar o momento
E ficar nesse planeta
Mesmo que não seja p'a sempre
Vamos beijar o presente até deixar esse planeta
Nós dois é oito ou oitenta
Até deixar esse planeta, até deixar esse planeta
You might also like
Chega de espaço, respiro no teu compasso
Quero manter contacto, somos constelações
Chega de espaço, quero contar os teus passos
Deixar o teu rasto nas minhas canções
Tira o capacete, dá-me a mão que isto promete
Não sou menos feminista se for do tipo que obedece
Não sou menos realista se acreditar na tua tese
Não sou perfecionista, deixa ver o que acontece
Deixa-me guiar sem querer pensar no amanhã
Eu deixo-te guiar, vou mergulhar nesse programa
Vamos aproveitar, vamos brindar, e amanhã
A única certeza é que estamos na mesma cama

Contigo 'tou noutro planeta
Quero congelar o tempo, aproveitar o momento
E ficar nesse planeta
Mesmo que não seja p'a sempre
Vamos beijar o presente até deixar esse planeta
Nós dois é oito ou oitenta
Até deixar esse planeta, até deixar esse planetaEmbed","[['neutral'], ['neutral'], ['neutral'], ['neutral'], ['neutral'], ['neutral'], ['neutral'], ['approval', 'neutral'], ['neutral'], ['neutral'], ['neutral'], ['neutral'], ['neutral'], ['neutral'], ['neutral'], ['neutral'], ['neutral'], ['neutral'], ['neutral'], ['neutral'], ['neutral'], ['neutral'], ['confusion', 'neutral'], ['neutral'], ['neutral'], ['neutral'], ['neutral'], ['neutral'], ['neutral'], ['neutral'], ['neutral'], ['neutral'], ['neutral'], ['neutral'], ['neutral'], ['neutral'], ['neutral'], ['neutral'], ['neutral'], ['neutral'], ['neutral'], ['neutral']]"
52,52,T-Rex - TA TUDO BEM,"10 ContributorsTÁ TUDO BEM Lyrics

Woah-woah, yeah-yeah
King Rex, eu 'tou noutra town
Eu 'tou noutro espaço tipo noutro space, baby
Yeah

Ela é boa vibe e fera
Queres mais uma bottle? Pega
(Yeah) O que quiseres, mami pede
O que faltava, hoje 'tá na bag
Eu já te disse ""'Tá tudo bem, shawty""
'Tá tudo bem ('Tá tudo bem)
'Tá tudo bem, 'tá tudo bem, yeah-woah
Ela é boa vibe e fera (Boa vibe e fera)
Queres mais uma bottle? Pega (Pega nessa bottle, bae)
Disse que quer chamar o gangue (Chama, chama)
Diz que é só mandar a location
Já te disse ""Tá tudo bem, shawty""
'Tá tudo bem ('Tá tudo bem)
'Tá tudo bem, woah-woah
'Tá tudo bem, woah-woah

(Ela disse) ""Woah, onde 'tás, protege o coração""
""Woah, é onde as coisas preciosas 'tão""
Woah, eu sei que a vida é sempre o mesmo bilo
Então eu 'tou lá à frente com o meu Nike
Eu já te disse, baby, eu não uso Fila, woah
Yeah, coração no peito e na minha tee, bae
Perguntou se eu tenho enemies, quem?
Achas me'mo que eu preciso disso, bae?
Checka o brilho, bae, 'tou mais big, bae
Tchillo everyday tipo b-day no teu b-day
Na brincadeira já gastaste mais do que esses wis, baby, yeah
You might also like
Eles não são fortes, bae
Nós 'tivemos onde o mundo distorce, bae
Essa nuvem no pé não era Air Force, bae
Essa nuvem no pé não era Air Force, bae
Eu escrevi os meus desejos num bloco, bae
Eu percebi, na tua história, os teus esforços, bae
Eu pedi p'a não ires e não foste, bae
As melhores companhias merecem o mundo, e ela—

Ela é boa vibe e fera
Queres mais uma bottle? Pega
(Yeah) O que quiseres, mami pede
O que faltava, hoje 'tá na bag
Eu já te disse ""'Tá tudo bem, shawty""
'Tá tudo bem ('Tá tudo bem)
'Tá tudo bem, 'tá tudo bem, yeah-woah
Ela é boa vibe e fera (Boa vibe e fera)
Queres mais uma bottle? Pega (Pega nessa bottle, bae)
Disse que quer chamar o gangue (Chama, chama)
Diz que é só mandar a location
Já te disse ""Tá tudo bem, shawty""
'Tá tudo bem ('Tá tudo bem)
'Tá tudo bem, woah-woah
'Tá tudo bem, woah-woah
Podem ir, os maus pesamentos podem ir
'Tou-me a ver na city a rollin’
A ver se a Pepsi vira um Rollie, baby
Pensa um pouco, o teu ex era só fogo de fósforo
Ela linda de Channel no ombro
Se ela passa, poesia move-se
B 'tá a ver se a vibe não trava
Porque as memórias voltam à night
Eu lhe disse: ""Deixa p'a trás ou dá ao tempo que o tempo faz""
Gás, é só subir ao nosso speed, bae
Não lhes ligues, bae
Poucos são os que fazem, o muito que dizem
Falar é tão barato que é quase free, baby

O sonho é o transporte bae
Nós 'tivemos onde o mundo distorce, bae
Essa nuvem no pé não era Air Force, bae
Essa nuvem no pé não era Air Force, bae
Hoje eu vi alguns desejos do bloco, bae
Vi-te de firme tipo é fácil ser forte, bae
Eu vi brindes, eu vi estrelas no copo, bae
As melhores companhias têm o teu brilho

Ela é boa vibe e fera
Queres mais uma bottle? Pega
(Yeah) O que quiseres, mami pede
(T-X) O que faltava, hoje 'tá na bag
Eu já te disse ""'Tá tudo bem, shawty""
'Tá tudo bem ('Tá tudo bem)
'Tá tudo bem, 'tá tudo bem, yeah-woah
Ela é boa vibe e fera (Boa vibe e fera)
Queres mais uma bottle? Pega (Pega nessa bottle, bae)
Disse que quer chamar o gangue (Chama, chama)
Diz que é só mandar a location
Já te disse ""Tá tudo bem, shawty""
'Tá tudo bem ('Tá tudo bem)
'Tá tudo bem, woah-woah
'Tá tudo bem, woah-woah
Woah, woah, yeah, yeah
King Rex, eu 'tou noutra town
Eu 'tou noutro espaço, tipo noutro space, babyEmbed","[['surprise'], ['neutral'], ['neutral'], ['approval', 'neutral'], ['neutral'], ['neutral'], ['neutral'], ['neutral'], ['neutral'], ['neutral'], ['neutral'], ['neutral'], ['curiosity', 'neutral'], ['neutral'], ['neutral'], ['neutral'], ['neutral'], ['surprise'], ['surprise'], [], ['surprise'], ['excitement', 'surprise'], ['neutral'], ['neutral'], ['neutral'], ['curiosity'], ['curiosity', 'neutral'], ['neutral'], ['neutral'], ['neutral'], ['confusion', 'neutral'], ['neutral'], ['neutral'], ['neutral'], ['neutral'], ['neutral'], ['neutral'], ['neutral'], ['neutral'], ['neutral'], ['neutral'], ['neutral'], ['neutral'], ['neutral'], ['neutral'], ['neutral'], ['neutral'], ['curiosity', 'neutral'], ['neutral'], ['neutral'], ['neutral'], ['neutral'], ['surprise'], ['surprise'], ['neutral'], ['neutral'], ['neutral'], ['neutral'], ['neutral'], ['neutral'], ['neutral'], ['neutral'], ['neutral'], ['neutral'], ['neutral'], ['neutral'], ['neutral'], ['neutral'], ['neutral'], ['neutral'], ['neutral'], ['neutral'], ['neutral'], ['neutral'], ['neutral'], ['neutral'], ['neutral'], ['neutral'], ['neutral'], ['neutral'], ['neutral'], ['neutral'], ['neutral'], ['curiosity', 'neutral'], ['neutral'], ['neutral'], ['neutral'], ['neutral'], ['surprise'], ['surprise'], ['surprise'], ['neutral'], ['neutral']]"
53,53,GIULIA BE - menina solta,"9 Contributors​menina solta Lyrics

Ah, ah

Ela era lá da Barra, ele de Ipanema
Foram ver um campeonato lá em Saquarema
Achando que ia dar bom mas só deu problema (Só deu problema, huh)
A mina chegou gigante, cheia dos esquema
O moleque apaixonado e ela toda plena
Ele queria um amor e ela só tinha pena (Só tinha pena)

Enquanto ele dormia, mal ele sabia
Que lá no pé da areia, outro chama de sereia
Essa menina solta
Essa menina solta
Enquanto ele dormia, mal ele sabia
Que lá na casa dela, ela sentava e escolhia quem ela queria
Essa menina solta

Vai ter que superar-ar-ar-ar
Vai ter que superar-ar-ar-ar
Essa menina solta
Essa menina solta
Vai ter que superar-ar-ar-ar
Vai ter que superar-ar-ar-ar
Essa menina solta
Essa menina solta
You might also like
Ah, ah

Saquarema tava quente e ela toda fria
Falando que ia pra festa que ela nem ia
Mesmo levando perdido, ele não desistia (Caraca, meu irmão, haha)
Apegado nos momentos que tiveram um dia
Sem noção da situação que ele se metia
Doido, sem entender o game que ela fazia (Vai, menina)

Enquanto ele dormia, mal ele sabia
Que lá no pé da areia, outro chama de sereia
Essa menina solta
Essa menina solta (Essa menina solta)
Enquanto ele dormia, mal ele sabia
Que lá na casa dela, ela sentava e escolhia quem ela queria
Essa menina solta

Vai ter que superar-ar-ar-ar
Vai ter que superar-ar-ar-ar
Essa menina solta
Essa menina solta
Vai ter que superar-ar-ar-ar
Vai ter que superar-ar-ar-ar
Essa menina solta (Essa menina solta)
Essa menina solta (Essa menina solta)
Logo, logo ele que era difícil de se apaixonar
Logo ele vai ter que superar-ar-ar-ar (Logo ele)
Vai ter que superar (Ha-ha)
Vai ter que superar-ar-ar-ar
Vai ter que superar-ar-ar-ar
Essa menina solta
Essa menina solta
Essa menina solta2Embed","[['neutral'], ['neutral'], ['neutral'], ['neutral'], ['neutral'], ['neutral'], ['neutral'], ['neutral'], ['neutral'], ['neutral'], ['neutral'], ['neutral'], ['neutral'], ['neutral'], ['neutral'], ['neutral'], ['neutral'], ['neutral'], ['neutral'], ['neutral'], ['neutral'], ['neutral'], ['confusion', 'neutral'], ['neutral'], ['neutral'], ['neutral'], ['amusement'], ['neutral'], ['neutral'], ['neutral'], ['neutral'], ['neutral'], ['neutral'], ['neutral'], ['neutral'], ['neutral'], ['neutral'], ['neutral'], ['neutral'], ['neutral'], ['neutral'], ['neutral'], ['neutral'], ['neutral'], ['neutral'], ['neutral'], ['neutral'], ['amusement', 'joy', 'neutral'], ['neutral'], ['neutral'], ['neutral'], ['neutral'], ['neutral']]"
