,Unnamed: 0,artist_title,lyrics,emotions
6-6 (6-6)9Embed","[['neutral'], ['neutral'], ['amusement', 'neutral'], ['neutral'], ['neutral'], ['neutral'], ['neutral'], ['neutral'], ['neutral'], ['neutral'], ['neutral'], ['neutral'], ['neutral'], ['neutral'], ['neutral'], ['neutral'], ['neutral'], ['neutral'], ['neutral'], ['neutral'], ['neutral'], ['neutral'], ['neutral'], ['neutral'], ['confusion', 'neutral'], ['neutral'], ['neutral'], ['neutral'], ['neutral'], ['neutral'], ['anger', 'neutral'], ['anger', 'neutral'], ['anger', 'neutral'], ['anger', 'neutral'], ['neutral'], ['neutral'], ['neutral'], ['neutral'], ['neutral'], ['neutral'], ['neutral'], ['neutral'], ['neutral'], ['neutral']]"
58,58,Exile - MiMiMaMaMu,"71 ContributorsTranslationsEnglishMiMiMaMaMu Lyrics

Я трахал суку, ей было сорок
На-хао-о-оу, на-хао-о-оу (Le' go)
Я удалю Доту, чтоб не видеть Snapfire, у-у, у-у
Похуй на те лузы
Эти сиськи летают, во мне Kasta-передоз
Я бледный не поймаю, она смотрит — она даёт
О, fales, violence
Она сосёт как лэм
Она ест, глотает, будто pills
Цифры на счету, как будто СНИЛС
Я побуду с той, пока я geek
Ты не станешь мной, угомонись
Тебя все сливают, бро, ты leak
Ты на дне — это пик, я лечу, Ань, топи
У меня тысяча флоу, и ты слышишь двухсотый
Могу через три года дропать
Ни капли пролитого пота
Я несу хуйню на бите, и в целом мне похуй
Всё равно лучше тебя, лоха
От твоих демок тебе плохо самому
«Ми-ми-ма-мо-му, ми-ми-ма-мо-му, ми-ми-ма-мо-му», —
Слова пацана с Азии, я тоже солидарен с ним
You might also like
Ха, я тоже солидарен с этим
Ха, ха, ха, ха, ха, ха, закончим с этим
Если рядом со мною тёлка, я называю её шестёркой
Не проживёт и дня со мной, если она не будет работать
Не будет работать, она, что не будет работать на меня, на меня
Как же я люблю стримить на Твиче
Делать IRL на Твиче
Дорогие стримы — пох на чек
Сорян, тебе не понять
BUSTER бэк, BUSTER бэк-бэк-бэк-бэк

Бля, ну найди подъезд уже, ёбаный в рот
Надеюсь, вы не расстроились, что я съебался, е

Сука, да, я Fashion-демон (Демон)
Да, я анимешник, детка
Нахуй всю крутую одежду
Буду флексить тачкой в аренду
Я здесь, потому что не смог отказаться
Ваша тима BICKS'ы — вы кринжовая команда
Попадаю в Forbes, но кредит висит на тачке
Ютуберской карьере желаю удачки
Иди на хуй, Слава и команда, и Ростик пошёл на хуй с Дмитрием Ликсом, сосите хуй!
Я, Лёша Кореш, я не поддерживаю
T-T-T-TOZZY​
It's a lean? It's Japanese lean
Key Kelly​3Embed","[['neutral'], ['neutral'], ['neutral'], ['neutral'], ['neutral'], ['neutral'], ['anger', 'neutral'], ['neutral'], ['neutral'], ['neutral'], ['neutral'], ['neutral'], ['neutral'], ['neutral'], ['neutral'], ['neutral'], ['neutral'], ['neutral'], ['neutral'], ['neutral'], ['neutral'], ['neutral'], ['confusion', 'neutral'], ['neutral'], ['neutral'], ['neutral'], ['neutral'], ['neutral'], ['neutral'], ['neutral'], ['neutral'], ['neutral'], ['neutral'], ['neutral'], ['neutral'], ['neutral'], ['neutral'], ['neutral'], ['neutral'], ['neutral'], ['neutral'], ['neutral'], ['neutral'], ['neutral'], ['neutral'], ['neutral'], ['curiosity'], ['neutral']]"
59,59,shadowraze - astral step,"96 ContributorsTranslationsRomanizationEnglish​astral step Lyrics

Void incarnate

Кидаю step, лечу прям вверх
Мой красный сет убил их всех
У них в башке один preset
Я покажу тоннельный свет
Им не найти меня, я скрылся
Я пропавший в dissimilate
Я не оставлю им и следа
Из ниоткуда выйду в late

Разрубаю глефой ноги, я бегу, за спиной Боги, а-а
Как на ринге, только в лобби, ты подох, бля, ха-ха
Я стреляю — это step, бро, you low, пау-пау
Я быстрее этих lame'ов, you slow, братан
Я юзаю эти спеллы — это мой lifesteal
Я сипую эти step'ы — это жёсткий стиль
Долбоёб назвал НН-ом, я его простил
Я убил их, даже не завейстил сил
Погасил этих псин, курю бензин, I'm steal
Показал им старый стиль, добил их всех, а кто спросил?
Astral step поразил долбоёбов и терпил
У меня сотка гулей, посмотри — ты вновь один
You might also like
Вот ты прикинь, челы чё-то там на Дота-рэп гонят, да
А я за один квартал лям рублей получил, бля
Лимон за Дота-рэп, ха-ха-ха-ха

В моих глазах горит квазар
Иду вперёд, ни шагу назад
Кидаю step, бегу на старт
Весь твой профит идёт на спад
Стреляю метко, как солдат
Мой step сияет — это факт
И я step'ую прямо в такт
Им не убить меня, so hard

Кидаю step, лечу прям вверх
Мой красный сет убил их всех
У них в башке один preset
Я покажу тоннельный свет
Им не найти меня, я скрылся
Я пропавший в dissimilate
Я не оставлю им и следа
Из ниоткуда выйду в late

Hunter on ghoul, я убил их всех
Уворот от пуль, у меня есть вес
Нахуй граммовка, у меня есть весы
Я не злодей, но у меня свои бесы
Много валюты, имею и песо
Мало хп, я накину им вессел
Много энергии, я будто Тесла
Стреляю так метко, все пули прям в висок, а
В моих глазах горит квазар
Иду вперёд, ни шагу назад
Кидаю step, бегу на старт
Весь твой профит идёт на спад
Стреляю метко, как солдат
Мой step сияет — это факт
И я step'ую прямо в такт
Им не убить меня, so hard91Embed","[['neutral'], ['neutral'], ['neutral'], ['neutral'], ['neutral'], ['neutral'], ['neutral'], ['neutral'], ['neutral'], ['neutral'], ['neutral'], ['neutral'], ['neutral'], ['neutral'], ['neutral'], ['neutral'], ['neutral'], ['neutral'], ['neutral'], ['neutral'], ['neutral'], ['confusion', 'neutral'], ['neutral'], ['neutral'], ['neutral'], ['neutral'], ['neutral'], ['neutral'], ['neutral'], ['neutral'], ['neutral'], ['neutral'], ['sadness'], ['neutral'], ['neutral'], ['neutral'], ['neutral'], ['neutral'], ['neutral'], ['neutral'], ['neutral'], ['neutral'], ['neutral'], ['neutral'], ['neutral'], ['neutral'], ['neutral'], ['neutral'], ['neutral'], ['neutral'], ['neutral'], ['neutral'], ['neutral'], ['neutral'], ['neutral'], ['neutral'], ['neutral']]"
60,60,Toxi$ - CRANKI,"17 ContributorsCRANKI Lyrics

Ayy, kadie, turn me up
У-у

Все деньги на мне, я подъезжаю на Bugatti (У-у)
(Ayy, ziplocker, how you sausin'?)
Во мне этот gas, если я в клубе, — это party (У-у)
Да, я ношу Guess, но я не обычный парень (У-у)
Я иду наверх и мне похер на твой статус (У-у)

(Е, е, е, cranky, cranky, cranky) Cranky all the way
Пацаны тебя сломают, как будто бы ты дисплей (Пау)
Да, я ношу только дизайнер, на тебе просто eBay
(Ayy, kadie, turn me up)
Хотят, чтоб выступил на сцене — бро, готовьте Apple Pay
Раньше все бабосы лежали, теперь твёркают весь день (Твёрк-твёрк-твёрк)
Помню как мечтал о Solaris, теперь я прыгаю в Benz (Skrrt)
Прыгнул в Benz, как отец, она хотела побыть здесь
Во время сна не считаю овец, я считаю только big stacks
Сделал банни-хоп как CS, я считаю только big racks
В этой игре я большой динозавр, как T-Rex (Ва-а)
В моём капе большие драги, но это не Teen X (Э-э-э)
You might also like
Все деньги на мне, я подъезжаю на Bugatti (У-у)
(Ayy, kadie, turn me up)
Во мне этот gas, если я в клубе, — это party (У-у)
(Ayy, ziplocker, how you sausin'?)
Да, я ношу Guess, но я не обычный парень (У-у)
Я иду наверх и мне похер на твой статус (У-у)
(Ayy, kadie, turn me up)
Все деньги на мне, я подъезжаю на Bugatti (Э-э)
Во мне этот gas, если я в клубе, — это party
Да, я ношу Guess, но я не обычный парень
Я иду наверх и мне похер на твой статус, е-е

Э-эEmbed","[['neutral'], ['neutral'], ['neutral'], ['curiosity', 'neutral'], ['neutral'], ['neutral'], ['neutral'], ['neutral'], ['neutral'], ['neutral'], ['neutral'], ['neutral'], ['neutral'], ['neutral'], ['neutral'], ['neutral'], ['neutral'], ['neutral'], ['neutral'], ['confusion', 'neutral'], ['neutral'], ['neutral'], ['neutral'], ['curiosity', 'neutral'], ['neutral'], ['neutral'], ['neutral'], ['neutral'], ['neutral'], ['neutral'], ['neutral'], ['neutral']]"
61,61,KENTUKKI - Замигает свет,"7 ContributorsЗамигает свет (Light flashing) Lyrics

Фонари светили, будто над луной
Поднимаюсь в падик, там на затяжной
Дверь открыта - дым, толпа передо мной
Погружаюсь в глубину её виной
Во внимании пацаны насобирались
За рассказами, скрывающими боль
Понемногу вечер таял, отражая
Кто здесь мразь, а с кем ты обретешь покой
С глубины - она, взглядами волна
Ты был занят, но покой нарушил облик
С кайфом до темна, она так чиста
Её бедра так манили тебя остро

Замигает свет из окна, как кстати
Папин олимпос на твоей кровати
В миг, замигает свет
Замигает свет, как кстати
Вдох за вдохом, время на часах в прокате
Холод из окна, ты вся в постельном платье
Риск намекает: ""Нет""
Намекает: ""Нет виноватых""
You might also like
Тот яркий цветок
Во тьме туманом поглощенный
Я искал тебя везде
Я нашел тебя во тьме
Забывай меня, но помни в мыслях те слова
Что сказал под утро: ""Нет, нам не будет трудно""
Солнце затмевало
Бил огонь по нашим стеклам
Но мы не стали прятаться, нет
Приведи в порядок сотни мыслей
В пустоте звук внутри
Не станешь хвастаться, нет

То ли ночная паранойя рубила с ног
То ли твой безупречный вид оставлял ожог
Но я же сильный, куда лечу без крыльев?
Однажды покоряя мир - покорил тебя
Когда другие отвернулись, что было зря
Любишь стабильность
Тупые кинофильмы

Замигает свет из окна, как кстати
Папин олимпос на твоей кровати
В миг, замигает свет
Замигает свет, как кстати
Вдох за вдохом, время на часах в прокате
Холод из окна, ты вся в постельном платье
Риск намекает: ""Нет""
Намекает: ""Нет виноватых""2Embed","[['neutral'], ['neutral'], ['neutral'], ['neutral'], ['neutral'], ['neutral'], ['neutral'], ['neutral'], ['neutral'], ['neutral'], ['neutral'], ['neutral'], ['neutral'], ['neutral'], ['neutral'], ['neutral'], ['neutral'], ['neutral'], ['neutral'], ['neutral'], ['confusion', 'neutral'], ['neutral'], ['neutral'], ['neutral'], ['neutral'], ['neutral'], ['neutral'], ['neutral'], ['neutral'], ['neutral'], ['neutral'], ['neutral'], ['neutral'], ['neutral'], ['neutral'], ['neutral'], ['neutral'], ['neutral'], ['neutral'], ['neutral'], ['neutral'], ['neutral'], ['neutral'], ['neutral'], ['neutral'], ['neutral'], ['neutral'], ['neutral']]"
62,62,pyrokinesis - Днями-ночами,"17 ContributorsДнями-ночами (All Day – All Night) Lyrics

Почтим святое, да
Но часики спешат, и то едва
Эй, моя судьба, ты нас сведи случайно
Но ещё хотя бы шаг, хотя бы два — и моё сердце засвистит, как чайник
Рьяно любя, не знать
И казалось, что будет проще, чем прямо так и сказать
Но я в лоб так и не смог, и сердце ударит
Стук — оно лопнет, как кинескоп
Она лапки тянет к луне
Дай ей звёзды — повесила бы замок на них
В зале гасит свет и подглядывает за окнами
Видна разница, ты права
Это правда, что у соседей была зеленей трава
И это правда, мы в круговой поруке
Ведь обратно планету не повернуть
И всё с виду не случайно и, моя судьба
Я растворяю своё сердце тебе в чай

Люби меня днями-ночами
Окутаны тенями печали
Будто бы мы в самом начале
Днями-ночами, днями-ночами
Люби меня днями-ночами
Окутаны тенями печали
Будто бы мы в самом начале
Днями-ночами, днями-ночами
Люби меня днями-ночами
Окутаны тенями печали
Будто бы мы в самом начале
Днями-ночами, днями-ночами
Люби меня днями-ночами
Окутаны тенями печали
Будто бы мы в самом начале
Днями-ночами, днями-ночами
You might also like
До беды по пятам не ходи (Не ходи)
И губы по губам не води (Не води)
Я пою на краю ни мою, ни твою
0:1, ты не та, ты не ты (Ты не ты)
Я другой выжидаю ходы
И другой подбираю коды
Умирают любимые ягоды
Я не гадаю, когда уже ты
Когда ты умрёшь

Люби меня днями-ночами
Окутаны тенями печали
Будто бы мы в самом начале
Днями-ночами, днями-ночами
Люби меня днями-ночами
Окутаны тенями печали
Будто бы мы в самом начале
Днями-ночами, днями-ночами
Люби меня днями-ночами
Окутаны тенями печали
Будто бы мы в самом начале
Днями-ночами, днями-ночами
Люби меня днями-ночами
Окутаны тенями печали
Будто бы мы в самом начале
Днями-ночами, днями-ночами14Embed","[['neutral'], ['neutral'], ['neutral'], ['neutral'], ['neutral'], ['neutral'], ['neutral'], ['neutral'], ['neutral'], ['neutral'], ['neutral'], ['neutral'], ['neutral'], ['neutral'], ['neutral'], ['neutral'], ['neutral'], ['neutral'], ['neutral'], ['neutral'], ['neutral'], ['neutral'], ['neutral'], ['neutral'], ['neutral'], ['neutral'], ['neutral'], ['neutral'], ['neutral'], ['neutral'], ['neutral'], ['neutral'], ['neutral'], ['confusion', 'neutral'], ['neutral'], ['neutral'], ['neutral'], ['neutral'], ['neutral'], ['neutral'], ['neutral'], ['neutral'], ['neutral'], ['neutral'], ['neutral'], ['neutral'], ['neutral'], ['neutral'], ['neutral'], ['neutral'], ['neutral'], ['neutral'], ['neutral'], ['neutral'], ['neutral'], ['neutral'], ['neutral'], ['neutral'], ['neutral']]"
63,63,KRBK - Крепче,"1 ContributorКрепче (Stronger) Lyrics
Baby, you're no good for me
You're no good for me
But, baby, I want you, I want

Сжимаю педаль газа
Вылетаю на встречку
Фары машин слепят
Руки сжимаются крепче
Любовь живет три года
Скоро станет легче
И крикну да все круто
Но похвастаться нечем
Помню хрупкие плечи
Твой каждый милиметр тела изучал бы вечно
Мягкие губы укрывают всю зверскую ярость
Девушка в черном дарившая безумную радость
Уже не радуюсь каждому дню как ребенок
За окном поют птицы, но я привязан к дому
Любовь живет три года
И скоро станет легче
Сердце заживет
Мое сердце станет крепче
Океан любви теперь суша
Люблю смотреть на внешность
Боюсь смотреть на душу
Мир разрушен
Где мой счастливый клевер?
Что не убьет меня, то сделает меня сильнее
Ночные бабочки летали вдоль дороги
Ночь, ноги несут, шнурки завязаны прочно
Я точно сверну и не дойду до подъезда
Среди угрюмых лиц мне становится тесно
Шесть пропущенных
Парни ждут на олимпийской
Закон нам не писан
Хаваем с одной миски
Мы с пацанами семья
Мы с пацанами братья
К черту вашу любовь
Мы на футбольчик катим
Хватит, хватит любви и романтики
Мы верны как собаки
Поэтому мы братики
Фатальны чувства стали
Твой яд бежит по венам
Рисую на асфальте имя кусочком мела
You might also like
You're no good for me
Baby, you're no good for me
You're no good for me
But, baby, I want you, I want
You're no good for me
Baby, you're no good for me
You're no good for me
But, baby, I want you, I wantEmbed","[['disapproval'], ['annoyance', 'disapproval'], ['desire'], ['neutral'], ['neutral'], ['neutral'], ['neutral'], ['neutral'], ['neutral'], ['neutral'], ['neutral'], ['neutral'], ['neutral'], ['neutral'], ['neutral'], ['neutral'], ['neutral'], ['neutral'], ['neutral'], ['neutral'], ['neutral'], ['neutral'], ['neutral'], ['neutral'], ['neutral'], ['neutral'], ['neutral'], ['neutral'], ['neutral'], ['neutral'], ['neutral'], ['neutral'], ['neutral'], ['neutral'], ['neutral'], ['neutral'], ['neutral'], ['neutral'], ['neutral'], ['neutral'], ['neutral'], ['neutral'], ['neutral'], ['neutral'], ['neutral'], ['confusion', 'neutral'], ['annoyance', 'disapproval'], ['disapproval'], ['annoyance', 'disapproval'], ['desire'], ['annoyance', 'disapproval'], ['disapproval'], ['annoyance', 'disapproval'], ['desire', 'neutral']]"
64,64,V - Love Me Again,"5 ContributorsTranslations한국어Englishالعربية日本語DeutschEspañolУкраїнськаFrançaisРусскийPortuguêsفارسیV - Love Me Again (Romanized) Lyrics
Chueokdo uimi eopsi
Naege neon sarajigo
Ijjeumedo I can't
Let you go, let you go
Geu mari dain geoni
Hanmadiman namgigo
Huhoehamyeon
Won't you let me know? Let me know?

Geurae na soljikage
Da malhallae
Neoneun maeil eotteon saram eotteon gose
Myeot beonssigina mwol haneunji neol saenggakae
Lost without you, baby

I wish you would love me again
No, I don't want nobody else
I wish you could love me again, again
I wish you would love mе again
No, I don't want nobody else
I wish you could love mе again, again

Naman jakku ireon geonji
Nae yeope ttan saram gwaenchanni
Yejeoneuro cheoncheonhi
Make it feel better, yeah, make it forever
Gwaenchanta malhaji ma
Said I'm alright, said I'll be ﬁne
I'm sorry, geojinmariya tteonajima
Jeori gajima meolli
You might also like
Geurae na soljikage
Da malhallae
Neoneun maeil eotteon saram eotteon gose
Myeot beonssigina mwol haneunji neol saenggakae
Lost without you, baby

Lost without you, baby
Lost without you, baby

I wish you would love me again
No, I don't want nobody else
I wish you could love me again, again
I wish you would love me again
No, I don't want nobody else
I wish you could love me again, again

I wish you would love me again
No, I don't want nobody else
I wish you could love me again, again7Embed","[['neutral'], ['neutral'], ['disappointment', 'disapproval'], ['neutral'], ['neutral'], ['neutral'], ['neutral'], ['curiosity', 'neutral'], ['neutral'], ['neutral'], ['neutral'], ['neutral'], ['sadness', 'neutral'], ['desire', 'love'], ['disapproval'], ['desire', 'love'], ['desire', 'love'], ['disapproval'], ['desire', 'love'], ['neutral'], ['neutral'], ['neutral'], ['neutral'], ['neutral'], ['neutral'], ['remorse'], ['neutral'], ['confusion', 'neutral'], ['neutral'], ['neutral'], ['neutral'], ['neutral'], ['sadness', 'neutral'], ['sadness', 'neutral'], ['sadness', 'neutral'], ['desire', 'love'], ['disapproval'], ['desire', 'love'], ['desire', 'love'], ['disapproval'], ['desire', 'love'], ['desire', 'love'], ['disapproval'], ['desire', 'love']]"
65,65,Jung Kook - Seven,"3 ContributorsTranslationsEnglishPortuguêsDeutsch日本語Bahasa IndonesiaFrançaisالعربية한국어РусскийУкраїнськаJung Kook - Seven (Clean Ver.) ft. Latto (Traducción al Español) Lyrics

Cargas con todo el peso del mundo en tus hombros
Beso tu cintura y hago que tu mente se calme
Debo ser afortunado por conocerte
Levanto mis manos y trazo tus líneas

Es la forma en la que encajamos tan bien
Es la forma en la que encajamos tan bien (Oh-oh-oh-oh)
Creo que te conocí en otra vida
Así que ven a mí una vez más (Oh-oh-oh-oh)
Me abrazas y me traes a la vida
Y es por eso que noche tras noche
Te amaré como se debe

Lunes, martes, miércoles, jueves, viernes, sábado, domingo (Una semana)
Lunes, martes, miércoles, jueves, viernes, sábado, domingo
Los siete días de la semana
Cada hora, cada minuto, cada segundo
Sabes qué noche tras noche
Te amaré como se debe
Los siete días de la semana
You might also like
Amas cuando me lanzo de lleno
Te ofrezco todo de mí
Te mostraré lo que es la devoción
Más profunda que el mar es
Iré lento lo tomaré con calma
Te dejaré con ese resplandor
Te mostraré lo que es la devoción
Más profunda que el mar es

Es la forma en la que encajamos tan bien
Es la forma en la que encajamos tan bien (Oh-oh-oh-oh)
Creo que te conocí en otra vida
Así que ven a mí una vez más (Oh-oh-oh-oh)
Me abrazas y me traes a la vida
Y es por eso que noche tras noche
Te amaré como se debe

Lunes, martes, miércoles, jueves, viernes, sábado, domingo (Una semana)
Lunes, martes, miércoles, jueves, viernes, sábado, domingo
Los siete días de la semana
Cada hora, cada minuto, cada segundo
Sabes qué noche tras noche
Te amaré como se debe
Los siete días de la semana
Lunes, martes, miércoles, jueves, viernes, sábado, domingo (Una semana)
Lunes, martes, miércoles, jueves, viernes, sábado, domingo
Los siete días de la semana
Cada hora, cada minuto, cada segundo
Sabes qué noche tras noche
Te amaré como se debe
Los siete días de la semana
(Gran Latto)
Tomando firmemente el control, tomando firmemente su alma
Toma tu teléfono y guarda este momento en tu galería (Uh)
Deja su ropa por la entrada
¿Qué estás esperando? Mejor ven y anota tu gol
Él simplemente se lanza
Lo haremos hasta el amanecer, no nos vamos a dormir
Siete días a la semana, siete sabanas diferentes
Siete posiciones diferentes, puedo ser tu fantasía
Abre bien, di: ""Ah""
Ven aquí, cariño, déjame tragar todo tu orgullo
¿Qué es lo que te gusta? Yo te lo puedo cumplir
Llámame y ahí estaré
