,Unnamed: 0,artist_title,lyrics,emotions
24,24,IVE - After LIKE,"22 ContributorsTranslationsУкраїнськаไทย / Phasa ThaiEspañolEnglishRomanization中文EnglishAfter LIKE Lyrics

또 모르지 내 마음이
저 날씨처럼 바뀔지
날 나조차 다 알 수 없으니?
(Na-na-na-na-na-na)
그게 뭐가 중요하니?
지금 네게 완전히
푹 빠졌단 게 중요한 거지
(Na-na-na-na-na-na)

아마 꿈만 같겠지만
분명 꿈이 아니야
달리 설명할 수 없는
이건 사랑일 거야
방금 내가 말한 감정
감히 의심하지 마
그냥 좋다는 게 아냐
What's after like?

You-ou and I-I
It's more than like
L 다음 또 O 다음
난 yeah-yeah, yeah
You-ou and I-I
It's more than like
What's after like?
You might also like
What's after like?

조심해 두 심장에 핀
새파란 이 불꽃이
저 태양보다 뜨거울 테니
(Na-na-na-na-na)
난 저 위로 또 아래로
내 그래프는 폭이 커
Yeah, that's me
(Yeah, that's me)

두 번 세 번 피곤하게
자꾸 질문하지 마
내 장점이 뭔지 알아?
바로 솔직한 거야
방금 내가 말한 감정
감히 의심하지 마 (Ooh-ooh, ooh-ooh)
그냥 좋다는 게 아냐
What's after like?

You-ou and I-I
It's more than like
L 다음 또 O 다음
난 yeah-yeah, yeah (Yeah, yeah)
You-ou and I-I
It's more than like (What's after like?)
What's after like?
What after like? 내 맘에 strike
지금 느낀 짜릿함은 마치 tike
L-O 다음에 I 그 다음에 V-E
여긴 너와 내 space, 아무도 막지 못해
나를 보면 눈 깜빡할
시간 조차도 아까울 걸
드디어 만나 반가워 (What's after like?)
L-O-V-E 사이 놓일 I (What's after like?)

You-ou and I-I
It's more than likе
E 앞 또 V 앞
난 yeah-yeah, yeah
You-ou and I-I
It's morе than like (Like, like)
What's after like?

You-ou and I-I
It's more than like
L 다음 또 O 다음
난 yeah-yeah, yeah
You-ou and I-I
It's more than like (Like, like, like)
What's after like?
What's after like?3Embed","[['neutral'], ['neutral'], ['curiosity', 'neutral'], ['neutral'], ['curiosity'], ['neutral'], ['neutral'], ['neutral'], ['neutral'], ['neutral'], ['neutral'], ['neutral'], ['neutral'], ['neutral'], ['neutral'], ['confusion', 'neutral'], ['neutral'], ['neutral'], ['amusement'], ['approval'], ['neutral'], ['neutral'], ['confusion', 'neutral'], ['confusion', 'neutral'], ['confusion', 'neutral'], ['neutral'], ['neutral'], ['neutral'], ['neutral'], ['neutral'], ['neutral'], ['neutral'], ['neutral'], ['neutral'], ['neutral'], ['curiosity'], ['neutral'], ['neutral'], [], ['neutral'], ['confusion', 'neutral'], ['neutral'], ['neutral'], ['amusement'], ['approval'], ['neutral'], ['neutral'], ['confusion', 'neutral'], ['curiosity'], ['neutral'], ['amusement', 'neutral'], ['neutral'], ['neutral'], ['neutral'], ['curiosity', 'neutral'], ['curiosity', 'neutral'], ['neutral'], ['neutral'], ['neutral'], ['approval'], ['neutral'], ['neutral'], ['confusion', 'neutral'], ['neutral'], ['neutral'], ['amusement'], ['approval'], ['neutral'], ['neutral'], ['confusion', 'neutral'], ['neutral']]"
25,25,LE SSERAFIM - ANTIFRAGILE,"15 ContributorsTranslations한국어Romanization日本語ไทย / Phasa ThaiEspañolPortuguêsFrançaisLE SSERAFIM - ANTIFRAGILE (English Translation) Lyrics
Anti-ti-ti-ti fragile, fragile
Anti-ti-ti-ti-fragile
Anti-ti-ti-ti-fragile, fragile
Antifragile, antifragile

Riding over the trail of thorns
You made me boost up (Ah-ah-ah)
A party packed with lies
They don't even burn
So much talk behind my back
Rivals I never knew I had
They all pray for the day I'm fallin'
Onto their hands, I'ma jump in
Yes, gimme that

Walk like a majestic lion
Eyes glinting with so much desire (Na-na-na)
Pour more gasoline on fire
Fly again, rising through the flames (Na-na-na)
Don't forget my pointe shoes I left behind
What more must be said
Don't underestimate the path I've walked
I go to ride 'til I die, die
You might also like
I'll climb higher
Top of the world I itched for (Ah-ah)
No biggie if I were to fall
I'm antifragile, antifragile (Ah-ah)
Right now, I'm on my way
Toss away your fairy tale (Ah-ah)
Now you know my name
I'm antifragile, antifragile

Anti-ti-ti-ti-fragile, fragile
Anti-ti-ti-ti-fragile
Anti-ti-ti-ti-fragile, fragile
Antifragile, antifragile

Lovey, lovey, lovey
Dovey, dovey, dovey
Defining me however you'd like
I don't know what to say I can't feel it
Fervent attention, welcome
Cute jealousy, go ahead
Stringed puppets, no thanks
With my song I'll build my future
Yes, gimme that
Walk like a majestic lion
Eyes glinting with so much desire (Na-na-na)
Pour more gasoline on fire
Fly again, rising through the flames (Na-na-na)
Don't forget my pointe shoes I left behind
What more must be saidDon't underestimate the path I've walked
I go to ride 'til I die, die

I'll climb higher
Top of the world I itched for (Ah-ah)
No biggie if I were to fall
I'm antifragile, antifragile (Ah-ah)
Right now, I'm on my way
Toss away your fairy tale (Ah-ah)
Now, you know my name
I'm antifragile, antifragile

Anti-ti-ti-ti-fragile, fragile
Anti-ti-ti-ti-fragile
Anti-ti-ti-ti-fragile, fragile
Antifragile, antifragile

We can break it, baby
Rock it, twist it, lock it, baby
All I know is you can't chain me
'Cause I’m gonna break out
Gonna, gonna, break out, out
We can break it, baby
Rock it, twist it, lock it, baby
All I know is you can't chain me
'Cause I'm gonna break out
Gonna, gonna break out, out (Oh-oh-oh-oh)
I'll climb higher
Top of the world I itched for (Ah-ah)
No biggie if I were to fall
I'm antifragile, antifragile (Ah-ah)
Right now I'm on my way
Toss away your fairy tale (Ah-ah)
Now, you know my name
I'm antifragile, antifragile

Anti-ti-ti-ti-fragile, fragile
Anti-ti-ti-ti-fragile
Anti-ti-ti-ti-fragile, fragile
Antifragile, antifragileEmbed","[['neutral'], ['neutral'], ['neutral'], ['neutral'], ['neutral'], ['neutral'], ['neutral'], ['neutral'], ['neutral'], ['realization'], ['neutral'], ['neutral'], ['neutral'], ['admiration', 'neutral'], ['desire', 'neutral'], ['neutral'], ['neutral'], ['neutral'], ['neutral'], ['caring'], ['neutral'], ['confusion', 'neutral'], ['neutral'], ['approval'], ['annoyance', 'neutral'], ['neutral'], ['neutral'], ['neutral'], ['neutral'], ['neutral'], ['neutral'], ['neutral'], ['neutral'], ['neutral'], ['love'], ['neutral'], ['neutral'], ['confusion'], ['gratitude', 'neutral'], ['admiration', 'approval'], ['neutral'], ['optimism'], ['neutral'], ['admiration', 'neutral'], ['desire', 'neutral'], ['neutral'], ['neutral'], ['neutral'], ['disapproval'], ['neutral'], ['neutral'], ['approval'], ['annoyance', 'neutral'], ['neutral'], ['neutral'], ['neutral'], ['neutral'], ['neutral'], ['neutral'], ['neutral'], ['neutral'], ['neutral'], ['caring', 'neutral'], ['neutral'], ['neutral'], ['neutral'], ['neutral'], ['caring', 'neutral'], ['neutral'], ['neutral'], ['neutral'], ['neutral'], ['neutral'], ['approval'], ['annoyance', 'neutral'], ['neutral'], ['neutral'], ['neutral'], ['neutral'], ['neutral'], ['neutral'], ['neutral'], ['neutral'], ['neutral']]"
26,26,V - Love Me Again,"5 ContributorsTranslations한국어Englishالعربية日本語DeutschEspañolУкраїнськаFrançaisРусскийPortuguêsفارسیV - Love Me Again (Romanized) Lyrics
Chueokdo uimi eopsi
Naege neon sarajigo
Ijjeumedo I can't
Let you go, let you go
Geu mari dain geoni
Hanmadiman namgigo
Huhoehamyeon
Won't you let me know? Let me know?

Geurae na soljikage
Da malhallae
Neoneun maeil eotteon saram eotteon gose
Myeot beonssigina mwol haneunji neol saenggakae
Lost without you, baby

I wish you would love me again
No, I don't want nobody else
I wish you could love me again, again
I wish you would love mе again
No, I don't want nobody else
I wish you could love mе again, again

Naman jakku ireon geonji
Nae yeope ttan saram gwaenchanni
Yejeoneuro cheoncheonhi
Make it feel better, yeah, make it forever
Gwaenchanta malhaji ma
Said I'm alright, said I'll be ﬁne
I'm sorry, geojinmariya tteonajima
Jeori gajima meolli
You might also like
Geurae na soljikage
Da malhallae
Neoneun maeil eotteon saram eotteon gose
Myeot beonssigina mwol haneunji neol saenggakae
Lost without you, baby

Lost without you, baby
Lost without you, baby

I wish you would love me again
No, I don't want nobody else
I wish you could love me again, again
I wish you would love me again
No, I don't want nobody else
I wish you could love me again, again

I wish you would love me again
No, I don't want nobody else
I wish you could love me again, again7Embed","[['neutral'], ['neutral'], ['disappointment', 'disapproval'], ['neutral'], ['neutral'], ['neutral'], ['neutral'], ['curiosity', 'neutral'], ['neutral'], ['neutral'], ['neutral'], ['neutral'], ['sadness', 'neutral'], ['desire', 'love'], ['disapproval'], ['desire', 'love'], ['desire', 'love'], ['disapproval'], ['desire', 'love'], ['neutral'], ['neutral'], ['neutral'], ['neutral'], ['neutral'], ['neutral'], ['remorse'], ['neutral'], ['confusion', 'neutral'], ['neutral'], ['neutral'], ['neutral'], ['neutral'], ['sadness', 'neutral'], ['sadness', 'neutral'], ['sadness', 'neutral'], ['desire', 'love'], ['disapproval'], ['desire', 'love'], ['desire', 'love'], ['disapproval'], ['desire', 'love'], ['desire', 'love'], ['disapproval'], ['desire', 'love']]"
27,27,Lim Young Woong - A bientot,"2 ContributorsTranslations한국어Lim  Young Woong - A bientot (Romanized) Lyrics
A bientot (Yeah, yeah)
Yeah
A bientot

I bami jinamyeon gwaenchanajil su isseulkka
Sseurin nae mami hoebokdoel suga isseulkka
Nega tteonan binjariga neomu keunikka
Geu gongheohame kkallyeo gyeou salgo itjana
Gieogeun janinhago huyujeungeun jidokae
Gyeou jameul irwodo kkumjarineun dwisungsunghae
Maeumui baneul doryeonae beorigo nan hue
Neoraneun gamogeseo pullyeonal su isseonne (A bientot)
38do tang ancheoreom pogeunhan
Geunarui ondoneun ajikdo naui gaseume
Gipge ppurinaeryeo ppeodeo miryeoniran nomeun
Gonggicheoreom nae maeumeul deunadeune
Neon billeonija hananimiya
Sel su eomneun maneun noraereul ingtaehago buswobeoryeonne
Neol hyanghae naneun gidohae
Neol hyanghae naneun gidohae

A bientot
A bientot
Insaengeun neomu oerowo
Neoege jeonhwareul geoneyo (Yeah, yeah)
A bientot
A bientot
Insaengeun neomu oerowo
Neoege jeonhwareul geoneyo
Ireom andoejiman
You might also like
Geuttae urin tteugeoun yongamcheoreom saranghaenne
Neoui yeongeun yeori doeeo nae mome inne
Gayeoldoen neoui ongiga ajikdo sikjil anne
Neujeun saebyeok nunmullo gadeuk chan nae begae
Sajine jjikyeo itdeon urideurui songarak
Chueogi doeeo heulleonaerineun geu songarak
Uriui chueokdeuri naneun neomu joatji
(radioeseo sogaedoen sayeondeulcheoreom)
Nan yosae young thug
Pick up the phone, kkochyeoisseo
Neoneun eotteon noraereul deunneunji gunggeumhae
Ajikdo hipabeul deutgo isseo
Hipabeul deutgo itdamyeon eonjenga
I noraedo deureul su isseulkka
Neon naege eumak geu isangui jonjaeyeosseo
Seororeul ihaehaneun beop mollasseotdeon urideul
Seotul ttaemune sangcheoreul jugobatgon haetjana
Hamkke nanun gamjeongdeul neomu daldalhaetgie
Dasi yejeoneuro balgeoreumeul dollyeoboryeo haedo

A bientot
A bientot
Insaengeun neomu oerowo
Neoege jeonhwareul geoneyo (Yeah, yeah)
A bientot
A bientot
Insaengeun neomu oerowo
Neoege jeonhwareul geoneyo
Ireom andoejiman
Insaengi neomu oerowo
Heogonge mareul geoljiman
Geugeon danjoroun rideumi dwae
Geugeon danjoroun rideumi dwae
Maeumi neomu oerowo
Heogonge mareul geoljiman
Geugeon danjoroun rideumi dwae
Geugeon danjoroun rideumi dwae, no
Geugeon danjoroun rideumi
Geugeon danjoroun rideumi doego inne

A bientot
A bientot
Ijeneun neoreul ijeulge
Ijeulge
A bientotEmbed","[['neutral'], ['approval', 'neutral'], ['neutral'], [], ['neutral'], ['neutral'], ['neutral'], ['neutral'], ['amusement', 'neutral'], ['neutral'], ['neutral'], ['neutral'], ['neutral'], ['neutral'], ['neutral'], ['neutral'], ['neutral'], ['neutral'], ['neutral'], ['neutral'], ['neutral'], ['neutral'], ['neutral'], ['neutral'], ['neutral'], ['neutral'], ['neutral'], ['neutral'], ['confusion', 'neutral'], ['neutral'], ['neutral'], ['neutral'], ['neutral'], ['neutral'], ['neutral'], ['neutral'], ['neutral'], ['neutral'], ['neutral'], ['neutral'], ['approval', 'neutral'], ['neutral'], ['neutral'], ['neutral'], ['neutral'], ['neutral'], ['neutral'], ['neutral'], ['neutral'], ['neutral'], ['neutral'], ['neutral'], ['neutral'], ['neutral'], ['neutral'], ['neutral'], ['neutral'], ['neutral'], ['neutral'], ['neutral'], ['neutral'], ['neutral'], ['neutral'], ['neutral'], ['neutral'], ['neutral'], ['neutral'], ['neutral'], ['neutral'], ['neutral'], ['neutral'], ['neutral']]"
28,28,Jimin - Closer Than This,"7 ContributorsTranslations한국어RomanizationPortuguêsEspañolفارسیJimin - Closer Than This (English Translation) Lyrics
Do you also remember?
The moment we first met?
We were so shy and awkward back then
Now that I look back
We've come this far in just a blink of an eye
We walked it together, alongside each other
At times, I fell and shed tears
We comforted each other, with a pat on the back
Gazing at one another with tears in our eyes
Calling out each other's names
Starting on June 13
To the us of thе present, herе and now
Even if you're not here
At the same place, always

Don't have to worry now
Letting go of your hand for a moment
But it's only a small comma in our story
Just call my name out loud
Until the days tinge purple once again

'Cause anytime you want me (I'll be)
Right here where you call me (I'll be)
I could never let you go
Never let you go
Whenever you need me (I'll be)
If you believe me (I'll be)
I'll never let you go
Never let you go
You might also like
Whenever it rains, I'll remember the times I sang in the rain
Whenever it snows, I'll cherish how you smiled for me in the snow
On the spring day, we meet again, I'll tell you everything I couldn't before
My love, my babe, forever by your side
Seven equals one, right, our hearts still beat as one
Close your eyes for just a second, I'll be standing in front of you, oh

Don't have to worry now
Letting go of your hand for a moment
But it's only a small comma in our story
Just call my name out loud
Until the days tinge purple once again

'Cause anytime you want me (I'll be)
Right here where you call me (I'll be)
I could never let you go
Never let you go
Whenever you need me (I'll be)
If you believe me (I'll be)
I'll never let you go
Never let you go

When I knock on your door with our hearts united as one
Open it for me with your bright smile
When the paused time begins to run again
Baby, I'll come back to you
Let's sing it together, this song
For the day, we'll reunite again
I could never let you go (Never let you go)
Never let you go (Never let you go)
Let's sing it even louder, this song
So we can become one again
I will never let you go (I will never let you go; Oh-oh)
Never let you go (Oh)

Let's sing it together, this song (Yeah)
For the day, we'll reunite again (Yeah)
I could never let you go (I could never let you go)
Never let you go (Never let you go)
Let's sing it even louder, this song (Yeah)
So we can become one again (Yeah)
I will never let you go (I will never let you go)
Never let you go (Never let you go)Embed","[['neutral'], ['neutral'], ['embarrasment'], ['neutral'], ['neutral'], ['neutral'], ['sadness'], ['caring', 'joy'], ['sadness'], ['neutral'], ['neutral'], ['neutral'], ['neutral'], ['neutral'], ['approval'], ['neutral'], ['neutral'], ['neutral'], ['neutral'], ['neutral'], ['neutral'], ['caring', 'neutral'], ['neutral'], ['approval', 'caring', 'optimism', 'neutral'], ['neutral'], ['caring', 'neutral'], ['neutral'], ['confusion', 'neutral'], ['love', 'realization', 'neutral'], ['joy', 'love'], ['neutral'], ['love'], ['approval', 'neutral'], ['neutral'], ['approval'], ['neutral'], ['neutral'], ['neutral'], ['neutral'], ['neutral'], ['neutral'], ['caring', 'neutral'], ['neutral'], ['approval', 'caring', 'optimism', 'neutral'], ['neutral'], ['caring', 'neutral'], ['neutral'], ['neutral'], ['neutral'], ['neutral'], ['caring', 'neutral'], ['neutral'], ['neutral'], ['caring', 'neutral'], ['caring', 'neutral'], ['neutral'], ['approval', 'neutral'], ['caring', 'neutral'], ['neutral'], ['approval', 'neutral'], ['neutral'], ['caring', 'neutral'], ['caring', 'neutral'], ['approval', 'neutral'], ['approval'], ['caring', 'neutral'], ['neutral']]"
29,29,BTS - Dynamite,"305 ContributorsTranslationsفارسیالعربيةУкраїнськаTürkçeEspañolРусскийPortuguês日本語한국어हिन्दीDeutschFrançaisDansk中文ShqipDynamite Lyrics
'Cause I, I, I'm in the stars tonight
So watch me bring the fire and set the night alight

Shoes on, get up in the morn'
Cup of milk, let's rock and roll
King Kong, kick the drum
Rolling on like a Rolling Stone
Sing-song when I'm walkin' home
Jump up to the top, LeBron
Ding-dong, call me on my phone
Ice tea and a game of ping pong

This is gettin' heavy, can you hear the bass boom? I'm ready (Woo-hoo)
Life is sweet as honey, yeah, this beat cha-ching like money, huh
Disco overload, I'm into that, I'm good to go
I'm diamond, you know I glow up
Hey, so let's go

'Cause I, I, I'm in the stars tonight
So watch me bring the fire and set the night alight (Hey)
Shinin' through the city with a little funk and soul
So I'ma light it up like dynamite, woah-oh-oh
You might also like
Bring a friend, join the crowd, whoever wanna come along
Word up, talk the talk, just move like we off the wall
Day or night, the sky's alight, so we dance to the break of dawn (Hey)
Ladies and gentlemen, I got the medicine, so you should keep ya eyes on the ball (Huh)

This is gettin' heavy, can you hear the bass boom? I'm ready (Woo-hoo)
Life is sweet as honey, yeah, this beat cha-ching like money, huh
Disco overload, I'm into that, I'm good to go
I'm diamond, you know I glow up
Let's go

'Cause I, I, I'm in the stars tonight
So watch me bring the fire and set the night alight (Hey)
Shinin' through the city with a little funk and soul
So I'ma light it up like dynamite, woah-oh-oh

Dyn-na-na-na, na-na-na-na-na, na-na-na, life is dynamite
Dyn-na-na-na, na-na-na-na-na, na-na-na, life is dynamite
Shinin' through the city with a little funk and soul
So I'ma light it up like dynamite, woah-oh-oh

Dyn-na-na-na, na-na, na-na, ayy
Dyn-na-na-na, na-na, na-na, ayy
Dyn-na-na-na, na-na, na-na, ayy
Light it up like dynamite
Dyn-na-na-na, na-na, na-na, ayy
Dyn-na-na-na, na-na, na-na, ayy
Dyn-na-na-na, na-na, na-na, ayy
Light it up like dynamite
'Cause I, I, I'm in the stars tonight
So watch me bring the fire and set the night alight
Shinin' through the city with a little funk and soul
So I'ma light it up like dynamite
(This is ah) 'Cause I, I, I'm in the stars tonight
So watch me bring the fire and set the night alight (Alight, oh)
Shinin' through the city with a little funk and soul
So I'ma light (Light) it (It) up (Up) like (Like) dynamite (Dynamite), woah-oh-oh

Dyn-na-na-na, na-na-na-na-na, na-na-na, life is dynamite (Life is dynamite)
Dyn-na-na-na, na-na-na-na-na, na-na-na, life is dynamite (Oh)
Shinin' through the city with a little funk and soul
So I'ma light it up like dynamite, woah-oh-oh298Embed","[['neutral'], ['neutral'], ['neutral'], ['approval', 'excitement', 'joy'], ['neutral'], ['neutral'], ['neutral'], ['neutral'], ['neutral'], ['neutral'], ['excitement'], ['approval', 'neutral'], ['excitement', 'joy'], ['neutral'], ['neutral'], ['neutral'], ['neutral'], ['admiration', 'neutral'], ['surprise', 'neutral'], ['confusion', 'neutral'], ['neutral'], ['neutral'], ['neutral'], ['neutral'], ['excitement'], ['approval', 'neutral'], ['excitement', 'joy'], ['neutral'], ['neutral'], ['neutral'], ['neutral'], ['admiration', 'neutral'], ['surprise', 'neutral'], ['neutral'], ['neutral'], ['admiration', 'neutral'], ['surprise', 'neutral'], ['neutral'], ['neutral'], ['neutral'], ['neutral'], ['neutral'], ['neutral'], ['neutral'], ['neutral'], ['neutral'], ['neutral'], ['admiration', 'neutral'], ['neutral'], ['neutral'], ['neutral'], ['admiration', 'neutral'], ['surprise', 'neutral'], ['neutral'], ['neutral'], ['admiration', 'neutral'], ['neutral']]"
30,30,IVE - I AM,"23 ContributorsTranslationsRomanizationEnglish日本語EspañolTagalog / ᜆᜄᜎᜓᜄ᜔Portuguêsไทย / Phasa Thaiहिन्दी中文I AM Lyrics

다른 문을 열어 따라 갈 필요는 없어
넌 너의 길로 난 나의 길로, mm-mm
하루하루마다 색이 달라진 느낌
밝게 빛이 나는 길을 찾아

I'm on my way-ay-ay
넌 그냥 믿으면 돼
I'm on my way-ay-ay
보이는 그대로야

너는 누군가의 dreams come true
제일 좋은 어느 날의 déjà vu
머물고픈 어딘가의 낯선 view
I'll be far away

That's my life is 아름다운 galaxy
Be a writer, 장르로는 fantasy
내일 내게 열리는 건 big, big stage
So that is who I am
You might also like
Look at me, look at me, look at me now
어제랑 또 다른 짜릿한 나
두려운 모든 게 설레이게
I'm in sky high, oh, my God
사소한 건 다 아득해져 와
Uh, look at me now, look at me now
I'm on fire

I'm on my way-ay-ay
넌 그냥 믿으면 돼
I'm on my way-ay-ay
보이는 그대로야

너는 누군가의 dreams come true
제일 좋은 어느 날의 déjà vu
머물고픈 어딘가의 낯선 view
I'll be far away

That's my life is 아름다운 galaxy
Be a writer, 장르로는 fantasy
내일 내게 열리는 건 big, big stage
So that is who I am
어느 깊은 밤
길을 잃어도
차라리 날아올라 그럼 네가 지나가는 대로 길이거든
One, two, three, one, two, three, one, two, three
Fly up

I hope you'd be someone's dreams come true
제일 좋은 어느 날의 déjà vu
머물고픈 어딘가의 낯선 view
I'll be far away

That's my life is 아름다운 galaxy
Be a writer, 장르로는 fantasy
내일 내게 열리는 건 big, big stage
So that is who I amEmbed","[['neutral'], ['neutral'], ['neutral'], ['neutral'], ['neutral'], ['neutral'], ['neutral'], ['neutral'], ['realization', 'neutral'], ['optimism', 'neutral'], ['amusement', 'neutral'], ['neutral'], ['neutral'], ['desire', 'optimism', 'neutral'], ['neutral'], ['neutral'], ['confusion', 'neutral'], ['surprise', 'neutral'], ['neutral'], ['neutral'], ['surprise'], ['neutral'], ['neutral'], ['anger'], ['neutral'], ['neutral'], ['neutral'], ['neutral'], ['realization', 'neutral'], ['optimism', 'neutral'], ['amusement', 'neutral'], ['neutral'], ['neutral'], ['desire', 'optimism', 'neutral'], ['neutral'], ['neutral'], ['neutral'], ['neutral'], ['neutral'], ['neutral'], ['neutral'], ['optimism'], ['optimism', 'neutral'], ['amusement', 'neutral'], ['neutral'], ['neutral'], ['desire', 'optimism', 'neutral'], ['neutral'], ['neutral']]"
31,31,Lim Young Woong - Love Always Run Away,"3 ContributorsTranslationsRomanization사랑은 늘 도망가 (Love Always Run Away) Lyrics

눈물이 난다 이 길을 걸으면
그 사람 손길이 자꾸 생각이 난다
붙잡지 못하고 가슴만 떨었지
내 아름답던 사람아
사랑이란 게 참 쓰린 거더라
잡으려 할수록 더 멀어지더라
이별이란 게 참 쉬운 거더라
내 잊지 못할 사람아

사랑아 왜 도망가
수줍은 아이처럼
행여 놓아버릴까 봐
꼭 움켜쥐지만
그리움이 쫓아 사랑은 늘 도망가
잠시 쉬어가면 좋을 텐데

바람이 분다 옷깃을 세워도
차가운 이별의 눈물이 차올라
잊지 못해서 가슴에 사무친
내 소중했던 사람아
You might also like
사랑아 왜 도망가
수줍은 아이처럼
행여 놓아버릴까 봐
꼭 움켜쥐지만
그리움이 쫓아 사랑은 늘 도망가
잠시 쉬어가면 좋을 텐데

기다림도 애태움도 다 버려야 하는데
무얼 찾아 이 길을 서성일까
무얼 찾아 여기 있나

사랑아 왜 도망가
수줍은 아이처럼
행여 놓아버릴까 봐
꼭 움켜쥐지만
그리움이 쫓아 사랑은 늘 도망가

잠시 쉬어가면 좋을 텐데
잠시 쉬어가면 좋을 텐데Embed","[['neutral'], ['neutral'], ['neutral'], ['neutral'], ['neutral'], ['neutral'], ['neutral'], ['neutral'], ['neutral'], ['neutral'], ['neutral'], ['neutral'], ['neutral'], ['neutral'], ['neutral'], ['neutral'], ['neutral'], ['neutral'], ['confusion', 'neutral'], ['neutral'], ['neutral'], ['neutral'], ['neutral'], ['neutral'], ['neutral'], ['neutral'], ['neutral'], ['neutral'], ['neutral'], ['neutral'], ['neutral'], ['neutral'], ['neutral'], ['neutral'], ['neutral']]"
32,32,Jimin - Interlude : Dive,"3 ContributorsTranslations한국어RomanizationEspañolالعربيةJimin - Interlude : Dive (English Translation) Lyrics
Wow, everyone, I really missed you so much
This is how we meet
Everyone, this is JiminYou might also likeEmbed","[['surprise'], ['neutral'], ['neutral']]"
