,Unnamed: 0,artist_title,lyrics,emotions
0,0,Post Malone - Sunflower - Spider-Man: Into the Spider-Verse,"2 ContributorsPost Malone Essentials Lyrics1. Post Malone- Circles
2. Post Malone- Wow
3. Saweetie- Tap In (feat. Post Malone, DaBaby & Jack Harlow)
4. Post Malone- Goodbyes (feat. Young Thug)
5. Tyla Yaweh- Tommy Lee (feat. SAINt JHN & Post Malone) 
6. Post Malone & Swae Lee- Sunflower (Spider-Man: Into the Spider-Verse)
7. Post Malone- rockstar (feat. 21 Savage)
8. Post Malone- Take What You Want (feat. Ozzy Osbourne & Travis Scott)
9. Post Malone- Better Now
10. Post Malone- Enemies (feat. DaBaby)
11. Post Malone- Congratulations (feat. Quavo)
12. Post Malone- Psycho (feat. Ty Dolla $ign)
13. Post Malone- White Iverson
14. Post Malonе- Saint-Tropez
15. Post Malone- I Fall Apart
16. 21 Savage- all my friеnds
17. Post Malone- Ball For Me (feat. Nicki Minaj)
18. Post Malone- Spoil My Night (feat. Swae Lee)
19. Tiësto & Dzeko- Jackie Chan (feat. Premo & Post Malone)
20. Post Malone- Go Flex
21. French Montana- Writing on the Wall (feat. Post Malone, Cardi B & Rvssian)
22. Post Malone- Rich & SadYou might also likeEmbed","[['neutral'], ['neutral'], ['neutral'], ['neutral'], ['neutral'], ['neutral'], ['neutral'], ['neutral'], ['neutral'], ['admiration'], ['neutral'], ['neutral'], ['neutral'], ['neutral'], ['neutral'], ['neutral'], ['neutral'], ['neutral'], ['neutral'], ['neutral'], ['neutral']]"
1,1,J. Cole - No Role Modelz,"403 ContributorsTranslationsEspañolРусскийEnglishItalianoFrançaisNo Role Modelz Lyrics
First things first: rest in peace, Uncle Phil
For real
You the only father that I ever knew
I get my bitch pregnant, I'ma be a better you
Prophecies that I made way back in the Ville
Fulfilled
Listen, even back when we was broke, my team ill
Martin Luther King woulda been on Dreamville, talk to a nigga

One time for my L.A. sisters
One time for my L.A. ho
Lame niggas can't tell the difference
One time for a nigga who know

Don't save her, she don't wanna be saved
Don't save her, she don't wanna be saved
Don't save her, she don't wanna be saved
Don't save her, she don't wanna be saved

No role models, and I'm here right now
No role models to speak of
Searchin' through my memory, my memory, I couldn't find one
Last night, I was gettin' my feet rubbed by the baddest bitch
Not Trina, but I swear to God, this bitch'll make you call your girl up
And tell her, ""Hey, what's good?
Sorry, I'm never comin' home, I'ma stay for good""
Then hang the phone up and proceed to lay the wood
I came fast like 9-1-1 in White neighborhoods
Ain't got no shame 'bout it
She think I'm spoiled and I'm rich 'cause I can have any bitch
I got defensive and said, ""Nah, I was the same without it""
But then I thought back, back to a better me
Before I was a B-list celebrity
'Fore I started callin' bitches ""bitches"" so heavily
Back when you could get a platinum plaque without no melody, you wadn't sweatin' me
You might also like
One time for my L.A. sisters
One time for my L.A. ho
Lame niggas can't tell the difference
One time for a nigga who know

Don't save her, she don't wanna be saved
Don't save her, she don't wanna be saved
Don't save her, she don't wanna be saved
Don't save her, she don't wanna be saved

I want a real love, dark-skinned Aunt Viv love
That Jada and that Will love
That leave a toothbrush at your crib love
And you ain't gotta wonder whether that's your kid love
Nigga, I don't want no bitch from reality shows
Out-of-touch-with-reality hoes
Out in Hollywood bringin' back five or six hoes
Fuck 'em then we kick 'em to the do', nigga, you know how it go
She deserved that, she a bird, it's a bird trap
You think if I didn't rap she would flirt back?
Takin' off her skirt, let her wear my shirt, 'fore she leave
""I'ma need my shirt back"" (Nigga, you know how it go)
One time for my L.A. sisters
One time for my L.A. ho
Lame niggas can't tell the difference
One time for a nigga who know

Don't save her, she don't wanna be saved
Don't save her, she don't wanna be saved
Don't save her, she don't wanna be saved
Don't save her, she don't wanna be saved
There's an old saying in Tennessee—I know it's in Texas, probably in Tennessee—that says, fool me once... shame on... shame on you
Fool me—can't get fooled again

Fool me one time, shame on you (Ayy)
Fool me twice, can't put the blame on you (Ayy)
Fool me three times, fuck the peace sign
Load the chopper, let it rain on you (Bop, bop, bop)
Fool me one time, shame on you (Ayy)
Fool me twice, can't put the blame on you (Ayy)
Fool me three times, fuck the peace sign
Load the chopper, let it rain on you (Bop, bop, bop)
My only regret was too young for Lisa Bonet
My only regret was too young for Nia Long
Now all I'm left with is hoes from reality shows
Hand her a script, the bitch prolly couldn't read along
My only regret was too young for Sade Adu
My only regret, could never take Aaliyah home
Now all I'm left with is hoes up in Greystone
With the stale face 'cause they know it's they song

She shallow but the pussy deep (She shallow
She shallow)
She shallow but the pussy deep (She shallow), yeah, ayy
(She shallow)
She shallow but the pussy deep (She shallow), haha
(She shallow)
She shallow but the pussy deep (She shallow
She shallow)

Don't save her, she don't wanna be saved
Don't save her, she don't wanna be saved
Don't save her, she don't wanna be saved
Don't save her, she don't wanna be saved
Don't save her, she don't wanna be saved
Don't save her, she don't wanna be saved
Don't save her, she don't wanna be saved
Don't save her, she don't wanna be saved
1.3KEmbed","[['caring', 'neutral'], ['neutral'], ['admiration'], ['anger', 'annoyance', 'caring'], ['realization', 'neutral'], ['neutral'], ['sadness'], ['neutral'], ['joy', 'neutral'], ['neutral'], ['neutral'], ['joy', 'neutral'], ['disapproval', 'neutral'], ['disapproval', 'neutral'], ['disapproval', 'neutral'], ['disapproval', 'neutral'], ['approval', 'neutral'], ['neutral'], ['neutral'], ['disgust'], ['anger', 'disapproval', 'disgust'], ['neutral'], ['remorse', 'neutral'], ['neutral'], ['neutral'], ['neutral'], ['annoyance', 'neutral'], ['neutral'], ['realization'], ['neutral'], ['anger', 'annoyance'], ['neutral'], ['confusion', 'neutral'], ['joy', 'neutral'], ['neutral'], ['neutral'], ['joy', 'neutral'], ['disapproval', 'neutral'], ['disapproval', 'neutral'], ['disapproval', 'neutral'], ['disapproval', 'neutral'], ['desire', 'love'], ['love', 'optimism', 'neutral'], ['love', 'neutral'], ['neutral'], ['annoyance', 'disapproval'], ['neutral'], ['neutral'], ['anger'], ['annoyance'], ['confusion', 'neutral'], ['neutral'], ['desire', 'neutral'], ['joy', 'neutral'], ['neutral'], ['neutral'], ['joy', 'neutral'], ['disapproval', 'neutral'], ['disapproval', 'neutral'], ['disapproval', 'neutral'], ['disapproval', 'neutral'], ['embarrasment'], ['anger', 'annoyance'], ['annoyance', 'embarrasment'], ['annoyance'], ['anger'], ['neutral'], ['annoyance', 'embarrasment'], ['annoyance'], ['anger'], ['neutral'], ['remorse'], ['remorse'], ['neutral'], ['neutral'], ['remorse', 'sadness'], ['remorse'], ['neutral'], ['neutral'], ['neutral'], ['neutral'], ['neutral'], ['neutral'], ['amusement', 'neutral'], ['neutral'], ['neutral'], ['neutral'], ['disapproval', 'neutral'], ['disapproval', 'neutral'], ['disapproval', 'neutral'], ['disapproval', 'neutral'], ['disapproval', 'neutral'], ['disapproval', 'neutral'], ['disapproval', 'neutral'], ['disapproval', 'neutral'], ['neutral']]"
2,2,Juice WRLD - Lucid Dreams,"528 ContributorsTranslationsTürkçeРусскийRomânăPortuguêsItalianoHebrewDeutschFrançaisفارسیNederlandsDanskEspañolLatviešuPolskiČeskyLucid Dreams Lyrics
Enviyon on the mix
No, no, no, no
No-no, no, no, no
No, no, no, no, no
No, no, no, no

I still see your shadows in my room
Can't take back the love that I gave you
It's to the point where I love and I hate you
And I cannot change you, so I must replace you, oh
Easier said than done, I thought you were the one
Listenin' to my heart instead of my head
You found another one, but I am the better one
I won't let you forget me
I still see your shadows in my room
Can't take back the love that I gave you
It's to the point where I love and I hate you
And I cannot change you, so I must replace you, oh
Easier said than done, I thought you were the one
Listenin' to my heart instead of my head
You found another one, but I am the better one
I won't let you forget me

You left me falling and landing inside my grave
I know that you want me dead
I take prescriptions to make me feel a-okay
I know it's all in my head
I have these lucid dreams where I can't move a thing
Thinking of you in my bed
You were my everything
Thoughts of a wedding ring
Now I'm just better off dead (Uh, uh, uh)
I'll do it over again
I didn't want it to end
I watch it blow in the wind
I should've listened to my friends
Leave this shit in the past, but I want it to last
You were made outta plastic, fake
I was tangled up in your drastic ways
Who knew evil girls had the prettiest face?
You gave me a heart that was full of mistakes
I gave you my heart and you made heartbreak
You might also like
You made my heart break
You made my heart ache (I still see your shadows in my room)
You made my heart break
You made my heart ache (Can't take back the love that I gave you)
You made my heart break (Were made outta plastic, fake)
You made my heart ache (I still see your shadows in my room)
You made my heart break again (I was tangled up in your drastic ways)
(Who knew evil girls had the prettiest face?)

I still see your shadows in my room
Can't take back the love that I gave you
It's to the point where I love and I hate you
And I cannot change you, so I must replace you, oh
Easier said than done, I thought you were the one
Listenin' to my heart instead of my head
You found another one, but I am the better one
I won't let you forget me
I still see your shadows in my room
Can't take back the love that I gave you
It's to the point where I love and I hate you
And I cannot change you, so I must replace you, oh
Easier said than done, I thought you were the one
Listenin' to my heart instead of my head
You found another one, but I am the better one
I won't let you forget me
Leave this shit in the past, but I want it to last
You were made outta plastic, fake
I was tangled up in your drastic ways
Who knew evil girls had the prettiest face?
Easier said than done, I thought you were—
—instead of my head
You found another— better one
I won't let you forget me523Embed","[['neutral'], ['disapproval'], ['disapproval'], ['disapproval'], ['disapproval'], ['neutral'], ['love'], ['anger', 'love'], ['neutral'], ['realization', 'neutral'], ['neutral'], ['admiration', 'neutral'], ['neutral'], ['neutral'], ['love'], ['anger', 'love'], ['neutral'], ['realization', 'neutral'], ['neutral'], ['admiration', 'neutral'], ['neutral'], ['sadness'], ['neutral'], ['approval', 'neutral'], ['neutral'], ['fear', 'neutral'], ['neutral'], ['neutral'], ['neutral'], ['sadness', 'neutral'], ['neutral'], ['disappointment'], ['neutral'], ['realization'], ['annoyance', 'neutral'], ['neutral'], ['neutral'], ['admiration', 'curiosity'], ['annoyance'], ['love', 'sadness'], ['confusion', 'neutral'], ['sadness'], ['sadness'], ['sadness'], ['love', 'sadness'], ['disappointment', 'sadness'], ['sadness'], ['disappointment'], ['admiration', 'curiosity', 'surprise'], ['neutral'], ['love'], ['anger', 'love'], ['neutral'], ['realization', 'neutral'], ['neutral'], ['admiration', 'neutral'], ['neutral'], ['neutral'], ['love'], ['anger', 'love'], ['neutral'], ['realization', 'neutral'], ['neutral'], ['admiration', 'neutral'], ['neutral'], ['annoyance', 'neutral'], ['neutral'], ['neutral'], ['admiration', 'curiosity'], ['confusion', 'neutral'], ['neutral'], ['neutral'], ['neutral']]"
3,3,Lil Uzi Vert - XO TOUR Llif3,"560 ContributorsTranslationsРусскийPortuguêsItalianoLatviešuXO Tour Llif3 Lyrics
Are you alright?
I'm alright, I'm quite alright
And my money's right
8… (Yeah)
Countin' them bands
All way to the top 'til they be fallin' over
(Yeah, yeah, yeah)
Countin' them bands
On my way to the top 'til we fallin' over

I don't really care if you cry
On the real, you should've never lied
Should've saw the way she looked me in my eyes
She said, ""Baby, I am not afraid to die""
Push me to the edge
All my friends are dead
Push me to the edge
All my friends are dead
Push me to the edge
All my friends are dead
Push me to the edge

Phantom that's all red, inside all white
Like somethin' you ride a sled down, I just want that head
My Brittany got mad, I'm barely her man now
Everybody got the same swag now
Watch the way that I tear it down
Stackin' my bands all the way to the top
All the way 'til my bands fallin' over
Every time that you leave your spot
Your girlfriend call me like, ""Come on over!""
I like the way that she treat me
Gon' leave you, won't leave me, I call it that Casanova
She say I'm insane, yeah
Wanna blow my brain out (Hey)
Xanny, help the pain, yeah
Please, Xanny, make it go away
I'm committed, not addicted, but it keep control of me
All the pain, now I can't feel it
I swear that it's slowin' me, yeah
See Lil Uzi Vert LiveGet tickets as low as $34You might also like
I don't really care if you cry
On the real, you should've never lied
Saw the way she looked me in my eyes
She said, ""I am not afraid to die"" (Yeah)
All my friends are dead
Push me to the edge (Yeah)
All my friends are dead, yeah, ooh
Push me to the edge
All my friends are dead, yeah
All my friends are dead, yeah

That is not your swag, I swear you fake hard
Now these niggas wanna take my cadence (Yeah)
Rain on 'em, thunderstorm, rain on 'em (Ooh, yeah)
Make some, lil' nigga, take some (Yeah, yeah)
Fast car, NASCAR, race on 'em
In the club, ain't got no ones, then we would become (Yeah)
Clothes from overseas, got the racks and they all C-Notes
You is not a G though
Lookin' at you stackin' all your money, it all green though
I was countin' that and these all twenties, that's a G-roll

She say, ""You're the worst, you're the worst""
I cannot die because this my universe
I don't really care if you cry
On the real, you should've never lied
Should've saw the way she looked me in my eyes
She said, ""Baby, I am not afraid to die""
Push me to the edge
All my friends are dead
Push me to the edge
All my friends are dead
Push me to the edge
All my friends are dead
Push me to the edge809Embed","[['caring'], ['caring', 'relief'], ['approval'], ['neutral'], ['neutral'], ['neutral'], ['approval'], ['neutral'], ['neutral'], [], ['realization', 'neutral'], ['neutral'], ['sadness', 'neutral'], ['neutral'], ['sadness', 'neutral'], ['neutral'], ['sadness', 'neutral'], ['neutral'], ['sadness', 'neutral'], ['neutral'], ['neutral'], ['desire'], ['anger'], ['neutral'], ['neutral'], ['neutral'], ['neutral'], ['neutral'], ['neutral'], ['love'], ['neutral'], ['neutral'], ['neutral'], ['caring', 'neutral'], ['neutral'], ['approval'], ['sadness'], ['neutral'], ['neutral'], [], ['realization', 'neutral'], ['neutral'], ['neutral'], ['sadness', 'neutral'], ['neutral'], ['grief', 'sadness'], ['neutral'], ['sadness', 'neutral'], ['sadness', 'neutral'], ['disapproval'], ['approval', 'excitement', 'neutral'], ['neutral'], ['neutral'], ['neutral'], ['neutral'], ['neutral'], ['neutral'], ['neutral'], ['neutral'], ['disgust'], ['annoyance', 'neutral'], [], ['realization', 'neutral'], ['neutral'], ['sadness', 'neutral'], ['neutral'], ['sadness', 'neutral'], ['neutral'], ['sadness', 'neutral'], ['neutral'], ['sadness', 'neutral'], ['neutral']]"
4,4,Post Malone - rockstar,"478 ContributorsTranslationsEspañolPolskiFrançaisفارسیNederlandsČeskyTürkçeDeutschAzərbaycanca / آذربايجانPortuguêsРусский​​rockstar Lyrics
Hahahahaha
Tank God
Ayy, ayy

I've been fuckin' hoes and poppin' pillies
Man, I feel just like a rockstar (Star, ayy, ayy)
All my brothers got that gas
And they always be smokin' like a Rasta ('Sta)
Fuckin' with me, call up on a Uzi
And show up, man, them the shottas ('Tas)
When my homies pull up on your block
They make that thing go grra-ta-ta-ta (Ta, pow, pow, pow, ayy, ayy)

Switch my whip, came back in black
I'm startin' sayin', ""Rest in peace to Bon Scott"" (Scott, ayy)
Close that door, we blowin' smoke
She ask me light a fire like I'm Morrison ('Son, ayy)
Act a fool on stage
Prolly leave my fuckin' show in a cop car (Car, ayy)
Shit was legendary
Threw a TV out the window of the Montage
Cocaine on the table, liquor pourin', don't give a damn
Dude, your girlfriend is a groupie, she just tryna get in
Sayin', ""I'm with the band"" (Ayy, ayy)
Now she actin' outta pocket, tryna grab up on my pants
Hundred bitches in my trailer say they ain't got a man
And they all brought a friend (Yeah, ayy, ayy, ayy)
See Post Malone LiveGet tickets as low as $149You might also like
I've been fuckin' hoes and poppin' pillies
Man, I feel just like a rockstar (Star, ayy, ayy)
All my brothers got that gas
And they always be smokin' like a Rasta ('Sta)
Fuckin' with me, call up on a Uzi
And show up, man, them the shottas ('Tas)
When my homies pull up on your block
They make that thing go grra-ta-ta-ta (Ta, pow, pow, pow)

I've been in the Hills fuckin' superstars
Feelin' like a popstar (21, 21, 21)
Drankin' Henny, bad bitches jumpin' in the pool
And they ain't got on no bra (Bra)
Hit her from the back, pullin' on her tracks
And now she screamin' out, ""¡No más!"" (Yeah, yeah, yeah)
They like, ""Savage, why you got a 12 car garage
And you only got six cars?"" (21)
I ain't with the cakin', how you kiss that? (Kiss that?)
Your wifey say I'm lookin' like a whole snack (Big snack)
Green hundreds in my safe, I got old racks (Old racks)
L.A. bitches always askin', ""Where the coke at?"" (21, 21)
Livin' like a rockstar, smash out on a cop car
Sweeter than a Pop-Tart, you know you are not hard
I done made the hot chart, 'member I used to trap hard
Livin' like a rockstar, I'm livin' like a rockstar (Ayy)
I've been fuckin' hoes and poppin' pillies
Man, I feel just like a rockstar (Star, ayy, ayy)
All my brothers got that gas
And they always be smokin' like a Rasta ('Sta, yeah, yeah, yeah, yeah)
Fuckin' with me, call up on a Uzi
And show up, man, them the shottas ('Tas)
When my homies pull up on your block
They make that thing go grra-ta-ta-ta (Ta, grra-ta-ta-ta-ta)

Star, star, rockstar, rockstar, star
Rockstar
Rockstar, feel just like a–
Rockstar
Rockstar
Rockstar
Feel just like a…773Embed","[['amusement'], ['neutral'], ['neutral'], ['anger'], ['admiration', 'neutral'], ['neutral'], ['neutral'], ['anger'], ['neutral'], ['neutral'], ['neutral'], ['neutral'], ['neutral'], ['neutral'], ['neutral'], ['annoyance', 'neutral'], ['anger'], ['admiration', 'neutral'], ['neutral'], ['neutral'], ['neutral'], ['joy', 'neutral'], ['neutral'], ['neutral'], ['neutral'], ['approval', 'neutral'], ['anger'], ['admiration', 'neutral'], ['neutral'], ['neutral'], ['anger'], ['neutral'], ['neutral'], ['neutral'], ['anger'], ['neutral'], ['annoyance', 'neutral'], ['neutral'], ['neutral'], ['neutral'], ['neutral'], ['curiosity'], ['curiosity', 'neutral'], ['neutral'], ['neutral'], ['neutral'], ['anger', 'neutral'], ['admiration'], ['neutral'], ['joy', 'neutral'], ['anger'], ['admiration', 'neutral'], ['neutral'], ['neutral'], ['anger'], ['neutral'], ['neutral'], ['neutral'], ['neutral'], ['neutral'], ['approval', 'neutral'], ['neutral'], ['neutral'], ['neutral'], ['neutral']]"
5,5,Travis Scott - goosebumps,"484 ContributorsTranslationsEspañolItalianoPortuguêsРусскийTürkçe​goosebumps Lyrics
Yeah
7:30 in the night, yeah
Ooh, ooh

I get those goosebumps every time, yeah, you come around, yeah
You ease my mind, you make everything feel fine
Worried 'bout those comments
I'm way too numb, yeah, it's way too dumb, yeah
I get those goosebumps every time, I need the Heimlich
Throw that to the side, yeah
I get those goosebumps every time, yeah
When you're not around (Straight up)
When you throw that to the side, yeah (It's lit)
I get those goosebumps every time, yeah

7-1-3
Through the 2-8-1, yeah, I'm ridin', why they on me?
Why they on me? I'm flyin', sippin' low-key
I'm sippin' low-key in Onyx, rider, rider
When I'm pullin' up right beside ya
Pop star, lil' Mariah
When I text a cute game, wildness
Throw a stack on the Bible
Never Snapchat or took molly
She fall through plenty, her and all her ginnies, yeah
We at the top floor, right there off Doheny, yeah
Oh no, I can't fuck with y'all
Yeah, when I'm with my squad, I cannot do no wrong
Yeah, saucin' in the city, don't get misinformed
Yeah, they gon' pull up on you (Brr, brr, brr)
Yeah, we gon' do some things, some things you can't relate
Yeah, 'cause we from a place, a place you cannot stay
Oh, you can't go, oh, I don't know
Oh, back the fuck up off me (Brr, brr, brr)
See Travis Scott LiveGet tickets as low as $86You might also like
I get those goosebumps every time, yeah, you come around, yeah
You ease my mind, you make everything feel fine
Worried 'bout those comments
I'm way too numb, yeah, it's way too dumb, yeah
I get those goosebumps every time, I need the Heimlich
Throw that to the side, yeah
I get those goosebumps every time, yeah
When you're not around
When you throw that to the side, yeah
I get those goosebumps every time

Uh, I want to press my like, yeah, I wanna press my
I want a green light, I wanna be like
I wanna press my line, yeah
I wanna take that ride, yeah
I'm gonna press my line
I want a green light, I wanna be like, I wanna press my—
Mama dearest, spare your feelings
I'm relivin' moments, peelin' more residual
I can buy the buildin', burn the buildin'
Take your bitch, rebuild the buildin' just to fuck some more
I can justify my love for ya
And touch the sky for God to stop debating war
Put the pussy on a pedestal (Ayy)
Put the pussy on a high horse
That pussy to die for
That pussy to die for
Peter Piper picked a pepper
So I could pick your brain and put your heart together
We depart the shady parts and party hard
The diamonds yours, the coupe forever
My best shot just might shoot forever like (Brr)
I get those goosebumps every time, yeah, you come around, yeah
You ease my mind, you make everything feel fine
Worried 'bout those comments
I'm way too numb, yeah, it's way too dumb, yeah
I get those goosebumps every time, I need the Heimlich
Throw that to the side, yeah
I get those goosebumps every time, yeah
When you're not around
When you throw that to the side, yeah
I get those goosebumps every time605Embed","[['approval', 'neutral'], ['neutral'], ['excitement'], ['excitement'], ['approval'], ['nervousness'], ['annoyance'], ['desire', 'excitement', 'joy'], ['anger', 'neutral'], ['excitement'], ['neutral'], ['neutral'], ['excitement'], ['neutral'], ['curiosity'], ['neutral'], ['neutral'], ['neutral'], ['neutral'], ['neutral'], ['neutral'], ['neutral'], ['neutral'], ['neutral'], ['anger'], ['approval'], ['neutral'], ['neutral'], ['approval'], ['neutral'], ['surprise'], ['anger'], ['optimism', 'neutral'], ['excitement'], ['approval'], ['nervousness'], ['annoyance'], ['desire', 'excitement', 'joy'], ['anger', 'neutral'], ['excitement'], ['neutral'], ['neutral'], ['excitement'], ['neutral'], ['desire'], ['approval', 'desire', 'neutral'], ['approval', 'desire'], ['neutral'], ['desire'], ['caring', 'love'], ['neutral'], ['approval', 'neutral'], ['anger'], ['love', 'neutral'], ['neutral'], ['neutral'], ['neutral'], ['annoyance', 'neutral'], ['annoyance', 'neutral'], ['neutral'], ['neutral'], ['neutral'], ['neutral'], ['admiration', 'approval', 'optimism', 'neutral'], ['excitement'], ['approval'], ['nervousness'], ['annoyance'], ['desire', 'excitement', 'joy'], ['anger', 'neutral'], ['excitement'], ['neutral'], ['neutral'], ['excitement', 'joy']]"
