,Unnamed: 0,artist_title,lyrics,emotions
30,30,Rauw Alejandro - Todo De Ti,"21 ContributorsTranslationsDeutschEnglishTodo De Ti Lyrics

One, two
One, two, three, four
Dice, Ra-Rauw

El viento soba tu cabello
Uh-uh-uh-uh-uh
Me matan esos ojos bellos
Uh-uh-uh-uh-uh
Me gusta tu olor, de tu piel el color
Y cómo me haces sentir
Me gusta tu boquita, ese labial rosita
Y cómo me besas a mí (Yeh)

Contigo quiero despertar
Hacerlo después de fumar (Ey)
Ya no tengo na' que buscar
Algo fuera de aquí
Tú combinas con el mar
Ese bikini se ve fenomenal
No hay gravedad que me pueda elevar
Me pones mal a mí (¡Yah!)
See Rauw Alejandro LiveGet tickets as low as $149You might also like
Aceleras to’ mis latidos
Y e' que me gusta todo de ti
De toa' tus parte’, ¿cuál decido?
Y e' que me gusta todo de ti

Ah, ah-ah, ah-ah, ah-ah
Y e' que me gusta todo de ti
Ah, ah-ah, ah-ah, ah-ah
Y e' que me gusta todo de ti

Quinta Avenida, no va pa'l mall
Ella sabe que le llego a solo un call
En la Raptor me gusta ponerla en four
El jogger large, la camisa small
Como la dieta keto
Por ti, me controlo y me quedo quieto
Aunque quiero comerte to' eso completo
De ese culo me volví un teco, eh
Mi-Mi-Micro dosi', rola, oxi
Besando eso' labio’ glossy
Ya yo le di en to’a la' posi
Champú de coco, Chanel su wallet
Me vuelve loco desde el casco hasta lo’ pedale'
Contigo quiero despertar (Oh-oh)
Hacerlo después de fumar
Ya no tengo na' que buscar
Algo fuera de aquí
Tú combinas con el mar (Eh)
Ese bikini se ve fenomenal (Eh-eh)
No hay gravedad que me pueda elevar
Me pones mal a mí (¡Yah!)

Aceleras to' mis latidos
Y e’ que me gusta todo de ti
De toa' tus parte', ¿cuál decido?
Y e' que me gusta todo de ti

Ah, ah-ah (Todo de ti), ah-ah (Todo de ti), ah-ah
Y e' que me gusta todo de ti
Ah, ah-ah (Todo de ti), ah-ah (Todo de ti), ah-ah
Y e' que me gusta todo de ti

(Contigo quiero despertar
Hacerlo después de fumar
Ya no tengo na' que buscar
Algo fuera de aquí)
Ra-Rauw
(Tú combinas con el mar)
Ey
(Ese bikini se ve fenomenal)
Naisgai, Colla
(No hay gravedad que me pueda elevar
Me pones mal a mí)
Dice
Rauw Alejandro
(Algo fuera de aquí)
Uh-uh, uh-uh
(Me pones mal a mí)15Embed","[['neutral'], ['neutral'], ['neutral'], ['neutral'], ['neutral'], ['neutral'], ['neutral'], ['neutral'], ['neutral'], ['neutral'], ['neutral'], ['neutral'], ['neutral'], ['neutral'], ['neutral'], ['neutral'], ['neutral'], ['neutral'], ['excitement'], ['optimism', 'neutral'], ['neutral'], ['neutral'], ['curiosity'], ['neutral'], ['neutral'], ['neutral'], ['neutral'], ['neutral'], ['neutral'], ['neutral'], ['neutral'], ['neutral'], ['neutral'], ['neutral'], ['neutral'], ['curiosity'], ['neutral'], ['neutral'], ['neutral'], ['neutral'], ['neutral'], ['excitement', 'neutral'], ['neutral'], ['neutral'], ['neutral'], ['neutral'], ['neutral'], ['neutral'], ['excitement'], ['neutral'], ['neutral'], ['curiosity'], ['neutral'], ['neutral'], ['neutral'], ['neutral'], ['neutral'], ['neutral'], ['neutral'], ['neutral'], ['neutral'], ['neutral'], ['neutral'], ['neutral'], ['neutral'], ['neutral'], ['neutral'], ['neutral'], ['neutral'], ['neutral'], ['neutral'], ['neutral'], ['neutral']]"
31,31,Bad Bunny - Neverita,"26 ContributorsTranslationsEnglishDeutschNeverita Lyrics

Yo 'toy puesto pa' ti y tú te me quita'
Diablo, qué piquete la chamaquita
El corazón lo puso en la neverita
Dice que este verano se queda solita
Yo 'toy puesto pa' ti y tú te me quita'
Diablo, qué piquete la chamaquita
El corazón lo puso en la neverita
Dice que este verano se queda solita

Pero nunca sola, sola
Amores vienen y van, como las ola'
El DM explotao', to's le escriben ""hola""
Una fila 'e cabrone' y yo quiero la cola, yeah, yeah, yeah


Déjame untarte el sunblock pa' que no te queme'
Aquí hay mucha' nenas linda' pero tú la tiene'
Jugar conmigo, eso te entretiene
No sea' mala, me tienes de meme (Ey, ey, ey, ey)
Me siento como el sol, ey, cuando te pones sunblock (Cuando te pones sunblock)
Baby, déjame entrar (Déjame entrar), dale, quítame el lock (Dale, quítame el lock), ey
Yo me la pasaría contigo viendo TikTok, je (¡Huh-huh!)
Déjame sorprenderte, ey
Déjame untarte el sunblock pa' que no te queme'
Aquí hay mucha' nenas linda' pero tú la tiene'
Jugar conmigo, eso te entretiene
No sea' mala, me tienes de meme
See Bad Bunny LiveGet tickets as low as $34You might also like
Yo 'toy puesto pa' ti y tú te me quita'
Diablo, qué piquete la chamaquita
El corazón lo puso en la neverita
Dice que este verano se queda solita

Pero nunca sola, sola
Amores vienen y van, como las ola'
Tú lo que ere' e' una abusadora
Vo'a buscarte una cerveza y de vez el cora, yeah, yeah, yeah3Embed","[['neutral'], ['neutral'], ['neutral'], ['neutral'], ['neutral'], ['neutral'], ['neutral'], ['neutral'], ['neutral'], ['neutral'], ['neutral'], ['approval', 'neutral'], ['neutral'], ['neutral'], ['neutral'], ['neutral'], ['neutral'], ['neutral'], ['excitement', 'neutral'], ['neutral'], ['neutral'], ['neutral'], ['neutral'], ['neutral'], ['neutral'], ['neutral'], ['neutral'], ['neutral'], ['neutral'], ['neutral'], ['neutral'], ['neutral'], ['neutral']]"
32,32,Don Omar - Dile,"17 ContributorsTranslationsDeutschEnglishDile Lyrics

Dile que bailando te conocí
Cuéntale
Dile que esta noche me quieres ver
Cuéntale
Cuéntale que beso mejor que él
Cuéntale
Dile que esta noche tú me va' a ver
Cuéntale

Cuéntale que te conocí bailando
Cuéntale, que soy mejor que él
Cuéntale, que te traigo loca
Cuéntale, que no lo quieres ver
Cuéntale que te conocí bailando
Cuéntale, que soy mejor que él
Cuéntale, que te traigo loca
Cuéntale, que no lo quieres ver

Que quizás fue la noche la que te traicionó
O el perfume de mi piel lo que te cautivó
Que ya no tienes excusa' pa' tu traición
Que tuviste mil motivos, que entre en razón
Que quizás te hablo al oído como ya él no
O en mí arde el fuego de la pasión
Ya no le mientas más y admite tu error
Y si es por mí no pidas perdón
Digo, queda de ti el que lo perdones
El que lo olvides o lo abandones
Porque con llorar no se compone
Entonces a mí dame otra noche
See Don Omar LiveGet tickets as low as $88You might also like
Otra, otra noche, otra
(Ay, que yo no te boté)
Otra, otra noche, otra
(Aunque tú vuelvas con él)
Otra, otra noche, otra
(Cuéntale, cuéntale)
Otra, otra noche, otra
(Que beso mejor que él)
Otra, otra noche, otra
(Cuéntale, cuéntale)
Otra, otra noche, otra

Cuéntale, que te conocí bailando
Cuéntale, que soy mejor que él
Cuéntale, que te traigo loca
Cuéntale, que no lo quieres ver
Cuéntale, que te conocí bailando
Cuéntale, que soy mejor que él
Cuéntale, que te traigo loca
Cuéntale, que no lo quieres ver

Que quizás fue la noche la que te traicionó
O el perfume de mi piel lo que te cautivó
Que ya no tienes excusa pa' tu traición
Que tuviste mil motivos, que entre en razón
Que quizás te hablo al oído como ya él no
O en mí arde el fuego de la pasión
Ya no le mientas más y admite tu error
Y si es por mí no pidas perdón
Digo, queda de ti el que lo perdones
El que lo olvides o lo abandones
Porque con llorar no se compone
Entonces a mi dame otra noche
Otra, otra noche, otra
(Ay, que yo no te boté)
Otra, otra noche, otra
(Aunque tu vuelvas con él)
Otra, otra noche, otra
(Cuéntale, cuéntale)
Otra, otra noche, otra
(Que beso mejor que él)
Otra, otra noche, otra
(Cuéntale, cuéntale)
Otra, otra noche, otra8Embed","[['neutral'], ['neutral'], ['neutral'], ['neutral'], ['neutral'], ['neutral'], ['neutral'], ['neutral'], ['neutral'], ['neutral'], ['neutral'], ['neutral'], ['neutral'], ['neutral'], ['neutral'], ['neutral'], ['neutral'], ['neutral'], ['neutral'], ['neutral'], ['neutral'], ['neutral'], ['neutral'], ['neutral'], ['neutral'], ['neutral'], ['neutral'], ['neutral'], ['optimism'], ['neutral'], ['neutral'], ['neutral'], ['neutral'], ['neutral'], ['neutral'], ['neutral'], ['neutral'], ['neutral'], ['neutral'], ['neutral'], ['neutral'], ['neutral'], ['neutral'], ['neutral'], ['neutral'], ['neutral'], ['neutral'], ['neutral'], ['neutral'], ['neutral'], ['neutral'], ['neutral'], ['neutral'], ['neutral'], ['neutral'], ['neutral'], ['neutral'], ['neutral'], ['neutral'], ['neutral'], ['neutral'], ['neutral'], ['neutral'], ['neutral'], ['neutral'], ['neutral'], ['neutral'], ['neutral'], ['neutral'], ['neutral'], ['neutral']]"
33,33,Bad Bunny - A Tu Merced,"26 ContributorsTranslationsDeutschEnglishA Tu Merced Lyrics

Yeh, yeh, yeh, yeh
Yeh, yeh, ey

Tengo par de babie' explotándome el cel
Y yo pensando en ti, estoy a tu merced
Tú siempre está' mojá' y yo que tengo sed, eh
Dime qué vamo' a hacer
Que tengo par de babie' explotándome el cel
Y yo pensando en ti, estoy a tu merced
Tú siempre está' mojá' y yo que tengo sed
Ey, ey, ey

Y ella' están buena', pero tú 'tás mejor (Mejor)
Traje pasto y alcohol
Por ti les picheo, las tengo en hold (En hold)
Y yo detrás de ti como Usain Bolt
Y si quiere' te busco en la Lamborghi (-ghi)
Si te lo hago te enchulo, como Anuel a Karol G (G)
Quiere' perreo, no balada
Tú ere' una pitcher, pero yo estoy puesto pa' la nueva entrada
¿Y qué? ¿Qué?
¿Qué quiere' hacer? Yo hago lo que tú diga'
Ese culo e' grande' liga', que Dio' te lo bendiga
Y dime, ¿qué? ¿Qué?
¿Qué quiere' hacer?, yo hago lo que tú diga'
Picheale a tu amiga, ey, ey
See Bad Bunny LiveGet tickets as low as $34You might also like
Porque tengo par de babie' explotándome el cel
Y yo pensando en ti, estoy a tu merced
Tú siempre está' mojá' y yo que tengo sed, ey
Dime qué vamo' a hacer
Es que tengo par de babie' explotándome el cel
Y yo pensando en ti, estoy a tu merced
Tú siempre está' mojá' y yo que tengo sed
Ey, ey, ey

Yo sé que no ere' fan del romanticismo
Y que está' cansá' de que esto' cabrone' te digan lo mismo
Moviendo el booty, no se va de ritmo
Punto die', en la cama va a haber un sismo
Quiero jalarte ese pelito rubio (Rubio)
Y darte en cuatro el cuatro de julio
Mañana tengo examen, pero tú lo sabe'
Que si me llama', no estudio

Mami, concédeme esta pieza
No somo' na', no somo' na', ey
Pero con un perreo se empieza
No sale' de mi cabeza
Mami, concédeme esta pieza
No somo' na', no somo' na', ey
Pero con un perreo se empieza
No sale' de mi cabeza, ey
Y to' los culo' de Miami explotándome el cel
Y yo pensando en ti, estoy a tu merced
Tú siempre está' mojá' y yo que tengo sed, eh
Dime qué vamo' a hacer
Es que tengo par de babie' explotándome el cel
Y yo pensando en ti, estoy a tu merced
Tú siempre está' mojá' y yo que tengo sed, eh
Dime qué vamo' a hacer

Eh-eh-eh
Eh-eh-eh
Eh-eh-eh
Yeah, yeah, eh8Embed","[['neutral'], ['neutral'], ['neutral'], ['neutral'], ['curiosity', 'optimism'], ['neutral'], ['neutral'], ['neutral'], ['neutral'], ['neutral'], ['neutral'], ['neutral'], ['neutral'], ['neutral'], ['neutral'], ['neutral'], ['neutral'], ['neutral'], ['curiosity'], ['curiosity'], ['neutral'], ['curiosity'], ['curiosity'], ['neutral'], ['neutral'], ['neutral'], ['neutral'], ['neutral'], ['neutral'], ['neutral'], ['neutral'], ['neutral'], ['neutral'], ['neutral'], ['neutral'], ['neutral'], ['neutral'], ['neutral'], ['neutral'], ['neutral'], ['neutral'], ['neutral'], ['neutral'], ['neutral'], ['neutral'], ['neutral'], ['neutral'], ['neutral'], ['neutral'], ['neutral'], ['neutral'], ['curiosity', 'optimism'], ['neutral'], ['neutral'], ['neutral'], ['curiosity', 'optimism'], ['neutral'], ['neutral'], ['neutral'], ['neutral'], ['neutral']]"
34,34,Bad Bunny - Una Vez,"27 ContributorsTranslationsDeutschEnglishUna Vez Lyrics

Lo nuestro no te conviene, eh
Pero él ya no te entretiene, eh
Sé que te incito a pecar, lo trata' de controlar
Pero no se detiene, eh

Y déjame sentirte una ve'
Por si no te vuelvo a ver
Luego lo sigo normal con mi vida
Y tú la tuya con él
Pero déjame sentirte una ve' (Sentirte una ve')
Por si no te vuelvo a ver
Luego lo sigo normal con mi vida

Pe-Pe-Pe-Pero dale escápate (-te)
Y si hay gente tápate (-te), y allá abajo acicálate
Porque hoy te va' pa' casa y casi ni traté (-té)
Y si tiene' problemas, conmigo pégate
Que quiero ponerte a gritar mi nombre pa' que lo recuerde'
Siempre anda conmigo cuando el novio se le pierde
Carita de nena buena, nunca pierde
Conmigo se siente cabrón, él es solo un resuelve
You might also like
¿Y qué va' a hacer si me pego?
Y te jalo por el pelo
Pa' mí que te va a gustar
Solo déjate llevar

Y déjame sentirte una ve'
Por si no te vuelvo a ver
Luego lo sigo normal con mi vida
Y tú la tuya con él
Pero déjame sentirte una ve' (Sentirte una ve')
Por si no te vuelvo a ver
Luego lo sigo normal con mi vida

Y tú la tuya con él (Yah)
Y tú la tuya con él (Yah)
Tú la tuya con él (Yah)
Yeh-yeh-yeh-yeh (Tú la tuya con él, tú la tuya con él, tú la tuya con él)
Ey

Baby, yo quiero chingarte, te lo confieso
Pero me conformo solo con un beso
Yo no creo en el amor ni en nada de eso
Pero no sé por qué ahora siempre que rezo
Le pido a Dios que me deje verte 'esnúa
Tú te va', pero esta bellaquera continúa
Me pongo celoso cuando habla' de él (Shh)
Dime qué vamo' a hacer
Yo solo quiero hacerlo hasta el amanecer
Porque sé que pronto va' a desaparecer
Si fuera por mí te llevara de gira
Creo que voy a extrañar la forma esa en que me mira'
Con cara de nena buena, pero bellaquita
Eso' ojito' que lo' podere' me quita
Quiero verte brincando to'a mojaíta'
Y tu cara cuando yo te pase la lengüita
Y te traje un whiskicito con agüita tónica
Yo sé que no ere' virgen, que no ere' católica
Lo má' que me gusta e' que tú ere media complicá'
Quiero ver cómo tus ojo' se ponen con Índica
Verdecito' colora'o, -a'o
No sé si se nota, me tiene' desespera'o
Soñando contigo, to'a las noche' desvela'o
Déjame probarte y cada cual por su la'o, eh
¿Y qué va' a hacer si me pego?
Y te jalo por el pelo
Yo sé que te va' a mojar
Solo déjate llevar

Y déjame sentirte una vez (Sentirte una vez)
Por si no te vuelvo a ver
Luego lo sigo normal con mi vida
Y tú la tuya con él

Aah
Y tú la tuya con él (Yah)
Tú la tuya con él (Yaah)
Tú la tuya con él, tú la tuya con él (Yaah)11Embed","[['curiosity'], ['curiosity', 'neutral'], ['neutral'], ['annoyance', 'neutral'], ['neutral'], ['neutral'], ['neutral'], ['neutral'], ['neutral'], ['neutral'], ['neutral'], ['neutral'], ['neutral'], ['neutral'], ['neutral'], ['neutral'], ['neutral'], ['neutral'], ['neutral'], ['confusion', 'neutral'], ['curiosity'], ['neutral'], ['neutral'], ['neutral'], ['neutral'], ['neutral'], ['neutral'], ['neutral'], ['neutral'], ['neutral'], ['neutral'], ['neutral'], ['neutral'], ['neutral'], ['neutral'], ['neutral'], ['neutral'], ['neutral'], ['neutral'], ['neutral'], ['neutral'], ['neutral'], ['neutral'], ['neutral'], ['neutral'], ['neutral'], ['neutral'], ['neutral'], ['neutral'], ['neutral'], ['neutral'], ['neutral'], ['neutral'], ['neutral'], ['neutral'], ['neutral'], ['neutral'], ['neutral'], ['neutral'], ['curiosity'], ['curiosity'], ['neutral'], ['neutral'], ['neutral'], ['neutral'], ['neutral'], ['neutral'], ['neutral'], ['amusement', 'neutral'], ['neutral'], ['neutral'], ['neutral']]"
35,35,Aventura - Volví,"3 ContributorsVolvió La Traicionera Lyrics

Ya volvió la cualquiera, traicionera, mujerzuela
La que me causó la pena, que cambió mi vida entera
Que no me dirija un palabra, porque no respondo de mí
Esto no se trata de machismo
Una dama y una diabla no es lo mismo
Bendita sean todas sólo por haber nacido mujer
Pero a la mierda las mando si son infiel
Cuidadito si cuentas la historia como no es
Por bandida te boté

Don't come around here 'cause it's over
You took me for granted and that was wrong
You know me well, don't test my knowledge
No chance, go, go
Don't come around here 'cause it's over
You took me for granted and that was wrong
You know me well, don't test my knowledge
No chance, go, go

No vuelvas aquí, traicionera
Mentirosa
It's over, girl
Go, go
She won't forget Romeo, ah-ah
Aventura
See Aventura LiveGet tickets as low as $34You might also like
Don't come around here 'cause it's over
You took me for granted and that was wrong
You know me well, don't test my knowledge
No chance, go, go
Don't come around here 'cause it's over
You took me for granted and that was wrong
You know me well, don't test my knowledge
No chance, go, go

¿Qué es lo que tú te crees?, bandida
It's over
Go, go

Dile al pueblo, cuentale la historia, la verdadera versión
Que jugaste con mis sentimientos, admite tu error
En tu barrio saben que me fuiste infiel
Se comenta tu traición
Un día mi padre me lo dijo y hoy le doy la razón
El que cree en mujeres cree en el Diablo, no se equivoco
No me exijas oportunidades
Sorry, my love (You did me wrong)
Don't come around here 'cause it's over
You took me for granted and that was wrong
You know me well, don't test my knowledge
No more chances, go, go
Don't come around here 'cause it's over
You took me for granted and that was wrong
You know me well, don't test my knowledge
Se acabó, go, go

Uuh!
That's the  right there
No more
Don't come around here 'cause it's over
Nah, nah, nah
Don't test my knowledge, go, go
Aventura
You see, Lenny?
I might have to  the beat
She wanna come and play me like that
Go, go
She played me 'cause I was weak
But now I'm feeling strong
That's right, yeah
Playboy
Throw the beat right there
Lenny Melody
Bananas
No more chances
NastyEmbed","[['neutral'], ['neutral'], ['neutral'], ['neutral'], ['neutral'], ['neutral'], ['neutral'], ['neutral'], ['neutral'], ['disapproval'], ['approval'], ['neutral'], ['neutral'], ['disapproval'], ['approval'], ['neutral'], ['neutral'], ['neutral'], ['neutral'], ['neutral'], ['excitement', 'neutral'], ['neutral'], ['neutral'], ['optimism', 'neutral'], ['disapproval'], ['approval'], ['neutral'], ['neutral'], ['disapproval'], ['approval'], ['neutral'], ['neutral'], ['curiosity'], ['neutral'], ['excitement', 'neutral'], ['neutral'], ['approval', 'neutral'], ['neutral'], ['neutral'], ['neutral'], ['neutral'], ['neutral'], ['remorse', 'sadness'], ['disapproval'], ['approval'], ['neutral'], ['neutral'], ['disapproval'], ['approval'], ['neutral'], ['neutral'], ['neutral'], ['neutral'], ['neutral'], ['disapproval'], ['disapproval', 'neutral'], ['annoyance'], ['neutral'], ['neutral'], ['neutral'], ['neutral'], ['excitement', 'neutral'], ['disappointment', 'neutral'], ['relief'], ['approval'], ['neutral'], ['neutral'], ['neutral'], ['neutral'], ['neutral'], ['neutral']]"
36,36,Mora - LA INOCENTE,"13 ContributorsTranslationsEnglishLA INOCENTE Lyrics

Yeah
Yeah-yeah
Yeah

Todo parece estar bien
Pero nada e' lo que parece
No supe darte mi cien
Aunque lo traté muchas vece'
Lo intenté, pero fracasé
Todos mis errore' ya los repasé
Y ahora dime cómo duermo si tú no me pertenece' (No-oh)
Abuelo me lo dijo, el amor no funciona
Quien meno' te espera' se va y te traiciona
Te fuistе sin despedirte
Como si nunca mе quisiste

Te di lo que pedía' y no fue suficiente
Tú solo mentía' y yo tu fiel creyente
Mil sueño' me vendía', yo fui tu cliente (Yo')
Siempre era yo el culpable y tú jugando a la inocente (Suena, wow)
You might also like
Tú callaíta' chequeando mis mensaje'
Y yo al garete llevándote de viaje
Una nébula, todo era un visaje
Te fuiste de casa y sacaste tu equipaje
Nadie te va amar como yo ni va a chingarte como yo
Y ahora quiere que me quede tranquilo si un hijueputa me choteó
En medio de esta situación, no me duele el corazón
Me duele que le haya' creído algo mío a otro cabrón
Que te tiraba to'a la noche
Se te olvidó que saldamo' to' mi coche
To' los mese' un nuevo perfume
Hasta te compraba pasto pa' que fume', bebé
No quiero que nada te falte
Y ojalá que ese cabrón te pague el esmalte, yeah-yeah
Yo no te deseo el mal, pero vas a pensar en mí cada ve' que te levantes (Wow)

Te di lo que pedía' y no fue suficiente
Tú solo mentía' y yo tu fiel creyente
Mil sueño' me vendía', yo fui tu cliente
Siempre era yo el culpable y tú jugando a la inocente

Tú me vendiste sueño' y yo fui tu cliente
Esa carita de inocente
Solo te la cree el resto de la gente
Quizá soy masoquista o solo tengo mala suerte
Le pido a Dio', a ver si contigo me ayuda
No pienso llamarte, te aclaro la duda
Yo quiero ser libre igual que Venezuela y Cuba
Nunca hablaste claro, te hiciste la muda
Quería' atención y yo te puse en el centro
Quería' mi corazón y te lo puse en descuento
Me pediste el cincuenta y yo te di 100%
Me pediste un reloj y yo perdiendo mi tiempo
Me quedé esperando que tu mensaje llegara
Me comí otro culo, pero pensando en tu cara
Quédate con la culpa y también con la ropa cara
Y recuerda que la traición, con traición se paga
Te di lo que pedía' y no fue suficiente
Tú solo mentía' y yo tu fiel creyente
Mil sueño' me vendía', yo fui tu cliente
Siempre era yo el culpable y tú jugando a la inocente2Embed","[['approval', 'neutral'], ['neutral'], ['approval', 'neutral'], ['neutral'], ['neutral'], ['disapproval', 'neutral'], ['neutral'], ['neutral'], ['neutral'], ['neutral'], ['neutral'], ['neutral'], ['neutral'], ['neutral'], ['neutral'], ['neutral'], ['neutral'], ['excitement'], ['confusion', 'neutral'], ['neutral'], ['neutral'], ['neutral'], ['neutral'], ['neutral'], ['neutral'], ['neutral'], ['neutral'], ['neutral'], ['neutral'], ['neutral'], ['neutral'], ['neutral'], ['neutral'], ['excitement'], ['neutral'], ['neutral'], ['neutral'], ['neutral'], ['neutral'], ['neutral'], ['neutral'], ['neutral'], ['neutral'], ['neutral'], ['neutral'], ['neutral'], ['neutral'], ['neutral'], ['neutral'], ['neutral'], ['neutral'], ['neutral'], ['neutral'], ['neutral'], ['neutral'], ['neutral'], ['neutral'], ['neutral']]"
37,37,Bad Bunny - Un Coco,"40 ContributorsTranslationsEnglishDeutschUn Coco Lyrics

Ante' que este Phillie se apague, yo te voy olvidar-dar
Yo te voy a olvidar-dar
Ante' que este Phillie se apague, yo te voy olvidar-dar-dar
Yo te voy a olvidar, yal

Me paso fumando bajo las palmera'
A ver si me cae un coco en la cabeza y me borra mi vida entera
Veo parejitas dándose beso' y me da dentera
Vo'a tirar el radio pa'l mar si sale Sin Bandera porque
No puedo escuchar cancione' dе romance (Du)
Y me cansé que dе pensar en ti no me canse
El último pétalo me dijo que aún hay chance
No sé si e' verdad, pero si va' a volver, avance
Por favor, aunque sea un mensaje ante' que salga el sol
Que en la mañana coja alergia buscando tu olor
Tantos trofeo' y aún me siento perdedor, perdedor
Búscame el encendedor, ey
Que si no te olvido me vo'a mudar pa' Chile
Pa' Argentina o pa' El Salvador
""Pero demen el lighter"" dije, por favor, por favor

Y ante' que este Phillie se apague, yo te voy olvidar-dar
Ey, yo te voy a olvidar-dar
Ante' que este Phillie se apague, yo te voy olvidar-dar (Ey)
Yo te voy a olvidar, yal
See Bad Bunny LiveGet tickets as low as $34You might also like
Ey, ey, ey
Me estoy ahogando y a la' ola' le' pedí socorro
Escribo tu nombre en la arena a ver si así lo borro
Pero tus labio' y tus ojo' los tengo de gorro
No sale' de mi cabeza (Du)
Otro Phillie y otra cerveza
Ya tu recuerdo me pesa
Te disfrazaste de Rubí y eras Teresa
Pero soy un pendejo y todavía me interesa'
Ey, ey, saber de tu paradero
Y preguntarte si fue verdadero
O si está' volá' como avión y yo fui pasajero (Wuh)
Qué cojones, todavía yo te quiero
Je, je, lo' muchacho' dicen que yo estoy charreando
Je, je, ey, pero en bajita seguimo' quemando (Rra)

Y ante' que este Phillie se apague, yo te voy olvidar-dar (Eh)
Yo te voy a olvidar-dar
Ante' que este Phillie se apague, yo te voy olvidar-dar
Yo te voy a olvidar, yal
Y ante' que este Phillie se apague, yo te voy olvidar-dar
Ey, yo te voy a olvidar-dar
Y ante' que este Phillie se apague, yo te voy olvidar-dar
Ey, yo te voy a olvidar, yal4Embed","[['neutral'], ['neutral'], ['neutral'], ['excitement', 'joy'], ['neutral'], ['neutral'], ['neutral'], ['neutral'], ['neutral'], ['neutral'], ['neutral'], ['neutral'], ['neutral'], ['neutral'], ['neutral'], ['neutral'], ['neutral'], ['neutral'], ['neutral'], ['neutral'], ['neutral'], ['neutral'], ['excitement', 'joy'], ['neutral'], ['neutral'], ['neutral'], ['neutral'], ['neutral'], ['neutral'], ['neutral'], [], ['neutral'], ['neutral'], ['neutral'], ['neutral'], ['neutral'], ['neutral'], ['neutral'], ['neutral'], ['neutral'], ['neutral'], ['neutral'], ['excitement', 'joy'], ['neutral'], ['neutral'], ['neutral'], ['neutral']]"
