,Unnamed: 0,artist_title,lyrics,emotions
0,0,Wegz - البخت,"18 ContributorsTranslationsEnglishEl Bakht - البخت Lyrics
عيني منها بشكل جِدّي (عيني منها بشكل جِدّي)
وتقيلة مش تقلانة، إتبخّر سحري (ولا باجي على بالها)
ومش باجي على بالها، ما فكرتشي (ولا باجي على بالها)
وبالي فيها، بابا بالي مش ملكي (ولا باجي على بالها)

بلعب البخت (وبعدين؟)، سألتها ورفضتني
إستغربتها، أومال فين هيبتي؟
حبيبي أنا بضحك على خيبتي
يا أخي كنت ع الثبات وهزّتني
واللي فات ده كان سحري
مش باجي على بالها إن جت سيرتي
أنا بالي معاها مش ملكي
قالِت كلام قبل أما تشوفني
عارفني صعب ومش مفهوم
كلامي دبش ومش موزون
أو بتحب حد والبال مشغول
ما شفتوهاش ولا حد يلومني
ملاك بريء ولا أنا مخدوع
هيا توتر ولا أنا مهزوز
أو آذاها حد والكل مرفوض

ولا إيه القصة؟ حبيبي فيدني
اللي أذوك ياما، حبيبي سيبني
أخلي اللي  جاي ورود وشموع
يتغنّالها وبصوت مسموع
ولا إيه القصة حبيبي فيدني
اللي آذوك ياما حبيبي سيبني
أنسيك ماضي كله دموع
ولا ما أقدرش أسيبك موجوع
You might also like
سحرتني ولا سحرتلي
(سحرتني ولا سحرتلي)
وعيون مش محتاجة تسحرلي
(وعيون مش محتاجة تسحرلي)
مش عايزة تجيبني بس جابتني
(مش عايزة تجيبني بس جابتني)
ونسيتني وفي قصتي حبستني

والله ووقعت، بفكر فيك كتير بالي عليك مشغول
وأنا بتصعب عليا حالي وأنا بكتبلِك كلام معسول
بعيد عن عيني ويا عيني، مع غيري ومش مبسوط
ده أنا أضيّع عمري يا عمري وأحبِك حب مش مشروط

لا تلاقي عندي وعود كدابة
وكبرت على ولا شيء مضمون
كلامي على قد اللي معايا
في الحب ما أستناش مردود
بالراحة على قلبي المكسور
اللي مشكلته إنه فيك مسحول
مين إختار اللي عينيك عملوه
ده مش ذنبي أنا صحيت محطوط

ولا إيه القصة؟ حبيبي فيدني
اللي أذوك ياما، حبيبي سيبني
أخلي اللي  جاي ورود وشموع
يتغنّالها وبصوت مسموع
ولا إيه القصة حبيبي فيدني
اللي آذوك ياما حبيبي سيبني
أنسيك ماضي كله دموع
ولا ما أقدرش أسيبك موجوع
ولا إيه القصة؟ حبيبي فيدني
اللي أذوك ياما، حبيبي سيبني
أخلي اللي  جاي ورود وشموع
يتغنّالها وبصوت مسموع
ولا إيه القصة حبيبي فيدني
اللي آذوك ياما حبيبي سيبني
أنسيك ماضي كله دموع
ولا ما أقدرش أسيبك موجوع
يا ليلي يا ليل
يا ليلي، ليلي يا ليل
ليلي، ليلي يا ليل5Embed","[['neutral'], ['neutral'], ['neutral'], ['neutral'], ['neutral'], ['neutral'], ['neutral'], ['neutral'], ['neutral'], ['neutral'], ['neutral'], ['neutral'], ['neutral'], ['neutral'], ['neutral'], ['neutral'], ['neutral'], ['neutral'], ['neutral'], ['neutral'], ['neutral'], ['neutral'], ['neutral'], ['neutral'], ['neutral'], ['neutral'], ['neutral'], ['confusion', 'neutral'], ['neutral'], ['neutral'], ['neutral'], ['neutral'], ['neutral'], ['neutral'], ['neutral'], ['neutral'], ['neutral'], ['neutral'], ['neutral'], ['neutral'], ['neutral'], ['neutral'], ['neutral'], ['neutral'], ['neutral'], ['neutral'], ['neutral'], ['neutral'], ['neutral'], ['neutral'], ['neutral'], ['neutral'], ['neutral'], ['neutral'], ['neutral'], ['neutral'], ['neutral'], ['neutral'], ['neutral'], ['neutral'], ['neutral'], ['neutral'], ['neutral'], ['neutral'], ['neutral'], ['neutral']]"
1,1,Mohammed Saeed - Alo Aleky,"3 ContributorsAlo Aleky - قالوا عليكي Lyrics
وهقول عنك مواويل وهقول عنك حكايات
إزاي يا حبيبتي برغم البُعد مفيش بينا مسافات؟
قولنا هنتفارق يوم وبعدنا كده كام يوم
وبرغم البُعد ساعات برجع وبحن في يوم

وقالوا عليكي إن إنتي عينيكي قاسية ومفيش فيها مكان
يمكن حبيتي وروحتي وجيتي واتنسيتي مع الأيام
وقالوا عليكي إن إنتي بقيتي حد ناسي لنفسه زمان
يمكن حبيتي وروحتي وجيتي واتنسيتي مع الأيام

وأنا لو على قلبي فحن عشانك فجأة ومال
وأنا مهما يقولوا بشوفك غير كل اللي اتقال
تسحرني عيونك لو قابلوني وأقول يا سلام
كان فين من بدري وجودك جمبي يا أحلى ملاك؟

وقالوا عليكي إن إنتي عينيكي قاسية ومفيش فيها مكان
يمكن حبيتي وروحتي وجيتي واتنسيتي مع الأيام
وقالوا عليكي إن إنتي بقيتي حد ناسي لنفسه زمان
يمكن حبيتي وروحتي وجيتي واتنسيتي مع الأيام

وأدي حالي معاك بسهر ليكي أوقات
وترد نجوم الليل تبعتلك السلامات
وأدي حالي معاك بسهر ليكي أوقات
وترد نجوم الليل تبعتلك السلامات
You might also like
وقالوا عليكي إن إنتي عينيكي قاسية ومفيش فيها مكان
يمكن حبيتي وروحتي وجيتي واتنسيتي مع الأيام
وقالوا عليكي إن إنتي بقيتي حد ناسي لنفسه زمان
يمكن حبيتي وروحتي وجيتي واتنسيتي مع الأيام
وقالوا عليكي إن إنتي عينيكي قاسية ومفيش فيها مكان
يمكن حبيتي وروحتي وجيتي واتنسيتي مع الأيام
وقالوا عليكي إن إنتي بقيتي حد ناسي لنفسه زمان
يمكن حبيتي وروحتي وجيتي واتنسيتي مع الأيامEmbed","[['neutral'], ['neutral'], ['neutral'], ['neutral'], ['neutral'], ['neutral'], ['neutral'], ['neutral'], ['neutral'], ['neutral'], ['neutral'], ['neutral'], ['neutral'], ['neutral'], ['neutral'], ['neutral'], ['neutral'], ['neutral'], ['neutral'], ['neutral'], ['confusion', 'neutral'], ['neutral'], ['neutral'], ['neutral'], ['neutral'], ['neutral'], ['neutral'], ['neutral'], ['neutral']]"
2,2,Essam Sasa - مسا مني ليكوا,"2 ContributorsMesa Meny Leko - مسا مني ليكوا Lyricsظالم مظلوم
وكاتم جوايا وما بقتش بعاتب ولا ألوٌم
عايش أيام ع الفاضي وعادي بعدي اليوم
وبقيت إنسان تايه لوحدي ومش مفهوم
(كيمو الديب)
عالم أشرار
من هم بُروح على هم ومن مُر على مَرار
أصحاب بتبيع وتخون وعنيها دي تطق شَرار
أنساهم وأبعد عنهم خلاص خدت القرار
الحُب كلام
سِكة مضلمة أولها غرام وآخِرها آلام
مخنوق من الدنيا ومن نفسي ومن الأيام
وبقيت من كُتر أما بفكر مش عارف أنام
سلام يا دنيا هبعد وأعيش مع حالي
دَمعت عنيا دي تمنها هيكون غالي
هانت في ثانية عِشرة سنين وليالي
عشان ناس تانية قَسوتكوا وريتوهالي
هكتم وأخبي وهسيبكوا للي خلقكوا
دمرتوا قلبي من كتر ما أنا بعشقكوا
بديلكوا حبي وإنتوا الخيانة مبدأكوا
الطيبة ذنبي ومش راجع أصدقكوا
You might also likeشايف نهايتي شايف دمُوع في عُيوني
أنا إيه حكايتي أنا ليه صُحابي نسيوني
راح اللي حيلتي مش عارف أسد ديوني
وراحت حبيبتي وأقرب ما ليا خانوني
مِسا مني ليكوا يا اللي الزمن غيركوا
إخية عليكوا من تاني مش هقدركوا
العيب ماليكوا وتعيبوا برضه في غيركوا
النقص فيكوا وقولوا في غيابي ده آخركوا
الحُب سَحلة خلى الواحد يتدمر
والدنيا رحلة وزمايلي جالها زهايمر
ساعة ما تحلى على جيبي كُله ينمر
والبُعد أحلى ما الخير ما عادش بيطمر
معرفش مالى مابقتش أشوف حوليا
فى الضيقه خالى ولا عمى سأل عليا
ألمى اللى جالى ولاقيته حاسس بيا
على قد حالى واللى فى جيبى مش ليا
واحدة وحبيتها أول ما الدنيا إدتنى قفاها راحت فى ساعتها
صدفة وجمعتنى بينى وبينها دوبت فى رقِتها
أتاريها شيطانة وعامله ملاك بس عادى نسيتها
ظالم مظلوم وكاتم جوايا ومبقتش بعاتب ولا ألوم
عايش أيام على الفاضى وعادى بعدى اليوم
وبقيت إنسان تايه لوحدى ومش مفهوم
كل ما أحب فى الأخر أنا بتصدم
ودايره كِدب والحُب موضه و قِدم
أحزان و غُلب والَصح مات وأتركن
معنديش قلب إحساسى بيا اتعدم
هغيب شويه ما القرب منكوا غضامه
دول فى الهويه كاتبين لكله كرامه
مفيش أخويه والكل عاشها دراما
صدمات قوية والعشق أخره ندامه
الطيبه جهل والدنيا قلبت غابه
الغدر سهل بس اللى باعنى اتغابي
والبُعد حل عشان القلوب قلابه
فعلا بمل أصل الصحاب كدابه
بسهر كتير بليل بصاحب الكاس
مفيش تقدير والحق غاب وأتداس
مالكوش فى خير أنا هقتل الإحساس
هكون شرير مباقتش طالبه الناسEmbed","[['neutral'], ['neutral'], ['neutral'], ['neutral'], ['neutral'], ['neutral'], ['neutral'], ['neutral'], ['neutral'], ['neutral'], ['neutral'], ['neutral'], ['neutral'], ['neutral'], ['neutral'], ['neutral'], ['neutral'], ['neutral'], ['neutral'], ['neutral'], ['neutral'], ['neutral'], ['neutral'], ['neutral'], ['neutral'], ['neutral'], ['neutral'], ['neutral'], ['neutral'], ['neutral'], ['neutral'], ['neutral'], ['neutral'], ['neutral'], ['neutral'], ['neutral'], ['neutral'], ['neutral'], ['neutral'], ['neutral'], ['neutral'], ['neutral'], ['neutral'], ['neutral'], ['neutral'], ['neutral'], ['neutral'], ['neutral'], ['neutral'], ['neutral'], ['neutral'], ['neutral'], ['neutral'], ['neutral'], ['neutral'], ['neutral'], ['neutral'], ['neutral']]"
3,3,Muslim - مُسلِم - Etnaset,"7 ContributorsTranslationsEnglishEtnaset - إتنسيت Lyrics
ما بقتش عارف أعمل إيه
حالي مش صعبان عليه
يعني ده اللي وصلنا ليه؟
سايبه وعارف روحي فيه
كل شيء إلا الفراق
فـ ما تسيبنيش وأنا مشتاق
عمري ما إتخيلت يوم أبعد وأسيب قلبي معاك
هصدقك وأكدب عينيا
ده إنت شوفت أجمل ما فيا
وما كانش عندي أي نية
أنساك وتضيع من بين إيديا

وإتنسيت كإني ما جيت ولو حسيت هتكسرني
وداريت في قلبي مشيت، على عيني تغربني
وإتنسيت كإني ما جيت ولو حسيت هتكسرني
وداريت في قلبي مشيت، على عيني تغربني

طال الغياب وهواك غلاب، عشمان في ضي عينيك
مليون جواب متساب على الباب اللي بترديه
ومش تحت طوعي، فارقتني روحي من بعد لما مشيت
وما بين أنساك وبين نرجع قلبي إتقسم نصين
نص مش قادر يخبي
ونص رافض تبقي جنبي
وكنت عارف هبقى وحدي
اللي هخسر مرتين
مرة لما رضيت بعيوبك
ومرة لما داريت عيونك
وإنت بتكدب ظنونك
من البداية ما حبتنيش
ومش هزود في الملام
مش هيفرق في الخصام
ده لو عينيك صادفت عينيا إمشي وما ترميلي سلام
You might also like
وإتنسيت كإني ما جيت ولو حسيت هتكسرني
وداريت في قلبي مشيت، على عيني تغربني
وإتنسيت كإني ما جيت ولو حسيت هتكسرني
وداريت في قلبي مشيت، على عيني تغربني2Embed","[['neutral'], ['neutral'], ['neutral'], ['neutral'], ['neutral'], ['neutral'], ['neutral'], ['neutral'], ['neutral'], ['neutral'], ['neutral'], ['neutral'], ['neutral'], ['neutral'], ['neutral'], ['neutral'], ['neutral'], ['neutral'], ['neutral'], ['neutral'], ['neutral'], ['neutral'], ['neutral'], ['neutral'], ['neutral'], ['neutral'], ['neutral'], ['neutral'], ['neutral'], ['neutral'], ['confusion', 'neutral'], ['neutral'], ['neutral'], ['neutral'], ['neutral']]"
4,4,Muslim - مُسلِم - Mesh Nadman,"1 ContributorMesh Nadman - مش ندمان Lyrics
برواز قديم ومتلصم
والعمر بيجري ويخصم
جروح بتلم وتبصم
تسيب جوة القلوب علامات
الحزن بقلبي متوصي
ومش كسبان ومش مرضي
الدمع في عيني بيخطي
يودعهم بدون سلامات

على العشرة وع الأيام
ما عادش يفيد ما بيننا كلام (ما بيننا كلام)
يومين بالكثير وأنساك
أنا سايبك ومش ندمان
وعلى العشرة وع الأيام
ما عادش يفيد ما بيننا كلام
ويومين بالكثير وأنساك
أنا سايبك ومش ندمان

وجيه اليوم اللي أشوفك فيه واقف مكسور بتندهلي
وشايل روحي على كفي
ولو حنيت هبيع قلبي
وعادي كله بيعدي
البعد بينسي
هكون مرتاح وأنا لوحدي
وقولي إيه أفتكرك بيه غير دمع عيني اللي يبكي
ما سيبتش ليا أي طريق غير المركب اللي تودي
والباب يفوت جمل
كل اللي ليك إتعمل
ما يطمرش
والعشق مش بالأجل
كان فيه حنين وإتقتل
ما يرجعش
هتشوف الفرق من بعدي
وأكيد هتجيلي من تاني
إمشي ويا ريت ما ترجعشي
قاطع إيدي إللي وجعاني
كنت ألوم لأجل تسمعني
أقوم ودموعي على خدي
وبقيت مضطر دلوقتي
أموت ولا أقولها وحشاني
You might also like
على العشرة وع الأيام
ما عادش يفيد ما بيننا كلام
ويومين بالكثير وأنساك
أنا سايبك ومش ندمانEmbed","[['neutral'], ['neutral'], ['neutral'], ['neutral'], ['neutral'], ['neutral'], ['neutral'], ['neutral'], ['neutral'], ['neutral'], ['neutral'], ['neutral'], ['neutral'], ['neutral'], ['neutral'], ['neutral'], ['neutral'], ['neutral'], ['neutral'], ['neutral'], ['neutral'], ['neutral'], ['neutral'], ['neutral'], ['neutral'], ['neutral'], ['neutral'], ['neutral'], ['neutral'], ['neutral'], ['neutral'], ['neutral'], ['neutral'], ['neutral'], ['neutral'], ['neutral'], ['neutral'], ['neutral'], ['confusion', 'neutral'], ['neutral'], ['neutral'], ['neutral'], ['neutral']]"
5,5,Ramy Sabry - يمكن خير,"2 ContributorsYmken Kher - يمكن خير Lyrics
ولا وقته إننا نتحاسب
ولا وقته إني ألوم ولا أعاتب
إيه، إيه هيفيد
على قد ما قلبي وجعني
وأنا شايفك جاي تودعني
وماشي، ماشي بعيد

يمكن خير ومين
يندم على اللي يبيع سنين
ويهد أحلامه في يومين
ويبيع قوام
هنساك وأعيش
وأهو حب راح وخلاص ما فيش
لهواك مكان ما يهمنيش
خلص الكلام

ولا وقته إننا نتحاسب
ولا وقته إني ألوم ولا أعاتب
إيه، إيه هيفيد
على قد ما قلبي وجعني
وأنا شايفك جاي تودعني
وماشي، ماشي بعيد
You might also like
يمكن خير عشان
كان لازم أبعد من زمان
أنا وإنت ما يسعناش مكان
والبركة فيك
موضوعنا مات
ما بقاش خلاص في معجزات
وبلاش نقلب في اللي فات
راحت عليك

ولا وقته إننا نتحاسب
ولا وقته إني ألوم ولا أعاتب
إيه، إيه هيفيد
على قد ما قلبي وجعني
وأنا شايفك جاي تودعني
وماشي، ماشي بعيدEmbed","[['neutral'], ['neutral'], ['neutral'], ['neutral'], ['neutral'], ['neutral'], ['neutral'], ['neutral'], ['neutral'], ['neutral'], ['neutral'], ['neutral'], ['neutral'], ['neutral'], ['neutral'], ['neutral'], ['neutral'], ['neutral'], ['neutral'], ['neutral'], ['confusion', 'neutral'], ['neutral'], ['neutral'], ['neutral'], ['neutral'], ['neutral'], ['neutral'], ['neutral'], ['neutral'], ['neutral'], ['neutral'], ['neutral'], ['neutral'], ['neutral'], ['neutral']]"
6,6,Cairokee - Basrah w Atooh,"2 ContributorsBasrah w Atoh - بسرح وأتوه Lyrics
بسرح وأتوه في الذكريات
وبعيش حياة ويا اللي فات
أشخاص أماكن كل شيء
حاجة توديني لحاجات

حكايات مواقف كلها
في الماضي دي أنا عشتها
كل اما أغمض عيني أروح
لسنين سابتني وسيبتها
كل اما أغمض عيني أروح
لسنين سابتني وسيبتها
ليه بحبها ماهي ماضي عدى وإنتهى
وإن سيبتها تمشي بترجع وحدها
وساعات أنا بشتاق لها فأنده لها
ليه بحن ليها وأعيش عليها
مفيش إجابة عرفتها
أنا عمري كام عشان تكون لي
الذكرى أسلوب حياة
دماغي فيها مليون شريط
ماضي قديم من ده وده
ده أنا كنت عيل من يومين
ودخلت أنام
صحيت لقيت العمر عدى، مخدنيش معاه
You might also like
بسرح وأتوه في الذكريات
وبعيش حياة ويا اللي فات
أشخاص، أماكن كل شيء
حاجة توديني لحاجات

وفي السنين أنا مش كبير
وشعري إسود زي ليل
والليل مبيعديش طويل
مافهوش هروب من الذكريات
ليه مليش في بكرة وليه بتوه
ليه مليش في حلم بترسموه
بسرح فلاقي الذكرى بس
وفيها بلقى أنا يومي أمس
غير يومكوا ده اللي بتعيشوه
الذكرى واخداني لمكان
أيام زمان وقت الفرح وقت الهنا
أنا وسط بكرة مليش وجود
في الذكرى بس بكون أنا
برجع في غمضة عين سنة
وسنة في سنة أنا ببقى أنا
عيل بيهوى الدندنة
أحلامه سهلة وممكنة
وعشان كدة أنا من هناك
أنا بنتمي للذكريات
ومليش مكان بينكم هنا
بسرح وأتوه في الذكريات
وبعيش حياة ويا اللي فات
أشخاص، أماكن كل شيء
حاجة توديني لحاجات1Embed","[['neutral'], ['neutral'], ['neutral'], ['neutral'], ['neutral'], ['neutral'], ['neutral'], ['neutral'], ['neutral'], ['neutral'], ['neutral'], ['neutral'], ['neutral'], ['neutral'], ['neutral'], ['neutral'], ['neutral'], ['neutral'], ['neutral'], ['neutral'], ['neutral'], ['neutral'], ['confusion', 'neutral'], ['neutral'], ['neutral'], ['neutral'], ['neutral'], ['neutral'], ['neutral'], ['neutral'], ['neutral'], ['neutral'], ['neutral'], ['neutral'], ['neutral'], ['neutral'], ['neutral'], ['neutral'], ['neutral'], ['neutral'], ['neutral'], ['neutral'], ['neutral'], ['neutral'], ['neutral'], ['neutral'], ['neutral'], ['neutral'], ['neutral'], ['neutral'], ['neutral']]"
7,7,Muslim - مُسلِم - Aleb Fel Dafater,"1 ContributorAleb Fel Dafater - قلب في الدفاتر Lyrics
قلب في الدفاتر تلقى الشعر بيحكي عنا فاكر
أيام ما كنا بنحلم نبقى تحت ضل ساتر
قل اللي بينا بالأيام وصبح كلامنا فاتر
مش لاقي حد غيرك حتى في البعاد أغازل
قلب في الدفاتر تلقى الشعر بيحكي عنا فاكر
أيام ما كنا بنحلم نبقى تحت ضل ساتر
قل اللي بينا بالأيام وصبح كلامنا فاتر
مش لاقي حد غيرك حتى في البعاد أغازل

آخر الطريق ما لقيتش غير لحني حزين
جف البكى من فرط صبري ع السنين
صدق اللي قالك إن بعض العشق دين
جف البكى ما عادش باقي في عيني شيء
آخر الطريق ما لقيتش غير لحني حزين
جف البكى من فرط صبري ع السنين
صدق اللي قالك إن بعض العشق دين
جف البكى ما عادش باقي في عيني شيء

غريبة عاشقك حتى وإنتي مش هنا
أنا لسه باقي ع اللي بينا، صورنا لسه تدلنا
كانت الشوارع في شتا الليالي تملنا
قلبي متيم بيكي، يشهد عليا ربنا
وغريبة عاشقك حتى وإنتي مش هنا
أنا لسه باقي ع اللي بينا، صورنا لسه تدلنا
كانت الشوارع في شتا الليالي تملنا
قلبي متيم بيكي، يشهد عليا ربنا
You might also like
إنت صبرك كله خير
إنت حزنك أبقى غير
إنت أعمى بس طير
على أي مرسى يوماتي ترسى
إنت فوقت ولا لسه؟
والليل سهرلك خوف
البُن ليك موصوف
النور محاوطك شوف
ولا بعيد لسه؟
""رديت وقولت ""إنسى
إنت صبرك كله خير
إنت حزنك أبقى غير
إنت أعمى بس طير
على أي مرسى يوماتي ترسى
إنت فوقت ولا لسه؟
والليل سهرلك خوف
البُن ليك موصوف
النور محاوطك شوف
ولا بعيد لسه؟
""رديت وقولت ""إنسى

صفر اللي جالك من شمالك زادك شيء
جمعك فأصبحت تبكي من لا شيء
صفر اللي جالك من يمينك غمى عليك
بقيت تزهد نفس الهوا من بعد عطش الليل
صفر اللي جالك من شمالك زادك شيء
جمعك فأصبحت تبكي من لا شيء
صفر اللي جالك من يمينك غمى عليك
بقيت تزهد نفس الهوا من بعد عطش الليل
بقينا فين؟ (بقينا فين؟)
الروح تشتاق تتمنى نظرة عين
آه وبقينا فين؟
آه الروح تشتاق تتمنى نظرة عين
قولي إنت فين؟

آخر الطريق ما لقيتش غير لحني حزين
جف البكى من فرط صبري ع السنين
صدق اللي قاللك إن بعض العشق دين
جف البكى ما عادش باقي في عيني شيء
آخر الطريق ما لقيتش غير لحني حزين
جف البكى من فرط صبري ع السنين
صدق اللي قاللك إن بعض العشق دين
جف البكى ما عادش باقي في عيني شيءEmbed","[['neutral'], ['neutral'], ['neutral'], ['neutral'], ['neutral'], ['neutral'], ['neutral'], ['neutral'], ['neutral'], ['neutral'], ['neutral'], ['neutral'], ['neutral'], ['neutral'], ['neutral'], ['neutral'], ['neutral'], ['neutral'], ['neutral'], ['neutral'], ['neutral'], ['neutral'], ['neutral'], ['neutral'], ['confusion', 'neutral'], ['neutral'], ['neutral'], ['neutral'], ['neutral'], ['neutral'], ['neutral'], ['neutral'], ['neutral'], ['neutral'], ['neutral'], ['neutral'], ['neutral'], ['neutral'], ['neutral'], ['neutral'], ['neutral'], ['neutral'], ['neutral'], ['neutral'], ['neutral'], ['neutral'], ['neutral'], ['neutral'], ['neutral'], ['neutral'], ['neutral'], ['neutral'], ['neutral'], ['neutral'], ['neutral'], ['neutral'], ['neutral'], ['neutral'], ['neutral'], ['neutral'], ['neutral'], ['neutral'], ['neutral'], ['neutral'], ['neutral'], ['neutral']]"
