,Unnamed: 0,artist_title,lyrics,emotions
25,25,Wet Bed Gang - Bairro,"24 ContributorsBairro Lyrics
Eu não pedi afeto a nenhum daqueles que não 'tava comigo
Eu não gosto de fama, eu não quis aparecer
Eu não quero esse brilho
Eu não quis essas fotos, não quis os abraços, só queria curtir
Tenho a selva no sangue, sou bicho do mato, quero 'tar sozinho

Por isso eu vou p'ro sky, ya, ya
Eu e a minha bula e fly, ya, ya
Sozinho no meu bairro, ya, ya
Eu e a minha music high, ya, ya

Uh, se devemos a alguém é bênção ao God
Todos focused no work, sem dar atenção a fotos
'Tou no block, saí da favela mas tenho vista po' morro
Conquista 'tá perto, eu não me iludo com pitas pa' fuck
Fama não é nada sem guita no pocket (Real talk)
Por isso 20 milhões sabe a pouco é (Real talk)
Razão deste esforço e descontentamento
Encontrei na mente uma vibe que me permita 'tar ótimo
Seja promíscuo ou uma love vibe, we gon' fly
Os meus guys, no meu bairro
O meu smile nunca sai lá no sky
Eu tenho motivos que me fazem chorar todos os dias
Mas optei por me fazerem brilhar todos os dias
Basta team, a família, sangria, bula, uma birra
Música faz a magia, sentes a vibe dos winners
Dreamers, believers, preachers
A pôr a vida no ouvido do people que me faz middle fingers
You might also like
Por isso eu vou p'ro sky, ya, ya
Eu e a minha bula e fly, ya, ya
Sozinho no meu bairro, ya, ya
Eu e a minha music high, ya, ya

Sei que cada vez que eu passo eles fazem cara feia
Mas não tenho nada contra quem não esconde a sua inveja
Quando eu 'tou drogado atiro dinheiro em discotecas
Na verdade eu tenho tido mais descontos que despesas
Tive que abraçar o diabo quando Deus me deu desprezo
Que se foda a minha alma, eu vou ser rico de certeza
Eu rejeito entrevistas se não me mostrarem cache
Fodi a filha de um racista, pus filhos na cara dela
No aeroporto eu viajei com 2000 euros na minha mala
Revistaram e encontraram, mas não me tiraram nada
Só a pessoa que me fez estar no mundo é que me cala
Eu não entendo o que vocês fazem tipo DJ Khaled
Para mim polícias são pessoas normais que gostam de se meter na vida dos outros
E eu 'tou tão tonto e fui ter com o meu dealer
Ao nosso ponto de encontro
Bora

Tu não sabes o que é que eu fiz pa' ter a minha primeira chave do carro
Às vezes tinha tanta fome, eu não sei o que é que eu arrotava
Viver do que o bairro dava
Eu e o Kroa a partilhar roupa amarrotada
Ninguém vê coração quando tens a cara rotulada, mas whatever
Na verdade nunca soube como lidar com a falta de G's
Hoje eu não sou vaidoso, eu só emancipei cada cicatriz
Eu 'tava envolvido no 'biz
Então levava desde o guarda-fato à Lisa
Algumas coisas po' pulmão e po' nariz
Hoje eu sou badman, pus a turma toda a cuspir fire, bro
Badman, não peço a ninguém abana a rasta
Badman, shawty diz que o flavour é Jamaican
Badman, momma senta o cú dela num Mazda
Eu tenho os meus niggas na back with me
Sisters na back with me
Im a V-Block winner até a vibe nos matar
E p'ra onde eu for eles também vão
Já dei voz à V-Block, hoje eu vou para o sky
Sky, ya, ya
Eu e a minha bula e fly, ya, ya
Sozinho no meu bairro, ya, ya
Eu e a minha music high, ya, ya5Embed","[['neutral'], ['neutral'], ['neutral'], ['neutral'], ['neutral'], ['neutral'], ['neutral'], ['neutral'], ['neutral'], ['neutral'], ['neutral'], ['neutral'], ['anger'], ['neutral'], ['neutral'], ['neutral'], ['neutral'], ['love', 'optimism', 'neutral'], ['neutral'], ['neutral'], ['neutral'], ['neutral'], ['neutral'], ['neutral'], ['neutral'], ['neutral'], ['confusion', 'neutral'], ['neutral'], ['neutral'], ['neutral'], ['neutral'], ['neutral'], ['neutral'], ['neutral'], ['excitement', 'neutral'], ['neutral'], ['neutral'], ['neutral'], ['neutral'], ['neutral'], ['neutral'], ['neutral'], ['neutral'], ['neutral'], ['neutral'], ['neutral'], ['neutral'], ['neutral'], ['neutral'], ['neutral'], ['neutral'], ['neutral'], ['neutral'], ['neutral'], ['neutral'], ['neutral'], ['neutral'], ['anger', 'neutral'], ['neutral'], ['neutral'], ['neutral'], ['neutral'], ['neutral'], ['neutral'], ['neutral'], ['neutral'], ['neutral'], ['neutral'], ['neutral'], ['neutral']]"
26,26,Slow J - Teu Eternamente,"21 ContributorsTeu Eternamente Lyrics
É que eu hoje sinto-me tão distante
Vivemos separados por tanto (hey)
Eu hoje sinto-me tão distante (hey)
Vivemos separados por tanto
'Mos separados por tanto

Eu sei que ’tás aqui ao lado mas hoje sinto-me tão distante
E o nosso silêncio diz tanto
Mas esquece o que as famílias deviam ser
E bora ser como nós sonhamos
Bora ser como éramos d'antes
Focados no que há de importante
Sem ter amor próprio primeiro, segundo terceiros
O quarto é minguante
E eu 'tou no meu canto

E não quero falar com ninguém, só quero ’tar sozinho (sozinho)
Fiz tanta estrada que esqueci o meu caminho
E não quero falar, não, eu não quero falar, não
Eu não quero falar com ninguém só quero 'tar sozinho

É que eu hoje sinto-me tão distante
Vivemos separados por tanto (hey)
Eu hoje sinto-me tão distante (hey)
Vivemos separados por tanto ('mos separados por tanto)
You might also like
Se o tal dia chegar e sentires só dor no teu peito
Olhares para o que a vida te traz e lhe mandares um beijo
Eu juro queria ajudar-te e tentei
Perdoa-me as falhas
Eu prometo ser melhor daqui p'ra frente
Próximas vidas virão, vemo-nos novamente
Não há bênção como conhecer-te
Teu eternamente

E não quero falar com ninguém
Eu só quero estar sozinho (sozinho)
Fiz tanta estrada, que esqueci o meu caminho
E não quero falar, não, eu não quero falar, não
Eu não quero falar com ninguém, só quero 'tar sozinho

É que eu hoje sinto-me tão distante
Vivemos separados por tanto (hey)
Eu hoje sinto-me tão distante (hey)
Vivemos separados por tanto ('mos separados por tanto)
É que eu hoje sinto-me tão distante11Embed","[['neutral'], ['neutral'], ['joy', 'neutral'], ['neutral'], ['neutral'], ['neutral'], ['neutral'], ['neutral'], ['neutral'], ['neutral'], ['neutral'], ['neutral'], ['neutral'], ['neutral'], ['neutral'], ['neutral'], ['neutral'], ['neutral'], ['neutral'], ['neutral'], ['joy', 'neutral'], ['neutral'], ['confusion', 'neutral'], ['neutral'], ['neutral'], ['neutral'], ['neutral'], ['neutral'], ['neutral'], ['neutral'], ['neutral'], ['neutral'], ['neutral'], ['neutral'], ['neutral'], ['neutral'], ['neutral'], ['neutral'], ['joy', 'neutral'], ['neutral'], ['neutral']]"
27,27,WIU - Coração de Gelo,"9 ContributorsCoração de Gelo Lyrics

Rarararara-naum

I get it, get it up, get it up, get it up, boy
Ainda tem grana a fazer por aí
Ela não vai te ligar, nem chamar pra sair
Cai pra noite, vai, deixa o baile seguir (Ye-eh-eh, ye)
Mas que falta de sorte
Trata o coração quebrado fumando um da forte (Oh-oh-oh-ohn)
Várias bunda' no lugar, mas nada que me importe
Só de olhar lá no fundo do olho
Eu já sei que nenhuma faz como tu faz
Te apresento essa neném com cara de malva' (Da)
Descendo do Uber com as cunhada'
Fuma um vape com gosto de ""hoje a mãe arrasa"" (Eh)
Aproveita е me leva pra tua casa (Eh-eh)
Mе promete prazer (Eh), preciso de amor não
Já me conformei que eu não vou segurar a sua mão
Mas tudo bem, tudo, tudo bem, tranquilão
Se ela me magoar, eu ligo a outra que ela tem mó bundão (Wow)

Essa bitch tá desconsiderando o nêgo
A nêga é coração de gelo
Essa bebê cara é foda, ela me deu um nó (Oh)
Ela não quer mais amor, só quer o isqueiro
Essa bitch tá desconsiderando o nêgo (Oh)
A nêga é coração de gelo
Essa bebê cara é foda, ela me deu um nó (Oh)
Ela não quer mais amor, só quer dinheiro
You might also like
Deixa eu quebrar o gelo do seu coração
Primeiro nós fode, depois fuma um balão
Ficou com tesão no brilho do cordão
Nem pensa em romance, ela só quer tapão
Get it, get it up, get it up, get it up, boy
Tranquilão fumando um do bom por aí
Sempre na onda, eu não deixo a vibe cair
Se quiser colar, vem, é só me seguir
My, my, my, my baby, foda que eu e ela era sal (Era sal)
Aquela raba fora do normal
Ela disse que quer conhecer Fortal'
Viciou no meu flow, no estilo vetin' criminal

Essa bitch tá desconsiderando o nêgo
A nêga é coração de gelo
Essa bebê cara é foda, ela me deu um nó (Oh)
Ela não quer mais amor, só quer o isqueiro
Essa bitch tá desconsiderando o nêgo (Oh)
A nêga é coração de gelo
Essa bebê cara é foda, ela me deu um nó (Oh)
Ela não quer mais amor, só quer dinheiro

Deixa eu quebrar o gelo do seu coração
Oh, oh
Ficou com tesão no brilho do cordão
Oh, ohEmbed","[['neutral'], ['neutral'], ['neutral'], ['neutral'], ['neutral'], ['neutral'], ['neutral'], ['neutral'], ['neutral'], ['neutral'], ['neutral'], ['neutral'], ['neutral'], ['neutral'], ['neutral'], ['neutral'], ['neutral'], ['excitement'], ['neutral'], ['neutral'], ['neutral'], ['neutral'], ['neutral'], ['neutral'], ['neutral'], ['neutral'], ['confusion', 'neutral'], ['neutral'], ['neutral'], ['neutral'], ['neutral'], ['caring', 'neutral'], ['neutral'], ['neutral'], ['neutral'], ['excitement', 'neutral'], ['neutral'], ['neutral'], ['neutral'], ['neutral'], ['neutral'], ['neutral'], ['neutral'], ['neutral'], ['neutral'], ['neutral'], ['neutral'], ['neutral'], ['neutral'], ['neutral'], ['neutral']]"
28,28,The Neighbourhood - Sweater Weather,"195 ContributorsTranslationsTürkçePortuguêsDanskРусскийPortuguêsFrançaisDeutschالعربيةItalianoSweater Weather Lyrics
And all I am is a man
I want the world in my hands
I hate the beach, but I stand
In California with my toes in the sand
Use the sleeves of my sweater, let's have an adventure
Head in the clouds, but my gravity's centered
Touch my neck and I'll touch yours
You in those little high-waisted shorts, oh

She knows what I think about
And what I think about
One love, two mouths
One love, one house
No shirt, no blouse
Just us, you find out
Nothing that I wouldn't wanna tell you about, no

'Cause it's too cold for you here and now
So let me hold both your hands in the holes of my sweater

And if I may just take your breath away
I don't mind if there's not much to say
Sometimes the silence guides a mind
To move to a place so far away
The goosebumps start to raise
The minute that my left hand meets your waist
And then I watch your face
Put my finger on your tongue 'cause you love the taste, yeah
These hearts adore
Everyone the other beats hardest for
Inside, this place is warm
Outside, it starts to pour
You might also like
Comin' down
One love, two mouths
One love, one house
No shirt, no blouse
Just us, you find out
Nothin' that I wouldn't wanna tell you about
No, no, no

'Cause it's too cold for you here and now
So let me hold both your hands in the holes of my sweater
'Cause it's too cold for you here and now
So let me hold both your hands in the holes of my sweater
Woah

Woah, woah, woah
Woah, woah, woah, woah
Woah, woah
Woah, woah, woah, woah
Woah, woah

'Cause it's too cold for you here and now
So let me hold both your hands in the holes of my sweater
'Cause it's too cold for you here and now
Let me hold both your hands in the holes of my sweater
And it's too cold, it's too cold
The holes of my sweater516Embed","[['neutral'], ['desire'], ['anger', 'disapproval'], ['neutral'], ['excitement'], ['neutral'], ['neutral'], [], ['neutral'], ['neutral'], ['love'], ['love'], ['neutral'], ['neutral'], ['neutral'], ['neutral'], ['neutral'], ['annoyance', 'neutral'], ['approval'], ['neutral'], ['neutral'], ['excitement', 'neutral'], ['neutral'], ['neutral'], ['love'], ['admiration', 'love', 'neutral'], ['neutral'], ['approval', 'caring'], ['neutral'], ['confusion', 'neutral'], ['neutral'], ['love'], ['love'], ['neutral'], ['neutral'], ['neutral'], ['disapproval'], ['neutral'], ['neutral'], ['neutral'], ['neutral'], ['surprise'], ['surprise'], ['surprise'], ['surprise'], ['surprise'], ['surprise'], ['neutral'], ['neutral'], ['neutral'], ['caring', 'neutral'], ['disapproval', 'neutral'], ['neutral']]"
29,29,Ivandro - Moça,"2 ContributorsMoça Lyrics

Moça, tu és tão sexy
Diz-me, queres dançar comigo?
Moça, tu és tão sexy
Diz-me, queres dançar comigo?

Só pela troca de olhares, senti o fogo
Tu nunca vais me incomodar, liga de novo
'Tou a sentir a tua vibe e não é pouco, baby
A tua bunda encaixada no meu colo, tetris

Destabilizaste o meu sistema
Gostei de ver o package
Essa miúda é tão completa
Sempre que nós falamos, mostra que tem bué cabeça
No dia que assentar vai ser contigo de certeza

Moça, tu és tão sexy
Diz-me, queres dançar comigo?
Moça, tu és tão sexy
Diz-me, queres dançar comigo?
You might also like
Por este andar e com esse clima
Fico em baixo e tu em cima
‘Tás à vontade, podes guiar
Seduziste-me com esse teu charme
Quero fazer muito amor
Ouvir aquilo que tu dizes
Nem que seja o mundo todo
Eu dou-te tudo o que pedires
Se eu não ‘tou apaixonado, é algo muito parecido
Ficas bem com essa tua saia, mas ‘tavas melhor comigo

Destabilizaste o meu sistema
Gostei de ver o package
Essa miúda é tão completa
Sempre que nós falamos, mostra que tem bué cabeça
No dia que assentar vai ser contigo de certeza

Moça, tu és tão sexy
Diz-me, queres dançar comigo?
Moça, tu és tão sexy
Diz-me, queres dançar comigo?Embed","[['excitement', 'neutral'], ['curiosity', 'neutral'], ['excitement', 'neutral'], ['curiosity', 'neutral'], ['neutral'], ['neutral'], ['love', 'neutral'], ['neutral'], ['neutral'], ['neutral'], ['neutral'], ['neutral'], ['neutral'], ['excitement', 'neutral'], ['curiosity', 'neutral'], ['excitement', 'neutral'], ['curiosity', 'neutral'], ['confusion', 'neutral'], ['neutral'], ['neutral'], ['neutral'], ['neutral'], ['neutral'], ['neutral'], ['neutral'], ['neutral'], ['neutral'], ['neutral'], ['neutral'], ['neutral'], ['neutral'], ['neutral'], ['neutral'], ['excitement', 'neutral'], ['curiosity', 'neutral'], ['excitement', 'neutral'], ['neutral']]"
30,30,Elton John - Cold Heart - PNAU Remix,"1 ContributorNew Music Friday 8/13/21 LyricsLizzo - Rumors (feat. Cardi B)
PinkPantheress - Just for me
Machine Gun Kelly - papercuts
blackbear - alone in a room full of people
WizKid - Essence (feat. Justin Bieber & Tems)
Dan + Shay - Steal My Love
Tiësto - Don't Be Shy
J Balvin - Que Locura
Sub Urban & Bella Poarch - INFERNO
Still Woozy - Woof
Jungle - All Of The Time
Elton John - Cold Heart - PNAU Remix
Kygo - Love Me Now (feat. Zoe Wees)
Kodak Black - Before I Go (feat. Rod Wave)
Swae Lee - Ball Is Life (feat. Jack Harlow)
Jay Wheeler - Take My Life
Chelsea Cutler - You Can Have It
Joel Corry - OUT OUT (feat. Charli XCX & Saweetie)
YNW Melly - Mind of Melvin (feat. Lil Uzi Vert)
NLE Choppa - Mmm Hmm
Deb Never - Sweet & Spice
binki - Invisible Fence 🕒
ericdoa - back n forth
RÜFÜS DU SOL - Next to Me
VanJess - Slow Down (feat. Lucky Daye)
The Killers - Runaway Horses (feat. Phoebe Bridgers) - Abridged
Sueco - Paralyzed
Junior Varsity - Limousine
Ben Platt - I wanna love you but I don’t
KIRBY - Break Her Heart For Me
$uicideboy$ - Life Is but a Stream~
DJ Snake - Run It (feat. Rick Ross & Rich Brian)
Coi Leray - Okay Yeah!
Prince Royce - Lao' a Lao'
Masked Wolf - Bop
James Arthur - Avalanche
Alessia Cara - The Use In Trying
Luke Hemmings - Baby Blue
Big Thief - Little Things
Sam Austins - JOY FOR YOUTH (with Sir Chloe)
spill tab - Indecisive (feat. Tommy Genesis)
Wale - Down South (feat. Yella Beezy & Maxo Kream)
Iggy Azalea - Is That Right
Reik - Loquita
Love Regenerator - We Can Come Together
Oscar Lang - Yeah!
Jade Bird - Candidate
Amos Lee - Worry No More
Trey Lewis - Shut the Door 🕒
Maude Latour - Clean
Louis The Child - hate u cuz i don't (feat. Bea Miller)
Cheat Codes - All Things $ Can Do (with Travis Barker & Tove Styrke)
21 Savage - Lazy Susan (with Rich Brian feat. Warren Hue & Masiwei)
Denzel Curry - The Game
POORSTACY - Party At The Cemetery
Aries - KIDS ON MOLLY
BabyJake - Watching
chloe moriondo - not okay (feat. mazie)
Sean Paul - Only Fanz (feat. Ty Dolla $ign)
Sebastian Yatra - Delincuente
Nao - Wait
Lecrae - Everyday
K CAMP - Rain On Your Skin (feat. Mooski)
Lonr. - Read My Mind (feat. Yung Bleu)
midwxst - Tic Tac Toe
Magdalena Bay - Secrets (Your Fire)
Day Wave - Before We Knew
THE BLOSSOM - SPORTS CAR
Weston Estate - Outside
jamesjamesjames - My Purple iPod Nano
Loud Luxury - Holiday Hills
EBEN - I Miss You
Maisie Peters - You Signed Up For This
GAYLE - abcdefu
Avery Lynch - Shit People
gabriel black - molotov
Flipp Dinero - Play My Part
D Smoke - Shame On You 🕒
Isaia Huron - Fallen / DGYLA
Mia Rodriguez - Billion Dollar Bitch
Rence - AWOOO!
Mallory Merk - Devil Laugh
Tenille Arts - Over You is You (feat. Matt Stell)
Jelly Roll - Sober
BIG30 - Backseat Of The Rolls Truck 🕒
Monaleo - Suck It Up
Deijuvhs - Flower Ghoul
Balu Brigada - Favourite Clothes
Madeline The Person - August (feat. Adam Melchor)
Keni - Big Enough
Johnny Orlando - Daydream
morgxn - DON'T THINK ABOUT IT
Dead Sara - Heroes
Bendigo Fletcher - Retail Lord
DJ Seinfeld - She Loves Me 🐚
Icewear Vezzo - Chamber Brothers 🕒
Wande - Don’t Worry Bout It
BAYLI - 16
COLETON RUBIN - Dad
Augustine - Summer WineEmbed","[['neutral'], ['neutral'], ['neutral'], ['excitement', 'neutral'], ['love', 'neutral'], ['neutral'], ['neutral'], ['neutral'], ['neutral'], ['neutral'], ['neutral'], ['love', 'neutral'], ['neutral'], ['neutral'], ['neutral'], ['admiration', 'neutral'], ['neutral'], ['neutral'], ['neutral'], ['neutral'], ['neutral'], ['neutral'], ['neutral'], ['neutral'], ['neutral'], ['neutral'], ['neutral'], ['love'], ['neutral'], ['neutral'], ['neutral'], ['neutral'], ['neutral'], ['neutral'], ['neutral'], ['neutral'], ['neutral'], ['neutral'], ['neutral'], ['neutral'], ['neutral'], ['approval', 'neutral'], ['neutral'], ['love'], ['neutral'], ['neutral'], ['fear', 'nervousness', 'neutral'], ['annoyance', 'neutral'], ['neutral'], ['neutral'], ['neutral'], ['neutral'], ['neutral'], ['neutral'], ['neutral'], ['neutral'], ['disappointment', 'disapproval', 'neutral'], ['neutral'], ['neutral'], ['neutral'], ['neutral'], ['neutral'], ['neutral'], ['neutral'], ['neutral'], ['neutral'], ['neutral'], ['neutral'], ['neutral'], ['neutral'], ['sadness', 'neutral'], ['neutral'], ['anger', 'neutral'], ['neutral'], ['neutral'], ['neutral'], ['disgust'], ['neutral'], ['anger', 'annoyance'], ['admiration', 'neutral'], ['neutral'], ['neutral'], ['neutral'], ['neutral'], ['neutral'], ['neutral'], ['neutral'], ['neutral'], ['neutral'], ['neutral'], ['neutral'], ['neutral'], ['neutral'], ['love'], ['approval'], ['neutral'], ['neutral'], ['neutral'], ['neutral']]"
31,31,The Weeknd - Starboy,"521 ContributorsTranslationsTürkçeEspañolРусскийPortuguêsFrançaisDeutschStarboy Lyrics
Ayy

I'm tryna put you in the worst mood, ah
P1 cleaner than your church shoes, ah
Milli point two just to hurt you, ah
All red Lamb' just to tease you, ah
None of these toys on lease too, ah
Made your whole year in a week too, yah
Main bitch outta your league too, ah
Side bitch outta your league too, ah
House so empty, need a centerpiece
Twenty racks a table, cut from ebony
Cut that ivory into skinny pieces
Then she clean it with her face, man, I love my baby, ah
You talkin' money, need a hearin' aid
You talkin' 'bout me, I don't see the shade
Switch up my style, I take any lane
I switch up my cup, I kill any pain

(Ha-ha-ha-ha-ha, ha-ha-ha-ha-ha)
Look what you've done
(Ha-ha-ha-ha-ha, ha-ha-ha-ha-ha)
I'm a motherfuckin' starboy
(Ha-ha-ha-ha-ha, ha-ha-ha-ha-ha)
Look what you've done
(Ha-ha-ha-ha-ha, ha-ha-ha-ha-ha)
I'm a motherfuckin' starboy
You might also like
Every day, a nigga try to test me, ah
Every day, a nigga try to end me, ah
Pull off in that Roadster SV, ah
Pockets overweight, gettin' hefty, ah
Comin' for the king, that's a far cry, I
I come alive in the fall time, I
The competition, I don't really listen
I'm in the blue Mulsanne, bumpin' New Edition
House so empty, need a centerpiece
Twenty racks a table, cut from ebony
Cut that ivory into skinny pieces
Then she clean it with her face, man, I love my baby, ah
You talkin' money, need a hearin' aid
You talkin' 'bout me, I don't see the shade
Switch up my style, I take any lane
I switch up my cup, I kill any pain

(Ha-ha-ha-ha-ha, ha-ha-ha-ha-ha)
Look what you've done
(Ha-ha-ha-ha-ha, ha-ha-ha-ha-ha)
I'm a motherfuckin' starboy
(Ha-ha-ha-ha-ha, ha-ha-ha-ha-ha)
Look what you've done
(Ha-ha-ha-ha-ha, ha-ha-ha-ha-ha)
I'm a motherfuckin' starboy
Let a nigga brag Pitt
Legend of the fall, took the year like a bandit
Bought Mama a crib and a brand new wagon
Now she hit the grocery shop lookin' lavish
Star Trek roof in that Wraith of Khan
Girls get loose when they hear this song
A hundred on the dash get me close to God
We don't pray for love, we just pray for cars
House so empty, need a centerpiece
Twenty racks a table, cut from ebony
Cut that ivory into skinny pieces
Then she clean it with her face, man, I love my baby, ah
You talkin' money, need a hearin' aid
You talkin' 'bout me, I don't see the shade
Switch up my style, I take any lane
I switch up my cup, I kill any pain

(Ha-ha-ha-ha-ha, ha-ha-ha-ha-ha)
Look what you've done
(Ha-ha-ha-ha-ha, ha-ha-ha-ha-ha)
I'm a motherfuckin' starboy
(Ha-ha-ha-ha-ha, ha-ha-ha-ha-ha)
Look what you've done
(Ha-ha-ha-ha-ha, ha-ha-ha-ha-ha)
I'm a motherfuckin' starboy
(Ha-ha-ha-ha-ha, ha-ha-ha-ha-ha)
Look what you've done
(Ha-ha-ha-ha-ha, ha-ha-ha-ha-ha)
I'm a motherfuckin' starboy
(Ha-ha-ha-ha-ha, ha-ha-ha-ha-ha)
Look what you've done
(Ha-ha-ha-ha-ha, ha-ha-ha-ha-ha)
I'm a motherfuckin' starboy628Embed","[['neutral'], ['annoyance', 'disgust'], ['annoyance', 'disgust', 'neutral'], ['annoyance', 'neutral'], ['amusement', 'annoyance', 'neutral'], ['neutral'], ['neutral'], ['anger'], ['anger', 'neutral'], ['neutral'], ['neutral'], ['neutral'], ['love'], ['caring', 'neutral'], ['neutral'], ['approval'], ['neutral'], ['amusement', 'joy'], ['annoyance', 'neutral'], ['amusement', 'joy'], ['anger'], ['amusement', 'joy'], ['annoyance', 'neutral'], ['amusement', 'joy'], ['anger'], ['confusion', 'neutral'], ['neutral'], ['sadness'], ['neutral'], ['neutral'], ['neutral'], ['neutral'], ['disappointment'], ['neutral'], ['neutral'], ['neutral'], ['neutral'], ['love'], ['caring', 'neutral'], ['neutral'], ['approval'], ['neutral'], ['amusement', 'joy'], ['annoyance', 'neutral'], ['amusement', 'joy'], ['anger'], ['amusement', 'joy'], ['annoyance', 'neutral'], ['amusement', 'joy'], ['anger'], ['neutral'], ['neutral'], ['neutral'], ['neutral'], ['neutral'], ['neutral'], ['neutral'], ['disapproval', 'neutral'], ['neutral'], ['neutral'], ['neutral'], ['love'], ['caring', 'neutral'], ['neutral'], ['approval'], ['neutral'], ['amusement', 'joy'], ['annoyance', 'neutral'], ['amusement', 'joy'], ['anger'], ['amusement', 'joy'], ['annoyance', 'neutral'], ['amusement', 'joy'], ['anger'], ['amusement', 'joy'], ['annoyance', 'neutral'], ['amusement', 'joy'], ['anger'], ['amusement', 'joy'], ['annoyance', 'neutral'], ['amusement', 'joy'], ['anger']]"
