,Unnamed: 0,artist_title,lyrics,emotions
64,64,Van Zee - Alma Nua,"5 ContributorsAlma Nua Lyrics
E essa cara brilha mais que a lua
Juro com uma luz que é tão tua
E se acabar o tempo e eu me confortar com o medo
Choro por mais um momento de alma nua
E essa cara brilha mais que a lua
Juro com uma luz que é tão tua
E se acabar o tempo e eu me confortar com o medo
Choro por mais um momento de alma nua

Paro por um segundo com o teu cabelo à chuva
Diz-me se vale a pena, ya viver para esta luta
‘Cause I’ve been through it all
São três da matina and I’m waiting for your call
Baby, call me
Eu quero esse lifestyle me'mo à Louis with the rollie
I put that on mysеlf, G, no hustle, nos meus homies
Acrеdita tou ca' firma desde o começo
G's 'tão a dar bué small talk e eu juro que nem os conheço
Quero notas roxas no meu wrist
'Tava bem numa praia em Ibiza
Far away from all of this
Vou fazer o meu e ser quem sou como o meu cota disse
Ele 'tá bem eu sei, I'm on my way to make my momma rich
Mano eu já perdi o chão, não perdi o love
That’s ‘cause I got brothers that are watching from above
Dava-lhes o mundo mas my bro that’s not enough
Shit got tough, shit got rough
You might also like
E 'tava nublado, nublado, nublado
E eu nublado no block sem ti
Eu quero mudar, mudar, mudar
Mas tão mudado eu perdi-me

E essa cara brilha mais que a lua
Juro com uma luz que é tão tua
E se acabar o tempo e eu me confortar com o medo
Choro por mais um momento de alma nua
E essa cara brilha mais que a lua
Juro com uma luz que é tão tua
E se acabar o tempo e eu me confortar com o medo
Choro por mais um momento de alma nua

E eu entrei bué tarde, era hábito
Um gajo ficava a pensar no tempo
Agora fico a pensar num 'rari, no ice e na lifestyle mais cara
E é claro que é normal eu ficar mais ausente
E se eu me focar na tua cara
Just for long enough eu juro compro-te uma mala
Por teres carregado o meu passado assim do nada
Com a saudade e a mágoa dum gajo
Valorizo ter-te by my side
Really feel like this is a family tie
Isso é ride or die ou é quê baby? (Hold up)
Isso é ride or die ou é quê baby?
E 'tava nublado, nublado, nublado
E eu nublado no block sem ti
Eu quero mudar, mudar, mudar
Mas tão mudado eu perdi-me

E essa cara brilha mais que a lua
Juro com uma luz que é tão tua
E se acabar o tempo e eu me confortar com o medo
Choro por mais um momento de alma nua

E essa cara brilha mais que a lua
Juro com uma luz que é tão tua
E se acabar o tempo e eu me confortar com o medo
Choro por mais um momento de alma nuaEmbed","[['neutral'], ['neutral'], ['neutral'], ['neutral'], ['neutral'], ['neutral'], ['neutral'], ['neutral'], ['neutral'], ['neutral'], ['approval', 'neutral'], ['gratitude', 'neutral'], ['neutral'], ['neutral'], ['neutral'], ['neutral'], ['neutral'], ['neutral'], ['neutral'], ['neutral'], ['neutral'], ['optimism', 'neutral'], ['love', 'neutral'], ['neutral'], ['neutral'], ['disappointment', 'sadness'], ['confusion', 'neutral'], ['neutral'], ['neutral'], ['neutral'], ['neutral'], ['neutral'], ['neutral'], ['neutral'], ['neutral'], ['neutral'], ['neutral'], ['neutral'], ['neutral'], ['neutral'], ['neutral'], ['neutral'], ['neutral'], ['neutral'], ['neutral'], ['neutral'], ['neutral'], ['neutral'], ['neutral'], ['neutral'], ['curiosity', 'neutral'], ['neutral'], ['neutral'], ['neutral'], ['neutral'], ['neutral'], ['neutral'], ['neutral'], ['neutral'], ['neutral'], ['neutral'], ['neutral'], ['neutral']]"
65,65,FRANKIEONTHEGUITAR - Imagina,"4 ContributorsImagina Lyrics

Imagina se eu não gastasse tanto tempo na saída
Se eu não mandasse umas mensagens nessas queridas (Hm)
Se eu gastasse o meu tempo, perdesse o meu tempo
Só a sonhar contigo
Vá, anda baby, imagina
Se eu não gastasse tanto tempo na saída (Hm)
Se eu gastasse o meu tempo, perdesse o meu tempo
Só a sonhar contigo, a sonhar contigo
Sonhar contigo
Hey

O sentimento não mudou
Se for para dar a cara, eu dou
Ya baby, we gotta grow
Como esses nossos sentimentos
Quando eu estou a olhar p'ra trás, vejo só grandes momentos
E o tempo ainda não parou p'ra nós
Já não é um passatempo, quero construir um império
'Tou a cuspir o meu sentimento
Tens de levar mais a sério e aproveitar os momentos
You might also like
Imagina se eu não gastasse tanto tempo na saída
Se eu não mandasse umas mensagens nessas queridas (Hm)
Se eu gastasse o meu tempo, perdesse o meu tempo
Só a sonhar contigo, a sonhar contigo
Sonhar contigo
Hey

Imagina o sentimento
Quando eu ouço essa guitarra pela primeira vez
Tocá-la p'a uma multidão pela primeira vez
Ouvi-los cantar a minha canção pela primeira vez
Ainda me arrepia, só lembrar a nossa primeira vez
Deixar fluir, nada a fazer depois no fim do dia
É assim que soa a nossa história, eu não a afinaria
Se eu voltasse atrás no tempo
E derramasse a areia da nossa ampulheta a meio de um deserto
O que é que florescia?
E eu sei que estás aqui ao meu lado
Não tenho casa e trabalho, só tenho amar e amar
P'a quê deixar um de lado se a escolha não tem uma solução
Não vou ficar com metade, dá-me essa vida ao quadrado
Vou ter de sonhar mais alto
Nem se eu usar a imaginação encontrava outra resposta
Outra melhor do que a nossa
Outra saída me mostra
Depois de tudo o que hoje eu sei
Baby, imagina
Imagina se eu não gastasse tanto tempo na saída
Se eu não mandasse umas mensagens nessas queridas (Hm)
Se eu gastasse o meu tempo, perdesse o meu tempo
Só a sonhar contigo
Anda baby, imagina
Se eu não gastasse tanto tempo na saída (Hm)
Se eu gastasse o meu tempo, perdesse o meu tempo
Só a sonhar contigo, a sonhar contigo
Sonhar contigo
Hey2Embed","[['neutral'], ['neutral'], ['neutral'], ['neutral'], ['neutral'], ['neutral'], ['neutral'], ['neutral'], ['neutral'], ['neutral'], ['neutral'], ['neutral'], ['approval'], ['neutral'], ['neutral'], ['neutral'], ['neutral'], ['neutral'], ['neutral'], ['confusion', 'neutral'], ['neutral'], ['neutral'], ['neutral'], ['neutral'], ['neutral'], ['neutral'], ['neutral'], ['neutral'], ['neutral'], ['neutral'], ['neutral'], ['neutral'], ['neutral'], ['neutral'], ['neutral'], ['curiosity', 'neutral'], ['neutral'], ['neutral'], ['neutral'], ['neutral'], ['neutral'], ['neutral'], ['neutral'], ['neutral'], ['neutral'], ['neutral'], ['neutral'], ['neutral'], ['neutral'], ['neutral'], ['neutral'], ['neutral'], ['neutral'], ['neutral'], ['neutral'], ['neutral']]"
66,66,Piruka - Louco,"7 ContributorsLouco Lyrics

Ayy, yeah
No, no
No, no

Miúda às vezes fico a pensar que o nosso love é louco
Fico sentado a tentar escrever cada momento nosso
Só me encontro quando 'tás perto e adoro esse nosso jogo
Porque depois volto-me a perder nas curvas do teu corpo
Nosso love é louco, nosso love é lindo
Fico a pensar se hoje eu vou, pensar se hoje eu fico
Então não vou dar o golpe, fica aqui comigo, miúda
Miúda às vezes fico a pensar que o nosso love louco
Fico sentado a tentar escrever cada momento nosso
Só me encontro quando 'tás perto e adoro esse nosso jogo
Porque depois volto-me a perder nas curvas do teu corpo
Miúda, o nosso love é louco, nosso love é lindo
Não pensa no que houve, mas pensa no que eu digo
'Bora tentar de novo, se não der eu repito
Então apaga a luz, já acende a bula

E vem curtir essa vibe, yeah, yeah
O nosso love é louco, é louco, é louco
Então vem curtir essa vibe, yeah, yeah
O nosso love é louco, é louco, é louco
Então vem curtir essa vibe, yeah, yeah
Yeah, yeah, yeah, yeah
Então vem curtir essa vibe, yeah, yeah
Yeah, yeah, ayy, ayy, ayy
You might also like
Nosso love é louco, nosso love é lindo
Fico a pensar se hoje eu vou, pensar se hoje eu fico
Então não vou dar o golpe, fica aqui comigo, miúda, hmm
Nosso love é louco, nosso love é louco, hmm
Nosso love é louco, nosso love é louco, yeah
Nosso love é louco, nosso love é louco, hmm

Minha pequena, para e olha no meu rosto
O meu tempo é contado, chega e aproveita
Tenho horas p'ra 'tar no palco, mas tu queres encosto
Hoje só posso ser o que come e que não se deita
Então minha morena, vem, vem
Sente a música no toque quando toco no teu corpo
Minha morena, vem, vem
Comigo na minha loucura que p'ra mim dura tão pouco
E eu só quero um beijo teu, um momento nosso
Sentir que se aconteceu podia acontecer de novo
Então tu desliga o telefone, sim
Tu desliga o telefone, já tenho o meu em modo voo
E eu disse, na vida não há impossíveis
Vamos brindar a nós, viver o nosso conto
Para o mundo não somos visíveis
Hoje é só tu e eu e aponta que eu 'tou pronto
Então minha morena, vem, vem
Sente a música no toque quando toco no teu corpo
Minha morena, vem, vem
Comigo na minha loucura que p'ra mim dura tão pouco
Hoje é só tu e eu, quero um momento nosso
Ter um momento meu, nem sabia que posso
Ter com a vida que tenho
Então minha morena, vem
Então vem curtir essa vibe, yeah, yeah
O nosso love é louco, é louco, é louco
Então vem curtir essa vibe, yeah, yeah
O nosso love é louco, é louco, é louco
Então vem curtir essa vibe, yeah, yeah
Yeah, yeah, yeah, yeah
Então vem curtir essa vibe, yeah, yeah
Yeah, yeah, ayy, ayy, ayy

Nosso love é louco, nosso love é lindo
Fico a pensar se hoje eu vou, pensar se hoje eu fico
Então não vou dar o golpe, fica aqui comigo, miúda, hmm
Nosso love é louco, nosso love é louco
Nosso love é louco, nosso love é louco, yeah
Nosso love é louco, nosso love é louco, hmm
Ayy, ayy, ayy2Embed","[['approval', 'neutral'], ['disapproval'], ['disapproval'], ['neutral'], ['neutral'], ['neutral'], ['neutral'], ['love', 'neutral'], ['neutral'], ['neutral'], ['neutral'], ['neutral'], ['neutral'], ['neutral'], ['neutral'], ['neutral'], ['neutral'], ['neutral'], ['neutral'], ['love', 'neutral'], ['neutral'], ['love', 'neutral'], ['neutral'], ['approval', 'neutral'], ['neutral'], ['approval', 'neutral'], ['confusion', 'neutral'], ['love', 'neutral'], ['neutral'], ['neutral'], ['love'], ['love'], ['love'], ['neutral'], ['neutral'], ['neutral'], ['neutral'], ['neutral'], ['neutral'], ['neutral'], ['neutral'], ['neutral'], ['neutral'], ['neutral'], ['neutral'], ['neutral'], ['neutral'], ['neutral'], ['neutral'], ['neutral'], ['neutral'], ['neutral'], ['neutral'], ['neutral'], ['neutral'], ['neutral'], ['neutral'], ['neutral'], ['love', 'neutral'], ['neutral'], ['love', 'neutral'], ['neutral'], ['approval', 'neutral'], ['neutral'], ['approval', 'neutral'], ['love', 'neutral'], ['neutral'], ['neutral'], ['love', 'neutral'], ['love'], ['love'], ['neutral']]"
67,67,Billie Eilish - bad guy,"347 ContributorsTranslationsHrvatskiTürkçeSvenskaEspañolРусскийRomânăPortuguêsPolskiItalianoHebrewDeutschFrançaisفارسیNederlandsDanskChinese TraditionalΕλληνικάالعربيةไทย / Phasa Thai​bad guy Lyrics
White shirt now red, my bloody nose
Sleepin', you're on your tippy toes
Creepin' around like no one knows
Think you're so criminal
Bruises on both my knees for you
Don't say thank you or please
I do what I want when I'm wanting to
My soul? So cynical

So you're a tough guy
Like it really rough guy
Just can't get enough guy
Chest always so puffed guy
I'm that bad type
Make your mama sad type
Make your girlfriend mad tight
Might seduce your dad type
I'm the bad guy
Duh

I'm the bad guy

I like it when you take control
Even if you know that you don't
Own me, I'll let you play the role
I'll be your animal
My mommy likes to sing along with me
But she won't sing this song
If she reads all the lyrics
She'll pity the men I know
See Billie Eilish LiveGet tickets as low as $94You might also like
So you're a tough guy
Like it really rough guy
Just can't get enough guy
Chest always so puffed guy
I'm that bad type
Make your mama sad type
Make your girlfriend mad tight
Might seduce your dad type
I'm the bad guy
Duh

I'm the bad guy, duh
I'm only good at bein' bad, bad

I like when you get mad
I guess I'm pretty glad that you're alone
You said she's scared of me?
I mean, I don't see what she sees
But maybe it's 'cause I'm wearing your cologne

I'm a bad guy
I'm, I'm a bad guy
Bad guy, bad guy
I'm a bad346Embed","[['anger', 'sadness'], ['caring', 'neutral'], ['neutral'], ['annoyance', 'neutral'], ['anger', 'neutral'], ['gratitude'], ['neutral'], ['confusion', 'curiosity', 'fear'], ['neutral'], ['neutral'], ['neutral'], ['neutral'], ['disapproval'], ['sadness', 'neutral'], ['neutral'], ['neutral'], ['anger', 'neutral'], ['neutral'], ['anger', 'neutral'], ['love'], ['neutral'], ['neutral'], ['neutral'], ['neutral'], ['disapproval', 'neutral'], ['neutral'], ['neutral'], ['neutral'], ['neutral'], ['neutral'], ['neutral'], ['neutral'], ['disapproval'], ['sadness', 'neutral'], ['neutral'], ['neutral'], ['anger', 'neutral'], ['neutral'], ['neutral'], ['approval', 'neutral'], ['love'], ['joy'], ['confusion', 'curiosity'], ['neutral'], ['neutral'], ['fear'], [], ['neutral'], ['neutral']]"
68,68,OneRepublic - I Ain't Worried,"48 ContributorsTranslationsDeutschI Ain’t Worried Lyrics
I don't know what you've been told
But time is running out, no need to take it slow
I'm stepping to you toe-to-toe
I should be scared, honey, maybe so

But I ain't worried 'bout it right now (Right now)
Keeping dreams alive, 1999, heroes
I ain't worried 'bout it right now (Right now)
Swimmin' in the floods, dancing on the clouds below

I ain't worried 'bout it
I ain't worried 'bout it (Hey)

I don't know what you've been told
But time is running out so spend it like it's gold
I'm living like I'm nine-zeros
Got no regrets even when I am broke (Yeah)
I'm at my best when I got something I'm wanting to steal
Way too busy for them problems and problems to feel (Yeah, yeah)
No stressing, just obsessing with sealing the deal
I'll take it in and let it go
See OneRepublic LiveGet tickets as low as $124You might also like
But I ain't worried 'bout it right now (Right now)
Keeping dreams alive, 1999, heroes
I ain't worried 'bout it right now (Right now)
Swimmin' in the floods, dancing on the clouds below

I ain't worried 'bout it
I ain't worried 'bout it (Hey)

Ooh, I ain't worried
Ooh, oh, no, no

I ain't worried 'bout it right now (Right now)
Keeping dreams alive, 1999, heroes
I ain't worried 'bout it right now (Right now)
Swimmin' in the floods, dancing on the clouds below

I ain't worried 'bout it (Ooh, hey)
I ain't worried 'bout it (Ooh, hey)

I ain't worried 'bout it5Embed","[['confusion'], ['disapproval'], ['neutral'], ['fear'], ['approval'], ['optimism', 'neutral'], ['approval'], ['neutral'], ['approval'], ['approval'], ['confusion'], ['realization', 'neutral'], ['neutral'], [], ['optimism'], ['neutral'], ['neutral'], ['neutral'], ['neutral'], ['approval'], ['optimism', 'neutral'], ['approval'], ['neutral'], ['approval'], ['approval'], ['approval', 'relief'], ['disapproval'], ['approval'], ['optimism', 'neutral'], ['approval'], ['neutral'], ['approval', 'relief'], ['approval', 'relief'], ['approval']]"
69,69,Metro Boomin - Creepin',"148 ContributorsTranslationsPortuguêsEspañolTürkçeفارسیDeutschCreepin’ Lyrics
(Just can't believe this, man)
(Metro Boomin want some more, nigga)
Somebody said they saw you
The person you were kissing wasn't me
And I would never ask you
I just kept it to myself

I don't wanna know
If you're playin' me, keep it on the low
'Cause my heart can't take it anymore
And if you creepin', please don't let it show
Oh, baby, I don't wanna know

I think about it when I hold you
When lookin' in your eyes, I can't believe
And I don't need to know the truth
Baby, keep it to yourself

I don't wanna know
If you're playin' me, keep it on the low
'Cause my heart can't take it anymore
And if you creepin', please don't let it show
Oh, baby, I don't wanna know
You might also like
Did he touch you better than me? (Touch you better than me)
Did he watch you fall asleep? (Watch you fall asleep)
Did you show him all those things that you used to do to me?
If you're better off that way (Better off that way)
There ain't more that I can say (More that I can say)
Just go on and do your thing and don't come back to me

Woah, woah, woah, 21
Had me crushin', I was cuffin' like the precinct
How you go from housewife to a sneaky link?
Got you riding 'round in all type of Benzes and Rovers
Girl, you used to ride in the rinky-dink
I'm the one put you in Eliantte (On God)
Fashion Nova model, I put you on the runway (On God)
You was rockin' Coach bags, got you Chane'-ne'
Side bitch in Frisco, I call her my Bay-bae (21)
I got a girl, but I still feel alone (On God)
If you playin' me that mean my home ain't home (On God)
Havin' nightmares of goin' through your phone (21)
Can't even record, you got me out my zone

I don't wanna know
If you're playin' me, keep it on the low
'Cause my heart can't take it anymore
And if you creepin', please don't let it show
Oh, baby, I don't wanna know
If you're playin' me, keep it on the low
'Cause my heart can't take it anymore
And if you creepin', please don't let it show
Oh, baby, I don't wanna know
If you creepin', just don't let me find out (On God)
Get a hotel, never bring 'em to the house (On God)
If you're better off that way
Baby, all that I can say
If you're gonna do your thing, then don't come back to me39Embed","[['surprise', 'neutral'], ['neutral'], ['neutral'], ['neutral'], ['neutral'], ['neutral'], ['neutral'], ['neutral'], ['annoyance', 'disappointment', 'neutral'], ['annoyance', 'neutral'], ['neutral'], ['neutral'], ['surprise'], ['disapproval', 'neutral'], ['neutral'], ['neutral'], ['neutral'], ['annoyance', 'disappointment', 'neutral'], ['annoyance', 'neutral'], ['neutral'], ['confusion', 'neutral'], ['curiosity'], ['curiosity', 'neutral'], ['neutral'], ['caring'], ['neutral'], ['caring', 'neutral'], ['surprise'], ['neutral'], ['curiosity'], ['neutral'], ['neutral'], ['neutral'], ['neutral'], ['admiration', 'neutral'], ['neutral'], ['sadness'], ['neutral'], ['neutral'], ['annoyance', 'disappointment'], ['neutral'], ['neutral'], ['annoyance', 'disappointment', 'neutral'], ['annoyance', 'neutral'], ['neutral'], ['neutral'], ['annoyance', 'disappointment', 'neutral'], ['annoyance', 'neutral'], ['neutral'], ['neutral'], ['neutral'], ['caring'], ['neutral'], ['neutral']]"
70,70,Juice WRLD - Lucid Dreams,"528 ContributorsTranslationsTürkçeРусскийRomânăPortuguêsItalianoHebrewDeutschFrançaisفارسیNederlandsDanskEspañolLatviešuPolskiČeskyLucid Dreams Lyrics
Enviyon on the mix
No, no, no, no
No-no, no, no, no
No, no, no, no, no
No, no, no, no

I still see your shadows in my room
Can't take back the love that I gave you
It's to the point where I love and I hate you
And I cannot change you, so I must replace you, oh
Easier said than done, I thought you were the one
Listenin' to my heart instead of my head
You found another one, but I am the better one
I won't let you forget me
I still see your shadows in my room
Can't take back the love that I gave you
It's to the point where I love and I hate you
And I cannot change you, so I must replace you, oh
Easier said than done, I thought you were the one
Listenin' to my heart instead of my head
You found another one, but I am the better one
I won't let you forget me

You left me falling and landing inside my grave
I know that you want me dead
I take prescriptions to make me feel a-okay
I know it's all in my head
I have these lucid dreams where I can't move a thing
Thinking of you in my bed
You were my everything
Thoughts of a wedding ring
Now I'm just better off dead (Uh, uh, uh)
I'll do it over again
I didn't want it to end
I watch it blow in the wind
I should've listened to my friends
Leave this shit in the past, but I want it to last
You were made outta plastic, fake
I was tangled up in your drastic ways
Who knew evil girls had the prettiest face?
You gave me a heart that was full of mistakes
I gave you my heart and you made heartbreak
You might also like
You made my heart break
You made my heart ache (I still see your shadows in my room)
You made my heart break
You made my heart ache (Can't take back the love that I gave you)
You made my heart break (Were made outta plastic, fake)
You made my heart ache (I still see your shadows in my room)
You made my heart break again (I was tangled up in your drastic ways)
(Who knew evil girls had the prettiest face?)

I still see your shadows in my room
Can't take back the love that I gave you
It's to the point where I love and I hate you
And I cannot change you, so I must replace you, oh
Easier said than done, I thought you were the one
Listenin' to my heart instead of my head
You found another one, but I am the better one
I won't let you forget me
I still see your shadows in my room
Can't take back the love that I gave you
It's to the point where I love and I hate you
And I cannot change you, so I must replace you, oh
Easier said than done, I thought you were the one
Listenin' to my heart instead of my head
You found another one, but I am the better one
I won't let you forget me
Leave this shit in the past, but I want it to last
You were made outta plastic, fake
I was tangled up in your drastic ways
Who knew evil girls had the prettiest face?
Easier said than done, I thought you were—
—instead of my head
You found another— better one
I won't let you forget me523Embed","[['neutral'], ['disapproval'], ['disapproval'], ['disapproval'], ['disapproval'], ['neutral'], ['love'], ['anger', 'love'], ['neutral'], ['realization', 'neutral'], ['neutral'], ['admiration', 'neutral'], ['neutral'], ['neutral'], ['love'], ['anger', 'love'], ['neutral'], ['realization', 'neutral'], ['neutral'], ['admiration', 'neutral'], ['neutral'], ['sadness'], ['neutral'], ['approval', 'neutral'], ['neutral'], ['fear', 'neutral'], ['neutral'], ['neutral'], ['neutral'], ['sadness', 'neutral'], ['neutral'], ['disappointment'], ['neutral'], ['realization'], ['annoyance', 'neutral'], ['neutral'], ['neutral'], ['admiration', 'curiosity'], ['annoyance'], ['love', 'sadness'], ['confusion', 'neutral'], ['sadness'], ['sadness'], ['sadness'], ['love', 'sadness'], ['disappointment', 'sadness'], ['sadness'], ['disappointment'], ['admiration', 'curiosity', 'surprise'], ['neutral'], ['love'], ['anger', 'love'], ['neutral'], ['realization', 'neutral'], ['neutral'], ['admiration', 'neutral'], ['neutral'], ['neutral'], ['love'], ['anger', 'love'], ['neutral'], ['realization', 'neutral'], ['neutral'], ['admiration', 'neutral'], ['neutral'], ['annoyance', 'neutral'], ['neutral'], ['neutral'], ['admiration', 'curiosity'], ['confusion', 'neutral'], ['neutral'], ['neutral'], ['neutral']]"
71,71,Shawn Mendes - Señorita,"2 ContributorsSeñorita (Demo) Lyrics
She loves it when I call her señorita
I wish I could pretend I didn't need ya
But every touch is ooh-la-la-la
It's true, la-la-la
Ooh, I should be runnin'
Ooh, you keep me coming for ya

Land in Miami
The air was hot from summer rain
Sweat drippin' off me
Before I even knew her name, la-la-la
It felt like ooh-la-la-la, yeah, no
Sapphire moonlight
We danced for hours in the sand
Tequila Sunrise
Her body fit right in my hands, la-la-la
It felt like ooh-la-la-la, yeah

She loves it when I call her señorita
I wish I could pretеnd I didn't need ya
But every touch is ooh-la-la-la
It's true, la-la-la
Ooh, I should bе runnin'
Ooh, I know you love it when I call you señorita
I wish it wasn't so damn hard to leave ya
But every touch is ooh-la-la-la
It's true, la-la-la
Ooh, I should be runnin'
Ooh, you keep me coming for ya
You might also like
Locked in the hotel
We built a mansion in the sheets
I don't touch and tell
But I wanna scream out in the streets, la-la-la, ooh
It felt like la-la-la, ooh
Ooh, when your lips undress me, hooked on your tongue
Ooh, love, your kiss is deadly, don't stop
{Chorus: Ali Tamposi, Shawn Mendes, Both}
I love it when you call me señorita
I wish I could pretend I didn't need ya
But every touch is ooh-la-la-la
It's true, la-la-la
Ooh, I should be runnin'
Ooh, you know I love it when I call you señorita
I wish it wasn't so damn hard to leave ya
But every touch is ooh-la-la-la
It's true, la-la-la
Ooh, I should be runnin'
Ooh, you keep me coming for ya

All along, I've been coming for ya (For you)
And I hope it meant something to you (Oh)
Cause your love keeps my coming for ya
Coming for ya
For ya
For ya
For ya
Ooh, I should be runnin'
Ooh, you keep me coming for yaEmbed","[['love'], ['desire'], ['neutral'], ['approval'], ['realization', 'neutral'], ['neutral'], ['neutral'], ['neutral'], ['neutral'], ['realization', 'neutral'], ['neutral'], ['neutral'], ['neutral'], ['neutral'], ['neutral'], ['joy', 'neutral'], ['love'], ['desire'], ['neutral'], ['approval'], ['neutral'], ['love'], ['desire'], ['neutral'], ['approval'], ['realization', 'neutral'], ['neutral'], ['confusion', 'neutral'], ['neutral'], ['neutral'], ['neutral'], ['neutral'], ['joy', 'neutral'], ['neutral'], ['love'], ['neutral'], ['love'], ['desire'], ['neutral'], ['approval'], ['realization', 'neutral'], ['love'], ['desire'], ['neutral'], ['approval'], ['realization', 'neutral'], ['neutral'], ['caring', 'neutral'], ['optimism'], ['love'], ['neutral'], ['neutral'], ['neutral'], ['neutral'], ['realization', 'neutral'], ['neutral']]"
