,Unnamed: 0,artist_title,lyrics,emotions
66,66,Anuel AA - Amanece,"5 ContributorsSencillos del Mes de Diciembre 2018 Lyrics* = letra incompleta.02/12Bad Bunny - Desde El Corazón
Natti Natasha - Me Gusta
Welo Fama - Sin Miedo a Morir ft. Miky Woodz
Juhn - Pocas Horas05/12Casper Magico - Loco ft. Pusho
Amarion - Secreto (Remix) ft. Rauw Alejandro, Randy, Darkiel, Anonimus & Mora07/12Ana Guerra - Bajito
Cauty - Ta To Gucci (Remix) ft. Brytiago, Darell, Cosculluela, Rafa Pabön, Chencho Corleone
DrefQuila - Exhibicionista
Duki - Sin Culpa ft. DrefQuila
Eladio Carrion - Lluvia
Feid - Sígueme
*Joniel el Lethal - La Plastic ft. Alexio y Farruko
*Jamby El Favo - Quédate A Mi Lado ft. Galindo Again
Lola Indigo - Ya No Quiero Ná (RMX) ft. Charly Black & Joey Montana
Lunay - A Solas (Remix) ft. Alex Rose, Lyanno, Brytiago & Anuel AA
Papichamp - Astronauta ft. Ecko
Princesa Alba - Summer Love ft. Gianluca
Wisin & Yandel - Callao ft. Ozuna12/12Ozuna & Generación Escogida - Llegó la Navidad ft. Christian Nieves
Nio García & Myke Towers - Dámela14/12Anonimus - El Teléfono ft. Noriel, Ele A & Lyanno
Anuel AA - Amanece ft. Fino Como El Haze
Bad Bunny - Solo de Mí
Brray - Como Lo Menea ft. Joyce Santana
Chris Wandell - Aquella Vez ft. Lenny Tavárez & Lyanno
Darkiel - Vestida Preciosa
*El Calle Latina - Pégate Mami 2 ft. Franco El Gorila
El Micha - Mala Mala ft. Wisin
El Micha - My Love ft. Farruko
El Micha - Lo Que Estás Pensando ft. Jowell & Randy
Ecko - Chilling ft. Sander Wazz, Blunted Vato & G. Benz
Jamby El Favo - La Carta
Jesse Baez - Fácil ft. C. Tangana
*Jochy El Lobo - Ojos Cielos ft. Myke Towers
Joey Montana - Rosas O Espinas (Remix) ft. Nacho
Joyce Santana - Nada Que Perder ft. Mora
Juan Magán, Deorro & MAKJ - Muñequita Linda ft. YFN Lucci
Kelmitt - Gravity
Lenny Tavárez - No Me Equivoqué ft. Miky Woodz
Miky Woodz - Na' Personal ft. Alex Rose
Myke Towers - No Lo Parece ft. Casper Mágico & Gotay
Nicki Minaj & Anuel AA - Familia ft. Bantu
Piso 21 - Te Vi ft. Micro TDH
Wisin & Yandel - Aullando ft. Romeo Santos
Wisin & Yandel - Dame Algo ft. Bad Bunny
Wisin & Yandel - La Luz ft. Maluma
Wisin & Yandel - Mi Intención ft. Miky Woodz
Wisin & Yandel - Deseo ft. Zion & Lennox
Wisin & Yandel - Ojalá ft. Farruko
Yera - Borracha (Remix) ft. Lola Indigo, Juan Magán & De La Ghetto
Yomo - Pa' los Under16/12Camiloskill - Bebeee (Remix) ft. Darell, Franco El Gorila, Pablo Chill-E, Tivi Gunz & Kris R
Myke Towers - La Forma En Que Me Miras (Remix) ft. Farruko18/12Nio García & Casper Mágico - Te Boté 2 ft. Jennifer López, Cosculluela, Wisin & Yandel21/12Jamby El Favo - Perdí21/12Amenazzy - Baby ft. Nicky Jam & Farruko
Agoney, Ana Guerra, Raoul Vásquez, Aitana & Lola Indigo - El Mundo Entero ft. Maikel Delacalle
Bryant Myers - Noche de Fantasía
Juanka El Problematik - Vitamina X
Kenny Man - Ni Gucci Ni Prada (Remix) ft. Sebastián Yatra
Lirico En La Casa - El Motorcito (Remix) ft. Nacho, De La Ghetto & Miky Woodz
Lola Indigo - Mujer Bruja ft. Mala Rodríguez
Maluma - Mala Mía (Remix) ft. Becky G & Anitta
Myke Towers - Pa' la Pared ft. Darell
MYM - Llega ft. Jory Boy
*Natan & Shander - El Corazón ft. Rayo Trip
Natti Natasha - Lamento Tu Pérdida
Oken - Noche Loca (Remix) ft. Myke Towers, Mora, De La Ghetto, Noriel, Juhn & Bryant Myers
Owy - Molly Con Percocet ft. Ñengo Flow
Paloma Mami - No Te Enamores
Revol - Bésame (Remix) ft. Jon Z, Baby Rasta & Arcángel24/12Bad Bunny - Otra Noche en Miami
Bad Bunny - 200 MPH ft. Diplo
Bad Bunny - Si Estuviésemos Juntos
Bad Bunny - RLNDT
Bad Bunny - La Romana ft. El Alfa
Carlitos Rossy & Jorgie Milliano - Respira ft. Randy
Carlitos Rossy & Jorgie Milliano - El Peor
Carlitos Rossy & Jorgie Milliano - Imagínate25/12Dalex - Mi Regalo
Kendo Kaponi - Na Na Na ft. Anuel AA26/12Duki - Mericrisma
Gino Mella - Villano ft. Falsetto
Helado Negro - País Nublado
*Pablo Chill-E - Caras Vemos ft. Kris R
Revol & Rauw Alejandro - Que Bien Te Ves27/12#TocoParaVos - Mi Ilusión
C-Kan - + ft. Polakan & Lito Kirino
C-Kan - Round 5 ft. MC Davo
*Jamby El Favo - Vida Fuerte ft. Galindo Again
Nio García - La Perpetua
*Prynce el Armamento - Beat Killa ft. C-Kan, Juanka, Lyan & Mozart La Para28/12C.R.O. - 7 Pakas ft. Chulu & Duki
*Osquel - Como Ayer ft. Anonimus29/12Alejo Park - Pocas Horas ft.  Lit Killah & Kodigo
J Lanny - Mi Jeva ft. Chris Wandell, Paulino Rey, Joyce Santana & Green Cookie30/12Big Soto - Cada Lunar31/12Daniela Darcourt & Legarda - Cheveraneando ft. Ama SoundEmbed","[['neutral'], ['neutral'], ['neutral'], ['neutral'], ['neutral'], ['neutral'], ['neutral'], ['neutral'], ['neutral'], ['neutral'], ['neutral'], ['neutral'], ['neutral'], ['neutral'], ['neutral'], ['neutral'], ['neutral'], ['neutral'], ['neutral'], ['neutral'], ['neutral'], ['neutral'], ['neutral'], ['neutral'], ['love', 'neutral'], ['neutral'], ['neutral'], ['neutral'], ['neutral'], ['neutral'], ['neutral'], ['neutral'], ['neutral'], ['neutral'], ['neutral'], ['neutral'], ['neutral'], ['neutral'], ['neutral'], ['neutral'], ['neutral'], ['neutral'], ['neutral'], ['neutral'], ['neutral'], ['neutral'], ['neutral'], ['neutral'], ['neutral'], ['neutral'], ['neutral'], ['neutral'], ['neutral'], ['neutral'], ['neutral'], ['neutral'], ['neutral'], ['neutral'], ['neutral'], ['neutral'], ['neutral'], ['neutral'], ['neutral'], ['neutral'], ['neutral'], ['neutral'], ['neutral'], ['neutral'], ['neutral'], ['neutral'], ['neutral'], ['neutral'], ['neutral'], ['neutral'], ['neutral'], ['neutral'], ['neutral'], ['neutral'], ['neutral'], ['neutral'], ['neutral'], ['neutral']]"
67,67,Feid - Ferxxo 100,"14 ContributorsFerxxo 100 Lyrics

Ey, lady, mi amor
Feliz cumpleaños
Maestro
Wow

Otra vez borracho otra madrugada
Viendo mi cel, pero tú no me escribe' nada
Me acuerdo cuando tú y yo prendíamos uno allá en la ventana
Estaba escuchando los tema' que yo te dediqué
Puro perreo explotando ese Bose, ey-yeah
Hoy salí con alguien dizque porque te olvidé

Pero la miro y me acuerdo de ti
No sé cómo explicarte lo que sentí (Sentí)
Salgo to' los día' pa' la calle, a vеr si te veo por ahí (Te vеo por ahí)
Yo todo intenso preguntando por vos
Te mando música por nota' de voz
Y solo espero que si no vuelves conmigo siempre te cuide Dios
Pero la miro y me acuerdo de ti
No sé cómo explicarte lo que sentí (Sentí)
Salgo to' los días pa' la calle, a ver si te veo por ahí (Te veo por ahí)
Yo todo intenso preguntando por vos
Te mando música por nota' de voz
Y solo espero que si no vuelves conmigo siempre te cuide Dios (Wow)
See Feid LiveGet tickets as low as $24You might also like
Qué falta me hacés tan hijueputa, cogiste otra ruta
Soltarte o no soltarte es mi disputa
Mi amor, ¿el mal de amor cómo se cura?
Me echaste como echaron de Philipp Plein a La Segura
Bebé, ¿esta noche qué vas a hacer?
Te necesito ver
Yo solo quiero que me pienses estés donde estés
Ya pasó más de un mes
Yo nunca la cagué
Solo espero que me creas
Bebé, ¿esta noche qué vas a hacer?
Te necesito ver
Yo solo quiero que me pienses estés donde estés
Ya pasó más de un mes
Yo creí que te olvidé

Pero la miro y me acuerdo de ti
No sé cómo explicarte lo que sentí
Salgo to' los día' pa' la calle, a ver si te veo por ahí
Yo todo intenso preguntando por vos
Te mando música por nota' de voz
Y solo espero que si no vuelves conmigo siempre te cuide Dios
Pero la miro y me acuerdo de ti
Uh-uh-uh
Mmm
(Yo todo intenso preguntando por vos
Te mando música por nota' de voz
Y solo espero que si no vuelves conmigo siempre te cuide Dios)4Embed","[['neutral'], ['neutral'], ['neutral'], ['surprise'], ['neutral'], ['neutral'], ['neutral'], ['neutral'], ['approval', 'neutral'], ['neutral'], ['neutral'], ['neutral'], ['neutral'], ['neutral'], ['neutral'], ['neutral'], ['neutral'], ['neutral'], ['neutral'], ['neutral'], ['neutral'], ['excitement'], ['neutral'], ['neutral'], ['neutral'], ['curiosity'], ['neutral'], ['curiosity'], ['neutral'], ['neutral'], ['neutral'], ['neutral'], ['neutral'], ['curiosity'], ['neutral'], ['neutral'], ['neutral'], ['neutral'], ['neutral'], ['neutral'], ['neutral'], ['neutral'], ['neutral'], ['neutral'], ['neutral'], ['neutral'], ['excitement', 'neutral'], ['neutral'], ['neutral'], ['neutral']]"
68,68,Anuel AA - Hasta Que Dios Diga,"29 ContributorsTranslationsHebrewEnglishDeutschHasta Que Dios Diga Lyrics

Brr
Hoy la noche se acaba, tú desnuda en mi cama (Cama)
Anoche te soñé (Soñé), y me quedé con las gana' (Gana'; uah)
Baby, apaga el celular que te quiero disfrutar
No le vaya' a contestar, no, yeah (Yeah-yeah)
Y ese traje se ve bien con tus nalga' apretá'
Pero e' hora de quitarlo

Ey, hoy la noche es tuya y mía (Tuya y mía, yeah-yeah)
La luz está apagá', pero tú está' prendía'
La nota me dice que siga (Me dice que—)
Te vo'a dar hasta que Dio' diga, ey (Brr)
Hoy la noche e' tuya y mía (Uah)
La luz está apagá', pero tú 'tás prendía' (Uah)
La nota me dice que siga (Que siga)
Te vo'a dar hasta que Dio' diga (Uah)

'Tás tan dura que hasta Ricky Martin quiere darte (Darte)
Tú llega' y estas putas empiezan a envidiarte (Envidiarte)
Tu gato dice que e' real, pero él te miente (Brr)
Yo soy real, yo soy real hasta la muerte, yah
¿Por qué ese jevo tuyo 'tá celoso? ('Tá celoso)
Y eso labio’ allá abajo 'tán jugoso' (Jugoso')
Baby, hoy la noche e' de nosotro' (De nosotro')
Y ese totito en mi boca 'tá chicloso, ey (Chicloso)
Que no' perdone La Virgen y Jesucristo
Fue que yo te vi, me tropecé con tu culito
Bebé, no me compare' porque yo nunca compito
Mayweather no se va a trepar al ring con Margarito (Brr)
Yo solo quiero perrearte, en la cama amarrarte
Morderte y lamberte to'as tus parte'
Hablándote al oído grosería' (Grosería')
Tu amor e' de él, pero en el sexo tú ere' mía, yah-yah (Brr)
You might also like
Hoy la noche es tuya y mía
La luz está apagá', pero tú está' prendía' (Eh)
La nota me dice que siga (Me dice que siga)
Te vo'a dar hasta que Dio' diga (Hasta que—; uah-uah)
Hoy la noche e' tuya y mía (Tuya y mía, baby)
La luz está apagá', pero tú está' prendía' (Uah)
La nota me dice que siga (Uah)
Te vo'a dar hasta que Dio' diga (Yeh-yeh-yeh), ey (Brr)

Ese culo está cabrón, mami, tú 'tás bendecida (Amén)
Te toqué y estaba' humedecida (Ey)
Pa' chingar no hay que estar junto' de por vida (No)
Dejemo' que la luna hoy decida (Wuh)
Porque nosotro' estamo' arrebatao' (Arrebatao'; ey)
Y tú bien bellaca, ya yo lo he notao' (Yo lo he notao'; jeje)
El gato tuyo siempre coge to' prestao' (Jaja; ey)
Y yo a 40 mil pie' en el jet trepao' (¡Wuh!)
Tú ere' mi Lady Gaga, yo tu Bradley Cooper
Ella se lo traga (Traga), y me lo escupe
Tú quiere' comerme, yo siempre lo supe
Si quiere' te compro la Range o la Mini Cooper (¡Wuh!)

Y te compré un babydoll Gucci (Gucci)
Pa' que te lo ponga' con lo tacone' Prada (Ah-ah)
Te veo typin', pero no envía' nada
Tírame el location y espérame en la entrada, ey
Que te compré un babydoll Gucci (Gucci)
Pa' que te lo ponga' con lo tacone' Prada (Ah-ah)
Te veo typin', pero no envía' nada
Envíame el location y espérame en la entrada, ey
Hoy la noche es tuya y mía
La luz está apagá', pero tú está' prendía'
La nota me dice que siga
Te vo'a dar hasta que Dio' diga (Uah; brr)
Hoy la noche e' tuya y mía (Uah)
La luz está apagá', pero tú está' prendía' (Uah)
La nota me dice que siga (Que siga)
Te vo'a dar hasta que Dio' diga

Ey; brr
Real, real (Yeh-yeh-yeh-yeh)
Real hasta la muerte, baby (Yeh-yeh-yeh-yeh)
Real hasta la muerte, baby
Bad Bunny, baby, eh, eh, eh
Bad Bunny, baby, yeah-yeah
Anuel
Chris Jeday
Ga-Gaby Music
Mera, dime Nino
Yeah-yeh
Dulce Como Candy
Yeah-yeh (Real hasta la muerte, baby)
Lo' reye' y lo' diose', ¿oí'te? (Real hasta la muerte, baby)
Brr
Mera, dime Frabian
Real hasta la muerte
(Yeh-yeh-yeh
Dile que tú ere' mía
La luz está apagá', pero tú 'tás prendía', prendía'
La nota me dice que siga
Te vo'a dar hasta que Dio' diga)
Yeah-yeah-yeah-yeah3Embed","[['neutral'], ['neutral'], ['neutral'], ['neutral'], ['disapproval', 'neutral'], ['neutral'], ['neutral'], ['neutral'], ['neutral'], ['neutral'], ['neutral'], ['neutral'], ['neutral'], ['neutral'], ['neutral'], ['neutral'], ['neutral'], ['neutral'], ['neutral'], ['curiosity'], ['neutral'], ['neutral'], ['neutral'], ['neutral'], ['neutral'], ['neutral'], ['neutral'], ['neutral'], ['neutral'], ['neutral'], ['neutral'], ['confusion', 'neutral'], ['neutral'], ['neutral'], ['neutral'], ['neutral'], ['neutral'], ['neutral'], ['neutral'], ['neutral'], ['neutral'], ['neutral'], ['disapproval', 'neutral'], ['neutral'], ['neutral'], ['neutral'], ['neutral'], ['excitement', 'neutral'], ['neutral'], ['neutral'], ['neutral'], ['neutral'], ['love', 'neutral'], ['neutral'], ['neutral'], ['neutral'], ['neutral'], ['neutral'], ['neutral'], ['neutral'], ['neutral'], ['neutral'], ['neutral'], ['neutral'], ['neutral'], ['neutral'], ['neutral'], ['neutral'], ['neutral'], ['approval', 'neutral'], ['neutral'], ['neutral'], ['curiosity'], ['neutral'], ['neutral'], ['neutral'], ['neutral'], ['neutral'], ['approval', 'neutral'], ['neutral'], ['neutral'], ['curiosity', 'neutral'], ['neutral'], ['neutral'], ['neutral'], ['neutral'], ['neutral'], ['neutral'], ['neutral'], ['neutral'], ['neutral']]"
69,69,KAROL G - BICHOTA,"7 ContributorsTranslationsEspañolKAROL G - BICHOTA (English Translation) Lyrics
I go out well-dressed from head to toe
Because it may be that you will run into my ass (Oh)
I feel like a boss bitch without leaving the hood (Ah)
They all want to fuck me and they don't have the tools to do it

They show off, but they can't with my pum-pum, with my pum-pum
And if there is someone that will give it to me
Because they can't handle my pum-pum
With my pum-pum, with my pum-pum

It's noticeable from afar that I have too much flow, flow
We drank a couple of bottles and now we're drunk
I also have a Jeepeta
I have it full with all of my shortie'
We leave the fear in the drawer, ah-ah
Be careful with what you put on your story
And guess who's coming around
Juana's coming, Mari's coming
All the babies want party
An out of place comment, and
And we're going to destroy you, yeah-yeah-yeah-yeah

I go out well-dressed from head to toe
Because it may be that you will run into my ass
I feel like a boss bitch without leaving the hood (Ah)
They all want to fuck me and they don't have the tools to do it
You might also like
They show off, but they can't with my pum-pum, with my pum-pum
And if there is someone that will give it to me
Because they can't handle my pum-pum
With my pum-pum, with my pum-pum
They show off, but they can't with my pum-pum, with my pum-pum
And if there is someone that will give it to me
Because they can't handle my pum-pum
With my pum-pum, with my pum-pum

Twerking hard, he likes my ass
I've been waiting for you for a long time
I don't know about you, but I'm here thinking (Ah)
You don't do anything for what you're showing off (Oh)
You are quick to give me a like on Insta (Eh)
But it's rumored out there that you are premature
No matter how much they hit me up, I don't care
The one that fronted me can't be heard from here (Ha)

I go out well-dressed from head to toe
Because it may be that you will run into my ass
I feel like a boss bitch without leaving the hood (Ah)
They all want to fuck me and they don't have the tools to do it
They show off, but they can't with my pum-pum, with my pum-pum
And if there is someone that will give it to me
Because they can't handle my pum-pum
With my pum-pum, with my pum-pum
They show off (Twerking)

Tra, tra (Ah)
Daddy, daddy
O-O-Ovy On The Drums
Daddy, daddyEmbed","[['neutral'], ['optimism'], ['annoyance'], ['anger', 'annoyance'], ['neutral'], ['neutral'], ['disapproval', 'neutral'], ['neutral'], ['realization'], ['neutral'], ['neutral'], ['neutral'], ['fear'], ['caring'], ['confusion', 'curiosity'], ['neutral'], ['excitement', 'neutral'], ['neutral'], ['anger'], ['neutral'], ['optimism'], ['annoyance'], ['anger', 'annoyance'], ['confusion', 'neutral'], ['neutral'], ['neutral'], ['disapproval', 'neutral'], ['neutral'], ['neutral'], ['neutral'], ['disapproval', 'neutral'], ['neutral'], ['love'], ['neutral'], ['neutral'], ['neutral'], ['neutral'], ['neutral'], ['annoyance', 'neutral'], ['neutral'], ['neutral'], ['optimism'], ['annoyance'], ['anger', 'annoyance'], ['neutral'], ['neutral'], ['disapproval', 'neutral'], ['neutral'], ['neutral'], ['neutral'], ['excitement'], ['neutral'], ['neutral']]"
70,70,KAROL G - AMARGURA,"16 ContributorsTranslationsDeutschEnglishPortuguêsAMARGURA Lyrics

Si te dicen que yo me estoy curando es la verdad
Hey

Ayer te vi, aparentemente estabas contento, estabas feliz
Besándola a ella, así como antes me besaba' a mí
En parte me alegra que uno de los dos no esté llorando
Ojalá me piense' de vez en cuando

Y aunque yo hago como si na'
Baby, qué amargura me da saber que ahora
Tú estás vacilando con otra
Por fuera me río, pеro por adentro estoy rota
Y aunque yo hago como si na' (Papi)
Baby, qué amargura mе da saber que ahora
Tú estás vacilando con otra
Por fuera me río, pero por adentro estoy rota

Primero, quiero decirte que no hay un segundo que
Piense que te lo dañó un tercero
Sin ti se siente vacío el cuarto, insisto
Polvo, llegábamos hasta el quinto
Te extraño tanto, sin ti es distinto
Me duele ver cómo me deja' en visto
A veces pienso que me extraña' un poquito
Yo misma lo' pajarito' me pinto (Ey)
See KAROL G LiveGet tickets as low as $31You might also like
Qué mal que ya no estés aquí
Estaría tomándomelos contigo y no por ti, por ti
En coleccionista me volví
Guardando toa' las foto', me volví más devota y ni así

Y aunque yo hago como si na'
Baby, qué amargura me da saber que ahora
Tú estás vacilando con otra
Por fuera me río, pero por adentro estoy rota
Y aunque yo hago como si na' (Papi)
Baby, qué amargura me da saber que ahora
Tú estás vacilando con otra
Por fuera me río, pero por adentro estoy rota

¡Ey!
¡Esta canción que no me la pongan borracha, hijo 'e puta!
O-O-Ovy On the Drums
(Baby, qué amargura me da)Embed","[['neutral'], ['neutral'], ['neutral'], ['neutral'], ['neutral'], ['neutral'], ['neutral'], ['neutral'], ['neutral'], ['neutral'], ['neutral'], ['neutral'], ['neutral'], ['neutral'], ['neutral'], ['neutral'], ['approval', 'neutral'], ['neutral'], ['neutral'], ['neutral'], ['neutral'], ['neutral'], ['neutral'], ['neutral'], ['neutral'], ['neutral'], ['neutral'], ['neutral'], ['neutral'], ['neutral'], ['neutral'], ['neutral'], ['neutral'], ['neutral'], ['neutral'], ['excitement', 'neutral'], ['neutral'], ['neutral'], ['neutral']]"
71,71,Piso 21 - Pa' Olvidarme De Ella,"7 ContributorsPa’ Olvidarme De Ella Lyrics

(Ba-bu-eh)
(Ba-bu-eh)
Piso 21, yeh
(Ba-bu-eh)
Christian Nodal
(Ba-bu-eh, ba-bu-eh)

Ya no aguanto tanto trago
He pensado matar lo que he olvidado
Mis amigo' me la tiraron (¡Wuh!)
Que como siga así, voy pa'l carajo
Yo ya olvidé lo que es el relajo
No juego FIFA desde hace rato (¡Wuah!)
Botellas a medias no me quedaron
Tomo un trago y otro trago
Me da por poner dizque a Dalmata y Ñejo
Y a veces escucho el consejo del viejo
La verdad e' que te fuiste lejo'
Quedé con la cara de pendejo
Tengo una vaina guarda' en el pecho (¡Wuh!)
¿Será despecho?
Como huevón mirando pa'l techo
Ya lo hecho está hecho
You might also like
Por favor que alguien me diga
Que se toma pa' las penas
Cuando está recién herido
Y el alcohol no ayuda
Pa' olvidarme de ella
Pa' olvidarme de ella
Ya bailé con otros labios
Y me acuerdo siempre de ella
He cantado mil rancheras
Y el alcohol no ayuda
Pa' olvidarme de ella
Pa' olvidarme de ella (Ajajajay; ba-bu-eh)

Que descanse en paz aquí
Tú te fuiste y yo me fui
Mi cuerpo camina solo
Mi alma se fue 'trás de ti
Tú no tienes la culpa
Que yo no me acostumbre a estar sin ti
(Yo no me acostumbro a estar sin ti)
Pero si voy a olvidarte
Te lo juro por quien quiera
Solo es cuestión de tiempo
Hasta que llegue una más buena que tú (Que tú)
Que lo haga mejor que tú, uh (Que lo haga mejor que tú)
Por favor que alguien me diga
Que se toma pa' las penas
Cuando está recién herido
Y el alcohol no ayuda
Pa' olvidarme de ella (Nou, nou, nou, nou, no)
Pa' olvidarme de ella (Ajay)
Ya bailé con otros labios
Y me acuerdo siempre de ella
He cantado mil rancheras
Y el alcohol no ayuda
Pa' olvidarme de ella (Yeh)
Pa' olvidarme de ella (Ba-bu-eh)

Ya bajé Tinder en mi celular
Y subí una foto pa' que le dé match
Una que esté buena y me ayude a olvidarla
De mi cama no pienso sacarla
Hasta que aparezca pienso emborracharme
Al tequila duro quiero darle
A mis penas yo las quiero ahogar
Pero las cabronas ya saben nadar (Yeh)
Ya bajé Tinder en mi celular
Y subí una foto pa' que le dé match
Una que esté buena y me ayude a olvidarla
De mi cama no pienso sacarla
Hasta que aparezca pienso emborracharme
Al tequila duro quiero darle
A mis penas yo las quiero ahogar
Pero las cabronas ya saben nadar (Yeh)
Por favor que alguien me diga (Que alguien me diga)
Que se toma pa' las penas
Cuando está recién herido (Cuando estás herido)
Y el alcohol no ayuda
Pa' olvidarme de ella (Pa' olvidarme de ella)
Pa' olvidarme de ella (Pa' olvidarme de ella)
Ya bailé con otros labios
Y me acuerdo siempre de ella
He cantado mil rancheras
Y el alcohol no ayuda
Pa' olvidarme de ella (Pa' olvidarme de ella)
Pa' olvidarme de ella (Pa' olvidarme de ella)

(Ba-bu-eh)
(Ba-bu-eh)
(Ba-bu-eh)
(Ba-bu-eh)
(Ba-bu-eh, ba-bu-eh)5Embed","[['neutral'], ['neutral'], ['neutral'], ['neutral'], ['neutral'], ['neutral'], ['neutral'], ['neutral'], ['neutral'], ['neutral'], ['neutral'], ['excitement', 'neutral'], ['neutral'], ['neutral'], ['neutral'], ['neutral'], ['neutral'], ['neutral'], ['neutral'], ['curiosity'], ['neutral'], ['neutral'], ['confusion', 'neutral'], ['neutral'], ['neutral'], ['neutral'], ['neutral'], ['neutral'], ['neutral'], ['neutral'], ['neutral'], ['neutral'], ['neutral'], ['neutral'], ['neutral'], ['neutral'], [], ['neutral'], ['neutral'], ['neutral'], ['neutral'], ['neutral'], ['neutral'], ['neutral'], ['neutral'], ['neutral'], ['neutral'], ['neutral'], ['neutral'], ['neutral'], ['neutral'], ['neutral'], ['neutral'], ['neutral'], ['neutral'], ['neutral'], ['neutral'], ['neutral'], ['neutral'], ['neutral'], ['neutral'], [], ['neutral'], ['neutral'], ['neutral'], ['neutral'], ['neutral'], ['neutral'], ['neutral'], [], ['neutral'], ['neutral'], ['neutral'], ['neutral'], ['neutral'], ['neutral'], ['neutral'], ['neutral'], ['neutral'], ['neutral'], ['neutral'], ['neutral'], ['neutral'], ['neutral'], ['neutral'], ['neutral'], ['neutral'], ['neutral'], ['neutral'], ['neutral'], ['neutral'], ['neutral']]"
72,72,The Weeknd - Blinding Lights,"234 ContributorsTranslationsTürkçeSvenskaEspañolSlovenčinaРусскийPortuguêsPolskiNorsk (bokmål / riksmål)日本語ItalianoHebrewDeutschFrançaisفارسیNederlandsDanskShqipالعربيةBlinding Lights Lyrics
Yeah

I've been tryna call
I've been on my own for long enough
Maybe you can show me how to love, maybe
I'm goin' through withdrawals
You don't even have to do too much
You can turn me on with just a touch, baby

I look around and
Sin City's cold and empty (Oh)
No one's around to judge me (Oh)
I can't see clearly when you're gone

I said, ooh, I'm blinded by the lights
No, I can't sleep until I feel your touch
I said, ooh, I'm drowning in the night
Oh, when I'm like this, you're the one I trust
Hey, hey, hey

I'm running out of time
'Cause I can see the sun light up the sky
So I hit the road in overdrive, baby, oh
You might also like
The city's cold and empty (Oh)
No one's around to judge me (Oh)
I can't see clearly when you're gone

I said, ooh, I'm blinded by the lights
No, I can't sleep until I feel your touch
I said, ooh, I'm drowning in the night
Oh, when I'm like this, you're the one I trust

I'm just calling back to let you know (Back to let you know)
I could never say it on the phone (Say it on the phone)
Will never let you go this time (Ooh)

I said, ooh, I'm blinded by the lights
No, I can't sleep until I feel your touch
Hey, hey, hey

Hey, hey, hey

I said, ooh, I'm blinded by the lights
No, I can't sleep until I feel your touch276Embed","[['approval', 'neutral'], ['neutral'], ['neutral'], ['love', 'optimism'], ['neutral'], ['neutral'], ['caring', 'neutral'], ['neutral'], ['neutral'], ['disappointment'], ['neutral'], ['neutral'], ['disapproval'], ['neutral'], ['realization', 'surprise'], ['excitement', 'neutral'], ['neutral'], ['neutral'], ['realization'], ['confusion', 'neutral'], ['disappointment', 'sadness', 'neutral'], ['disappointment'], ['neutral'], ['neutral'], ['disapproval'], ['neutral'], ['realization', 'surprise'], ['neutral'], ['neutral'], ['caring', 'joy'], ['neutral'], ['disapproval'], ['excitement', 'neutral'], ['excitement', 'neutral'], ['neutral'], ['disapproval', 'neutral']]"
