,Unnamed: 0,artist_title,lyrics,emotions
45,45,Steve Lacy - Bad Habit,"91 ContributorsTranslationsEspañolPortuguês한국어РусскийBad Habit Lyrics
I wish I knew you wanted me
I wish I knew
I wish I knew you wanted me
I wish I knew
I wish I knew you wanted me

What you, ooh, uh, what you do?
Made a move, could've made a move
If I knew I'd be with you
Is it too late to pursue?

I bite my tongue, it's a bad habit
Kinda mad that I didn't take a stab at it
Thought you were too good for me, my dear
Never gave me time of day, my dear
It's okay, things happen for
Reasons that I think are sure, yeah

I wish I knew
I wish I knew you wanted me (I wish I knew)
I wish I knew (Oh)
I wish I knew you wanted me
I wish I knew (Yeah)
I wish I knew you wanted me (Oh)
I wish I knew
I wish I knew you wanted me
You might also like
Please say to me (Please just say to me)
If you still want it
I wish you wouldn't play with me
I wanna know (I wanna know)

Can I bite your tongue like my bad habit?
Would you mind if I tried to make a pass at it?
No, you're not too good for me, my dear
Funny you come back to me, my dear
It's okay, things happen for
Reasons that I can't ignore, yeah

I wish I knew
I wish I knew you wanted me
I wish I knew (Wish I knew)
I wish I knew you wanted me (Oh)

You can't surprise a Gemini (I wish I knew)
I'm everywhere, I'm cross-eyed, and (I wish I knew you wanted me)
Now that you're back, I can't decide (I wish I knew)
If I decide if you're invited (I wish I knew you wanted me)
You always knew the way to wow me
Fuck around, get tongue-tied, and
I turn it on, I make it rowdy
Then carry on, but I'm not hidin'
You grabbin' me hard 'cause you know what you found
It's biscuits, it's gravy, babe

You can't surprise a Gemini
But you know it's biscuits, it's gravy, babe
I knew you'd come back around
'Cause you know it's biscuits, it's gravy, babe
Let's fuck in the back of the mall, lose control
Go stupid, go crazy, babe
I know I'll be in your heart 'til the end
You'll miss me, don't beg me, babe24Embed","[['desire'], ['desire'], ['desire'], ['desire'], ['desire'], ['curiosity', 'neutral'], ['neutral'], ['love', 'neutral'], ['confusion'], ['annoyance', 'disappointment'], ['anger', 'annoyance'], ['realization'], ['gratitude'], ['approval'], ['approval'], ['desire'], ['desire'], ['desire'], ['desire'], ['desire'], ['desire'], ['desire'], ['desire'], ['confusion', 'neutral'], ['neutral'], ['neutral'], ['desire'], ['excitement', 'neutral'], ['annoyance', 'curiosity'], ['curiosity', 'neutral'], ['disapproval'], ['joy'], ['approval'], ['neutral'], ['desire'], ['desire'], ['desire'], ['desire'], ['neutral'], ['neutral'], ['curiosity'], ['curiosity', 'neutral'], ['admiration', 'surprise'], ['anger', 'annoyance'], ['approval'], ['neutral'], ['neutral'], ['amusement', 'neutral'], ['neutral'], ['neutral'], ['approval', 'realization'], ['amusement', 'neutral'], ['anger'], ['anger'], ['caring', 'neutral'], ['sadness', 'neutral']]"
46,46,XXXTENTACION - Moonlight,"251 ContributorsTranslationsРусскийTürkçeEspañolPortuguêsPolskiHebrewDeutschFrançaisNederlandsMoonlight Lyrics
Yeah

Spotlight, uh, moonlight, uh
Nigga, why you trippin'? Get your mood right, uh
Shawty look good in the moonlight
All these pussy niggas so bad mind
Spotlight, moonlight
Nigga, why you trippin'? Get your mood right
Shawty look good in the moonlight
All these pussy niggas so bad mind
Spotlight, uh, moonlight
Nigga, why you trippin'? Get your mood right, uh
Shawty look good in the moonlight
All these pussy niggas so bad mind
Spotlight, moonlight
Nigga, why you trippin'? Get your mood right
Shawty look good in the moonlight
All these pussy niggas so bad mind

Feel like I'm destined
I don't need no Smith & Wesson, no
Boy, who you testin'?
Fuck a Scantron, here's your lesson, oh
Knife in intestine
Takin' shots at all your brethren, no
Feel like I'm damaged
Girl I know you fucking planned this
You might also like
All alone, call my phone, make me feel right
Girl you know when you call, make me feel right
All alone, call my phone, make me feel right
Girl you know when you call, make me feel right

Spotlight, uh, moonlight, uh
Nigga, why you trippin'? Get your mood right, uh
Shawty look good in the moonlight
All these pussy niggas so bad mind
Spotlight, moonlight
Nigga, why you trippin'? Get your mood right
Shawty look good in the moonlight
All these pussy niggas so bad mind
Spotlight, uh, moonlight
Nigga, why you trippin'? Get your mood right, uh
Shawty look good in the moonlight
All these pussy niggas so bad mind
Spotlight, moonlight
Nigga, why you trippin'? Get your mood right
Shawty look good in the moonlight
All these pussy niggas so bad mind377Embed","[['approval', 'neutral'], ['neutral'], ['neutral'], ['admiration', 'approval'], ['annoyance'], ['neutral'], ['neutral'], ['admiration', 'approval'], ['annoyance'], ['neutral'], ['neutral'], ['admiration', 'approval'], ['annoyance'], ['neutral'], ['neutral'], ['admiration', 'approval'], ['annoyance'], ['realization', 'neutral'], ['disapproval'], ['curiosity', 'neutral'], ['anger'], ['neutral'], ['neutral'], ['disappointment', 'sadness'], ['anger'], ['confusion', 'neutral'], ['neutral'], ['approval'], ['neutral'], ['approval'], ['neutral'], ['neutral'], ['admiration', 'approval'], ['annoyance'], ['neutral'], ['neutral'], ['admiration', 'approval'], ['annoyance'], ['neutral'], ['neutral'], ['admiration', 'approval'], ['annoyance'], ['neutral'], ['neutral'], ['admiration', 'approval'], ['annoyance', 'neutral']]"
47,47,Kendrick Lamar - Money Trees,"532 ContributorsTranslationsTürkçeEnglishFrançaisPortuguêsEspañolSvenskaРусскийMoney Trees Lyrics
Uh, me and my niggas tryna get it, ya bish (Ya bish, ya bish)
Hit the house lick: tell me, is you wit' it, ya bish? (Ya bish, ya bish)
Home invasion was persuasive (Was persuasive, was persuasive)
From nine to five I know it's vacant, ya bish (Ya bish, ya bish)
Dreams of livin' life like rappers do (Like rappers do, like rappers do)
Back when condom wrappers wasn't cool (They wasn't cool, they wasn't cool)
I fucked Sherane and went to tell my bros (Tell my bros, tell my bros)
Then Usher Raymond ""Let It Burn"" came on (""Let Burn"" came on, ""Let Burn"" came on)
Hot sauce all in our Top Ramen, ya bish (Ya bish, ya bish)
Park the car, then we start rhymin', ya bish (Ya bish, ya bish)
The only thing we had to free our mind (Free our mind, free our mind)
Then freeze that verse when we see dollar signs (See dollar signs, see dollar signs)
You lookin' like a easy come-up, ya bish (Ya bish, ya bish)
A silver spoon, I know you come from, ya bish (Ya bish, ya bish)
And that's a lifestyle that we never knew (We never knew, we never knew)
Go at a reverend for the revenue

It go Halle Berry or hallelujah
Pick your poison, tell me what you doin'
Everybody gon' respect the shooter
But the one in front of the gun lives forever
(The one in front of the gun, forever)
And I been hustlin' all-day
This-a-way, that-a-way
Through canals and alleyways, just to say
Money trees is the perfect place for shade
And that's jus how I feel
Nah, nah
A dollar might just fuck your main bitch
That's jus' how I feel, nah
A dollar might say fuck them niggas that you came with
That's jus' how I feel, nah, nah
A dollar might just make that lane switch
That's jus' how I feel, nah
A dollar might turn to a million and we all rich
That's jus' how I feel

Dreams of livin' life like rappers do (Like rappers do, like rappers do)
Bump that new E-40 after school (Way after school, way after school)
You know, “Big Ballin' With My Homies” (My homies)
Earl Stevens had us thinkin' rational (Thinkin' rational, that's rational)
Back to reality, we poor, ya bish (Ya bish, ya bish)
Another casualty at war, ya bish (Ya bish, ya bish)
Two bullets in my Uncle Tony head (My Tony head, my Tony head)
He said one day I'll be on tour, ya bish (Ya bish, ya bish)
That Louis Burgers never be the same (Won't be the same, won't be the same)
A Louis belt that never ease that pain (Won't ease that pain, won't ease that pain)
But I'ma purchase when that day is jerkin' (That day is jerkin', that day is jerkin')
Pull off at Church's, with Pirellis skirtin' (Pirellis skirtin', Pirellis skirtin')
Gang signs out the window, ya bish (Ya bish, ya bish)
Hopin' all of 'em offend you, ya bish (Ya bish, ya bish)
They say your hood is a pot o' gold (A pot o' gold, a pot o' gold)
And we gon' crash it when nobody's home
You might also like
It go Halle Berry or hallelujah
Pick your poison, tell me what you doin'
Everybody gon' respect the shooter
But the one in front of the gun lives forever
(The one in front of the gun, forever)
And I been hustlin' all-day
This-a-way, that-a-way
Through canals and alleyways, just to say
Money trees is the perfect place for shade
And that's jus' how I feel

Nah, nah
A dollar might just fuck your main bitch
That's jus' how I feel, nah
A dollar might say fuck them niggas that you came with
That's jus' how I feel, nah, nah
A dollar might just make that lane switch
That's jus' how I feel, nah
A dollar might turn to a million and we all rich
That's jus' how I feel
Be the last one out to get this dough? No way!
Love one of you bucket headed hoes? No way!
Hit the streets, then we break the code? No way!
Hit the brakes when they on patrol? No way!
Be the last one out to get this dough? No way!
Love one of you bucket headed hoes? No way!
Hit the streets, then we break the code? No way!
Hit the brakes when they on patrol? No way!
'Magine Rock up in them projects where them niggas pick your pockets
Santa Claus don't miss them stockings; liquors spillin', pistols poppin'
Bakin' soda YOLA whippin', ain't no turkey on Thanksgivin'
My homeboy just dome'd a nigga, I just hope the Lord forgive him
Pots with cocaine residue, every day I'm hustlin'
What else is a thug to do when you eatin' cheese from the government?
Gotta provide for my daughter n'em—get the fuck up out my way, bish!
Got that drum and I got them bands just like a parade, bish!
Drop that work up in the bushes, hope them boys don't see my stash
If they do, tell the truth, this the last time you might see my ass
From the gardens where the grass ain't cut, them serpents lurkin', Blood
Bitches sellin' pussy, niggas sellin' drugs but it's all good
Broken promises, steal your watch and tell you what time it is
Take your J's and tell you to kick it where a Foot Locker is
In the streets with a heater under my Dungarees
Dreams of me gettin' shaded under a money tree

It go Halle Berry or hallelujah
Pick your poison, tell me what you doin'
Everybody gon' respect the shooter
But the one in front of the gun lives forever
(The one in front of the gun, forever)
And I been hustlin' all-day
This-a-way, that-a-way
Through canals and alleyways, just to say
Money trees is the perfect place for shade
And that's jus' how I feel

Kendrick, just bring my car back, man. I-I called in for another appointment. I figured you weren’t gonna be back here on time anyway. Look, shit, shit, I just wanna get out the house, man. This man is on one. He feelin' good as a motherfucker. Shit, I’m tryna get my thing goin', too. I'm going to Merlin' house. Just bring my car back. Shit, he faded. He feelin' good. Look, listen to him!
Girl, girl, I want your body, I want your body, 'cause you got a big ol' fat ass. Girl, girl, I want your body, I want your body, 'cause of that big ol' fat ass. Girl, I want your body, 'cause of that big ol'—
See, he high as hell. Shit, and he ain't even trippin' off them dominoes no more. Just bring the car back!
Did somebody say dominoes?
993Embed","[['neutral'], ['curiosity', 'neutral'], ['neutral'], ['neutral'], ['desire', 'neutral'], ['disapproval'], ['annoyance', 'neutral'], ['neutral'], ['neutral'], ['neutral'], ['neutral'], ['neutral'], ['approval', 'neutral'], ['neutral'], ['realization', 'neutral'], ['neutral'], ['neutral'], ['curiosity'], ['admiration', 'approval'], ['neutral'], ['neutral'], ['neutral'], ['neutral'], ['neutral'], ['admiration', 'approval'], ['neutral'], ['disapproval', 'neutral'], ['anger', 'annoyance'], ['neutral'], ['anger', 'neutral'], ['neutral'], ['neutral'], ['neutral'], ['neutral'], ['neutral'], ['desire', 'neutral'], ['neutral'], ['neutral'], ['neutral'], ['disappointment'], ['neutral'], ['neutral'], ['neutral'], ['neutral'], ['neutral'], ['neutral'], ['neutral'], ['neutral'], ['optimism', 'neutral'], ['neutral'], ['neutral'], ['confusion', 'neutral'], ['neutral'], ['curiosity'], ['admiration', 'approval'], ['neutral'], ['neutral'], ['neutral'], ['neutral'], ['neutral'], ['admiration', 'approval'], ['neutral'], ['disapproval', 'neutral'], ['anger', 'annoyance'], ['neutral'], ['anger', 'neutral'], ['neutral'], ['neutral'], ['neutral'], ['neutral'], ['neutral'], ['disapproval'], ['disapproval', 'love'], ['annoyance', 'disapproval'], ['disapproval'], ['disapproval'], ['disapproval', 'love'], ['annoyance', 'disapproval'], ['disapproval'], ['neutral'], ['neutral'], ['gratitude', 'neutral'], ['optimism'], ['neutral'], ['curiosity'], ['anger', 'annoyance', 'caring'], ['neutral'], ['optimism'], ['annoyance'], ['neutral'], ['annoyance'], ['neutral'], ['anger', 'neutral'], ['neutral'], ['neutral'], ['neutral'], ['curiosity'], ['admiration', 'approval'], ['neutral'], ['neutral'], ['neutral'], ['neutral'], ['neutral'], ['admiration', 'approval'], ['neutral'], ['anger'], ['desire'], ['annoyance', 'neutral'], ['confusion', 'curiosity', 'neutral'], ['neutral']]"
48,48,Arctic Monkeys - 505,"196 ContributorsTranslationsTürkçeEspañolРусскийItalianoFrançaisPortuguêsDeutschالعربية505 Lyrics
I'm going back to 505
If it's a seven hour flight or a forty-five minute drive
In my imagination, you're waitin' lyin' on your side
With your hands between your thighs

Stop and wait a sec
And when you look at me like that, my darlin'
What did you expect?
I'd probably still adore you
With your hands around my neck
Or I did last time I checked
Not shy of a spark
The knife twists at the thought
That I should fall short of the mark
Frightened by the bite, though
It's no harsher than the bark
The middle of adventure
Such a perfect place to start

I'm going back to 505
If it's a seven hour flight or a forty-five minute drive
In my imagination, you're waitin' lyin' on your side
With your hands between your thighs
You might also like
But I crumble completely when you cry
It seems like once again you've had to greet me with goodbye
I'm always just about to go and spoil the surprise
Take my hands off of your eyes too soon

I'm going back to 505
If it's a seven hour flight or a forty-five minute drive
In my imagination, you're waitin' lyin' on your side
With your hands between your thighs and a smile300Embed","[['neutral'], ['neutral'], ['neutral'], ['neutral'], ['annoyance', 'neutral'], [], ['curiosity'], ['love'], ['neutral'], ['neutral'], ['neutral'], ['neutral'], ['neutral'], ['fear', 'neutral'], ['neutral'], ['neutral'], ['approval'], ['neutral'], ['neutral'], ['neutral'], ['neutral'], ['confusion', 'neutral'], ['sadness'], ['neutral'], [], ['caring'], ['neutral'], ['neutral'], ['neutral'], ['neutral']]"
49,49,Lewis Capaldi - Someone You Loved,"222 ContributorsTranslationsSvenskaEspañolPortuguêsDeutschNederlandsFrançaisTürkçeالعربيةSomeone You Loved Lyrics
I'm going under, and this time, I fear there's no one to save me
This all or nothing really got a way of driving me crazy
I need somebody to hear,  somebody to know
Somebody to have, somebody to hold
It's easy to say, but it's never the same
I guess I kinda liked the way you numbed all the pain

Now, the day bleeds into nightfall
And you're not here to get me through it all
I let my guard down and then you pulled the rug
I was getting kinda used to being someone you loved

I'm going under, and this time, I fear there's no one to turn to
This all or nothing way of loving got me sleeping without you
Now, I need somebody to know, somebody to hear
Somebody to have, just to know how it feels
It's easy to say, but it's never the same
I guess I kinda like the way you help me escape

Now, the day bleeds into nightfall
And you're not here to get me through it all
I let my guard down and then you pulled the rug
I was getting kinda used to being someone you loved
You might also like
And I tend to close my eyes when it hurts sometimes
I fall into your arms
I'll be safe in your sound till I come back around

For now, the day bleeds into nightfall
And you're not here to get me through it all
I let my guard down and then you pulled the rug
I was getting kinda used to being someone you loved
But now the day bleeds into nightfall
And you're not here to get me through it all
I let my guard down and then you pulled the rug
I was getting kinda used to being someone you loved
I let my guard down and then you pulled the rug
I was getting kinda used to being someone you loved168Embed","[['fear'], ['confusion', 'disappointment', 'surprise'], ['desire', 'neutral'], ['neutral'], ['approval', 'neutral'], ['neutral'], ['sadness', 'neutral'], ['disappointment', 'disapproval'], ['neutral'], ['love', 'realization'], ['fear'], ['love'], ['neutral'], ['neutral'], ['approval', 'neutral'], ['love'], ['sadness', 'neutral'], ['disappointment', 'disapproval'], ['neutral'], ['love', 'realization'], ['confusion', 'neutral'], ['sadness', 'neutral'], ['caring', 'love', 'neutral'], ['caring'], ['sadness', 'neutral'], ['disappointment', 'disapproval'], ['neutral'], ['love', 'realization'], ['sadness', 'neutral'], ['disappointment', 'disapproval'], ['neutral'], ['love', 'realization'], ['neutral'], ['love', 'neutral']]"
50,50,Harry Styles - Watermelon Sugar,"168 ContributorsTranslationsDeutschTürkçeEspañolPortuguêsPolskiNorsk (bokmål / riksmål)ČeskyDanskWatermelon Sugar Lyrics
Tastes like strawberries on a summer evenin'
And it sounds just like a song
I want more berries and that summer feelin'
It's so wonderful and warm

Breathe me in, breathe me out
I don't know if I could ever go without
I'm just thinking out loud
I don't know if I could ever go without

Watermelon sugar high
Watermelon sugar high
Watermelon sugar high
Watermelon sugar high
Watermelon sugar

Strawberries on a summer evenin'
Baby, you're the end of June
I want your belly and that summer feelin'
Getting washed away in you

Breathe me in, breathe me out
I don't know if I could ever go without
You might also like
Watermelon sugar high
Watermelon sugar high
Watermelon sugar high
Watermelon sugar high
Watermelon sugar high
Watermelon sugar high
Watermelon sugar high
Watermelon sugar high

I just wanna taste it, I just wanna taste it
Watermelon sugar high

Tastes like strawberries on a summer evenin'
And it sounds just like a song
I want your belly and that summer feelin'
I don't know if I could ever go without

Watermelon sugar high
Watermelon sugar high
Watermelon sugar high (Sugar)
Watermelon sugar high (Sugar)
Watermelon sugar high
Watermelon sugar high
Watermelon sugar high
Watermelon sugar high
I just wanna taste it, I just wanna taste it (Eh-eh-eh)
Watermelon sugar high
I just wanna taste it, I just wanna taste it (Ooh, yeah)
Watermelon sugar high
Watermelon sugar116Embed","[['neutral'], ['neutral'], ['desire'], ['admiration'], ['neutral'], ['confusion', 'optimism'], ['neutral'], ['confusion', 'optimism'], ['neutral'], ['neutral'], ['neutral'], ['neutral'], ['neutral'], ['neutral'], ['neutral'], ['desire'], ['neutral'], ['neutral'], ['confusion', 'optimism'], ['confusion', 'neutral'], ['neutral'], ['neutral'], ['neutral'], ['neutral'], ['neutral'], ['neutral'], ['neutral'], ['neutral'], ['desire'], ['neutral'], ['neutral'], ['neutral'], ['desire'], ['confusion', 'optimism'], ['neutral'], ['neutral'], ['neutral'], ['neutral'], ['neutral'], ['neutral'], ['neutral'], ['neutral'], ['desire'], ['neutral'], ['desire'], ['neutral'], ['neutral']]"
51,51,Fleetwood Mac - Dreams - 2004 Remaster,"1 ContributorWomen of Rock LyricsStevie Nicks - Edge of Seventeen (2016 Remaster)
Joan Jett & The Blackhearts - I Love Rock 'N Roll
Blondie - One Way Or Another
The Cranberries - Zombie
4 Non Blondes - What's Up?
Big Brother & The Holding Company - Piece of My Heart (feat. Janis Joplin)
Heart - Barracuda
Pat Benatar - Hit Me With Your Best Shot (1999 Digital Remaster)
Alabama Shakes - Don't Wanna Fight
Amy Winehouse - Back To Black
K.Flay - Blood In The Cut
HAIM - The Wire
Hole - Celebrity Skin
Tash Sultana - Jungle (Radio Edit)
Florence + The Machine - Dog Days Are Over
Saint Agnes - Welcome to Silvertown
Alanis Morissette - You Oughta Know (2015 Remaster)
LP - Lost on You
Patti Smith - Because the Night
Joan Jett & The Blackhearts - I Hate Myself for Loving You
Paramore - Misery Business
Carly Simon - You're so Vain
Fleetwood Mac - Dreams (2004 Remaster)
Elle King - Ex's & Oh's
The Cardigans - Lovefool
Dorothy - Raise Hell
No Doubt - Just A Girl
Hannah Wicklund & The Steppin Stones - Bomb Through the Breeze
The Interrupters - She's Kerosene
The Ting Tings - Shut Up and Let Me Go
The Breeders - Cannonball
Meg Myers - Running Up That Hill
Annie Lennox - I Put A Spell On You
Grace Potter & The Nocturnals - Paris (Ooh La La)
Jade Bird - I Get No Joy
The Runaways - Cherry Bomb
Yeah Yeah Yeahs - Heads Will Roll (A-Trak Remix Radio Edit)
PJ Harvey - Down By The Water
Bishop Briggs - River
Fleetwood Mac - Everywhere (2017 Remaster)
YONAKA - Teach Me To Fight
Juliet Simms - It’s A Man’s, Man’s, Man’s World (The Voice Performance)
Mazzy Star - Fade Into You
Letters To Cleo - I Want You To Want Me (Soundtrack)
Halestorm - I Miss The Misery
The New Respects - Trouble
Grace Mitchell - Kids (Ain't All Right)
The Pretty Reckless - Take Me Down
PVRIS - You and I
Garbage - #1 Crush
Joan Jett & The Blackhearts - Crimson and Clover
Dead Sara - Weatherman
Bleached - Wednesday Night Melody
Evanescence - Bring Me To Life
The Kills - Future Starts Slow
Björk - Army Of Me
Jefferson Airplane - Somebody to Love
Emily Wolfe - Atta Blues
The Beaches - Give It Up
'Til Tuesday - Voices Carry (Single Mix)
Edie Brickell & New Bohemians - What I Am
Best Coast - Feeling Ok
The Go-Go's - We Got The Beat (Single Mix)
Metric - Help I'm Alive
The Aces - Stuck
Rilo Kiley - Portions for Foxes
MS MR - Hurricane
Luscious Jackson - Naked Eye
Flyleaf - All Around Me
Gin Wigmore - Black Sheep
Marmozets - Captivate You
Lana Del Rey - Young And Beautiful
Kendra Morris - Banshee
Tigress - Power Lines
First Aid Kit - My Silver Lining
L7 - Pretend We're Dead
In This Moment - Oh Lord
New Years Day - Skeletons
Eliot Sumner - Halfway To Hell
Veruca Salt - Seether
Of Monsters and Men - Crystals
Joan Jett & The Blackhearts - Cherry Bomb
Lita Ford - Kiss Me Deadly
Indigo Girls - Closer to Fine
Melissa Etheridge - Like The Way I Do
Lissie - Daughters
Brandi Carlile - The Story
Cilver - I'm America
Kate Bush - This Woman's Work
BLOXX - Curtains
The Regrettes - California Friends
Liz Phair - Never Said (Remastered)Embed","[['admiration', 'love'], ['neutral'], ['neutral'], ['curiosity', 'neutral'], ['neutral'], ['neutral'], ['neutral'], ['neutral'], ['neutral'], ['neutral'], ['neutral'], ['neutral'], ['neutral'], ['neutral'], ['gratitude', 'neutral'], ['neutral'], ['disappointment', 'neutral'], ['neutral'], ['anger'], ['neutral'], ['admiration', 'neutral'], ['neutral'], ['neutral'], ['neutral'], ['neutral'], ['neutral'], ['neutral'], ['neutral'], ['anger', 'neutral'], ['neutral'], ['neutral'], ['amusement', 'neutral'], ['neutral'], ['neutral'], ['neutral'], ['neutral'], ['neutral'], ['neutral'], ['neutral'], ['neutral'], ['neutral'], ['neutral'], ['desire', 'neutral'], ['disappointment', 'neutral'], ['neutral'], ['neutral'], ['neutral'], ['neutral'], ['disgust', 'neutral'], ['neutral'], ['neutral'], ['neutral'], ['neutral'], ['neutral'], ['neutral'], ['admiration', 'love'], ['neutral'], ['neutral'], ['neutral'], ['neutral'], ['admiration'], ['excitement', 'neutral'], ['neutral'], ['neutral'], ['neutral'], ['neutral'], ['admiration', 'neutral'], ['neutral'], ['neutral'], ['neutral'], ['admiration'], ['neutral'], ['neutral'], ['neutral'], ['neutral'], ['neutral'], ['excitement', 'neutral'], ['neutral'], ['neutral'], ['neutral'], ['neutral'], ['neutral'], ['neutral'], ['neutral'], ['neutral'], ['neutral'], ['neutral'], ['neutral'], ['neutral'], ['neutral'], ['neutral']]"
