,Unnamed: 0,artist_title,lyrics,emotions
0,0,Jimin - Like Crazy,"15 ContributorsTranslations한국어RomanizationEspañolDeutschРусскийPortuguêsالعربيةFrançaisJimin - Like Crazy (English Translation) Lyrics
(I think we could last forever
I'm afraid that everything will disappear
Just trust me)

She's saying
Baby, don't think about it
There's not a bad thing here tonight
Baby, it's fine if you leave
Stay with me, just for today

Watch me go
Drenching myself all night (Away)
So that even the morning
Gets drunk and doesn't arrive

As the loud music
I get faded out
A cliché story like a drama
I get used to it
Have I come too far to find the me that you used to know
Yeah, I know
You know
I know (Ooh)
You might also like
I'd rather be
Lost in the lights
Lost in the lights
I'm outta my mind
Hold onto the end of the night
Every night
You spin me up high
The moon with you in its arms
Let me have a taste

Give me a good ride (Oh, I'm fallin', I'm fallin', I'm fallin')
It's gon' be a good night (Oh, I'm fallin')
Forever you and I

Mmm-hmm
Yeah, hey
Mmm-hmm
Ooh-woah
Mmm-hmm
Mmm-hmm
(Forever, you and I)

The me, reflected in the mirror
Is going crazy endlessly
I'm feelin' so alive, wasting time
I'd rather be
Lost in the lights
Lost in the lights
I'm outta my mind
Hold onto the end of the night
Each night
You spin me up high
The moon with you in its arms
Let me have a taste

Give me a good ride (Oh, I'm fallin', I'm fallin', I'm fallin')
It's gon' be a good night (Oh, I'm fallin')
Forever you and I

This will break me
This is gonna break me (Break me)
No, don’t you wake me (Wake me)
I wanna stay in this dream, don't save me
Don't you try to save me (Save me)
I need a way we (Way we)
I need a way we can dream on (On, on, on)
(Alone again
What's the point?)Embed","[['neutral'], ['fear'], ['approval'], ['neutral'], ['neutral'], ['approval', 'neutral'], ['caring', 'neutral'], ['neutral'], ['neutral'], ['neutral'], ['neutral'], ['neutral'], ['neutral'], ['sadness'], ['optimism'], ['realization'], ['curiosity', 'neutral'], ['approval'], ['neutral'], ['joy'], ['confusion', 'neutral'], ['neutral'], ['disappointment', 'neutral'], ['disappointment', 'neutral'], ['neutral'], ['neutral'], ['neutral'], ['neutral'], ['neutral'], ['neutral'], [], ['caring'], ['neutral'], ['neutral'], ['neutral'], ['neutral'], ['excitement', 'surprise'], ['neutral'], ['neutral'], ['neutral'], ['neutral'], ['excitement', 'neutral'], ['annoyance', 'disappointment', 'sadness'], ['neutral'], ['disappointment', 'neutral'], ['disappointment', 'neutral'], ['neutral'], ['neutral'], ['neutral'], ['neutral'], ['neutral'], ['neutral'], [], ['caring'], ['neutral'], ['disappointment', 'sadness', 'neutral'], ['sadness', 'neutral'], ['neutral'], ['desire'], ['anger', 'caring'], ['desire', 'neutral'], ['desire'], ['sadness', 'neutral'], ['confusion', 'curiosity']]"
1,1,Jung Kook - Seven,"3 ContributorsTranslationsEnglishPortuguêsDeutsch日本語Bahasa IndonesiaFrançaisالعربية한국어РусскийУкраїнськаJung Kook - Seven (Clean Ver.) ft. Latto (Traducción al Español) Lyrics

Cargas con todo el peso del mundo en tus hombros
Beso tu cintura y hago que tu mente se calme
Debo ser afortunado por conocerte
Levanto mis manos y trazo tus líneas

Es la forma en la que encajamos tan bien
Es la forma en la que encajamos tan bien (Oh-oh-oh-oh)
Creo que te conocí en otra vida
Así que ven a mí una vez más (Oh-oh-oh-oh)
Me abrazas y me traes a la vida
Y es por eso que noche tras noche
Te amaré como se debe

Lunes, martes, miércoles, jueves, viernes, sábado, domingo (Una semana)
Lunes, martes, miércoles, jueves, viernes, sábado, domingo
Los siete días de la semana
Cada hora, cada minuto, cada segundo
Sabes qué noche tras noche
Te amaré como se debe
Los siete días de la semana
You might also like
Amas cuando me lanzo de lleno
Te ofrezco todo de mí
Te mostraré lo que es la devoción
Más profunda que el mar es
Iré lento lo tomaré con calma
Te dejaré con ese resplandor
Te mostraré lo que es la devoción
Más profunda que el mar es

Es la forma en la que encajamos tan bien
Es la forma en la que encajamos tan bien (Oh-oh-oh-oh)
Creo que te conocí en otra vida
Así que ven a mí una vez más (Oh-oh-oh-oh)
Me abrazas y me traes a la vida
Y es por eso que noche tras noche
Te amaré como se debe

Lunes, martes, miércoles, jueves, viernes, sábado, domingo (Una semana)
Lunes, martes, miércoles, jueves, viernes, sábado, domingo
Los siete días de la semana
Cada hora, cada minuto, cada segundo
Sabes qué noche tras noche
Te amaré como se debe
Los siete días de la semana
Lunes, martes, miércoles, jueves, viernes, sábado, domingo (Una semana)
Lunes, martes, miércoles, jueves, viernes, sábado, domingo
Los siete días de la semana
Cada hora, cada minuto, cada segundo
Sabes qué noche tras noche
Te amaré como se debe
Los siete días de la semana
(Gran Latto)
Tomando firmemente el control, tomando firmemente su alma
Toma tu teléfono y guarda este momento en tu galería (Uh)
Deja su ropa por la entrada
¿Qué estás esperando? Mejor ven y anota tu gol
Él simplemente se lanza
Lo haremos hasta el amanecer, no nos vamos a dormir
Siete días a la semana, siete sabanas diferentes
Siete posiciones diferentes, puedo ser tu fantasía
Abre bien, di: ""Ah""
Ven aquí, cariño, déjame tragar todo tu orgullo
¿Qué es lo que te gusta? Yo te lo puedo cumplir
Llámame y ahí estaré
Haces que los lunes se sientan como fines de semana
Hago que serme infiel ni siquiera se te ocurra
Hago que faltes al trabajo y a reuniones
Durmamos hasta tarde, sí
(Siete días a la semana, ooh)

Lunes, martes, miércoles, jueves, viernes, sábado, domingo (Una semana)
Lunes, martes, miércoles, jueves, viernes, sábado, domingo
Los siete días de la semana
Cada hora, cada minuto, cada segundo (Oh-oh-oh)
Sabes qué noche tras noche
Te amaré como se debe
Los siete días de la semana (Oh)
Lunes, martes, miércoles, jueves, viernes, sábado, domingo (Una semana)
Lunes, martes, miércoles, jueves, viernes, sábado, domingo (Ooh, ooh, ooh, ooh, ooh)
Los siete días de la semana
Cada hora, cada minuto, cada segundo (Hora, minuto, segundo)
Sabes qué noche tras noche
Te amaré como se debe
Los siete días de la semanaEmbed","[['neutral'], ['neutral'], ['neutral'], ['neutral'], ['neutral'], ['neutral'], ['neutral'], ['neutral'], ['neutral'], ['neutral'], ['neutral'], ['neutral'], ['neutral'], ['neutral'], ['neutral'], ['neutral'], ['neutral'], ['neutral'], ['confusion', 'neutral'], ['neutral'], ['neutral'], ['neutral'], ['neutral'], ['neutral'], ['neutral'], ['neutral'], ['neutral'], ['neutral'], ['neutral'], ['neutral'], ['neutral'], ['neutral'], ['neutral'], ['neutral'], ['neutral'], ['neutral'], ['neutral'], ['neutral'], ['neutral'], ['neutral'], ['neutral'], ['neutral'], ['neutral'], ['neutral'], ['neutral'], ['neutral'], ['neutral'], ['neutral'], ['approval', 'neutral'], ['neutral'], ['neutral'], ['neutral'], ['curiosity'], ['neutral'], ['neutral'], ['neutral'], ['neutral'], ['neutral'], ['neutral'], ['curiosity', 'neutral'], ['neutral'], ['neutral'], ['neutral'], ['neutral'], ['neutral'], ['joy', 'neutral'], ['neutral'], ['neutral'], ['neutral'], ['neutral'], ['neutral'], ['neutral'], ['neutral'], ['neutral'], ['excitement', 'neutral'], ['neutral'], ['neutral'], ['neutral'], ['neutral'], ['neutral']]"
2,2,Jimin - Like Crazy (English Version),"1 ContributorTranslationsEnglishEspañolTürkçeJimin - Like Crazy (English Version) (الترجمة العربية) Lyrics
(أعتقد أننا يمكن أن نكون سويًا إلى الأبد
أخشى بأن كل شيء سوف يختفي
فقط ثق بي)

هي تقول
حبيبي، تعال واتبعني
لا يوجد ما هو سيء هنا الليلة
أحتفظ بجميع أسبابك لوقت لاحق
ابقَ معي قليلاً

شاهدني أذهب
الآن، أنا أغرق، وحيدًا بعيدًا
أين أنا؟
ضباب أسود يخيم على عيني

باستطاعتي سمع الأصوات تستمع
لا أعرف من هم
أحاول تخفيف الضغط
لقد وصلت إلى النجوم
أخبرني هل سأجد نفسي مرة أخرى؟
عندما أذهب بعيدًا جدًا؟
نعم، أعلم
أنتِ تعلمي، أنا أعلم (أوه)
You might also like
أُفضل أن أكون
تائه في الأضواء، تائه في الأضواء
أنا فاقد لعقلي
هل يمكنك مساعدتي في تخدير الألم؟
كل ليلة، تدوري بي إلى الأعلى
مشاعري متجمدة
اسمحي لي بالتجربة

خذيني برحلة جيدة (أوه، أنا أسقط، أنا أسقط، أنا أسقط)
أوه، ستكون ليلة رائعة (أوه، أنا أسقط)
للأبد، أنتِ و أنا

ممم-همم
نعم، هيي
ممم-همم
أوه-واه
ممم-همم
ممم-همم
(للأبد، أنتِ و أنا)

كل تأملاتي، أنا
لا أستطيع حتى التعرف
أشعر أنني على قيد الحياة، بتضيعي للوقت
أُفضل أن أكون
تائه في الأضواء، تائه في الأضواء
أنا فاقد لعقلي
هل يمكنك مساعدتي في تخدير الألم؟
كل ليلة، تدوري بي إلى الأعلى
مشاعري متجمدة
اسمحي لي بالتجربة

خذيني برحلة جيدة (أوه، أنا أسقط، أنا أسقط، أنا أسقط)
أوه، ستكون ليلة رائعة (أوه، أنا أسقط)
للأبد، أنتِ و أنا

هذا سوف يحطمني
هذا سوف يحطمني (يحطمني)
لا، لا توقظنني (توقظنني)
أريد أن أبقى في هذا الحلم، فلا تنقذيني
لا تحاولي إنقاذي (إنقاذي)
أحتاج إلى طريقة لكي (طريقة لكي)
أحتاج إلى طريقة يمكننا أن نحلم بها (بها، بها، بها)
(وحيد مجددًا
ما كان الهدف؟)Embed","[['neutral'], ['neutral'], ['neutral'], ['neutral'], ['neutral'], ['neutral'], ['neutral'], ['neutral'], ['neutral'], ['neutral'], ['neutral'], ['neutral'], ['neutral'], ['neutral'], ['neutral'], ['neutral'], ['neutral'], ['neutral'], ['neutral'], ['neutral'], ['confusion', 'neutral'], ['neutral'], ['neutral'], ['neutral'], ['neutral'], ['neutral'], ['neutral'], ['neutral'], ['neutral'], ['neutral'], ['neutral'], ['neutral'], ['neutral'], ['neutral'], ['neutral'], ['neutral'], ['neutral'], ['neutral'], ['neutral'], ['neutral'], ['neutral'], ['neutral'], ['neutral'], ['neutral'], ['neutral'], ['neutral'], ['neutral'], ['neutral'], ['neutral'], ['neutral'], ['neutral'], ['neutral'], ['neutral'], ['neutral'], ['neutral'], ['neutral'], ['neutral'], ['neutral'], ['neutral'], ['neutral']]"
3,3,Jimin - Set Me Free Pt.2,"10 ContributorsTranslations한국어Romanization中文Español日本語PortuguêsالعربيةDeutschРусскийहिन्दीJimin - Set Me Free Pt.2 (English Translation) Lyrics
Yeah

I got a good time
Yeah, time to get mine
I wandered into a maze
Hennessy at night
I never stop, I never stop
Again, repe-e-eat
I never stop, fuck all your opps
Finally free-e-e

Ah, yeah, ah, yeah
I'm standing at the edge
Not yet, not yet
I won't look back
Now yeah, now yeah
Fly away, butterfly-y-y
Finally free-e-e

Look at me now (Me now)
I won't hide anymore, even if it hurts
Going insane to stay sane
Raise your hands for the past me
You might also like
Now, set me free-e-e
Set me free-e-e, set me free-e-e
Set me free-e-e, set me free-e-e
(Oh-eh-oh, oh-eh-oh) Set me free-e-e
(Oh-eh-oh, oh-eh-oh) Set me free-e-e
(Oh-eh-oh, oh-eh-oh) Set me free-e-e
(Oh-eh-oh, oh-eh-oh) Set me free-e-e

I got feel low
Still in a maze
But I got no time to break soul
Just let me flow
Hey fool, just get out of my way
Shut up, fuck off
I'm on my way

Ah, yeah, ah, yeah
It's begun, my prime time
Forget, forget
I'll gladly hop on
Now yeah, now yeah
Fly away, butterfly-y-y
Finally free
Look at me now
I won't stop, even if they mock me
Going insane to stay sane
Raise your hands for the past me

Now, set me free-e-e (Set me free, set me free)
Set me free-e-e (Set me, free)
Set me free-e-e (Set me free, set me free)
Set me free-e-e (Won't you set me free)
Set me free-e-e (Yeah)
(Oh-eh-oh, oh-eh-oh) Set me free-e-e
(Oh-eh-oh, oh-eh-oh) Set me free-e-e
(Oh-eh-oh, oh-eh-oh) Set me free-e-e (Free, free)
(Oh-eh-oh, oh-eh-oh) Set me free-e-e
(Won't you set me free)

(Oh-eh-oh, oh-eh-oh, set me free)
(Oh-eh-oh, oh-eh-oh, set me free)
(Oh-eh-oh, oh-eh-oh, set me free)
Set me free1Embed","[['approval', 'neutral'], ['joy'], ['approval', 'neutral'], ['neutral'], ['neutral'], ['neutral'], ['neutral'], ['anger'], ['neutral'], ['approval', 'neutral'], ['neutral'], ['neutral'], ['neutral'], ['approval', 'neutral'], ['neutral'], ['neutral'], ['neutral'], ['approval'], ['annoyance'], ['neutral'], ['confusion', 'neutral'], ['neutral'], ['neutral'], ['neutral'], ['neutral'], ['neutral'], ['neutral'], ['neutral'], ['disappointment', 'neutral'], ['neutral'], ['neutral'], ['neutral'], ['anger'], ['anger'], ['neutral'], ['approval', 'neutral'], ['excitement', 'neutral'], ['neutral'], ['joy'], ['approval', 'neutral'], ['neutral'], ['relief', 'neutral'], ['neutral'], ['neutral'], ['annoyance'], ['neutral'], ['neutral'], ['neutral'], ['neutral'], ['neutral'], ['neutral'], ['neutral'], ['neutral'], ['neutral'], ['neutral'], ['neutral'], ['neutral'], ['neutral'], ['neutral'], ['neutral']]"
4,4,NewJeans - Hype Boy,"14 ContributorsTranslations한국어EnglishEspañolहिन्दीPortuguêsไทย / Phasa Thai中文УкраїнськаBahasa IndonesiaالعربيةNewJeans - Hype Boy (Romanized) Lyrics
(Uh-uh)
(Uh-uh)
One, two, three, four

Baby, got me looking so crazy
Ppajyeobeorineun daydream
Got me feeling you, neodo malhaejullae?

Nuga naege mworadeun
Namdeulgwaneun dalla neon
Maybe you could be the one
Nal mideobwa han beon
I'm not looking for just fun
Maybe I could be the one

Oh, baby
Yeminhadae na lately
Neo eopsineun maeil maeiri, yeah-eh
Jaemieopseo, eojjeoji
I just want you, call my phone right now
I just wanna hеar you're mine
You might also like
'Cause I know what you likе, boy (Uh-uh)
You're my chemical hype boy (Uh-uh)
Nae jinan naldeureun, nun tteumyeon inneun kkum
Hype boy, neoman wonhae
Hype boy, naega jeonhae

And we can go hi-i-i-i-i-igh
Malhaebwa, yeah, neukkyeobwa, mm-mm
Take him to the sky-y-y-y-y-y (Uh-uh)
You know, I hype you, boy
Nuneul gama, ah-ah-ah, ah-ah (Uh-uh)
Malhaebwa, yeah, neukkyeobwa, mm-mm
Take him to the sky-y-y-y-y-y (Uh-uh)
You know, I hype you, boy

Jame deullyeogo jame deullyeo haedo
Ne saenggage tto saebyeok se si, uh-oh
Allyeojul geoya, they can't have you no more
Bwabwa yeogi, nae ireum sseoitdago
Yeah-eh

Nuga naege mworadeun
Namdeulgwaneun dalla neon
Maybe you could be the one
Nal mideobwa han beon
I'm not looking for just fun
Maybe I could be the one
Oh, baby
Yeminhadae na lately
Neo eopsineun maeil maeiri, yeah-eh
Jaemieopseo, eojjeoji
I just want you, call my phone right now
I just wanna hear you're mine

'Cause I know what you like, boy (Uh-uh)
You're my chemical hype boy (Uh-uh)
Nae jinan naldeureun, nun tteumyeon inneun kkum
Hype boy, neoman wonhae
Hype boy, naega jeonhae

And we can go hi-i-i-i-i-igh
Malhaebwa, yeah, neukkyeobwa, mm-mm
Take him to the sky-y-y-y-y-y (Uh-uh)
You know, I hype you, boy
Nuneul gama, ah-ah-ah, ah-ah (Uh-uh)
Malhaebwa, yeah, neukkyeobwa, mm-mm
Take him to the sky-y-y-y-y-y (Uh-uh)
You know, I hype you, boy13Embed","[['neutral'], ['neutral'], ['neutral'], ['excitement'], ['neutral'], ['curiosity', 'neutral'], ['neutral'], ['neutral'], ['neutral'], ['neutral'], ['disapproval'], ['neutral'], ['neutral'], ['neutral'], ['neutral'], ['neutral'], ['desire'], ['desire'], ['confusion', 'neutral'], ['neutral'], ['neutral'], ['neutral'], ['neutral'], ['neutral'], ['neutral'], ['neutral'], ['neutral'], ['neutral'], ['neutral'], ['neutral'], ['neutral'], ['neutral'], ['neutral'], ['neutral'], ['disappointment', 'neutral'], ['neutral'], ['neutral'], ['neutral'], ['neutral'], ['neutral'], ['neutral'], ['disapproval'], ['neutral'], ['neutral'], ['neutral'], ['neutral'], ['neutral'], ['desire'], ['desire'], ['approval', 'neutral'], ['neutral'], ['neutral'], ['neutral'], ['neutral'], ['neutral'], ['neutral'], ['neutral'], ['neutral'], ['neutral'], ['neutral'], ['neutral'], ['neutral']]"
5,5,Kodak Black - Angel Pt. 1,"39 ContributorsAngel Pt. 1 Lyrics
Angel, don't fly so close to me
I pull you down eventually
You don't want to lose those wings
People like me break beautiful things
Angel, don't fly so close to me
I'm what you want, not what you need
You don't want to lose those wings
People like me break beautiful things

I give it all up to ease your pain, yeah, I would do that all day
I stepped back from the game to keep you out of harm's way
Risk it all for the game but it take more than one person
Two people one 'til I feel the same when you hurtin'
I was still in middle school when Givens fled the whip
Bodies were droppin' before we ever knew 'bout the truck
We gonna be family no matter what way this go, brother
From the ugly corner where everybody betray each other
I let you hang in the jets, I let you bang with my set
Put you before my own flesh like why’d I ever do that?
Me and the streets got soul ties
The devil on my shoulder he whisper but I told him

Angel, don't fly so close to me
I pull you down eventually
You don't want to lose those wings
People like me break beautiful things
Angel, don't fly so close to me
I'm what you want, not what you need
You don't want to lose those wings
People like me break beautiful things
You might also like
Generation curses of disloyalty, we breakin' that
Lost my dawg, got him back
Took him in, we shakin' back
Struggle never broke us, it just made us who we is
Losses taught a lot of lessons
Made the wins feelin' like blessings
Family all that you got at the end
Hope you get the message
I ain't tryin' to make it without you
But if I got to then I got you
This ain't about me, it's about the whole cake
We can take a slice on a different day
Just keep your plate
God, family, hustle, goals
Heart, mind, body, soul
Watching out for street signs on a narrow road
Heaven at the end, prayin' for the lost souls with my angels

Don't you know, don't you know, don't you know, don't you know?
I will never let you down
No, I'll never be perfect
Never want to see you hurtin'
You should go, you should go
Get away fast a hundred on the dash tonight
Wish it didn't have to be this way
Angel, don't fly so close to me (My angel, don't close to me)
I pull you down eventually
You don't want to lose those wings
People like me break beautiful things
Angel, don't fly so close to me
I'm what you want, not what you need
You don't want to lose those wings (Lose those wings)
People like me break beautiful things12Embed","[['neutral'], ['neutral'], ['neutral'], ['disappointment'], ['neutral'], ['caring', 'disapproval'], ['neutral'], ['disappointment'], ['approval'], ['caring', 'neutral'], ['optimism'], ['neutral'], ['neutral'], ['neutral'], ['neutral'], ['neutral'], ['neutral'], ['neutral'], ['neutral'], ['neutral'], ['neutral'], ['neutral'], ['neutral'], ['disappointment'], ['neutral'], ['caring', 'disapproval'], ['neutral'], ['disappointment'], ['confusion', 'neutral'], ['annoyance', 'realization'], ['neutral'], ['neutral'], [], ['neutral'], ['neutral'], ['neutral'], ['optimism'], ['disapproval', 'neutral'], ['neutral'], ['disapproval'], ['neutral'], ['neutral'], ['neutral'], ['neutral'], ['neutral'], ['caring', 'neutral'], ['curiosity'], ['caring', 'neutral'], ['disapproval'], ['disappointment', 'sadness', 'neutral'], ['caring', 'neutral'], ['neutral'], ['desire'], ['neutral'], ['neutral'], ['neutral'], ['disappointment'], ['neutral'], ['caring', 'disapproval'], ['caring', 'neutral'], ['neutral']]"
6,6,NewJeans - Ditto,"28 ContributorsTranslations한국어English日本語PortuguêsEspañolNederlandsไทย / Phasa Thai中文УкраїнськаالعربيةTürkçeNewJeans - Ditto (Romanized) Lyrics
Hoo-ooh, ooh-ooh
Hoo-ooh, hoo

Stay in the middle
Like you a little, don't want no riddle
Malhaejwo say it back, oh, say it ditto
Achimeun neomu meoreo so say it ditto

Huljjeok keobeoryeosseo
Hamkkehan gieokcheoreom
Neol boneun nae maeumeun
Eoneusae yeoreum jina gaeul
Gidaryeotji all this time
Do you want somebody?
Like I want somebody?
Nal bogo useotjiman
Do you think about me now, yeah?
All the time, yeah, all the time

I got no timе to lose
Nae gireotdеon haru
Nan bogo sipeo
Ra-ta-ta-ta, ullin simjang (Ra-ta-ta-ta)
I got nothing to lose
Neol joahandago, ooh-woah, ooh-woah, ooh-woah
Ra-ta-ta-ta, ullin simjang (Ra-ta-ta-ta)
But I don't want to
You might also like
Stay in the middle
Like you a little, don't want no riddle
Malhaejwo, say it back, oh, say it ditto
Achimeun neomu meoreo so say it ditto
I don't want to
Walk in this miro
Da aneun geon anieodo baradeon daero
Malhaejwo, say it back, oh, say it ditto
I want you so, want you, so say it ditto

Not just anybody
Neoreul sangsanghaetji
Hangsang daaitdeon
Cheoeum neukkim geudaero nan
Gidaryeotji all this time

I got nothing to lose
Neol joahandago, ooh-woah, ooh-woah, ooh-woah
Ra-ta-ta-ta, ullin simjang (Ra-ta-ta-ta)
But I don't want to

Stay in the middle
Like you a little, don't want no riddle
Malhaejwo, say it back, oh, say it ditto
Achimeun neomu meoreo so say it ditto
I don't want to
Walk in this miro
Da aneun geon anieodo baradeon daero
Malhaejwo, say it back, oh, say it ditto
I want you so, want you, so say it ditto
Hoo-ooh, ooh-ooh
Hoo-ooh, hoo8Embed","[['excitement'], ['excitement'], ['neutral'], ['approval', 'neutral'], ['annoyance', 'neutral'], ['neutral'], ['neutral'], ['neutral'], ['neutral'], ['neutral'], ['neutral'], ['curiosity', 'neutral'], ['confusion', 'curiosity', 'neutral'], ['neutral'], ['neutral'], ['neutral'], ['neutral'], ['neutral'], ['neutral'], ['neutral'], ['relief'], ['excitement', 'neutral'], ['neutral'], ['disapproval'], ['confusion', 'neutral'], ['neutral'], ['approval', 'neutral'], ['annoyance'], ['neutral'], ['disapproval'], ['neutral'], ['neutral'], ['annoyance'], ['desire'], ['neutral'], ['neutral'], ['neutral'], ['neutral'], ['neutral'], ['relief'], ['excitement', 'neutral'], ['neutral'], ['disapproval'], ['neutral'], ['approval', 'neutral'], ['annoyance'], ['neutral'], ['disapproval'], ['neutral'], ['neutral'], ['annoyance'], ['desire'], ['excitement'], ['excitement', 'neutral']]"
